대학 글쓰기 2: 사회과학글쓰기,손제연,21,Fall,5.0,"손제연 교수님은 신이시고 나는 무적이니라,,, 다른 강평에도 다 써있지만 성적을 굉장히 잘 주신다 뭐 과제 열심히 하긴 했으니까 그 덕에 잘 받은걸 수도 있지만 그냥 하라는걸 성실하게 따라가면 에이쁠 받는듯 또한 글쓰기도 많이 배움 철학적 딜레마에 기반한 주제를 선정해야 하기에 인문학글쓰기 아닌가? 하는 느낌이 들긴 하지만, 글의 논증구조와 전개 방식은 어떤 글쓰기에느 모두 통용될만한 내용. 또 교수님도 강의가 사과글에 부합하지 않는다는 소문이 있다는 사실을 알고 계시는데, 그럼에도 같은 내용을 지도하시는 모습이 더 믿음을 주었음.  처음 기안문을 작성할때는 어렵고 힘들게 느껴지는 면이 분명 있지만, 이 강의에서 배운 내용은 두고두고 도움이 될 것이라고 생각한다."
대학 글쓰기 2: 사회과학글쓰기,손제연,22,Spring,4.0,기안문 작성 너무 힘들었고 아직도 내용이 이해가 잘 안됨 그렇지만 학점으로 미화됨
대학 글쓰기 2: 사회과학글쓰기,손제연,21,Fall,5.0,교수님께서 연역적 논증을 매우 중시하셔서 평소 글쓰던 습관에 대해 돌아볼 수 있었던 것 같습니다. 글쓰기 방법보다는 논리적으로 사고하는 방법에 더 집중해서 수업해주십니다. 성적은 잘 주시는 것 같습니다.
대학 글쓰기 2: 사회과학글쓰기,손제연,21,Fall,3.0,"솔직히 평가 좋은건 성적 영향도 있다고 생각합니다.. 저도 에쁠 나올줄 몰랐는데 주셨고, 과제만 적당히 했습니다 수업은 글쓰기에 초점이 맞춰져 있지는 않아서 호불호가 갈릴듯 합니다"
대학 글쓰기 2: 사회과학글쓰기,손제연,21,Fall,5.0,"사과글이라는 이름 때문에 강의가 어떨지 엄청 걱정했지만, (그리고 사실 손제연 교수님만의 정치철학, 가치론 이야기를 어느 정도까지 이해해야 하는 건지 몰라 조금 당황도 했었지만) 결과적으로는 앞으로 사회과학도로서 무엇을 왜 어떤 방식으로 논증해내야 하는지를 처음부터 배울 수 있었던 강의라고 생각합니다. 저번 학기까지의 강의평에서 가치론 이야기 때문에 힘들었다고 하셨던 분들도 사실 많은데, 저는 오히려 이 가치론을 통해서 글을 더 탄탄하게 구성하는 방법을 익힌 것 같아 좋았습니다 =)"
대학 글쓰기 2: 사회과학글쓰기,손제연,21,Fall,5.0,"사과글은 손제연 교수님으로!! 지각 제출, 미제출 없이 과제 꼬박꼬박 맞춰 해내면 좋은 학점은 물론, 기존에 갖고 있던 글쓰기에 대한 선입견도 부숴주시는 강의"
대학 글쓰기 2: 사회과학글쓰기,손제연,21,Fall,5.0,"아니 머죠..... 다른 기말에 치여서 거의 못썻는데 분량도 못채우고 가끔 과제제출 늦기도 하고 근데 내가 A+??????  감사합니다. 2년중 처음A+받네요 강의 내용도 전 너무 재밌었어요."
대학 글쓰기 2: 사회과학글쓰기,손제연,21,Fall,5.0,"장점: 이론강의 부분은 녹강으로 진행되어서 부담이 적고요, 녹강 영상에 무려 자막이 있습니다!!!! 로드는 진짜 거의 없습니다(제안논문 하나 대충 써서 고치면 되고 기말과제는 기안문, 개요서 작성이 순서대로 이루어지고 기안문 논증구조에 대해 상세히 피드백 해주셔서 그거 반영해서 고치면 거의 그냥 최종본 쓸 수 있습니다. 이전학기에는 조별과제가 있었던 모양인데 이번학기에는 그것도 없어서 그냥 꿀 그 자체). 그리고 무엇보다도 진짜 논리적인 글쓰기란 무엇인지에 대해서 배울 수 있었고 관련된 철학 사상(공리주의, 자유주의, 능력주의 등등) 같은 것도 나름 깊이있게 알아볼 수 있어서 너무 좋았습니다. 여태까지 내가 썼던 것은 글이 아니고 글자묶음이었다는 걸 깨닫게 해주는 명강. 교수님이 글쓰기 책 내시면 한 10권 사서 주변에 돌릴 의향 있음   단점: 녹강이 좀 늦게 올라옵니다.. 교수님께서도 이에 대해서 여러번 양해를 구하셨고 영상 퀄리티 보면 늦어지는거 충분히 납득이 되지만..... 화요일쯤에 월요일 수업을 올려주시면 실강으로 진행되는 수요일 수업 전에 미처 보지 못하는 경우가 있어서 약간 아쉬웠습니다.  +) 성적도 좀 늦게 나옴... 저희 분반이 아마 마지막이었던 것 같은데 1월 3일에서야 나왔습니다.... 하지만 공개된 성적을 보면 교수님께서 다 깊은 뜻이 있으셔서 이렇게 늦게 공개하셨구나 하는 생각이 들 것임.  수신 서버 터져서 남는거 대충 주웠는데 뜻밖에 핵꿀강+핵명강을 만나서 한학기가 정말로 즐거웠습니다. 사과글은 묻지도 따지지도 말고 빛제연 교수님 선택하세요!!!!!!!"
대학 글쓰기 2: 사회과학글쓰기,손제연,21,Fall,5.0,"로드 거의 없음. 진짜 거의 없는 수준임. 수업 내용에서 얻어가는 것도 많았음. 글쓰기에 대한 새로운 관점을 얻게 됨. 기안문 작성은 사람마다 다르겠지만 본인은 그렇게 힘들진 않았음. 학점 그냥 뿌려주심. 친구는 동료피드백 하나 못 했는데도 에쁠. 본인도 물론 에쁠.  결론: 그냥 무조건 들으시면 됩니다"
대학 글쓰기 2: 사회과학글쓰기,손제연,21,Fall,5.0,"생각보다 로드도 어마무시하게 많지는 않았고, 글쓰기에 대한 관점도 정립할 수 있었고, 학점도 뿌려주시는 갓교수님 감사합니다"
대학 글쓰기 2: 사회과학글쓰기,손제연,21,Fall,5.0,드디어 사과글에 대글1 뺨치는 천사가?? 차악을 고르는 사과글 강의에 내린 '빛' 그 자체. 처음으로 논리적인 글에 대해 체계적으로 배울 수 있었던 기회였다. 더불어 로드가 거의 0에 수렴... 그러곤 학점까지 챙겨주는 그는 대체.... 아마 앞으로 사과글 강의 중에서는 수강신청 경쟁이 가장 빡셀 것으로 보인다.
대학 글쓰기 2: 사회과학글쓰기,손제연,21,Fall,5.0,"저는 개인적으로 많이 배웠습니다! 연역적 글쓰기에 대해서 체계적으로 배운 것 같습니다 그리고 그동안의 고생이 학점으로 싹 씻겨내려갑니다!"
대학 글쓰기 2: 사회과학글쓰기,손제연,21,Spring,4.0,기안문 작성하는 건 정말 힘들었지만 학점으로 미화됩니다..
대학 글쓰기 2: 사회과학글쓰기,손제연,21,Spring,4.0,"힘들지만, 과제만 시간 내에 잘 제출한다면 학점 잘 받아가실 수 있을 겁니다."
대학 글쓰기 2: 사회과학글쓰기,손제연,21,Spring,4.0,솔직히 기안문 때문에 힘들고 스트레스 많이 받았는데 학점으로 미화된 강의... 철학적인 내용 많이 다뤄서 어려웠어요
대학 글쓰기 2: 사회과학글쓰기,손제연,21,Spring,5.0,미쳤습니까 교수님..... 그저 빛........ 저같은 학생을 제자로 두지 마십시오 수업이 살짝 어려운데 안들어도 지장 없고 성적 잘주세요 흑
대학 글쓰기 2: 사회과학글쓰기,손제연,21,Spring,3.0,수업 내용이 너무 어려워요.. 학점은 정말 잘 주시는 것 같아요!
대학 글쓰기 2: 사회과학글쓰기,손제연,21,Spring,4.0,개인적으로 너무 힘들었고 스트레스도 받고… 특히 기안문 피드백 때는 너무 창피하고 자신감도 떨어져서 논리적인 글쓰기를 그냥 포기하고 싶었어요ㅠㅠ 제가 너무 못난 거 같아서.. 그래서 반쯤 포기 상태로 최종 논문만 어찌저찌 마무리해서 냈는데 에이플 주셨네요 ㅎ 아직까지도 점수가 잘못 입력된 건 아닐까 하는 걱정이 되긴 합니다만 학점 하나로 그간의 스트레스가 다 잊혀지는 … 그런 수업이네요 원래 에타에 잘 안 들어오는데 학점이 너무 충격적으로 좋아서 들어왔습니다 ㅋㅋㅋㅋㅋ 좋은 성적으로 대글2 처리하게 해주신 교수님 감사합니다
대학 글쓰기 2: 사회과학글쓰기,손제연,21,Spring,4.0,사과글보다는 철학 수업에 가까운 느낌이라 다루는 내용이 생각보다 어렵긴 했지만 그래도 과제 제출만 제때 하면 점수는 아주 잘 주시는 것 같습니다
대학 글쓰기 2: 사회과학글쓰기,손제연,21,Spring,5.0,"제가 감히 성적도 안보고 교수님을 섣불리 평가했었네요... 교수님 사랑합니다.. 어디 계신지 몰라서 사방으로 절할게요"
대학 글쓰기 2: 사회과학글쓰기,손제연,20,Fall,5.0,멋들어진 글쓰기보다는 논리를 배우기에 좋은 수업입니다. 타성에 젖어서 논리없는 나열형 글쓰기에 한계를 느끼고 계신다면 좋은 수업입니다
대학 글쓰기 2: 사회과학글쓰기,손제연,20,Fall,5.0,"사회과학 에 대한 얘기보다는 철학에 관한 얘기가 훨씬 더 많다 논리적으로 엄밀하게 글을 쓰는 방법을 배우고 싶으면 추천함 본인은 개인적으로 만족한 수업이었음 다만 계절보다는 정규학기로 듣는게 훨씬 나을듯함"
대학 글쓰기 2: 사회과학글쓰기,손제연,20,Fall,5.0,"겨울계절 수강평입니다.  일단 계절학기의 특성상 약 5주의 시간동안 한 학기 분량의 수업을 소화하다보니 배우는 내용에 대해 깊이 생각해 볼 시간도 너무 없었고 글의 주제에 대해 생각해 볼 시간도 적었습니다. 그래서 혹시라도 손제연 교수님 수업을 꼭 들어야겠다 하시는 분들은 되도록이면 정규학기에 들으시는 것을 추천드립니다!  강의 - 교수님이 그때그때 생각나는 부분에 대해 즉흥적으로 말을 하셔서 듣다보면 정신없이 느껴질 수 있지만 그냥 본인이 이해한 부분만 가지고 가도 충분할 듯 합니다.  - 동영상 강의는 내용이 잘 정리되어 있는 편입니다. - 발표 및 토론 수업이 있지만 대부분 발표자가 발표한 후에는 교수님께서 강의하는 느낌으로 진행됩니다. - 따로 강의 ppt가 올라오지는 않아서 교수님 수업하시는 내용 중에 기억해야하는 부분이 있다면 개별적으로 필기 꼭 해두세요!! (기안문과 개요서 상담할 때도 마찬가지입니다!)  과제 - 책 읽고 발표하는 게 가장 어려웠습니다. 책 자체가 어렵다보니 미리비리 읽어두시는 걸 추천드려요. - 기안문과 개요서는 교수님이 말씀하신 부분을 적당히 반영해서 작성하시면 됩니다. 교수님도 본인이 요구하는 바가 이상적이고 현실로 이루어지기는 힘들다는 것을 알고 계셔서 본인이 말한대로 모든 걸 고치는 것은 바라지 않으시는 듯 해요. 그러니 너무 고통받지 마시고 과제하시면 될 것 같습니다ㅎㅎ  성적 - 그렇게 잘 주시는 편은 아니라고 교수님 본인은 이야기하시지만 제가 생각했을 때는 굉장히 잘 주시는 편인 것 같아요. 드랍자도 많다보니 적당히 과제 잘 해서 제출하면 좋은 성적 받으실 수 있으실 거에요!  교수님 인성도 좋으신 편이고 질문하는 거에 답변도 잘 해주셔서 저는 대체적으로 만족한 수업이었습니다. 다만 호불호는 충분히 갈릴 수 있을 듯합니다."
대학 글쓰기 2: 사회과학글쓰기,손제연,20,Fall,1.0,"대글2 N회차,, 마지막이라는 생각으로 존버했지만, 그동안 들었던 수업 중 최악이었어요 ! 최악 ! 최악 ! 최악 ! 26명 중 10명 드랍함  추천하는 사람 ; 정말 철학적 논리적 사고를 하고싶다, 평등과 분배에 관한 이슈가 아니면 안된다(다른 주제 선택할 자유따윈 없어요), 뼛속까지 문과다, 뒤에 수업이 없다(수업시간 무조건 10분이상 초과,, 그래도 시간내에 못끝내서 따로 시간잡는 경우多, 쉬는시간 없거나 짧음)  암튼 그냥 듣지마!! 듣지마!! 도망쳐!! 수강평 믿지마 !! 저 ENFP인데 교수님이 저랑 상극인 것 같아요"
대학 글쓰기 2: 사회과학글쓰기,손제연,20,Fall,1.0,"기안문 하나만 평가하시고 학점 부여하시는 것 같습니다.  그냥 클래스프랩이나 다른 것들은 대충 제출만 하시고 기안문만 열심히 쓰세요. 수업도 사회과학 글 쓰는 법은 배우지도 않고, 평등 이야기만 하다가 끝나네요.  덕분에 다른 사과글 청강이라도 해서 글 쓰는 법 배워야겠습니다.  감사합니다.   왜 들었는지 후회되네요."
대학 글쓰기 2: 사회과학글쓰기,손제연,20,Fall,5.0,앞에 클라스프렙만 잘하고 어느 정도 기말 보고서 잘 쓰시면 학점 잘 주십니다!!
대학 글쓰기 2: 사회과학글쓰기,손제연,20,Fall,4.0,"일단 교수님은 정말 좋으신 분 같아요. 학점도 깐깐하지는 않으신 것 같구요. 근데 강의내용이 저한테는 생각보다 너무 어려워서 강의계획서 꼭 보시고 신청하세요.. 약간 법철학적인 내용을 다루는데, 이렇게 제 적성에 안맞을 줄은 몰랐습니다. 너무 어려워서 수업시간에 집중도 잘 안되더라구요.. 근데 적성에 맞는 분들한테는 나름 꿀강일듯? 그래도 교수님은 정말정말 좋으세요! 과제 제출하면 피드백도 기분나쁘지 않게 꼼꼼하게 잘 해주시고, 강의나 과제 계획 등등도 지금까지 들은 강의 중에 젤 체계적이더라구요. 신청할 때 강의계획서 꼭 보시고, 법철학 등에 관심 많으신 분들에게 추천합니다!"
대학 글쓰기 2: 사회과학글쓰기,손제연,20,Fall,4.0,"학점은 정말 정말 잘주십니다. 교수님 정말 정말 착하시고 다정하시고 똑똑하십니다. 단점이라면 사회과학 글쓰기인데 철학적 측면에 좀 많이 치중되어 있는 것과, 교수님께서 비교적 정리되지 않은 생각들을 줄줄 읊으시고 그 속에서 알아서 정보를 챙겨 먹어야 하는 점입니다. 저는 부족하여 정신줄 놓고 들은 적 많이 있었습니다. 시간이 오버되는 경우도 꽤 있습니다.  호불호가 많이 갈릴 것 같아요."
대학 글쓰기 2: 사회과학글쓰기,손제연,20,Fall,5.0,"이 수업이 평등이나 차별 등에 관한 철학적 주제를 다룰 거라는 사실은 강의계획서나 강의평만 봐도 알 수 있습니다~ 그렇기 때문에 어느 정도 관심이 없는 분들이 듣기에는 수업 참여가 조금 어려울 수는 있다고 생각합니다!  하지만 수업 전반에서 논증을 기초로 한 글쓰기를 섬세하게 배운다는 점, 평등에 대하여 심도 있고 다양한 논의를 할 수 있다는 점은 저에게 유익했습니다. 부가적으로 열심히 노력하면 학점도 잘 주시는 것 같구요! 그래서 저는 추천드려요!!"
대학 글쓰기 2: 사회과학글쓰기,손제연,20,Fall,3.0,"학점을 잘 받았긴 하지만, 저라면 다른 사회과학 글쓰기 수업을 들을 것 같습니다.  이번 학기의 수업 주제는 '평등' 이었습니다. 수업은 전체적으로 세 파트로 구성이 되었는데, (1)조별로 텍스트 읽고 분석, 발표하기 (2)기안문 발표 (3)요약서 발표 순으로 진행되었습니다. 평가는 중간중간 간단한 로드가 있었고(영상, 논문 보고 댓글달기), 기안문이나 요약서는 전부 기말논문을 작성하기 위한 것입니다. 사실상 완결된 글은 한 편만 쓰면 된다고 할 수 있겠네요.  장점 1. 수업 시간에 캠을 안 켜도 되고, 대부분이 발표로 진행되다보니까 줌 수업이라도 자유롭습니다. 실제로 교수님도 중간, 기말 기간에 학생들이 다른 것을 할 수 있음을 인식하시고 계시는 듯합니다. 하지만 제재는 전혀 없고 기습 질문 이런 것도 없어요. 2. 기안문>요약서>최종 글쓰기로 나아가는 순서가 상당히 체계적입니다. 교수님이 제시해주시는 순서만 잘 지키면 글을 완성할 때 혼란스럽지는 않습니다. 3. 교수님은 친절하세요. 학생들을 배려해주시고, 수업에 대한 노력도 많이 하시는 것 같습니다. 4. 학점은 잘 주십니다. 5. 매우 간단하지만 흔히 간과되는 '연역적 글쓰기'에 대해서는 확실히 배워갈 수 있습니다.  단점 1. 교수님 강의력이 별로입니다. 줌 수업 시간에 하시는 말씀, 수업의 흐름을 따라가기 어렵고 집중도 안됩니다. (동영상으로 제작하신 강의는 괜찮습니다.) 처음 두 달 정도는 조별 발표를 듣고 교수님이 코멘트를 하는식으로 수업이 진행되었는데, 솔직히 내용 이해에 큰 도움이 되지 않습니다. 2. 논문, 책이 어렵습니다. '평등'을 주제로 한 글을 읽고 정리해야하는데 철학에 문외한인 저에게는 상당히  힘들었습니다. 학기 전반부는 도대체 이게 글쓰기 강의인지 철학 강의인지 구분이 안 갑니다. 제시해주신 텍스트만 가지고도 2시간은 수업해야 이해될 것 같은데, 1시간 15분 동안 그냥저냥 지나갑니다.  3. 솔직히 이 강의가 왜 '사회과학' 강의인지 이해가 안 갑니다. 차라리 '인문학 글쓰기'라면 이해할 것 같아요. 저는 답이 정해져있지 않은, 철학적 인문학 글쓰기를 하고 싶지 않아서 사회과학 글쓰기를 신청했는데 결과적으로 의미가 없었네요ㅜ 제 기말논문도 사실상 철학적 글쓰기였고요. 법, 정책 관련 글쓰기를 원하시는 분들에게는 비추입니다. 그냥 인문학 글쓰기라고 생각해주세요. 4. 수업 시간 배분이 불균형합니다. 아무래도 어려운 내용으로 짧은 시간에 강의가 진행되다보니까 시간 조절이 힘든 것 같습니다. 특히 기안문과 개요서 개인 발표 시간은 처음 발표한 학생은 거의 30분을 코멘트하시고, 뒤로 갈수록 시간 관계 상 급격히 적은 시간을 투자하게 됩니다. 물론 최대한 시간은 맞춰시기는 하지만, 시간 내에 못 끝낸 학생은 또 따로 보강을 들어야 했어요.. 만약 여러분이 뒷쪽 순서라면 따로 시간을 내어서 피드백을 받아야 하는 상황이 됩니다. 5. 사회과학 논문을 쓰는 방법이라던가, 귀납적으로 글쓰는 방법, 근거 나열식(?) 글쓰기를 어떻게 다듬을 수 있는지에 대한 내용은 안 다룹니다. ""연역적""으로 논리를 빈틈없이 이어나가는 방식을 배워요. 개인적으로 도움이 되기는 하였지만, 귀납적이거나 다른 평범한,, 방식으로 진행되는 글을 쓰는 법을 배우고 싶어서 아쉬웠습니다.  아래 분들이 너무 좋은 평 위주인 것 같아서, 솔직하게 적어보았습니다.  저라면 다른 평범한 사회과학글쓰기를 들을 것 같아요."
대학 글쓰기 2: 사회과학글쓰기,손제연,20,Fall,5.0,"비사회대 사과글=손제연입니다 too much talker긴 하지만 나름 배워가는것도 있고, 모든수업을 열심히 듣지 않아도 되고, 로드적고, 학점잘주면 크으으으으으으 👍"
대학 글쓰기 2: 사회과학글쓰기,손제연,20,Fall,5.0,"1월 1일 새벽에 에이쁠 받은 거 보고 수강평 남깁니다. ^^ 기분이 아주 좋네요.  1)조별로 책 한 챕터 정도 읽고 발표하는 거랑 2)수업 잘 들었는지 확인하는 용의 3줄 글 올리기 같은 과제가 있고 3)기안문 작성-최종 논증문 내기로 이어지는 대형 과제가 하나 있습니다.  1)이랑 2)는 기한을 잘 맞추는 거에 초점을 두시는 거 같고, 3)을 가장 중요하게 여기세요. 저는 2)과제를 까먹고 있다가 하루 늦게 냈는데도 좋은 성적 받은 거 보면 자잘한 과제 몇 번 늦었다고 절망할 필요는 없는 듯 합니다. 1)도 어렵긴 한데 3)이 좀 많이 힘들어요! 다른 것보다도 논리적인 논증을 요구하십니다. 그 논리를 구성하느라 일주일동안은 머리 싸매고 끙끙댔던 거 같네요... 그래도 의미 있는 시간이었다는 생각입니다. 저는 개인적으로 기존의 글쓰기 방식(주장 쓰고 근거 1,2,3 나열하는)에 회의감을 갖던 중이어서 이 수업이 더 와닿았어요! 그냥 흐느적 글쓰는 거 말고 논리적으로 생각하는 거 좋아하고 따박따박 따지는 글쓰기 하고 싶으신 분께 추천드립니다. 인문대생으로서 원래 글 쓰는 걸 좋아했다가 최근 길을 잃은 기분이었는데 간만에 글 쓰면서 괴로움과 짜릿함을 느꼈어요. 여태껏 들은 수업 중에선 가장 많은 걸 얻어가는 것 같습니다. 글쓰는 방식이 새롭냐? 이건 아니에요 엄~~청엄청 기본적인 건데 평상시에는 그렇게 잘 안 쓰는... 그런 글쓰기라고 생각합니다. 또 교수님이 너무 좋으세요! 열정 있으시고 메일 답변도 빠르십니다. 그런데 뭔가 교육자로서의 열정보단 스스로 도전한다는 사실에 더 열정이 있으신 것 같아요 ㅋㅋㅋㅋㅋ 손제연 교수님 최고~~ 에이쁠 최고~~ ^^"
대학 글쓰기 2: 사회과학글쓰기,손제연,20,Fall,4.0,기안서를 몇 번이고 갈아엎었을 때 얼마나 힘들었는 줄 모르겠다. 개요서까지 어찌어찌쓰고 최종 보고서는 개요서에 거의 살만 조금 붙여서 냈는데 A+을 주셨다. 비사회대 분반이긴 했어도 몇 안 되는 공대생이라 정말정말 걱정이 많았는데 좋은 학점을 내주셔서 정말 감사하다. 다만 학우들 간의 개인 피드백 시간을 균등하게 해주셨으면 하는 바람이 있다...
대학 글쓰기 2: 사회과학글쓰기,손제연,20,Spring,4.0,"1.   학점은 정말 잘 주시는 것 같다. 최종 보고서를 열심히 안 쓴 건 아닌데 영 마음에 안 들어서 제출하는 순간까지 마음이 안 좋았는데 A+ 받았음. 근데 학점 공개가 느리다. (사실 강의 업로드, 줌 강의 개설 등 수업 운영의 여러 측면에서 빠르신 건 아니다. 이런 걸 답답해하는 사람은 좀 힘들 수도 있음)  2.   글쓰기 수업 특성상 중간에 로드가 아예 없지는 않다. 특히 철학자의 저술을 읽고 발제를 해야 하는 파트가 있는데, 내용을 3번씩 읽었는데도 이해하기가 어려워서 정말 힘들었다. 물론 여기서는 내용 수준보다는 과제물 제출과 성의를 더 중요하게 보신다. (중요한 건 최종 기말보고서에 대한 기안문이다.)  3.   비사회대 사과글이라서 그런지 사회대 사과글에서 배우는 사회과학 논문 작성법에 대해 배우지는 않는다. 오히려 소재만 사회과학인 인문학글쓰기에 가깝다는 생각까지 들었다. 논리적으로 엄밀한 글을 쓰는 걸 중요하게 생각하셔서, 교수님이 원하는 형식과 내용으로 보고서를 쓰는 게 중요하다. (특정 정치적 사상을 강요하는 것 정도까지는 아니고, 글이 깔끔한 논리 구조를 갖기를 끊임없이 요구하신다.) 어쨌든 사회과학 논문을 쓰는 법을 익히고자 하는 사람이라면 이 수업은 조금 비추, 사회과학적 소재에 대한 논리적 사고를 해보고 싶다면 추천."
대학 글쓰기 2: 사회과학글쓰기,손제연,20,Spring,3.0,공대생인데 대충대충 과제 내기만 했더니 비쁠 나왔습니다. 좋은데 조금 어려웠습니다.
대학 글쓰기 2: 사회과학글쓰기,손제연,20,Spring,5.0,"교수님께서 법철학 전공이라서 그런지 사회과학글쓰기인데 인문학글쓰기 같은 주제를 다룸(ex.자유 평등). 그런데 법을 근거로 논리를 이어가는 걸 싫어하심ㅎ 교수님이 원하시는 좋은 글의 논리 형태가 명확해서 한 학기동안 그렇게 글을 쓰는 법을 익힘(그 방식이 법 조항 얘기와 맞지 않아서 싫어하시는 듯). 매 학기 책을 달리하시는 것 같은...? 책 읽고 요약하는 거 책이 어려워서 힘들었으나ㅠ 이해 잘 못해도 평가나 과제에 큰 영향X  과제 내용을 공유하면서 발표하고 질문 받는 식으로 화상강의 진행하심. 동영상으로 글 논리 구조 작성하는 방법을 설명해주심. 과제를 하면서 점점 기말 보고서로 가는 느낌이라 중간중간은 힘들어도 마지막에 아무것도 없어서 뭘 쓸지 모르는 느낌은 없었음. 교수님이 엄청 열정 있으시고 학생들을 존중해주셔서 따뜻한 한 학기를 보낼 수 있었음. 그리고 개인적으로 인문학 주제 엄청 어려워 하는 편인데 그 어려움을 어느정도 극복하고 내적으로 성장한 것 같아서 기억에 오래 남을 듯한 수업. 로드가 없는 건 절대 아니나 모든 대글은 일정량의 로드가 정해져 있으니 논외로 하고 교수님이 좋아서👍🏻 추천  (아 글고 제때 내는 게 중요하다는 밑에 강의평에 실수로 멍청하게 한번 늦게 내본 사람으로써 덧붙이자면 한번 정도는 큰 영향 없는 듯 그정도로 교수님이 좋으심)"
대학 글쓰기 2: 사회과학글쓰기,손제연,20,Fall,5.0,"교수님 좋으세요 ㅜ 시키는 건 자잘하게 있긴 한데 그냥 퀄리티 상관없이 하기만하면 되고 늦지 않게 하는 것이 중요한 것 같아요"
