대학 글쓰기 2: 사회과학글쓰기,장은미,21,Spring,3.0,뭐 개인차이 일수도 있겠지만 나는 그냥 그랬음. 배워가는게 없는 느낌. 교수님이랑도 별로 스타일 안맞아서 그냥 존버하고 학점만 가져감
대학 글쓰기 2: 사회과학글쓰기,장은미,22,Spring,5.0,"겨울 계절 들었는데 ㄹㅇ 학점 뿌리시고 아주 친절하심 사람이 많이 없어서 가능했는지는 모르겠지만 수업 분위기 매우 훈훈했고 에세이 과제 내기 전에 한 명씩 개별면담도 해주시고 발표 때도 건설적인 피드백 많이 받아서 좋았음.  물론 과제는 고통스러웠지만 원래 사과글이 그런 것이니.. 다만 교수님이 과제 비중을 정확히 어떻게 반영하시는 건지 상당히 의문이긴 함"
대학 글쓰기 2: 사회과학글쓰기,장은미,21,Spring,5.0,"갈수록 사과글 로드가 줄어간다던데! 로드는 각오했고, 적응하니 별로 없다고 느껴졌습니다. 너무 좋아요! 배우는 것도 많고 학점도 잘 주심"
대학 글쓰기 2: 사회과학글쓰기,장은미,21,Spring,4.0,"1. 교수님 좋으시고 수업 준비 열심히 해주심. 2. 수업 중 많은 참여를 원하시는데, 교수님이 던지시는 질문이 답변하기가 너무 모호할 때가 있음. 3. 과제량은 그냥 보통 대글2정도인듯 4. 그래도 기한 넉넉히 주심 5. 할거 끝난 것 같아 보이는데 수업 시간을 끝까지 채우시려는 경향이 좀 있음 6. 그냥 나쁘지 않음 통강으로 대글 치우려면 낫밷"
대학 글쓰기 2: 사회과학글쓰기,노광우,21,Fall,5.0,"작년 강의평이 안 좋길래 걱정했는데 우려와 다르게 로드도 적고 교수님께서 학생들 편의를 많이 봐주십니다 다만 학점은 칼같이 주시는 것 같습니다"
대학 글쓰기 2: 사회과학글쓰기,노광우,21,Fall,4.0,"사과글이 이 정도면 진짜 널널합니다! 학생들 편의도 많이 봐주시고, 기한도 항상 넉넉하게 주시고 그래서 전 개인적으로 되게 편하고 좋았습니다. 다만 학점은 한 만큼 주시는 것 같아요"
대학 글쓰기 2: 사회과학글쓰기,노광우,20,Fall,1.0,"시간 약속을 안지키십니다 수업 시작하고 20분 지나서 들어오셨던 적도 몇 번 있는데, 차라리 빨리 끝내주지 듣게 들어오실건 또 뭔지 .. 참 그랬습니다 얻어가는것도 그닥 없습니다 그렇다고 학점을 잘 주시는 것도 아닙니다 그냥 듣지마세요"
대학 글쓰기 2: 사회과학글쓰기,정지웅,22,Fall,4.0,배워가는 것이 딱히 없는 것 같습니다. 수업 시간에 별로 도움 안 되는 것 만 시키시구
대학 글쓰기 2: 사회과학글쓰기,정지웅,22,Spring,5.0,발표와 토론 좋아하시면 무난하게 듣기 좋은 대글입니다👍 정의란 무엇인가 책한권 읽고 매시간마다 토론참여 열심히하고 글쓰기 과제도 2개 모두 별시간 안 쏟고 그럭저럭 제출했는데 좋은 학점 받았어요:) 개인적으로 토론이랑 발표 좋아해서 정말 재밌었습니다ㅎㅎ
대학 글쓰기 2: 사회과학글쓰기,정지웅,22,Spring,5.0,지금 폐강 위기라길래 강평 남기러 왔습니다. 제발 들으세요. 대글 수업 중에서 이만큼 로드 없고 학점 잘 주는 강의 없습니다. 교수님도 학생들 편의 잘 봐주시고 시험기간에 휴강이나 녹강 대체도 많이 해주세요. <정의란 무엇인가> 일부 파트 읽고 토론 참여하면 되는데 전혀 부담없고 말도 많이 안 해도 돼요. 글쓰기 과제도 분량 굉장히 적고 학점도 에이쁠 뿌리세요. 그러니 대글2는 제발 정지웅 교수님🫶
대학 글쓰기 2: 사회과학글쓰기,정지웅,22,Spring,5.0,로드도 많이 없고 교수님이 학생들을 많이 배려해주셔서 시험기간에도 수업을 빼주시거나 녹강해주시기도했어요 성적도 잘 주셔서 좋았습니다.
대학 글쓰기 2: 사회과학글쓰기,정지웅,22,Spring,5.0,"교수님이 학생 편의 많이 봐주세요! 수업시간에 말하는 게 편하지 않아서 토론 참여 거의 못했는데 과제 열심히 해서 에이쁠 받았습니다 한 학기 동안 편하게 들을 수 있는 강의예요"
대학 글쓰기 2: 사회과학글쓰기,정지웅,22,Spring,4.0,"우선 저는 수업 토론이 적성에 맞지 않아 힘들었는데 과제 2장, 6장 열심히 조건에 맞게 하니까 에이쁠을 주셨어요!! 교수님 요구사항을 파악하는게 중요한 것 같아요"
대학 글쓰기 2: 사회과학글쓰기,정지웅,21,Fall,4.0,"계절학기 수강생입니다. 너무 좋아요! 마이클 샌델의 <정의란 무엇인가> 책 내용을 바탕으로 네 가지 정의론에 대해 토론하는 것이 주 수업활동이고(책을 살 필요나, 읽어오는 숙제는 없었음. 그냥 권유 정도..?), 가끔 소회의실을 열어서 조원들끼리 의견 공유하는 활동도 있었어요 토론 경험도 거의 없고, 사회문제나 인문학에 대해 깊게 고민해본 적도 없어서, 다른 사람들 앞에서 제 의견 말하는 게 처음에는 무서웠는데요... 부족한 만큼 매 수업때 교수님이 말씀하시는 거 키워드 위주로만 메모하고, 다른 학생들의 의견도 듣고 하다보니 후반부로 갈수록 익숙해져서 괜찮았어요.! 과제는 짧은 글 써서 etl 올리고 짝끼리 서로 댓글 달아주기, 두번째 과제도 글쓰기였는데 분량 적었고, 마지막 기말 과제는 참고문헌 포함 6p 레포트 쓰는 건데 이건 그동안 수업 때 배웠던 정의론에 입각해 사회문제 분석하고 해결방안 쓰는게 주제였어용. 저는 스스로 부족하다고 생각하는 사람이라, 솔직히 B+만 받아도 만족하려고 했는데 ㅠㅠ 에쁠 받았습니닽 감사합니다 교수님  타 사과글과는 달리 정의론을 다룬다는 게 이 수업의 가장 큰 특징입니다. 저는 전공 자체가 인문학과 거리가 멀어서 완전 의미있는 수업이었어요! 다만 조금 아쉬웠던 점은 글쓰기 방법을 녹강으로만 배워서, 그런 부분에서는 얻어가는 게 많이는 없었던 것 같아요. 그래도 완전 만족!"
대학 글쓰기 2: 사회과학글쓰기,정지웅,21,Fall,5.0,"겨울계절수강생임당 그저 빛 타 사과글 드랍하고 넘어옴 배우는것도 많고 교수님 인품도 좋으시고 (학생들 배려도 매우 잘해주심) 그냥..빛 그자체 교수님 사랑해요♡"
대학 글쓰기 2: 사회과학글쓰기,정지웅,21,Fall,5.0,"겨울 계절학기로 수강하였습니다. 학생들 편의도 많이 봐주시고, 과제 양도 적은 편이어서 큰 부담없이 수강하였습니다!! 토론을 바탕으로 수업을 진행하시지만, 크게 부담이 될 정도는 아닙니당~"
대학 글쓰기 2: 사회과학글쓰기,정지웅,21,Fall,5.0,"토론 외에 강의 시간에 하는 거 거의 없습니다… 가끔 교수님께서 한국 사회에 대해서 말씀해 주시기도 하는데 가만히 듣고만 있어도 됩니다! 로드는 책 읽어오기와 2페이지의 글쓰기, 6페이지 글쓰기 밖에 없습니다! 그리고 성적도 너무 잘 주십니다. 꼭 들으세요!"
대학 글쓰기 2: 사회과학글쓰기,정지웅,21,Fall,5.0,좋은 내용으로 수업해주시고 학생들의 의견을 잘 반영해주십니다. 로드도 적으니 최고라고 할만합니다
대학 글쓰기 2: 사회과학글쓰기,정지웅,21,Fall,5.0,이번 학기 로드 빡센데 사과글 들어야한다면 닥 지웅교수님 사과글입니다. 사과글의 희망! 감사했습니다!!
대학 글쓰기 2: 사회과학글쓰기,정지웅,21,Spring,5.0,열심히 수업하시는 교수님께는 좀 죄송하지만 노력을 들이지 않고 좋은 학점을 얻어가고 싶다면 이 강의 추천. 책 안 읽어갔다가 걸리면 교수님의 사랑을 독차지할 수 있음 주의.
대학 글쓰기 2: 사회과학글쓰기,정지웅,21,Spring,5.0,교수님께서 강의평을 보셨는지 정치적 발언을 상당히 주의하신다. 강의를 듣다 보면 자연스럽게 알 수 있고 강의 후반으로 갈 수록 정치적 발언을 많이 하시긴 하지만…ㅎㅎ 그런데 어차피 교수님의 정치적 성향이 시험이나 과제에 반영되는 것도 아니고 그냥 그러려니 하고 넘어가면 돼서 단점으로 짚고 넘어갈 수준은 아닌 것 같다. 대글을 정말 가벼운 마음으로 들을 수 있어서 꿀강을 찾는 사람에게 정말 추천하고 싶었음. 시험기간에는 녹강을 올려주셔서 일주일 안에만 들으면 되고  기말이 다가올 때는 조기종강까지…! 안그래도 몇개 안되는 과제에 미흡한 점이 많았던 것 같은데 학점이 매우 잘 나왔다. 대신 ‘정의란 무엇인가’를 읽고 그 책에서 다루는 여러 쟁점들에 대해 거의 매시간 토론해야하기 때문에 말하는 걸 싫어하는 분들에게는 추천할 수 없을듯
대학 글쓰기 2: 사회과학글쓰기,정지웅,21,Spring,5.0,"성적: 잘주심 과제: 2페이지 글, 6페이지 에세이 수업: 정의란 무엇인가 읽고 매주 토론  교수님이 학생들을 챙겨주시는 걸로는 최고입니다. 시험기간 고려해서 녹강/실강 조정해주시고 심지어는 조기종강까지 해주십니다.  글쓰기에 관한 그 어떤 것도 얻어갈 수는 없습니다.  교수님은 원하시는 답이 있기는 합니다. 그렇지만 대놓고 비난하지는 않습니다. 반박하고 싶으나 매번 늦게 끝내주셔서 더 늦어지기 싫어서 참았습니다.  과제는 다른 대글2와 비교한다면 정말정말정말 꿀입니다.  그냥 로드 적은 대글2를 듣고 싶다면 정지웅쌤걸로 들으면 됩니다."
대학 글쓰기 2: 사회과학글쓰기,정지웅,21,Spring,5.0,"로드가 2페이지짜리 글이랑 5페이지짜리 글, 이 두개밖에 없어서 편하고 좋았어요. 정치 성향이 좀 드러나는 편이라서 예민하신 분들은 듣기 불편하실 수도 있는데 그냥 참고 견디면 됩니다.  학생들 배려 많이 해주십니다. 시험 일정 물어봐주시면서 과제 제출일 부담 없도록하려고 되게 노력해주세요.  학생들 기말고사 있다고 하니까 6월 초 수업시간에 갑작스레 종강 선언해주셔서 개꿀이었습니다"
대학 글쓰기 2: 사회과학글쓰기,정지웅,21,Spring,5.0,"과제는 미니 보고서 (2장) + 기말 보고서 (6장) 이 끝일 정도로 로드가 널널함. 수업방식은 학기 초반에는 녹강하시다가 중반부터 책 (이번 학기는 정의란 무엇인가) 읽고 오면 수업시간에 조별로 토론하고 다시 모여서 교수님이랑 토의함. 최대한 중립을 지키고자 하시지만 토론 주제별로 원하는 답변이 있다는 것은 느껴짐. (대체로 진보적인 성향을 가지신 편인듯) 그렇다고 해서 반대쪽 의견을 마냥 비판하지는 않으시고 가능한 수용하려고 하심. 그 외로 학생들을 아껴주신다는 것이 느껴져서 교수님에게 애정이 갔음. 학점도 후하게 주신듯."
대학 글쓰기 2: 사회과학글쓰기,정지웅,21,Spring,5.0,"일단 과제 부담이 없는게 제일 좋았고, 수업 중 정치 성향이 드러나시긴 하지만 불편할 정도는 아니에요. 학생들 시험기간도 고려해주시고 최대한 학생들이 안 바쁘도록 노력해주세요. 학점도 잘 주시는 것 같아요"
대학 글쓰기 2: 사회과학글쓰기,정지웅,21,Spring,5.0,"아이러브 지웅 갓지우 그저 빛 로드 거의 제로에 수렴하고 학점까지 잘 주심 대글 듣는다면 다시 들어도 이 분입니다"
대학 글쓰기 2: 사회과학글쓰기,정지웅,21,Spring,5.0,"교수님이 학생에게 사랑을 주심. 사과글을 다시 들어야 한다면 이 교수님 수업을 듣겠음."
대학 글쓰기 2: 사회과학글쓰기,정지웅,21,Spring,5.0,"성적은 아직 안나왔습니다 다만 2장 글쓰기, 5장 글쓰기 과제가 전부이며 수업 또한 부담 없이 들을 수 있어서 좋습니다 정의란 무엇인가로 수업하고 정치얘기 이런거 많다고 하시는데 많긴합니다 근데 적당히 걸러들으면 되고 그런 부분을 되게 조심스러워하셔서 마냥 비난만 할 수는 없는 것 같습니다 성적은 잘 주시려나 모르겠네요 평가요소가 거의 없었어서 .."
대학 글쓰기 2: 사회과학글쓰기,정지웅,21,Spring,3.0,"일단 수업 부담은 적음. 그러나 교수님의 행보가 문제임. 자꾸 중립과 정의로 스스로를 포장하면서 국가주의적 사상을 강요하고 이에 대해 반론하면 자꾸 스스로가 틀렸다고 인정하도록 유도함.  그점이 심히 나와는 맞지 않음"
대학 글쓰기 2: 사회과학글쓰기,정지웅,20,Fall,5.0,"사과글이라 로드 빡셀까봐 걱정했는데 진짜 로드 1도 없고 수업 직전에 한 챕터씩만 읽어오면 되는 수업이었음. 수업은 각 챕터의 핵심 주제에 대한 토론 형식으로 진행했고 사과글 특성상 교수님의 정치 성향이 드러나지 않을 수는 없지만 교수님의 견해와 다른 의견을 제시하더라도 논리만 탄탄하면 교수님도 쿨하게 인정해주심. 시험기간에 학생들 배려해주시려고 한 주 쉬어가시고, 직전에 시험 있는 친구들 출첵만 하고 나가게 해주심. 과제 2개(서평 1개, 학술에세이 1개)만 하면 되고, 점수 완전 후하게 주심. 진짜 관악 최고 꿀강 갓지웅 수업 꼭 ㄱㄱ"
대학 글쓰기 2: 사회과학글쓰기,정지웅,20,Fall,5.0,"평이 안좋은 이유를 정말 모르겠어요 대글인데 과제도 진짜 없고 학생들 배려 엄청 해주십니다. 그 다음 수업에 시험 있다 하면 그냥 출석만 하고 공부하러 가라 하시고 전 진짜 좋았습니다. 제 주변 같이 들었던 학생들도 다 교수님 최고고, 숨겨있는 꿀강 명강이라 했는데 말이죠,, 사회적 이슈를 다루기 때문에 정치적인 얘기를 안할 수가 없어서 조금의 색은 어쩌다 나올 수도 있지만, 예민한 부분이라 언청 조심하시는게 느껴졌어요!! 대글은 과제때문에 다들 힘들어하는데 교수님 강의는 과제가 초고랑 마지막 레포트 딱 이거 두개에요! 댓글쓰는 이런것도 없고요ㅜㅜㅜㅜㅜ 진짜 좋아요 후회한적 정말 없어요! 학생들에게 생각도 많이 하게 해서 도움도 많이 되었고요!! 수업 중간중간 질문을 하시긴 하지만 친절하시고, 배려 많이 해주시고, 과제도 없고, 학점도 잘 주십니다 정말로요."
대학 글쓰기 2: 사회과학글쓰기,정지웅,20,Fall,2.0,"과제 적음. 글쓰기 2번이랑 일주일마다 책 한 챕터 읽는 정도. 정치색 꽤 나타남. 사용하는 용어, 교수님 생각과 다른 의견 제시하는 학우에게는 그에 관한 질문을 많이 하는 느낌? 토의 위주 수업이라 글쓰는 법은 딱히 배우지 못함. 학점은 무난히 주시는듯."
대학 글쓰기 2: 사회과학글쓰기,정지웅,20,Fall,4.0,"호불호가 갈리는 수업 같은데 저는 뭐랄까 성격만 맞으면 정말 꿀강일 수 있을 것 같습니다. 토론식 수업이지만 사실 의견 짧게 한번 정도만 말하거나 말을 안해도 큰 지장이 없습니다. 저는 오히려 우리 학교 학생들은 참 똑똑하구나 느낄 수 있는 수업이었습니다. 교수님은 사실상 주제만 던져주셔서 수업에서 보다는 학생들 사이의 토론에서 배워갈 것이 많습니다. 교수님도 정치적인 성향에 대해서는 많이 조심하십니다. 그러나 어떤 성향이 드러나는 것을 사실 숨길 수는 없는 것 같은데, 그냥 교수님도 토론 참가자 중 한 명이라고 생각하고 반박을 하든 동의를 하든 별 상관이 없습니다. 애초에 교수님도 그런 주장을 환영하시고요. 다만 아쉬운 점은 확실히 글을 어떻게 쓰는 지에 대한 공지가 좀 많이 부족합니다. 주제도 모호하고 형식도 모호하고 그렇다고 답변이 빠르신 편이 아닙니다. 그런데 기간도 넉넉히 주시고, 기준을 보면 애초에 글은 형식만 맞추면 감점을 하지 않으시는 것 같습니다. 대글1에서 배운대로만 써 주시고, 주제는 토론을 하도 많이 해서 잡기도 편합니다. 저는 토론식 수업 보고 굉장히 쫄았고, 시간대 때문에 이 수업을 신청했습니다.  그런데 토론도 다른 학우들 평균에 한참 못 미치게 필수적일 때만 참여를 하고 글은 후딱 써서 냈는데도 점수를 괜찮게 받았습니다. 그냥 열린 마음으로 최대한 듣기만 하고 좋은 학점 딴다고 생각하세요"
대학 글쓰기 2: 사회과학글쓰기,정지웅,20,Fall,2.0,"솔직히 수업 퀄리티에 대해서는... 할말은 많지만 하지 않겠음... 배워가는 것도 없고,,, 최종 레포트는 너무 방목하는 느낌? 사전에 조금조금씩 써보면서 교정도 해주고, 채점 기준에 대해서도 감이 오기 해야하는데, 수업은 그냥 정치학 수업깉음... 채점 기준도 좀 빡빡한 굿 같고... 에이쁠 따기는 어려운, 하지만 확실히 로드는 적은 수업? 4.2~4.3대 중에 에이쁠 중요하거나 아니면 뭔가 글쓰기 수업에서 배워가고 싶은 시람이라면 조금 비추 ㅇㅇ 에쁠은 몰라도 에이대 받기는 쉬울 것 같은데 (추측일뿐이지만) 로드 적고 대충 학점 후한 것 원하면 추천ㅇㅇ (*정치적 색채 심함. 나 개인적으로 진보 성향이고, 현 정부에 대해서도 비판적인 편은 아닌데, 그럼에도 불구하고 교수님 발언 많이 불편했음. 정치적 중립 지키려고 노력하신다는데 글쎄...? 사람마다 다르겠으나 난 조금 불편했으니 참고하길)"
대학 글쓰기 2: 사회과학글쓰기,정지웅,20,Fall,5.0,"교수님 친절하시고, 수업도 토론 열심히 참여하면 배워가는 것도 많습니다. 로드도 적고요. 유일한 단점이라면, 공지가 좀 불명확한 것 같습니다. 최종 에세이 관련 공지가 ‘ 센델의 정의론'을 읽고 학술에세이(이때 반드시 한국적 상황을 언급해야 함 였는데, 채점 후 공지에서는 ‘정의를 보는 다양한 관점으로 한국사회를 다루’길 바라셨다고 하셨습니다. 기말과제 같은 주제라면 참고하세요! 그래도 학점은 매우 후하세요."
대학 글쓰기 2: 사회과학글쓰기,정지웅,20,Fall,5.0,교수님이 학생들을 신경써주신다는 것이 온몸으로 느껴지는 수업이에요. 학생 편의도 진짜 많이 봐 주시고 여러모로 감동인 일이 많았음.. 진짜 착하시고 여러모로 배워가는 것도 많은 수업이라 생각합니다. 물론 정치 이야기도 많이 하시지만 학생들에게 강요하는 수업이 전혀 아니라 최대한 객관적으로 전달하시려고 노력하셔요.
대학 글쓰기 2: 사회과학글쓰기,정지웅,20,Spring,1.0,걍 수업시간마다 뇌 비우고 자습시간이다 생각하고 듣고 하란대로 글 두 편쓰면 에쁠 쓱싹 맞을 수 있어요. 진짜 체감상 1학점 느낌이었고 수업은 단언컨대 한 번도 들은 적이 없음. 맨날 정치얘기하시고 혼자 얘기하다가 흥분하심;;; 그럴거면 한국정치론 이런 수업 여시지 ... 수업 듣지도 않았지만 매주 줌켜놓는게 고역이었음 . 가끔 랜덤 질문하면 당황스럽긴 한데 본인의 임기응변 능력을 믿으세요 파이팅^^
대학 글쓰기 2: 사회과학글쓰기,정지웅,20,Spring,4.0,"교수님 친절하신듯해요. 근데 정치적 성향이 너무 달라서 듣고 있기 힘들었어요. 학점도 다 에쁠준건 아닌듯.. 그래도 대글치고 로드가 거의 없어서 편하게 듣긴 했습니다."
대학 글쓰기 2: 사회과학글쓰기,손제연,23,Fall,2.0,성적이 어떻게 나오든지와 관련없이 많이 실망스러운 강의였습니다. 교수님께서도 당신이 말하는 내용을 왔다갔다 하시고 내용 전달이 불분명한 경우가 한 학기 내내 있었습니다… 과제는 다른 사과글에 비해 적은 거 같기는 하지만 일체의 피드백이 이루어지지 않은 점이 가장 아쉬운 부분이었습니다. 마지막 최종 과제 제출일 일주일 전에 20분 가량 피드백을 해주시는데 이때 긍정적인 피드백을 받지 못한 경우 완전히 다시 갈아엎어야 하는 상황도 발생할 수 있을 것 같다는 생각을 하게 되었습니다. 이 강의를 통해 얻어간 것은 대학 글쓰기 1보다도 없는 거 같습니다.
대학 글쓰기 2: 사회과학글쓰기,손제연,23,Fall,5.0,"학기 중 엄청난 고뇌와 스트레스, 막막함을 이겨낸 당신에게는 에이쁠이 찾아옵니다…!!! 시키는 것만 잘하면 됩니다 물론 글쓰기의 측면에서 엄청난 걸 얻어가기는 어렵지만 철학적 사고와 논문의 논증 구조를 알아간다는 점에서는 충분히 좋은 수업이에요 교수님이 피드백을 빡빡하게 하지만 전부 다 고치기 보다는 교수님이 강조하시는 논증 부분이랑 자신의 의견을 명확히 하는 식으로 퇴고해서 최종본 내면 충분히 좋은 성적 받을 수 있습니다"
대학 글쓰기 2: 사회과학글쓰기,손제연,23,Fall,5.0,"사과글 = 손제연 교수님. 이건 그냥 공식으로 박아둡시다. 제가 왜 에이쁠..? 알 수가 없네요.. 물론 수업이야 적당히 듣긴 했고 과제도 적당히 힘쓰긴 했는데.. 뒤로 갈수록 제 논증구조엔 아무런 변화가 생기지 않았습니다.. 거의 학기 내내 같은 논증 우려먹기였는데. ㅠ.ㅠ 하여간 교수님께 여러모로 죄송해졌습니다.. 로드가 적은 건 아니고 중간중간 과제와 상호 피드백, 팀플 등등 있지만 크게 시간을 잡아먹진 않습니다. 교수님께서 가르쳐주시는 내용이 좀 사변적이라서 그렇지 정말 도움 많이 되는 것들이니 잘 들어두세요.. 저처럼 멍때리지 말고.."
대학 글쓰기 2: 사회과학글쓰기,손제연,23,Fall,5.0,마지막으로 평가한 사람 백퍼 저학년일듯 ㅋㅋㅋㅋㅋ 젼공 수업 들으면 그런 생각조차 않듦
대학 글쓰기 2: 사회과학글쓰기,손제연,23,Fall,2.0,로드 별로 없는데 배워가는 건 많지 않았고... 철학을 좋아하시는 듯한데 잘 못 알아들었습니다. 다양한 주제로 글 써보고 싶었는데 한 학기 내내 주제가 하나여서 아쉬웠어요
대학 글쓰기 2: 사회과학글쓰기,손제연,23,Fall,5.0,"마지막 3주를 전부 줌수업으로 돌리셔서 매우 편하게 들었습니다! 교수님께서 원하시는 글쓰기 방향이 있는 건 사실이지만, 성적을 엄청 후하게 주시기 때문에 제때 제출하시면 좋은 결과 있을 거예요!!"
대학 글쓰기 2: 사회과학글쓰기,손제연,23,Fall,5.0,교수님의 말씀이 조금 중구난방일 때도 있지만 배울 수 있는 점이 많고 지적을 많이 하시지만 생각의 폭을 대폭 확장시켜주실 수 있다는 장점이 있습니다!
대학 글쓰기 2: 사회과학글쓰기,손제연,23,Fall,5.0,"GOAT 과제 대글보다 적음 수업시간에 과제시간을 주심 학기말에는 과제 첨삭을 줌으로 하시는데 1ㄷ1이여서 사실상 휴강 학점 최고"
대학 글쓰기 2: 사회과학글쓰기,손제연,23,Fall,5.0,"버티면 a+이 나오는 좋은 강의! 강의내용이 이해가 안된다고 하는데, 나는 글을 쓰는 기본적 토대를 잡을 수 있었던 것 같아 좋았다"
대학 글쓰기 2: 사회과학글쓰기,손제연,23,Fall,5.0,학기말에 줌으로 피드백하는 시간 전까지는 매주 로드가 있었습니다. 이 줌 + 수업 X +과제 X 기간이 길었고 또 성적을 잘 받아서 미화된 것 같기는 하지만 그래도 들을 만한 강의였다고 생각합니다. 저는 논증 구조의 틀만 맞춘다는 생각으로 적당히 대충 (사실 제대로 할 수 있는 능력도 없음) 했는데 에쁠 받았습니다. 상호 피드백이나 교수님 피드백 시간에 보면 글을 수준높게 쓰시는 분들이 많아서 그냥 사과글 해치운다는 생각으로 있었는데 성적이 잘 나와 놀랍습니다. 교수님 수업도 집중해서 들으면 무슨 말을 하고 싶으신 건지 다 알 수 있습니다. 교수님이 정하신 글쓰기 주제나 논증에 흥미를 가진 분이라면 만족하실 것 같습니다. 제가 했으니 모두 하실 수 있습니다. 파이팅!
