대학 글쓰기 2: 사회과학글쓰기,임인숙,23,Fall,5.0,"글의 소재/주제 선택과 관련하여: 단순히 독창적인 주제로 글을 잘 써야 하는 수업은 아닙니다. 친숙한 소재여도, 친숙한 주제여도 교수님은 환영하십니다. 글을 능숙하게 잘 쓰지 못하더라도, 스스로의 생각을 잘 표현하는 것이 중요합니다.

(제가 이해한) 교수님이 요청하신 글의 스타일: 다만 교수님은 선택한 주제를 바탕으로 새로운 가치를 창출해내는 글을 요청하십니다. 기존 연구들과 어떻게 차별화되는지 (굳이 다른 결론을 내야 하는 것은 아니고, 과정에서의 차별화 지점도 괜찮습니다) 열심히 진행한 연구를 글에 잘 녹여낼 것을 한 학기 내내 강조하십니다.
독창적인 주제를 선택하는 것이 차별화되는 지점을 뽑기에 대개 좋다 보니 이왕이면 주제 선택할 때 창의적인 것을 고르면 좋겠지만, 주제 선택에 너무 힘들일 필요는 없었습니다. 저는 이미 연구가 활발히 진행되어 새로운 결론을 도출해내는 것이 거의 불가능한 주제를 골랐고, 제 연구만의 가치를 표현하는 데에 집중하였습니다. 중요한 것은 본인이 제일 잘 아는 연구/소논문의 가치를 얼마나 잘 표현해내느냐인 것으로 보입니다.

정리: 굳이 독창적인 주제를 선택하실 필요는 없고, 주제 선택을 잘해두신다면 새로운 가치를 표현하기 쉽습니다. 물론 기존에 있던 흔한 주제더라도 자신만의 연구와 그 연구에서 창출된 자신만이 아는 가치를 효과적으로 표현해낸다면 좋은 성적 받을 수 있을 것입니다.
물론 이것은 어려운 일이라고 교수님께서도 말씀하십니다.
그렇지만 주제 잡는 첫 과정부터 단계별로 과제를 주시니 어떤 글을 써야 할지, 한 학기 수업이 어떻게 진행되는지 매우 명확합니다.

개인적으로 힘든 학기였는데, 사과글 시간으로 힐링할 수 있었고, 대글이 사고와 표현 분야에 왜 속해 있는지 납득하게 된 강의였습니다. 학점을 잘 주시는지는 읽는 분께서 판단하실 몫이지만, 독창적인 주제를 뽑을 수 있을지, 글을 잘 쓸 수 있을지는 크게 걱정하실 필요 없을 것 같다는 (23-2 기준) 생각이 듭니다.

강의평이 갈리는 것은 무엇보다 학점 때문이라는 생각이 들어
학점을 잘 받은 저로서는 강의평을 올리지 않으려 했으나
한 학기 동안 교수님이 요청하신 글의 스타일이
읽는 분들에게 잘 전달되지 않을 수 있겠다는 생각이 들어
교수님께서 요청하신 글 스타일을 기억나는 대로 강의평에 남깁니다
(제가 선택한 소논문 과제 위주로 썼으나 비평문 과제에서 요구하시는 느낌도 유사합니다. 에세이 과제의 경우에도 큰 틀에서는 비슷할 것입니다.)"
대학 글쓰기 2: 사회과학글쓰기,임인숙,23,Fall,5.0,"로드 거의 없음_이게 왜 평이 갈리는지 모르겠으나,  공식적인 과제는  •서평3p  •소논문 혹은 체험에세이 5p  •각각에 대한 발표  •지정토론문 0.5p 뿐임 교수님 좋으심_인간적으로도 교수자로서도 학점_A+ 잘 나왔고 예상한 만큼 나온거라 더 할말은 없음 학점보기 전부터 해당 강의 좋아했음  +) 매주 짜잘하게 댓글달기나 한쪽자리 과제 등이 없고,  대신 학생발표때 질문/피드백 횟수 체크하심 괜히 댓글 다는 것보다 질문 한번씩 툭툭 하는게 훨씬 편해서 좋았음; 이 부분이 성향따라 추천/비추천이 갈릴듯 +) 소논문뿐만 아니라 체험에세이 가능한 점도 좋았음 +) 모든 조별활동은 수업시간 내에 끝납니다"
대학 글쓰기 2: 사회과학글쓰기,임인숙,23,Fall,3.0,"초반엔 과기글만 하시지 왜 사과글까지 하시지라는 생각이 들었음. 다른 사과글의 경우 사회과학 분야 논문 여러 편을 함께 읽는 걸로 아는데 여기는 교수님 전공 분야인 과학기술학 관련 책만 뜬금없이 가져오셔서 당황스러웠음. 로드는 많은 편이라기엔 사과글 특성인 거 같고, 피드백 꼼꼼하게 해주시니 그건 좋았음."
대학 글쓰기 2: 사회과학글쓰기,임인숙,23,Fall,5.0,처음 열린 강의인데 교수님은 괜찮았음 로드는 조금 많음
대학 글쓰기 2: 사회과학글쓰기,임인숙,23,Fall,5.0,"로드는 아랫분들이 잘 써주셨으니 생략하겠습니다. 개인적으로 3쪽 5쪽 제한이 결코 채우기 어렵지는 않아서 로드가 많다고 생각하진 않습니다. 필교치고 수업에서 얻어가는 것도 많고요. 다만 어느 정도 시간 투자는 해야 하고, 저도 이번 학기 전공과 비슷하게 투자하고 A+ 나왔습니다. 요약하자면 난 사과글에서 무언가를 얻어가고 싶다: 추천 난 사과글을 힘들이지 않고 치우고 싶다: 비추천"
대학 글쓰기 2: 사회과학글쓰기,임인숙,23,Fall,3.0,"교수님 인품도 좋으시고, 주어진 로드도 그리 많다고 생각하진 않습니다. 특히 교수님이 발표에 대해 정확히 짚어주리고 비판하시는 부분은 좋았습니다. 물론 그러면서 수업 점수 짜게 주시겠구나.. 하는 생각은 들었습니다 수업도 친절하시구요.   다만 로드가 많지 않으나, 퀄리티를 높게 하고 좋은 성적을 받으려면 노력을 상당히 많이 해야 합니다. 즉, 주제 뻔하게 해서 대충 치워야지~ 하거나 글 못쓰면 제대로 썰립니다.  자신이 진짜 독창적인 주제로 잡은 후 퇴고에 퇴고를 하는 과정이 매우 고됩니다. 자신의 글의 수준이 완벽하지 않다는것이 보이기에... 그러기에 대충 대글 듣고 치우자 하는게 보이는 글에는 점수를 매우 짜게 준거 같습니다. 특히 자신이 연구하고자 하는 주제가 확실하면 교수님께서 좋아하는거 같습니다. 단순 글쓰기 보단 사회과학 자유주제 소논문을 쓰는 느낌이 살짝 들었습니다.  저는 뼛속까지 이과였는데 동기분들이 글을 너무 잘 쓰고 글의 주제도 명확하고 수준도 높아서 많이 고생했습니다. 글쓰기를 그리선호하지 않으신 이과분은 과기글을 추천합니다  자신이 글 잘쓰고 교수님의 건설적인 비판에 맞설 자신이 있으면 점수를 확실히 가져갈 수도 있고, 수업들으면서 많은 성장을 이룰 수 있을거 같아 추천합니다. 다만, 글쓰기에 자신 없거나 대충 치우고 생각하는 분은 비추천합니다. 독창적인 주제로 글을 쓰는 것보다 무난하게 좋은 글을 선호하는 분에게도 크게 추천하지는 않습니다."
대학 글쓰기 2: 사회과학글쓰기,임인숙,23,Fall,2.0,성적을 정말 쪼잔하게 주지만 C+이라 오히려 좋아서 별 두 개 드립니다
대학 글쓰기 2: 사회과학글쓰기,임인숙,23,Fall,4.0,"학점 빼고 다 좋은 강의! 저는 아쉬운 성적을 받았지만, 수업 자체가 너무 좋았어요. 사과글은 원래 로드가 많다는 걸 감안하면 로드도 딱히 많은 편이라고 느끼지는 않았고, 기말 보고서를 소논문과 에세이 중 선택해서 쓸 수 있었다는 점이 좋았어요. 무엇보다도 수업 분위기가 정말 좋다는 점이 최고의 장점입니다. 다만 쉽게 좋은 성적을 얻어갈 수 있는 강의는 아니어서, 학점을 잘 받는 게 중요하신 분들은 다른 강의를 수강하시는 게 나을 것 같아요. 한 학기 동안 다들 수고 많으셨습니다~"
대학 글쓰기 2: 사회과학글쓰기,임인숙,23,Fall,5.0,"저는 정말정말 너무 만족했습니다!! 이번 학기부터 강의를 시작하셔서 어떨지 모르고 신청했지만, 임인숙 교수님 진짜 수업도 잘 하시고 잘 챙겨주시고 인품도 좋으셔요!! 그리고 엄청 똑똑하세요... 이번 학기 최애 강의였습니다!! 강의 또 듣고 싶어요!! ㅠㅠㅠ  1) 수업 분위기/강의 방식  교수님 인품도 좋으시고, 수업도 너무 잘하셔요! 또 공지나 설명을 정말 꼼꼼히 해주셔서 이해가 어렵거나 모호했던 적이 한 번도 없었어요! 그리고 학생들의 질문 하나하나에 다 열심히 대답해주시고, 상호작용을 원활하게 하려고 노력 많이 하세요!! 교수님 자체가 워낙 유쾌하시고 여러 밈도 많이 아시고, 이름도 다 외우세요! 저희 반은 실제로 다들 손도 많이 들고, 질문도 많이 하고, 수업 중간중간에 많이 웃기도 했어서 분위기가 정말 좋았어요!! 또 듣고 싶다는 생각이 들 정도로요!! 그리고 피드백 때 여러 조언을 주시는데요!! 진짜 똑똑하시다는 생각이 들었어요!! 피드백이 날카로운데 따뜻해요!! 하나도 기분이 안 나쁘고 다 납득하게 됩니다!! 정말 논리적이시고... 근데 부드러우세요.. 많이 배웠습니다!!  그리고 여러 글을 같이 읽고 팀끼리 이야기해보는 시간을 많이 가집니다! 부담은 하나도 없구 생각해보는 시간을 마련해주시려고 하는 것 같아요(성적에도 안 들어가요!)! 글의 한계나 의의를 함께 찾아보기도 하고, 대상을 정의해보기도 해요!(ex. 대학생 인플루언서는 어떻게 정의할 수 있을까?) 정말 재밌어요! 교수님이 돌아다니시면서 재밌게 이야기 소재를 이끌어내주시기도 합니다!    2) 로드  그다지 많지 않았습니다!! 글쓰기 과제 2개 빼고는 별다른 과제가 없어서 수업 진짜 편하게 재밌게 들었어요! 1. 책 일부분 읽고 비평글 쓰기(3쪽 이내) 2. 에세이나 소논문 중에 자유롭게! 하나 골라서 쓰기(5쪽 이내) 이렇게 2개예요!!   제가 제일 좋았던 건! 과정중심평가를 지향하세요! 무조건 잘 쓴 글에게 점수를 잘 주는 것이 아니라 얼마나 발전되고 있는지를 보세요!! 그래서 글을 잘 못 쓰는 저도 용기를 얻었던 것 같아요!!   그리고 글을 그냥 써오라고 하는 것이 아니라 단계별로 차근차근 할 수 있게 도와주셔서 더 좋았습니다!! 팀끼리 책 내용에 대해 미리 이야기해보는 시간도 가지고! 개인 논문 쓸 때도, 주제만 먼저 정해보고 피드백 받고 개선해볼 수 있고요!! 너무 어렵다 싶으면 교수님께 바로 연락드리면, 정말정말 친절하게 알려주십니다!! 저도 교수님께 질문 많이 드렸어요!!   그리고 다른 학우들의 글을 읽고 질문도 주고받고 그러는데, 정말 다들 똑똑하십니다! 재밌는 주제도 많고 같이 이야기해보는 시간도 많아서!! 고등학생으로 돌아간 듯한 느낌이었어요! 제가 제일 좋아했던 시간입니다!  3) 성적  A+ 받았습니다!! 근데 초반에 언급했듯, 잘 쓴 글보다는 얼마나 발전시켰는지 과정을 더 중시하신 것 같아요!! 왜냐하면 저는 확실히 글을 잘 못 쓰거든요..ㅎㅎ... 그래서 초안에 대한 피드백과 여러 학우분들의 질문도 최종본에 다 반영해보려고 생각도 오래 해보면서 노력했던 것 같아요!! 발전된 모습을 보이려고 했습니다!!   그리고 발표 후 질문 시간에도 열심히 참여했어요!! 사실 질의응답이 되게 자유롭고 활발했기에 재밌어서 참여했던 거였지만,,, 교수님께서 질문자 누구인지 확인하시기도 했어서 성적에 도움이 되었던 것 같기도 합니다!!  4) 세부사항  - 미리 한 학기 세부 일정표도 올려주셔서 일정 조정하기도 편했습니다.  - 카톡 오픈채팅방으로 과제 공지도 꼼꼼히 해주셔서 마감기한에 맞춰서 제출하기 좋았습니다!   - 글쓰기 부담 없애주시려고 2일 동안 휴강!    - 발표 순서도 원하는 날짜 투표도 받으심!!  - 조교님도 교수님처럼 엄청 친절하심!  - 지각 10분까지 정상출석으로 인정해주셔서 지각쟁이들에게 최고!  - 글쓰기 고민 상담도 받아주시고, 수정본도 받아주시는 배려왕!!  5) 총평 저는 교수님의 똑똑함과 날카로움, 그리고 따뜻함과 유쾌함이.. 너무 멋있었습니다. 정말 많이 배웠고 본받고 싶었어요! 질문에 대해 하나하나 친절히 받아주시고 피드백해주셔서 정말 감사했고!! 똑똑하신 학우분들, 유쾌한 반 분위기, 따뜻하신 교수님 덕에 정말 좋은 기억이었습니다!! 어차피 사과글 들어야하고 어차피 글 2개 써야한다면, 저는 임인숙 교수님 추천해요!!"
대학 글쓰기 2: 사회과학글쓰기,임인숙,23,Fall,5.0,교수님 친절하시고 학생들과 티키타카도 재밌게 해주셔서 수업 분위기가 항상 좋았습니다. 다른 사과글을 드랍하고 들었는데 상대적으로 로드는 그리 많다고 느끼진 않았어요.
대학 글쓰기 2: 사회과학글쓰기,임인숙,23,Fall,2.0,"일단 성적마감일날 나온 최종학점 보고 실망감을 감출 수가 없네요.. 다른 친구들 말 들어보면 대글은 학점미화되는 강의라고 입모아 말하던데.. 제가 열심히 안한 것도 아니고 제출기한이나 형식을 안지킨 것도 아니고 결석이나 지각을 단한번도 한 적도 없고 토의 참여점수도 높을뿐더러 피드백에서 나쁜 평가를 받지도 않았는데 이렇게 학점을 주신다니 많이 놀랐습니다..  사과글 특성상 당연히 로드가 매우 많습니다. 특히 임인숙교수님 사과글은 다른 사과글에 비해 로드가 빡세다고 할 수 있습니다. *발표3번(원래 4번인데 줄여주신거임)+발표 때마다 질의응답 및 피드백 시간 가짐(상호작용을 매우 중요하게 생각하심,교수님도 질문 많이 하심)  1) 매수업 때마다 읽기자료 읽고 조원들과 토의를 거친 후 패들릿에 짧게 글을 올려야 함(상당히 귀찮아요..) 2) 수업 중간중간에 교수님이 학생들을 지목해서 질문하심(심장이 떨립니다..질문도 어려워요..) 3) (테크놀로지의 정치라는 책..절대 쉽지 않은 책입니다) 테크놀로지의 정치 읽고->개요서 쓰기, 비평문 쓰기(3쪽), 비평문 초안 발표하고 질의응답 및 피드백, 비평문 최종본 쓰기 4) 소논문이나 체험에세이 개요서 쓰기, 개요서 발표하고 질의응답 및 피드백, 초고 쓰기, 초고 발표하고 질의응답 및 피드백, 최종본 쓰기  교수님 카리스마 넘치시고 강의에 열의도 넘치시고 글쓰기의 모범을 완벽히 알고 계시는 엄청 똑똑하신 인품 좋은 분입니다. 배우는 것도 감탄한 점도 많은 수업이었습니다. 하지만 6학점 되는듯한 수업을 포기하지 않고 최선을 다했는데 학점을 이렇게 주시니 화가 날수밖에 없네요. 평가에 있어서 엄청 깐깐하고 엄격하십니다. 이 점 각오하고 수강신창하세요. 힉점 잘 받고 대글 수월하게 치우고 싶으시면 이 강의 비추입니다. 훈훈한 이별을 한줄 알았는데 학점을 이렇게 주시다니.. 역대 최악으로 학점 안좋게 주는 강의 같습니다."
대학 글쓰기 2: 사회과학글쓰기,임인숙,23,Fall,3.0,로드가 많다곤 하지만 수업 전개 방식은 흥미로웠습니다. 얻어 가는 것도 나름 있었구요. 다만 최종 학점을 받고 나선 웃음기가 사라졌습니다.
대학 글쓰기 2: 사회과학글쓰기,임인숙,23,Fall,5.0,"이번 학기부터 강의를 시작하셔서 어떤 강의일지 모르고 신청했는데, 저는 개인적으로 매우 만족스러운 선택이었습니다.  [강의 방식과 자료, 강의력] 강의를 통한 지식 전달보다는 학생들의 글쓰기 산출물을 바탕으로 한 발표와 토론에 힘이 실린 수업입니다. 과제마다 간단한 이론/글쓰기 방식 설명과 실습이 끝나면 바로 초고에 대한 발표와 학생/교수자 피드백이 진행됩니다. 전체 수업 중에서 발표와 토론이 차지하는 비중이 큽니다. ""논문의 힘(김기란)""이라는 책을 이론 설명 수업 자료에 활용하시는 듯합니다(반드시 읽어야 하는 것은 아니며, 수업 시간 중에 넌지시 추천해주십니다.). 때때로 수업 진행 과정에서 에세이, 소논문 등 예시 읽기 자료가 주어지나 부담스럽지는 않으며, 읽기 자료에 대한 과제는 거의 없습니다(로드에서 후술). 교수님께서는 조목조목 글쓰기에서 필요한 부분들을 짚어주시며, 설명 과정에서 이해가 되지 않은 적은 없었습니다. 피드백 시간에 주시는 조언도 날카롭고 유용하다고 느꼈어요. 젊으셔서인지 유행하는 대학원 meme도 들고 오시고, 매 수업마다 웃음이 나올 정도로 수업 분위기는 유쾌했다고 느꼈습니다. 수업에 자잘자잘하게 언급되는 부분들까지 꼼꼼하게 챙겨 글에 반영한다면 좋을 것 같아요. 유용한 조언이나 이론 설명을 더 많이 해주실 수도 있을 것 같은데, 수업 시간이 촉박하여 그러시지 않는 것 같습니다. 이에 대해서는 개별적으로 글쓰기에 대한 고민 상담을 신청할 때 여쭈어도 좋을 듯합니다.  [로드] 크게 서평(초고 3쪽 이내, 최종본 3쪽 이상)과 체험에세이/학술소논문(초고 5쪽 이내, 최종본 5쪽 이상)으로 이루어집니다(11pt 기준). 기본적으로 로드가 많은 사과글치고는(최종 보고서를 10쪽 넘게 작성하도록 권장하는 교수님도 계시다고 하니) 로드 적은 편이라고 생각해요. 그 외로는 자잘하게 간단한 1쪽 내 분량의 도서 발제문이나 에세이/소논문 개요서를 작성하여 제출하거나, padlet에 읽기 자료를 읽고 글을 게시하기도 합니다. 부담스러운 수준은 아닙니다. padlet 활동은 수업 중에 거의 해결되며, 교수님께서도 간단하게 쓰실 것을 권장합니다. 이번 학기 서평의 경우는 교수님의 전공인 물리교육과 과학학이 반영되어 과학기술학 분야의 명저인 ""테크놀로지의 정치(실라 재서노프)""가 제시되었습니다. 개인적으로는 책의 내용이 신선했고, 과학기술학 분야에 대해 관심도 가질 수 있었어요. 책의 내용 일부 혹은 전부를 대상으로 작성하면 됩니다. 참고로 책을 읽고 조별로 활동하는 시간을 몇 주 갖는데, 조별 활동에 큰 부담은 가지시지 않으셔도 괜찮을 것 같습니다. 최종보고서는 체험에세이나 학술소논문 중 하나를 택하여 작성하는데, 구체적인 사항은 수업에서 안내되니 각자 원하는 것을 고르면 됩니다. 둘 중 하나를 더 권장하시지는 않아요. 각 글의 특성에 맞는 글을 썼는지를 더 중요하게 판단하시는 것 같습니다.  [성적] 저는 글쓰기교실에 방문하는 등 과제에 많은 노력을 투자하였고, 발표 후 질문 시간에도 때때로 참여했습니다. 그래서인지 최종적으로는 A+을 받았습니다(참고로 성적은 강제공개일에 공개되었습니다.). 다만 다른 학우님들 강의평을 보니 성적을 뿌리시지는 않은 듯합니다. 피드백 받고 수정하는 과정에서 얼마나 발전했는지를 중시한다고 하십니다. 문장력, 필력보다는 논리적으로 구성된 짜임을 중점적으로 평가한다고 말씀하셨으니, 그러한 점에 유의한다면 좋은 성적을 받으실 수 있을 것이라고 생각해요.  [총평] 이번 학기에 가장 재미있었던 수업이라고 생각합니다. 교수님의 시크함과 따뜻함과 함께하며 글도 잘 갈무리할 수 있었고, 뛰어난 학우님들께 많이 배우며 내적 친밀감도 생겼어요ㅎㅎ 들어야 할 사과글이라면 저는 임인숙 교수님 사과글 매우 추천합니다!!"
대학 글쓰기 2: 사회과학글쓰기,임인숙,23,Fall,2.0,"성적도 늦게 나오고.. 잘 안주고..과제도 많습니다. 학생들 생각 많이해주시긴 하는데 한학기 내내 고통스러웠네요."
대학 글쓰기 2: 사회과학글쓰기,임인숙,23,Fall,2.0,과제 많고 대글2 수업 중 성격도 짜게 주는 편입니다. 고려하고 신청하세요.
대학 글쓰기 2: 사회과학글쓰기,김태영,22,Fall,3.0,강의에서 배워가는 건 많지 않았는데 저는 생각보다 노력대비 학점이 나쁘지 않다고 생각했습니다. 그래도 로드가 많으니 적다는 분 걸로 들으세요.
대학 글쓰기 2: 사회과학글쓰기,김태영,22,Fall,2.0,학점 짜고 강의력이 좋다고는 생각하지 못했습니다.
대학 글쓰기 2: 사회과학글쓰기,김태영,22,Fall,4.0,"전 김태영 교수님 너무 괜찮았습니다 솔직히 다른 사과글 보면 이 사과글이 로드 제일 없습니다 다른 친구들이랑 비교해봐도 이 수업이 제일 편하게 사과글 치울 수 있어요 교수님이 피드백 상세하게 해주시는 편이고 전 이해하기 쉽게 해주셨다고 생각해서 좋았습니다 데드라인도 촘촘하게 짜주셔서 전 오히려 좋았네요 안밀리고 과제 할 수 있었습니다 그냥 과제 한번에 몰아주시고 데드라인 길게 주셨으면 오히려 밀려서 힘들었을 것 같은 .. 그리고 이론적 설명 잘해주신다고 생각했습니다 예시까지 들어가면서 잘 해주셨다고 생각했는데 왜 배워간게 없다고 느낀 분들이 많았는지 잘 모르겠습니다.. 전 학술에세이 쓸 때도 수업시간에 배운 내용 도움 많이 됐어요 타 학우들의 피드백 듣는 것도 도움 됐습니다 어쨌든 예리한 지적들이 많이 나오고 학우들 간 상호작용 할 만한 수업이 많이 없는데 지적인 상호작용이 일어날 수 있는 수업이라는 점에서 유의미하다고 생각합니다 물론 저도 학점에 약간 아쉬움이 남습니다만 타 학우분들이 뛰어나시기도 하고.. 제 글이 부족했을 수도 있잖아요 졌잘싸 같은 느낌입니다  수업시간 다 채우시는건 뭐 저는 이해하고 늦게 끝날 땐 급한 사정 있는 사람들은 보내주셨습니다"
대학 글쓰기 2: 사회과학글쓰기,김태영,22,Fall,2.0,"위트있게 수업을 하려고 하시는 것 같은데 정작 배울 수 있는 건 별로 없었어요. 굳이 비유하자면... 대학 강의가 아니라 외부 강연 듣는 느낌이라 해야되나...? 교수님께서 원하시는 글 유형이 분명 있는 것 같지만 그게 명확히 뭔지는 잘 모르겠어요. 학점이 수업의 전부는 아니지만, 다른 강의평들을 보니 저만 기준을 알 수 없는 학점을 받은 건 아닌가보네요. 여러모로 아쉬움이 많이 남아요."
대학 글쓰기 2: 사회과학글쓰기,김태영,22,Fall,2.0,"출석은 너그러우신 듯하고, 학생들 간의 상호 피드백을 중시하셔서 서로 발표/피드백을 상당히 많이 합니다만 도움이 되진 않습니다.. 수업 시간 내에 가벼운 글짓기를 많이 하나 글쓰는 방법에 대해서는 크게 도움된 것 같지는 않아요. 그리고 엣지있는 학술 에세이를 원하시는데 뭔지 잘 모르겠고 주제의식을 화끈하게 제시해라 이런 피드백을 하십니다.. 학점은 물론 굉장히 짜구요. 정말 투입을 많이 했는데 아쉽습니다"
대학 글쓰기 2: 사회과학글쓰기,김태영,22,Fall,3.0,과제 빡세고 학점은 박해요. 교수님만의 글 평가 기준이 매우 강해요
대학 글쓰기 2: 사회과학글쓰기,김태영,22,Fall,2.0,"교양이라고 하기엔 힘든 수업입니다. 학술에세이 발표할 때 수업이 40분 정도 늦게 끝나기도 했고 한두 번을 제외하고는 항상 꽉꽉 채워서 혹은 3~5분 늦게 끝내주셨습니다. 논평 세 번(+학우 글에 댓글 달기)에 학술에세이 하나(개요+초고+최종본)를 석 달 내에 해치우려니 상당히 빠듯합니다. 피드백을 길게 해주시긴 하시나 그 피드백을 어떻게 반영하여 퇴고했어야 했을지는 아직도 잘 모르겠습니다. 시간을 많이 투자한 것에 비해 힘들었다는 기억 외에는 별로 남는 게 없는 듯합니다."
대학 글쓰기 2: 사회과학글쓰기,김태영,22,Fall,2.0,편하게 치우기는 했는데 … 배운 것은 없었다… 교수자만의 기준이 되게 강하다고 느꼈고 피드백에서도 학생의 글를 제대로 읽고 이해했는지가 의문이었다.
대학 글쓰기 2: 사회과학글쓰기,최정은,23,Fall,5.0,"사과글 들을거면 이 강의 듣자 머 하나 부족할 거 없는 강의 과제는 좀 있지만 스스로 점점 글을 잘 쓰게 되는 경험을 하게 된다. 조교님도 너무 착하시다. 열심히시고 말이야."
