현대종교와 문화,최연정,21,Fall,4.0,"-중간보고서, 기말시험이 끝임 -녹강도 어떤건 20분짜리이기도 해서 정말 이득 -하지만 내용 자체가 추상적이어서인지 집중이 잘 안되고 나도 모르게 딴짓하게 된다.. -글 쓰기 주제는 종교관련 사회이슈나 문화 사례와 종교 엮어서 글쓰기 6페이지 정도~! -시험문제는 시험정보칸에 올려두었음. 기말시험은 제법 잘 친 느낌?이었음. 시간을 2시간 주셔서 침착하게 할 수 있었암 -녹강도 바로 안 지우셔서 반복해서 들을 수 있음 -중간보고서는 발표해달라고 요청받음(글의 퀄과 상관없이 주제가 좋고 흥미로우면 선택된다고 하셨음)그래서 발표 아주 부담없이 간단하게 했음 결과는 에쁠 확실히 부담이 없는 편이기는 한 듯"
현대종교와 문화,최연정,21,Spring,5.0,이 강의 진짜 배워가는거 많습니다.. 최고. 소규모로 진행되어서 그런건지 모르겠지만 학생들에게 신경엄청 쓰시는게 보임
현대종교와 문화,최연정,21,Spring,5.0,"일단 교수님께서 수업과 학생들에게 애정 있으신 게 보였습니다. 시험은 기말 한 번이고 오픈북이어서 수업은 가벼운 마음으로 재밌게 들을 수 있었습니다. 저처럼 종교학 처음 접하시는 분들도 부담 없이 들을 수 있도록 사례도 많이 들어주시고 내용 자체도 어렵지 않습니다. 종교에 대한 새로운 인사이트를 얻어갈 수 있어서 좋았습니다. 중간보고서는 주제 신중히 잘 정하시고 평소 수업 들으면서 생각 좀 정리해 두시면 큰 어려움 없이 작성할 수 있고, 피드백도 받아 보실 수 있습니다. 중간시험이 없다 보니 로드도 딱히 많다고는 느껴지지 않았습니다. 강의평도 없고 이번 학기에 소규모로 진행되었어서 처음엔 조금 걱정됐지만 전반적으로 되게 만족스러운 수업이었어요."
현대종교와 문화,최연정,21,Spring,5.0,"종교학을 아예 모르던 사람인데, 이 강의를 들으면서 종교학에 관심이 생길 정도로 유익하고 재밌게 들었던 강의입니다! 과제- 쪽글 1번, 중간 보고서 1번 / 시험- 기말. 비대면 오픈북 학생들 편의도 많이 봐주시고, 소통도 정말 잘해주셨습니다. 시험도 강의 열심히 들었다면 충분히 잘 써낼 수 있었고, 과제 진행할 때도 피드백 많이 주셔서 큰 부담없이 들었던 강의였습니다. 강의평이 없어서 초반엔 조금 걱정됐지만 성적도 잘 주시는 것 같습니다!"
현대종교와 문화,김민아,19,Fall,4.0,"그냥  그랬던 강의였습니다. 시험은 기말 한 번이고, 과제는 중간보고서, 기말보고서 두개였습니다. 기말보고서가 40퍼고 기말고사가 30퍼이니, 보고서의 비중이 매우 큰 것을 알 수 있으실 것 같습니다. 수업은 피피티 위주로 진행되며, 빽빽한 피피티를 주로 읽으시고 이에 대한 부연설명 한두 마디정도 덧붙이십니다..! 저는 기말 보고서에 영혼을 아그작 갈아넣었는데요, 점수가 낮은 편인지는 확실치 않아 잘 모르겠습니다. 기말고사는 그냥 2회독하고 가니 충분했습니다. 저는 오픈북이라 피피티의 목차를 따로 정리해서 사전찾는듯이 했던 것 같습니다. 시험 질문도 어려운게 아니라 무슨 내용인지 이해했는지를 물어보는 것 위주라 찾는 것만 빨리하시면 큰 무리 없을 것 같습니다. 그러나 시험범위 자체가 좀 부담스러웠습니다. 물론 암기가 아니긴 하지만 분량이 너무 많았어요. 매 수업때마다 20~24슬라이드정도를 나가시는데, 그게 약 24회차 분량이었습니다. 물론 사진으로 채워진 슬라이드도 많았지만 저는 1회독 좀 꼼꼼히해서 3~4일정도 걸린것 같습니다!  오픈북이다보니 인쇄할 프린트의 양도 어마어마했어요..! 그래도 최대한 학생들의 의견을 들으려고 하시고 열정 넘치시는 교수님이십니다. 종교학에 대해 좀 더 공부해보고싶으시다 한다면 시간안맞으실때 끼워넣는 강의정도로 적당할 것 같아요.. 그런데 중간보고서 채점이나 기말 보고서 채점이 약속보다 계속 미뤄지면서 지쳤던 부분들은 좀 있네요.. 그냥 전반적으로 무난무난 했습니다. 16명?정도 들었던 수업이라 비율이어느정도일진 모르겠으나 저는 에이플 받았어요.. 그냥 고생 한만큼 받은 것 같습니다"
현대종교와 문화,유요한,23,Fall,5.0,이번학기는 수강생이 8명 밖에 없어가지고.. 가족같은 분위기의 수업이었습니다. 근데 과제도 무난하고 시험도 오픈북이라서 큰 부담없이 수강하였습니다.
현대종교와 문화,유요한,18,Fall,2.0,"스누라이프 평을 참고하면 좋을듯 저는 별로였습니다"
현대종교와 문화,유요한,18,Fall,3.0,"제가 이과라  이러한 성격의 과목들에 익숙하지 못해서 그런지는 모르겠지만, 저에게는 강의 내용이 좀 어렵게 느껴졌습니다.  교수님께서 말하는 게 빠르셔서 저는 필기하고 있는데 뒤의 내용으로 넘어가고 계시는? 이런 상황이 계속 반복되더라구요...저처럼 노베이신 분들은 강의 따라가기 좀 힘드실 수도 있을 것 같아요.  시험은 오픈북 기말 한번이었는데 피피티를 프린터해서 들고 들어가는 건 불가능합니다.  시험범위가 많아서 정리하는 데만 사나흘 정도 쓴 거 같아요(제 타자가 그렇게 빠르지 않은 점 감안해서).  앞에서도 말씀드렸듯이 제가 이런 분야 논술을 잘 못해서...성적은 좀 그렇네요.  과제는 두번인데 첫 과제는  한페이지 분량에 제출만 하면 만점이고, 두번째 과제는 세페이지 정도 분량에 성적에도 꽤 많이 들어갑니다. 이 강의는 내가 완전 이과 성향이다 혹은 이쪽 분야에 노베다 하시는 분들께는 좀  어려울 수 있을 듯하네요..."
현대종교와 문화,유요한,18,Fall,4.0,"교수님이 학생들과의 소통을 중요하게 생각하십니다. 수업시간에 눈 많이 마주치시고 이름도 거의 다 외우고 계십니다. 마지막 날에 시험보는데 돌아다니시면서 말 걸으시면서 따뜻한 말도 해주셨어요.  열정이 넘치시고 강의도 재밌게 하시려 노력하십니다.  과제는 총 두개였는데, 하나는 내기만 하면 만점처리하시고 그다음 하나는 조금 꼼꼼히 채점하시는 편인 것 같습니다.  시험은 오픈노트로 보기 때문에, 노트를 스스로 정리했다면 시험 문제에서 물어보는 부분을 빨리 찾아 쉽게 답할 수 있어요. 단 기말몰빵이기 때문에 미리미리 정리해 놓으시는 것을 추천합니다.  현대종교와 문화에 대해 새로운 지식을 얻기보다는 여러 관점들을 배운 강의였습니다."
현대종교와 문화,유요한,18,Fall,4.0,"수업자체는 초반부 개념 설명을 제외하면 어렵진 않았어요. 학업적으로나 인생에 있어서나 많이 얻어갈 수 있는 수업이었다고 생각해요. 로드는 2개 보고서있는데 첫번째는 다 만점이고 두번째 레포트가 비율 많이 차지해요. 기말은 오픈북이라서 그냥 한 두번 읽어가면 다 쓸 수 있어요.  학점은 칼같이 쁠마제 다 챙겨주는 것 같네요."
현대종교와 문화,유요한,18,Fall,2.0,"기대를 많이 하고 수강신청한 강의였는데 생각보다 얻어가는 게 그리 많지 않았습니다. 고등학교 선생님 같은 느낌은 맞는데 제가 좋아하는 방식의 강의는 아니어서 조금 힘들었어요. 교수님께서 파이팅 넘치시는 스타일인데 개인적으로 조금 부담스러웠습니다. 죄송합니다 교수님,,,, 그래도 멋진 어른이셔용,,,,  시험은 오픈 노트고 어렵지는 않았습니다. 평소 수업을 아예 자면서 듣지만 않으면 충분히 잘 풀어낼 수 있는 수준이었어요. 물론 절대 못 잡니다. 학생들을 계속 깨우시거든요. 이름이랑 얼굴도 다 외우십니다. 그게 참 신기했던 기억이... 과제는 중간레포트 제출만 하면 만점인 것 하나, 기말레포트 하나인데 둘 다 깐깐하고 꼼꼼하게 보십니다.  교수님께서 인문대 부학장??인가 하신다고 다음 학기에는 강의 안 열린다고 하네요. 혹시라도 나중에 강의가 열린다고 하더라도 그리 권장하고 싶은 강의는 아닙니다."
현대종교와 문화,유요한,18,Spring,4.0,"강의력이 굉장히 좋으심 그리고 수업 때 대학생활, 인생 이야기를 수업 내용 관련해서 많이 해주시는데 너무 좋았음 위로 받고 힐링 되는 느낌~!! 수업 내용 자체도 처음 종교 개념 강의 좀 제외하면 크게 어렵지 않고 교수님 강의력이 좋으시기 때문에 핵교임에도 불구하고 편하게 들을 수 있었음 로드도 2번 밖에 안 되는데 한 번은 제출하면 무조건 만점이고 다른 하나도 5장 내외라 크게 부담 없음 시험은 기말 한 방인데 오픈북이라 할 만함~ 다만 성적은 칼로 짤라서 쁠마제 다 주심... 그래도 노력한만큼 성적 나오고 배워가는 게 많았던 수업~!!"
현대종교와 문화,김종서,22,Spring,5.0,"군원격강좌로 수강했습니다.  과제는 매주 열리는 토론 게시물에 댓글 작성하기와 2번의 보고서 작성이 있습니다. 첫 번째 보고서는 영화 감상문 쓰기인데 영화를 구글에 검색해서 몇 천원 내고 보면 자막이 지원됩니다. 두 번째 보고서 쓸 때 참고자료로 교수님이 쓰신 책을 추천해 주시는데, 굳이 읽지 않고 써도 상관없는 것으로 보입니다(저는 읽고 썼는데 책 내용을 하나도 반영 안했습니다). 시험은 족보를 타는 것 같습니다."
