시사스페인어,김선영,23,Fall,5.0,가장 친절하시고 가장 좋으셨던 교수님인데다가 가장 학생들의 편의를 봐주셨던 강의. 육아휴직으로 잠시 쉬시긴 하지만 다시 돌아오신다면 꼭꼭 다시 강의로 만나뵙고 싶은 분.
시사스페인어,김선영,23,Fall,5.0,"교수님이 너무 스윗하세요!! 진짜 교수님 최고.. 다만 교수님께서 쉬운 걸 선택하시려고 노력은 굉장히 많이 하시는데 제 수준이 딸려서 그런가 처음엔 따라가기가 좀 어려웠어요ㅠ 대학교에서 처음으로 스페인어 배우는 분이시라면 초스2도 좀 어려울 것 같고 중스까지는 들으셨어야 할 것 같아요… 스페인어 전공생분들도…ㅎ 들으시니 준비는 단단히 하고 오세용 하지만 시험이 준비만 제대로 하면 쉬운 편이고 교수님께서 학생 편의를 많이 봐주셔서 성적은 잘 나왔어요! 시험준비는 전혀 어렵지 않아용"
시사스페인어,김선영,23,Fall,5.0,"졸업까지 가장 재밌었던 수업 중 하나입니다. 교수님도 정말 좋으세요. 평소 스페인어 관심 많은 분들은 꼭 들으세요. 다만 초스1만 들으신 분들은 권장하지 않아요. 어느정도 초스2 수준은 나와야 해석도 편하고 수업 내용 더 잘 이해해서 재미있게 들을 수 있을 거예요. 교수님 다른 수업을 또 못 듣고 졸업하는 게 아쉽습니다.  시험도 학생들 부담 줄여주시려고 많이 신경써주십니다. 그래서 시험에 너무 부담 갖지 않고 수업 재미있게 들을 수 있었어요. 수강생글 발표 내용도 재밌었습니다"
시사스페인어,박은영,22,Fall,5.0,교수님이 너무 착하고 좋습니다. 이해도 많이 해주시고 어려운게 있으면 애기도 잘 들어줍니다. 부담 없이 듣고 A+ 받아갑니다.
시사스페인어,성초림,20,Spring,5.0,"출석20 기말80 (아마..?) 두 번 결석했고,, 기말의 경우에는 앞에 있는 스페인어 표현 문제 다섯 갠가 못쓰고 뒤에 있는 번역 문제도 맨 마지막 건 제 맘대로 모르는 거 다 생략하고 써서 성적으로는 꼴찌였을 것 같았는데 에제를 받았네용 ㅎㅎ,,  초스2 까지만 들은 스페인어 찌랭이라 매 수업 전날 열라 열심히 예습해가도 모르는 것 투성이였기에 수업 따라가려고 공부를 많이 하게 되었던 것 같음,, 그래서 스페인어 글 보는 (?) 읽는 (?) 실력이 꽤나 늘어난 것 같음 ! ! 교수님께서도 많이 알려주시려고 하고 편하게 공부할 수 있도록 신경 써주셨지만 그걸 100% 다 받아먹진 못한 것 같아서 아쉽고 조오금 죄송하기도 한,, 고런 수업이었음 ~ 저에겐 나름 challenging하고 재밌기도 하고 스스로 열심히 할 수 있었던 수업이라 많이 배우고 많이 얻어갑니다!!"
시사스페인어,성초림,20,Spring,5.0,"이번 학기는 비대면이라서 중간고사가 없었고 전범위 기말고사만 한 번 봤습니다. 소수강의여서 더 그런지 교수님께서 학생들과 소통하려고 많이 노력하시고 수업참여와 질문 기회도 많이 주십니다. 수업 전에 기사를 읽고 모르는 단어를 대략 찾아오는 거 외에는 로드가 전혀 없습니다. 시험은 스페인어 단어의 한글 뜻 쓰기(단답) + 문단 해석(서->한)으로 나왔고, 수업 때 알려주신 시사용어 필기만 잘 외웠다면 쉬운 시험이었습니다. 절평이라 학점도 잘 주시는 것 같고요. 쉬운 기사는 중스2보다 훨씬 쉽고 어려운 기사는 중스2보다 어려운 정도의 난이도입니다.  스페인어 좀 하시는 분이라면 상당히 꿀강이니 꼭 들어보세요!"
