고급물리학 2,양운기,23,Fall,5.0,"시험없고 과제없고
오직 ”태도 100%“
재밌었습니다~"
고급물리학 2,양운기,22,Fall,1.0,"고급물리학 1에 별 5개 박아놓은 사람입니다. 이번에도 A+의 맛에 홀려 5점을 박으려던 찰나 극적으로 정신을 차리고, 이렇게 강의평을 작성합니다. 역시 똑같은 실수를 두번 반복할수는 없죠.  시험은 쉽고, 딱히 공부할것도 없습니다. 이에 따라 평균도 높고, 감사하게도 평균적인 학점 또한 높게 책정해주셨습니다. 숙제 문제는 매번 내주신다고 하면서 결국 학기가 끝날때까지 한번도 내주시지 않았습니다. (전 처음에는 이게 츤데레 컨셉인가 생각했는데, 가면 갈수록 컨셉이 아니라 진심으로 자기가 한 말을 까먹는 것 같아 조금 무서웠습니다.) 자 미담은 여기까지 하고 왜 본 강의는 1점을 받아 마땅한지 설명해 보이겠습니다.  양 교수님의 물리학은 으음 무슨 단어를 써야 할지 잘 모르겠는데... 폭력적입니다. 제가 알고 있는 물리학은 고상하고, 때로는 대범하고, 종합적으로 '잘 짜여 있는' 학문입니다. 하지만 이 수업에서 제가 접한 물리학은 분명 그 구성 요소들은 비슷한데, 그 짜임새가 조금 (많이) 맛이 가 있습니다. 어떤 두 내용은 어느정도 다른 관점에서 보아야 하는 것인데, 그 둘이 어거지로 끼워맞추어져 있습니다. 마치 맞지 않는 구멍에 억지로 쑤셔넣은 것처럼요. 물론 보기 좋은 폭력성 또한 있습니다. ""와 이런 발상을 해? 크으으 미쳤다"" 하는 류의 어떤 비직관적 도약이라던지, 멋진 접근법이라던지가 그 예시입니다. 하지만 이 수업을 들으면서는 위와 같은 생각보다는 ""...미쳤나?"" 하는 생각이 더 자주 들었던것 같습니다...  비유를 통해 설명하겠습니다. 제가 아는 (그리고 좋아하는) 물리는 잘 쓰여진 설명서를 따라서 조립한 레고 작품입니다. 하지만 이 수업에서 구축하는 물리는 영유아가 눈에 보이는 대로 닥치는 대로 조립한 레고 덩어리같습니다. 서로 맞지 않는 조각들이 어거지로 끼워져 있고, 전체적인 조형 또한 아름답지 못합니다. Quantum harmonic oscillator 에서 어거지로 식을 끼워맞춰 플랑크 법칙을 유도하는 것을 볼 때는 정말... 막스 플랑크가 눈앞에서 부관참시당하는 것을 보는 기분이었습니다. 파동방정식에서 슈뢰딩거 방정식을 '유도' 하는것을 볼때도 마찬가지였습니다. 1학기때는 그래도 교수님이 실수하고 고치시거나, 아예 못 푸시는 그런 경우가 대부분이어 괜찮았는데, 이번 학기에는 애초에 '잘못된' 물리학이 강행되어 그 점이 굉장히 속상했습니다. 더욱 슬픈 점은 교수님이 이러한 자신의 강의에 대하여 나름의 자부심과 믿음을 가지고 계시다는 점이 느껴졌다는 것입니다.  저는 이러한 물리학이, 실례와 비판을 무릅쓰고 '오답'이라 말하고 싶습니다. 일반적인 논리, 유명한 논리가 언제나 좋은 논리라 할 수는 없지만, 최소한 그 보편성과 안정성에만큼은 동의할 수 있습니다. 교육에서의 활용을 위해 논리 자체의 고상함을 약간 포기하고 접근성을 높인 논리도 있으며, 모든 고정관념을 해체하고 자신의 언어로 재구성하는 천재적인 논리도 있습니다. 하지만 이 수업은 위 중 어디에도 속하지 않습니다. 원래의 물리학을 해체하고, 마구 뒤섞어놓은 다음 그 어떤 것도 제대로 마무리하지 않는 이것은, 물리학이라 하기에는 너무 조악합니다.  자신의 물리학, 그러니까 자신이 스스로 공부하며 쌓아온 물리학의 내용, 구성, 체계가 충분히 견고하지 않은 사람이라면 이 강의는 조금 위험할 수 있겠다는 생각이 듭니다. 물리에 대한 나의 노력과 믿음이 확실하다면 문제없지만 (공짜 A+), 물리란 무엇일까 하는 질문에 처음 봉착해 혼란을 겪고 있는 학생들에게는 독이 될 것입니다.  이러한 이유 때문에 저는 이 강의가 별 하나를 받아 마땅하다고 생각합니다.  이 수업을 수강하지 말라는 뜻이 아닙니다. 강의실 와서, 알아서 시간 잘 보내시다가, 시험 잘 쳐서 A 받아가세요. 이만 각설하겠습니다."
고급물리학 2,양운기,22,Fall,4.0,물리를 배우기 위한 강의가 아니라 전공 땡겨들을 친구들이 물리 교양 로드를 죽이고 성적 꿀빨으려고 듣는 강의! 1학기와 달리 과제도 없었다. 출석은 매번 부르시고 공부 안 하고 봐도 90점 이상 맞게 시험도 나온다.
고급물리학 2,양운기,22,Fall,4.0,로드는 그냥 없다고 보면 됨. 이번 학기에는 교수님이 까먹으셨는지 과제가 그냥 나온게 없었다. 게다가 시험도 너무 쉽게 나와서 공부하는게 의미없을 정도. 다만 쉬운만큼 얻어가는 건 없는듯
고급물리학 2,강병남,21,Fall,5.0,"매일매일 출석했더니 A+을 주셨다 교수님 마지막 강의라고 하시네요.."
고급물리학 2,강병남,20,Fall,5.0,1학기에 이어 2학기때도 듣게 되었는데 정말 좋은 교수님인것 같습니다. 수업 방식도 자유로운 편이며  다른 교양 물리학 강의에서 하지 않는 활동들을 해볼 수 있습니다.
고급물리학 2,강병남,20,Fall,5.0,물리학 뿐만 아니라 영어 실력과 프로그래밍 능력을 동시에 향상할 수 있는 훌륭한 수업입니다. 다만 과학고등학교를 우수한 성적으로 졸업하거나 한국물리올림피아드 겨울학교를 수료하거나 물리인증제 전문가과정을 통과했다고 본인이 고급물리학 2 자격시험에 무조건 합격할 실력이라고 자만하시면 안됩니다. 이번 학기에는 국제물리올림피아드 국가대표 후보이자 물리학부문 대통령과학장학생이 탈락하는 사건이 발생했습니다. 고로 아무리 자신있다고 하더라도 물리학 2를 반드시 수강신청해놓아야 합니다. 세상은 넓고 물리학과 영어를 잘하는 학생은 많습니다.
고급물리학 2,강병남,17,Fall,5.0,"킹-갓 과목입니다. 들을 수 있다면 그냥 반드시 들으세요. 못해도 에제는 주십니다. 대부분 에플 주시니 그냥 들으세요. 같이 듣는 친구들도 갓갓이라 많은 걸 배울 수 있습니다."
