이태리어 2,이기철,23,Fall,5.0,꿀강그자체 이기철 선생님 감사합니다 문화 자료도 처음엔 버거웠는데 나중에 범위 줄여주세요
이태리어 2,이기철,23,Fall,5.0,"절평이지만 성적 컷이 그렇게 널널하지는 않습니다. 또 5페이지 레포트가 기말에 있어서 조금 귀찮습니다. 하지만 교수님이 수업을 열정적으로 하시고, 학생들을 배려해주시는 따듯한 분입니다. 이태리어 1과 달리 이태리어 원문 해석이 추가되지만, 다른 중급 외국어보다 훨씬 편한 강의라, 성적 잘 안나왔지만 5점 드리고 싶네요 ㅎㅎ"
이태리어 2,이기철,22,Fall,5.0,이태리어 1과는 달리 절평이라 성적을 잘 주시는 분위기인 거 같아요!! 수업도 재밌고 교수님도 친절하시고 저는 영어 면제라 외국어 두 개 들어야 해서 들었는데 로드도 없고 최고입니다
이태리어 2,이기철,21,Fall,5.0,"중간고사와 기말고사는 모두 책과 읽기자료에서 나옵니다.  친절한 설명과 흥미로운 이야기들이 가득한 수업으로 수강하시길 매우 추천드립니다."
이태리어 2,이기철,20,Fall,5.0,"ㄹㅇ 천사십니다..진짜 선생님이 가르치시는 다른 수업 더 있었다면 다 찾아들었을 정도👍 수업은 선생님이 계속 강의하시다가 연습문제/프린트 해석 같은 건 학생에게 시키시는 형태로 진행되는데, 연습문제는 교재 답안이 엄청 잘 돼있고(해석도 다 되어있음) 프린트 해석도 수업 전에 미리 공지하시기 때문에 큰 부담은 없습니다.(저는 미리 안 하고 파파고 틀어놓고 시키시면 했어욬) 근데 잘 못하고 버벅거리더라도 꼭 잘했다고 해주시고 같이 해석해주셔서 마음이 따뜻해지는 시간이었습니다. 시험은 교재랑 프린트 예문에서 토씨 하나 안 틀리고 나오는 편이라 저는 그냥 통으로 암기했는데 그래서 시험 때 빠르게 쓰고 나올 수 있었네요. 다만 프린트 해석 문제가 나온다고 하셔서 대충 한두 문장 나오겠지 생각했는데 한 문단씩 3-4 문제가 나와서 좀 당황했던 기억도; 하여튼 기철쌤 이태리어 안 들으시면 손햅니다 여러분"
이태리어 2,이기철,19,Fall,5.0,"이태리어 원래 할 줄 아시거나 이태리어1 강의 들으셨으면 이거 들으면 진짜 꿀입니다. 과제도 정말 쉬운 거 하나밖에 없고 시험범위도 적은 편이에요.  출결은 초반에만 몇 번 부르시다가 안 부르시고 학점도 정말 잘 주십니다(이번학기에 절평과목. 근데 이게 시범운영인지 계속 갈건지는 모르겠음).  이탈리아 문화 관련 읽기자료를 주시고 이것도 교재 문법사항과 더불어 시험범위에 들어가는데, 무슨 뜻인지 적을수만 있으면 되도록 문제 내시고 내용도 나름 재미있습니다."
이태리어 2,이기철,17,Fall,5.0,"강의력도 좋으시고 학점도 개꿀.. 최고예요 시험도 책 그대로 내시고 문화 관련 얘기도 많이해주셔서 정말 많이 배우고 갑니다!"
