인간과 종교,방원일,23,Fall,5.0,"정말 꼭 들으시길!
종교를 이루는 믿음, 의례, 텍스트, 권력 등등의 요소들을 하나씩 뜯어보고, 더 중요하게는 그 속에 담긴 인간적인 구석들을 끌어내 곱씹어보는 수업입니다. 내용도 매우 흥미로웠고, 구성이 탄탄하다고 느꼈습니다! 교수님도 너무 좋으셨습니당,, 이번 학기 최고의 수업!"
인간과 종교,방원일,23,Fall,4.0,종교관련 교양으로 듣기 좋은 강의. 영상도 많이 틀어주시고 해서 나름 수업이 흥미로웠던 것 같아요. 중간 대체 과제랑 기말고사 보는데 시험은 수업 때 다뤘던 굵직한 내용들을 중심으로 나옵니다.
인간과 종교,방원일,23,Fall,5.0,종교를 다양한 측면에서 바라보면서 나의 편협한 종교관을 깨부셔주십니다.. 그리구 현대사회에서 인간이 종교를 실천하는 방법에 강의 초점이 맞춰져있어서 재밌고 흥미로운 사례들이나 영상자료를 많이 들고 와주십니다 쪽글이 당일 마감이라 조금 빡센데 금방 작성하기도 하고 흥미로운 주제인만큼 부담스럽지 않은 정도얐어요
인간과 종교,방원일,24,Spring,5.0,교수님 재밌으시고 좋으심. 쪽글 제출하는 게 있긴 하지만 출석도 잘 안 부르고 좋음
인간과 종교,방원일,23,Fall,4.0,"내용 괜찮고 성적도 너그럽게 주심 근데 종교 관심없으면 힘들듯"
인간과 종교,방원일,23,Fall,5.0,전체적인 내용이 흥미롭고 성적도 너그럽게 주십니다.
인간과 종교,방원일,23,Fall,5.0,"매우 흥미로웠던 수업! 종교에 대해 다각도로 알아보고, 여러 시각자료들을 통해 현대 종교학에 대해 알아볼 수 있었습니다. 교수님 강의력도 좋으시고, 종교학이라는 학문에 관심이 별로 없었지만 덕분에 많은 것 배워갑니다. 로드는 짜잘하게 있긴하지만 성적은 잘 주시는 것 같습니다."
인간과 종교,방원일,23,Fall,5.0,"교수님께서도 '종교학개론' 같은 수업이라고 하셨듯, 교재 맬러리 나이의 『문화로 본 종교학』을 바탕으로 종교학의 입문적인 내용들을 다룹니다. 교재에 나온 의례, 텍스트, 믿음, 젠더 등 다양한 키워드를 중심으로 종교의 다양한 면모에 대해 학습하는데, 궁극적으로는 '종교는 결국 인간이 하는 것'이라는 종교학적 메시지를 담고 있습니다. 이러한 종교학적 관점에서 종교에 대해 다시 생각하고 이해해 보는 기회를 얻을 수 있는 강의입니다. 비종교인으로서 그간 종교를 '믿음'에 국한시켜 이해하고 편견어린 시선으로 바라보고는 했었는데, 수업을 수강하며 그런 편견에서 벗어나서 종교를 학문적으로 접근할 수 있었던 것 같습니다. 교수님께서 다양한 사례를 들어 종교를 설명해 주시기에 내용이 흥미진진하고 이해가 어렵지 않습니다. 또한 잔잔하지만 흡인력 있는 어조로 강의를 진행하시는 데다 유머 감각도 있으셔서 수업 자체도 매번 재밌었습니다.  과제는 총 네 차례의 쪽글과 중간 보고서가 있었고, 시험은 기말고사만 보았습니다. 개별적인 점수는 공개하지 않으셔서 채점 기준을 알기는 어렵지만, '종교는 인간이 하는 활동이며 그것을 이해하고자 노력해야 한다'는 강의의 궁극적인 메시지를 과제와 시험 답안에 얼마나 잘 녹여내느냐가 관건인 듯합니다. 중간 보고서는 메일로 피드백을 요청드리면 최종 성적 산출 기간에 피드백을 해 주시는데, 매우 따듯하고 친절하게 답장을 남겨 주십니다. 시험은 전부 서술형인데, 굵직한 내용 위주로 출제되므로 답안 적기가 어렵지 않습니다. 다만 적어야 하는 분량에 비해 시험 시간이 적은 편이라 시험은 다소 빠듯합니다. 그래도 열심히 하는 만큼 최종 성적은 잘 주십니다.   결론적으로 종교를 보는 새로운 관점을 제시해 주는 매우 좋은 교양 강의입니다. 저처럼 종교를 가지지 않은 사람들도 들어보기 좋은 강의이므로 관심이 있으시다면 꼭 수강하시길 권합니다. 교수님께서 티스토리에 개인 블로그도 운영하시는데, 종교학과 관련된 흥미로운 글을 자주 올리시기 때문에 참고할 만합니다."
인간과 종교,방원일,23,Fall,5.0,"시간 남아서 들었던 강의였는데, 생각보다 재밌고 교수님이 너무 유쾌하셔서 2학기 수업 중 가장 좋았던 수업이었습니다 ㅎㅎ 본인 기독교인데 타 종교에 관해서 시야를 넓힐 수 있는 강의였어요. 종교학은 신을 공부하는게 아니라 인간을 공부하는 학문이라는 말씀이 인상깊었습니다 :)"
인간과 종교,방원일,23,Fall,5.0,"우선 로드는 한 페이지 이내의 쪽글을 4~5개 (2~3주에 한 번씩) 쓰기 + 중간 보고서 4장 + 기말고사이고요 리딩이 있기는 있으나 안 읽어도 아무 문제 없습니다. 그래도 수업이랑 중간보고서, 기말 때 도움이 되니 읽는 걸 추천합니다. 출석을 3주에 한 번씩…? 불러서 출석이 아주 깐깐하지 않습니다.  종교학을 처음 접해보거나, 종교를 많이 생각해본 적이 없다면 추천하는 강의입니다. 정말로 종교학 찍먹하는 느낌이라 내용 깊이에 다소 실망할 수도 있는데, 그만큼 듣기도 편하고 나름 힐링입니다. 교수님도 친절하시지만 수업 듣다가 약간 재미없어서 졸게 될 수도 있습니다. 종교학을 처음 접해보면 추천하는 강의입니다.  쪽글은 수업 당일 제출인데, 수업 내용을 기반으로 쓰기 때문에 수업 때 집중하는 것이 좋습니다. 중간 보고서는 영화를 보고 종교에 대학 본인의 이론을 세우는 것이라 약간 부담스러울 수도 있지만 교재 참고하면 그렇게 어렵지는 않은 것 같습니다. (참고문헌도 교재+2 필수 인 것으로 기억합니다) 기말은 수업의 큰 흐름+ 쟁점의 흐름을 잘 알아두면 그렇게 어렵지 않습니다. 서술형 7문제?라 아주 어렵지 않습니다.   다만 쪽글에 대한 피드백/점수가 제공되지 않고 중간 보고서 피드백도 종강 이후에 주셔서(아직 안 받은 상태) 내가 잘 하고 있는 건지 모르는 수업입니다…  저는 사실 아무런 점수도 모르지만 쪽글과 중간 보고서 열심히 썼고 기말은 조금 부족했건 것 같은데 A+입니다."
인간과 종교,방원일,23,Fall,5.0,와 쪽글 거의 매주 있었던거 한번빼고 싹다 안냈는데 B0나옴 개혜자 에인절 갓갓
인간과 종교,방원일,23,Fall,5.0,"수업:  이번 학기의 힐링 수업이었고, 지금까지 들어 본 교양 강의 중에선 최고로 재밌었습니다!!  이 수업은 종교를 인간 행위라는 관점에서 접근하는 수업입니다. 그래서 인간의 행동 양식이나 문화적 코드 별로 해당되는 종교적 사례를 적용시키는 방식의 수업입니다.  그리고 매번 강의 내용과 관련된 영상 자료를 보여주시는데 정말 재미있어요!  종교를 학문 자체로 바라보는 수업이기 때문에 비종교인이더라도 공감되는 부분도 많고 배울 게 많은 수업입니다.  서울대에서 종교학 교양을 듣는다면 꼭 이 수업을 듣는 걸 추천합니다.   로드:  간단한 영상 자료를 보고 1페이지 쪽글을 2-3주에 한 번씩 제출하는데, 영상 자료도 이해하기 쉽고 재미있는 내용이라서 별로 부담되진 않습니다.  중간 보고서는 영화 목록 중에 하나 선택해서 종교학의 관점에서 영화를 비평하는 것인데, 재밌는 영화들이 많아서 쓰는 데 재미있었어요!   시험:  시험은 족보랑 다르게 나와서 족보를 보는 건 의미가 없을 거 같습니다. 그 대신 지엽적인 건 안 나오고 큰 흐름을 이해하면 쓸 수 있는 서술형 문제들입니다. 마지막에는 논술형도 있어요. 수업 내내 글 쓰는 게 많다 보니 글 쓰는 걸 좋아하는 사람에게 유리한 수업인 것 같습니다.   학점:  학점도 잘 주시는 것 같습니다!!"
인간과 종교,방원일,23,Fall,5.0,"수업은 잘 안 들었긴 한데... 들을 때는 재밌었음. 시험 벼락치기하면서 생각보다 재밌어서 왜 공부 안 했나 후회함. 교과서도 잘 나와있고 좋은 듯."
인간과 종교,방원일,23,Fall,5.0,수업 쟈미있고 유익합니다. 쪽글 조금 귀찮긴 한데 이 정도면 로드도 거의 없는 편입니다
인간과 종교,방원일,23,Spring,5.0,"이번 학기에 들었던 수업 중 뜻밖에도 가장 재미있었던 수업이었습니다! 종교 유무와 관계없이 대학에서 종교 관련된 교양수업은 하나쯤 들어야 한다고 생각해서 들었던 수업이었고, 궁금했던 내용들을 얻어가는 것 같아 만족스럽습니다.   여러가지 종교의 교리를 암기하듯 공부하는 세계종교 입문식의 수업이 아니라 ‘종교’ 그 자체가 무엇인지 논하고 종교적인 요소들을 인류학적으로 바라보는 수업입니다. 종교, 의례, 텍스트, 믿음, 다툼, 젠더, 신종교 등의 챕터로 나누어 수업이 진행됩니다. 학자들의 이론, 실제 사회현상, 영화 등 다양한 문화적 텍스트를 자료로 사용하십니다. 교수님께서 예전에 종교와 영화 수업을 하셔서 그런지 영화 자료가 풍부했는데, 특히 격주로 비대면 수업을 하실 때 관련 영화를 시청하는 경우가 대부분이어서 좋았습니다 ㅎㅎ PK, 축제, 내 이름은 칸 등을 시청했습니다.  중간고사는 보고서로 대체되는데 이 역시 영화를 한 편 골라 보고 영화 속 종교적 요소를 논하는 식입니다. 부담이 아예 없지는 않지만 자기가 좋아하는 영화로 고르면 고통이 다소 상쇄됩니다. 교수님께 메일로 요청드리면 친절하게 보고서 피드백도 해주시고, 관련 도서도 추천해주십니다! 기말고사는 교재, 부교재, 피피티 모두 포함되지만 수업 잘 듣고 피피티만 공부해도 괜찮습니다. 지엽적이지는 않지만 추상적인 내용을 정확히 이해하는 게 중요한 것 같습니다. 최종 성적은 잘 주시는 것 같습니다.  종교가 무엇인지 궁금하고 우리 삶 속의 종교적 요소들을 찍먹식으로 (재미있게!) 알아보고 싶으신 분들께 추천드립니다. 귀엽고 친절하신 교수님도 보실 수 있습니다 ㅎ 추상적인 내용의 공부가 잘 맞지 않으시다면 힘드실 수도 있을 것 같습니다."
인간과 종교,방원일,23,Spring,5.0,"다른 걸 떠나서, 종교학이라는 학문에 대해서 접할 기회는 흔치 않다. 이쪽에 관심이 있고 흥미가 있는 자라면 강추."
인간과 종교,방원일,23,Spring,5.0,"종교학적 시각으로 바라보는 법을 중심으로 강의가 진행되었습니다 배우고 간다는 느낌이 강해서 남는게 많은 것 같아서 좋았네요  적절한 영상자료 사용과 엄청나지는 않지만 잔잔하면서 좋은 강의력 부담 없는 과제와 지엽적이지 않고 큰 흐름을 바탕으로 하는 시험 종합적으로 추천드립니다 성적도 잘 주셔요"
인간과 종교,방원일,23,Spring,1.0,개노잼. 절대 듣지마셈... 진짜 뭘 가르치는건지도 모르겠고 성적도 개같이 줌. 걍 최악임
인간과 종교,방원일,23,Spring,5.0,종교학을 처음 접하는 입장에서 매우 듣기 좋은 강의라고 생각합니다. 내용 자체가 재밌기도 하고 다양한 영상 자료들을 통해 수업을 진행하셔서 지루하지 않았습니다.
인간과 종교,방원일,22,Spring,5.0,"흥미로운 강의 내용, 적당한 로드와 시험 한번, 너그러운 성적 강의 내용은 교양으로 적당한 난이도였고, 종교학에 대해 선행지식이 없어도 듣기 좋은 수업이다."
인간과 종교,방원일,22,Fall,5.0,"강의 내용도 흥미롭고, 로드도 딱히 없어요! 가끔 쓰는 쪽글은 출석 체크 대신 하는거라서 내기만 하면 점수 잘 주십니당. 다만 종교학 분야에 관심이 1도 없는 분이라면 조금 지루할 수는 있을 것 같아요."
인간과 종교,방원일,22,Fall,5.0,정말 좋았던 강의! 초반에는 좀 지루했는데 한 5-6번째부터 너무 재미있어서 설레기까지 했던 수업. 시험도 있고 출석 대체 쪽글도 있어서 완전 꿀강이라고 하기는 어렵지만 얻어갈게 진짜 많고 교수님 질문도 친절하게 답변해주심
인간과 종교,방원일,22,Fall,5.0,이 과목을 듣고 종교학과 개설 과목들 더 들어보기로 했습니다. 명강이고 강의평 보니 강의 내용도 계속 바뀌는 듯합니다. 시험은 배운 것을 얼마나 잘 체화했고 그것을 활용해 새로운 논리를 전개할 수 있는지를 봅니다.
인간과 종교,방원일,22,Fall,5.0,강의력이 좋으시고 정말 얻어가는 게 많습니다. 수업 자체도 재미있고 교수님도 되게 친절하세요!
인간과 종교,방원일,21,Fall,2.0,"꿀강이라는 말만 듣고 수강했다가 망했어요, 종교에 관심 없으면 비추"
인간과 종교,방원일,22,Spring,5.0,얻어갈 수 있는게 많은 좋은 강의입니다 추천해용
인간과 종교,방원일,22,Spring,5.0,저는 중간 보고서 쓰느라 좀 고생했고 기말 시험도 열심히 공부했지만 잘 쓴 것 같지 않아서 B 각오하고 있었는데 에쁠 떴어요.. 강의는 재밌고 얻어가는 것도 많은 강의입니다
인간과 종교,방원일,22,Spring,5.0,인간과 종교에 대해 생각해볼 기회가 생기면서도 너무 깊게는 들어가지 않아 유익한 강의였습니다.
인간과 종교,방원일,20,Spring,3.0,"솔직히 강의 너무 좋았고, 교수님 정말 좋으신 분입니다. 그러나 매주차 출석 대체 보고서 열심히 쓰고, 중간 기말 모두 평균 정도로 점수 받았는데 비마는 좀 충격이네요.. 컴플레인 메일 드렸는데 제가 죄송할 정도로 친절하게 답변 주셔서 차마 내려달라고도 말씀 못드렸습니다ㅋㅋㅋㅋ  다른 분들 강의평 보시고 백퍼 꿀강이구나 해서 신청하시는 분들 계실까해서 올립니다.🥲"
인간과 종교,방원일,22,Spring,5.0,종교에 큰 흥미가 없는 채로 듣기 시작한 강의인데 생각보다 정말 좋았어요! 수업 자료도 정말 풍부하고 교수님이 수업에 신경을 많이 쓰시는게 느껴집니다 익숙한 주제를 새로운 시각으로 바라볼 수 있게 시야를 넓혀갈 수 있었던 것 같아요 다만 중간중간 제출하는 과제나 시험에 대한 점수는 알려주시지 않고 최종 학점만 공지하시는데 아마 성적을 꽤나 잘 주시는 듯 합니다
인간과 종교,방원일,22,Spring,5.0,"명강입니다! 이번 학기 들은 교양 중 최고였습니다. 종교에 별로 관심 없는 상태로 수업 듣기 시작했는데 흥미로운 강의에 빠져서 저절로 열심히 듣게 되었네요. 종교학적 관점을 접하면서 종교를 대하는 시야가 넓어지는 느낌이었고, 영화, 음악, 애니메이션 등 다양한 자료를 가지고 내용을 설명하셔서 이해하기도 쉬웠습니다. 출첵 따로 안하시고 가끔 수업시간 내 영상보고 쪽글 작성하는 걸로 확인하셨는데 전 수업이 좋아서 한번도 결석 안하고 다했습니다. 종교 관련 영화 보고 작성하는 중간보고서 다섯 장은 이틀동안 빡세게 썼습니다. 시험은 기말 한번인데 수업시간동안 열심히 들으며 필기했더니 시험 전 이틀 정도만 봐도 충분했습니다. 달달 외우지도 않았고요. 문제는  전부 서술 또는 논술인데 전혀 지엽적이지 않고 배운 내용에서 핵심적인 것만 잘 이해하고 있는 정도면 충분합니다. 별 기대없이 듣기 시작한 수업이었는데 젤 열심히했고 에쁠 받아서 뿌듯합니다 ㅎ방원일교수님 다른 종교학수업 있다면 듣고싶은데 없는게 아쉽네요…"
인간과 종교,방원일,22,Spring,5.0,"교수님께서 수업 준비도 열정적으로 해오시고, 동영상같은 영상 자료도 많이 보여주셔서 재미있게 수업에 참여할 수 있었어요. 성적은 수업시간에 쪽글 성실하게 썼고, 중간보고서 공들여서 쓰고, 1~2일 정도 기말고사 공부했더니 A+ 나왔습니다! 학점보다도, 종교에 대한 더 폭넓은 이해를 할 수 있어서 좋았던 것 같아요!"
인간과 종교,방원일,22,Spring,5.0,"종교에 관심 있어서 들었는데 듣길 너무 잘한 것 같음  많이 배워갔고 로드부담도 없어서 마음 편하게 재밌게 들을 수 있었음 ! 솔직히 교재 읽을 필요 없는 거 같은데 미리 읽어가면 도움 되긴 함 수업 때 열심히 듣고 필기했으면 시험 공부도 부담 없음  핵심 내용 위주로만 공부하면 시험 문제 다 쓸 수 있고, 서술형도 그냥 평소 생각 쓰면 된다"
인간과 종교,방원일,22,Spring,5.0,"명강. 타과생으로서 종교 관련 강의를 딱 하나 들어야 한다면 이 강의를 고를 것 같습니다! 종교에 대한 지식을 습득하는 것도 있지만 그것보다도 종교를 보는 시각을 배워갈 수 있었다는 점이 좋았어요.  2주에 1번 정도씩 쪽글 과제가 있고 (수업 시간에 작성하는 거라 시간 부담은 없음), 그외 로드는 전혀 없습니다. 이번 학기에는 중간고사를 과제로 대체하셨는데 2학기나 내년부터는 그냥 시험으로 평가하실 거 같아요 (학기 초에 시험으로 바꿨어야 하는데.. 라는 식으로 말씀하심) 기말고사는 배운 내용을 이해, 숙지하고 있는지 확인하는 서술형 7(?)문제와 생각 서술하는 문제 하나 있었습니다. 문제가 막 어렵다거나 지엽적이라는 느낌은 없었고, 수업 시간에 배운 내용을 잘 이해하고 있는지, 서로 다른 부분에서 나온 내용을 잘 종합할 수 있는지를 위주로 평가하시려는 것 같았어요. 성적은 A+ 받았고, 교수님께서 A는 30% 맞춰서 주신다고 하셨던 걸로 기억합니다.  교수님 정말 귀여우시고 영상 자료 같은 걸 많이 활용하셔서 수업도 재밌어요!! 아 그리고 수업 교재가 시험 범위에 들어가는데 미리미리 수업이랑 병행하면서 읽어두시면 나중에 시간을 아낄 수 있어요 (수업에선 안 다뤘지만 교재에만 있는 내용이 시험에 직접적으로 출제되지는 않는 듯합니다)"
인간과 종교,방원일,22,Spring,5.0,많이 배워가는 강의.. 교수님도 열정적이고 똑똑하심
인간과 종교,방원일,22,Spring,5.0,"배워가는 것도 많고 로드도 전혀없어요!! 다만, 종교를 가진 분의 경우, 흠칫할만한 내용도 있다고 생각됩니다"
인간과 종교,방원일,22,Spring,5.0,과제 하루 늦어도 감점안함. 성적 너그러움. 내용 재밌음. 그저 빛...
인간과 종교,방원일,21,Fall,5.0,수강생이 적어서 오순도순 잘 들을 수 있었습니다. 동종지 듣고 이 과목 수강하는 건데 동종지는 많은 양의 종교를 우다다다다 외우고 딱딱하게 가는 거라면 이 과목은 종교를 우리가 어떻게 이해해야하는가 종교 전쟁이라고 하는 단어는 어떻게 이해해야할까 하는 물음표들이 많은 수업입니다. 그렇다고 막 열린 수업은 아니고 책의 주장에 따라 나름대로 교수님이 어느정도 닫아주셔서 답을 구할 수 있습니다. 무교인 저는 종교에 대해서 흥미가 생겼던 과목이었어요 많은 영상자료들이 흥미로운데 그중에서도 몰몬교 애니메이션을 통해 사이비를 이해하는 부분이 진짜 재밌었어요 굳굳
인간과 종교,방원일,18,Fall,5.0,"중간중간틀어주시는 영상도 너무재밌었음 하라는대로 잘 따라하면 성적잘받기가능 일단 수업자체가 좋았다"
인간과 종교,방원일,20,Spring,3.0,"매주 글쓰기 과제가 귀찮기는 하지만 1장 분량이기도 하고 하다보면 글쓰기 실력도 나름 향상되는 것 같아서 좋았습니다 다만 매 글쓰기 과제마다, 그리고 중간대체보고서, 기말고사 점수도 알려주시지 않고 채점 기준도 명확하지 않아서 아쉬웠네요."
인간과 종교,방원일,20,Fall,5.0,"비대면이라서 너무 아쉬웠어요ㅠㅠ 매주 과제가 부담스럽기는 해서 아주 꿀강이라고 말하기는 어렵지만, 배우는 내용이 흥미롭기도 하고 글쓰기를 많이 하다 보니 글로 생각을 표현하는 능력이 는 것 같기도 해서 명강인 건 맞는 것 같습니다."
인간과 종교,방원일,20,Fall,5.0,"교수님 대면으로 뵙고 싶을 정도로 흥미로운 수업이었습니다. 비대면이라 아쉬웠지만,  수업 자료들이 정말 알찼습니다. 매주 한 페이지 글쓰기 과제가 약간은 부담되기도 했지만 배움에 있어서 만큼은 큰 도움이 된 것 같습니다. 종교를 보다 넓은 시야에서 바라볼 수 있게 해 주는 명강입니다!! 교수님께 한 학기 동안 감사하다는 말씀 드리고 싶어 강의평 남깁니다."
인간과 종교,방원일,20,Fall,5.0,"무교고 종교에 전혀 관심없는 사람이었는데, 저는 개인적으로 수업 들으면서 종교라는 개념에 대한 시각이 굉장히 넓어진것 같아서 한 학기중 배워가는게 가장 많은 교양수업이었어요! 학점도 무난하게 잘 주시는것 같아요"
인간과 종교,방원일,20,Fall,5.0,이번 학기 제일 재밌고 유익했던 수업. 과제는 매주 수업 내용에 대한 자기 생각 한 페이지 쓰기+중간고사 대체 보고서였는데 매주 쓰는게 귀찮을 뿐 전체적으로 보면 양이 많은 편은 아닌듯. 시험은 기말만 비대면으로 봤는데 암기보다 이해 위주의 문제여서 좋았음. 학점도 엄청 잘주시는듯 다만 무교에다가 원래 종교 별로 관심없었으면 내용 중에 일부분은 ㅇㅓ려울 수 있음 나처럼ㅜ 암튼 꿀강이자 명강이라고 생각하는데 이제 한동안 수업 안하신다니 아쉬움
인간과 종교,방원일,19,Spring,2.0,"꿀강이라는 말만 듣고 듣지 마세요. 종교에 관심 없던 사람도 관심을 갖고 재밌게 배우는 수업은 아닙니다. 무교고 종교에 원래 관심 별로 없으면 상당히 지루하고 이해가 안됩니다."
인간과 종교,방원일,20,Fall,5.0,"이번학기 들었던 교양중 단연 최고였습니다.. 다만 과제가 많긴해요. 글쓰기를 좋아해서 이부분은 상쇄되었습니다. 무엇보다도 매주 글쓰기 과제를 하는 것 자체가 생각을 많이해야하고 공부했던 내용을 상기시켜야하다보니 공부가 된 것 같아요. 과제는 많았지만 생각할 거리를 많이 제공해준, 명강인 것 같습니다!(꿀강은 아닌것같아요..쩜쩜)"
인간과 종교,방원일,20,Fall,5.0,"한 학기동안 종교에 대한 시야를 넓힐 수 있던 명강이었습니다. 출석은 매주 글쓰기 과제로 확인하셨고 성적에도 반영되었습니다. 로드가 조금 빡세긴 했지만 매주 배운 내용을 바탕으로 생각을 정리할 수 있어서 정말로 종교에 대해 ‘배울 수 있던’ 기회가 되었던 것 같습니다. 암기 과목같은 느낌이 아니라 종교에 대한 사고방식을 매주 확장해나가던 방식으로, 대학 교양같은 느낌을 얻을 수 있었습니다. 방원일 교수님 짱❤️"
인간과 종교,방원일,20,Spring,5.0,매주 과제는 있지만 그냥 자기 생각 쓰면 되는 거라 별로 부담스럽지는 않았습니다. 다 흥미로운 것들이었구요. 성적도 잘 주십니다.
인간과 종교,방원일,20,Spring,5.0,녹강이고 매주 글쓰기 과제가 있어요. 하지만 열심히 쓰면 잘 주시는 것 같아요! 글쓰기 과제가 힘든 건 사실이지만 내용이 워낙 흥미롭고 학점도 너무 잘주셔서 명강이자 꿀강인 것 같습니다!
인간과 종교,방원일,20,Spring,4.0,방원일교수님 너무 좋아요ㅠㅠ 매주 과제가 약간 부담스럽기는 하지만 정말 한학기 동안 흥미롭고 재밌는 내용을 많이 배워갈 수 있었습니다!! 교수님 강의력도 좋으시고 성적도 잘 주시는 편이신 것 같아요~ 졸업 전에 방원일 교수님 다른 수업도 찾아 듣고 싶은 마음...
인간과 종교,방원일,20,Spring,4.0,"매주 글쓰기가 워낙 고통스러워서 4점... 하지만 A+받았습니다 외쳐 갓원일"
