인간과 종교,이진구,23,Spring,5.0,그냥 시간 맞는 교양 찾다가 신청한 강의인데 생각보다 만족스러웠습니다. 대학 교양의 표본 같은 수업이라고 생각합니다. 종교에 대한 전반적인 지식을 훑고 가는 느낌인데 내용이 깊지도 않고 딱 교양 수준의 깊이라고 생각합니다. 교수님의 강의가 아주 살짝 지루하긴 하지만 중간중간 치시는 개그가 은근 제 취향에 맞아서 재미있었습니다. 수업은 속기를 할 필요는 없지만 그래도 피피티에 빨간색 파란색 표시가 되어있는 키워드에 대한 설명은 꼼꼼히 적어두시는게 좋습니다. 시험문제가 두 키워드가 나오게 된 맥락과 그 의미 그리고 두 키워드 사이의 관계를 적는 것이기 때문에 수업 내용을 거시적으로 정리한 다음에 키워드 중심으로 공부하는 것이 전략입니다! 그 전날 밤 10시에 기말 공부 시작해서 A0 맞았다는 것만으로도 성적은 매우 잘 주시는 것 같습니다. 시험문제 2번은 아예 서술형인데 제가 거의 못 적고 냈는데도요.. 과제는 책 읽고 수업 내용과 연관지어 쓰는 것인데 하루컷 가능할 정도로 간단하고 본인의 생각이 드러나게 강의안과 잘 연결시켜서 쓰면 됩니다. 교양 학점 채우고 싶은 분들께 추천드립니다~!
인간과 종교,이진구,23,Spring,4.0,"교수님이 재밌으시다 근데 학점 잘 주시는건 아닌듯합니다.."
인간과 종교,이진구,23,Spring,5.0,"한 학기 동안 내 힐링강의. 신과 종교에 관해 한번이라도 생각해본 사람이라면 들으면 좋은 수업. 내용이 어렵거나 무겁지는 않지만 얻어가는게 없는건 절대 아님 시험은 기말이랑 기말후제출인 3p짜리 서평인데, 3p인만큼 부담도 적고 중간고사가 없어서 다른 수업들 중간 준비하기 좋았음 성적도 잘 주시는 듯. 또 교수님 특유의 재치가 있는데 본인은 잘 맞아서 웃겼음ㅋㅋ 유일한 단점은 아침수업이란 건데 학생들 배려해서 학기 중 꽤 여러번 수업동영상 탑재로 대체하신다 그저 GOD.. 어쩌면 지금까지의 수업은 갓진구 교수님을 알현하는 누미노제 체험이 아니었을지?"
인간과 종교,이진구,23,Spring,5.0,"종교학입문을 듣고 교수님의 수업을 한 번 더 듣고 싶어 수강했습니다. 종교학에 어느 정도 흥미도 있고, 교수님께서 잔잔하게 수업하시는 방식이나 유머, 기말과 서평으로만 이루어진 평가방식 모두 마음에 들어서 이 수업도 들었습니다. 시험은 한 개념 정도 헷갈려서 아예 다른 걸 썼고, 서평은 시험 끝나고부터 나름 열심히 적었더니 에쁠을 주셨네요. 두 번 수강해보니 서평의 내용도 나름 중요시하시는 게 아닌가 생각이 들었습니다. 로드도 적고 흥미로우니, 종교학에 관심을 갖고 계신 분이라면 추천합니다!"
인간과 종교,이진구,23,Spring,5.0,만족스러운 교양 강의. 재치 넘치는 교수님과 흥미로운 강의 내용. 로드도 과제 한 번과 시험 한 번으로 많지 않음.
인간과 종교,이진구,23,Spring,5.0,약간 지루해 보일 수도 있는 강읜데 교수님께서 강의력도 좋으시고 내용도 듣다보면 되게 재밌습니다. 첨에 딱 집중 잘하면 시간 금방가게 잘 들을 수 있는 것 같아요. 또 교수님께서 학생들을 되게 신경 써주시고 배려해주셔서 좋았습니다!
인간과 종교,이진구,23,Spring,5.0,"교수님께서 수업을 진행하실 때 사실 제대로 듣는 사람이 많지 않은 것 같긴 하지만, 그래도 간간이 터지는 웃음을 보면 교수님의 유쾌함이 수업 자체의 지루함을 압도할 때가 종종 있는 것 같습니다. 때로는 학생들을 배려하고 컨디션을 관리한다는 명목 하에 비대면 녹화 강의로 전환하시는 경우도 있습니다."
인간과 종교,이진구,23,Spring,5.0,"제가 먼저 나서서 친구들에게 추천을 하고 다닌 유일한 교양입니다. 교수님 수업도 잘하시고, 로드도 적고, 학생들 편의도 잘 봐주시고 모든 게 좋아요. 전 무교이고 종교에 대한 관심과 지식이 하나도 없었는데 수업 내용에 흥미를 느껴 재밌게 들었어요. 성적은 아직 모릅니다."
인간과 종교,이진구,22,Fall,5.0,"명강이자 꿀강 비록 저는 기말 공부를 못해서 성적이 잘 나오진 않았지만.. 수업 자체는 정말 재미 있고 만족스럽게 들었습니다 종교학에 관심을 갖게 해준 강의!"
인간과 종교,이진구,22,Fall,5.0,"수업 내용도 재밌고 교수님도 중간중간에 개그하시는데 잔잔하게 웃겨요. 전에 종교학의 이해 수강하고 수업 내용이나 교수님 강의 너무 좋아서 인간과 종교도 또 수업 들었습니다. 피피티에 빨간색/파란색 글씨로 써주신 키워드 위주로 흐름 이해하면서 외웠더니 시험도 적당히 쉬웠습니다. 서평 쓰는 것도 책이 재밌어서 금방 썼어요. (중간×기말○, 보고서 1번(3쪽 내외))"
인간과 종교,이진구,22,Fall,5.0,"들었던 교양 중에서는 가장 만족스러운 명강의입니다. 수업 듣다보면 조금 졸립기는 하지만, 졸음을 참기 위해 한글 켜놓고 속기 비슷하게 하면서 듣다보면 정말 재밌습니다. 교양수업이란 이런 것이다를 보여준 강의가 아닐까 싶습니다. 기말 한방 + 책 읽고 독후감 1개라서 로드는 매우 적은 편입니다. 출석도 나름 중요한 것 같습니다. 기말 공부방법은 PPT만 외우면 됩니다. 전반적인 흐름 위주이지만, 시험은 키워드만 툭툭 던져놓고 흐름을 써보라는 식이기 때문에 각 키워드가 어디서 나오는지 외워야 합니다. 그래도 이틀 정도 기말 공부하고, 반나절 정도 날 잡고 책 읽고 독후감 썼더니 에제 나왔습니다. 성적도 엄청 잘 주신 것 같습니다."
인간과 종교,이진구,22,Fall,5.0,"교수님 설명도 재밌게 들었고, 전반적으로 얻어가는 게 많은 과목이었습니다. 시험은 피피티 내용 암기만 하면 쉽게 풀 수 있었습니다."
인간과 종교,이진구,22,Fall,5.0,"JESUS 무슨 말이 필요해  이상 수업 때 졸았지만 은혜를 입은 학생입니다. 교수님 사랑해요"
인간과 종교,이진구,21,Summer,5.0,계절 비대면이라 녹강으로 아주 편하게 수강했습니다.
인간과 종교,이진구,20,Fall,5.0,"비대면 수업 오픈북 시험 최고임!!ㅠㅠ 중간중간 농담 은근 재밌으심"
인간과 종교,이진구,22,Spring,3.0,"꿀강이라는 소문 때문에 너무 기대했나봐요.. 대면으로 바뀌면서 그렇게 꿀강은 아닌 것 같아요 아침 9시 반 수업.. 기말 시험범위 통암기.. 저는 종교학에 흥미를 못 느껴서 힘들었던 것 같아요 에마 나왔습니다"
인간과 종교,이진구,22,Spring,5.0,"말 그대로 인간과 종교에 대한 통찰을 제공하는 강의. 각 종교들의 세계와 이상적 인간상, 죽음에 대한 관점을 엿볼 수 있음. 로드는 책 한권 독후감밖에 없어 부담이 덜함. 시험은 한번 치는데 키워드 위주로 답을 쓰면 됨. 학점도 후하게 주시는 것 같음."
인간과 종교,이진구,22,Spring,5.0,"종교에 대해서 개괄적으로 배울 수 있어서 흥미로운 수업이었음. 수업이 조금 졸린 건 맞지만 열심히 듣다보면 간간이 나오는 개그가 아주 재밌음. 기말 한방이고 독후감 하나 있는 게 다임. 기말은 족보로 문제 유형 파악하는 게 중요, 내용이 어떻게 서로 이어지는지 전체적인 흐름을 잡는 게 중요. 독후감은 첫날 얘기해주시는 책 세 권 중 하나 골라서 세 페이지 후루룩 쓰면 됨. 책은 꽤나 재밌었음."
인간과 종교,이진구,22,Spring,4.0,"첫 대면 전환이라 드랍자가 많아서 그런지 성적은 엄청 후하게 주신 것 같음 하지만 시험 문제가 엄청 지엽적이고 교양치고 양도 많아서 암기에 능하지 않다면 힘들 것. 속기 다 쳐서 꼼꼼히 볼 자신 있는 사람만 들으셈"
인간과 종교,이진구,22,Spring,5.0,"이진구 교수님 천사세요..? 기말 진짜 심각하게 망쳤다고 생각했는데...이왜A+...?"
인간과 종교,이진구,22,Spring,5.0,"성적은 나오기 전이지만 수업 꽤 재밌어서 강의평 씀. 종교 관심 있는 사람은 재밌게 들을 수 있는 수업인 듯. 시험은 맥락을 굉장히 중요하게 여기시는 듯"
인간과 종교,이진구,21,Fall,5.0,"비대면 오픈북이어서 수업만 잘 듣고, 필기 잘하면 성적 잘 나옵니다. 근데 필기가 중요한 거 같아요!"
인간과 종교,이진구,21,Fall,4.0,조금 지루하지만 교수님 착하시고 학점도 나쁘지않게 주세요
인간과 종교,이진구,21,Fall,5.0,"강의 내용도 좋고, 독후감도 수업 내용 적용하면서 쓰면 수월하게 쓰실 수 있습니다"
인간과 종교,이진구,18,Spring,5.0,수업 내용이 알차고 재밌었습니다. 로드도 영화나 책을 읽고 종교적 관점으로 해석해 보고서를 제출하는 것이었습니다. 시험도 크게 어렵지 않았습니다.
인간과 종교,이진구,21,Fall,5.0,학점도 나름 괜찮게 주시고 시험은 강의내용에 대해 한번쯤 깊은 고민을 해보면 술술 써낼 수 있습니다
인간과 종교,이진구,22,Spring,5.0,중간 중간 농도 재밌으시고 학점을 매우매우 잘 주시는 것 같습니다 . 강의 내용도 정말 재밌었어요 . 수업 자체는 좀 지루할 수도…
인간과 종교,이진구,21,Fall,5.0,"겨울계절 수강했습니다. 전체 녹강 + 비대면 오픈북 시험 이었어요.  종교에 아주 관심이 없는 게 아니라면 강의 내용이 아주 재미있습니다. 다소 편향되기 쉬운 주제임에도 교수님이 잘 설명해 주셔서 편안하게 들을 수 있었어요. ppt에 단어만 있는 내용도 많이 나오니 필기는 잘 해 두시길... 기말시험 한번, 3페이지 분량 독후감 한 편으로 평가됩니다. 시험은 스랖에 기출이 올라와 있으니 두개 정도만 보고 유형 파악하면 좋아요. 공백제외 1500자 분량 서술형이 하나 있는데 꽤 어려우니 시간배분 잘 하셔야 할 것 같아요. 독후감은 책이 200p 정도로 금방 읽을 수 있고 독후감 분량도 작아서 부담없이 쓸 수 있습니다.  성적도 잘 주시는 편입니다."
인간과 종교,이진구,21,Fall,5.0,"교수님께서 중간 중간 농담도 섞어가며 강의를 하셔서 수업 자체가 지루하다는 느낌은 별로 없었고 시험도 기말 한 번에 과제도 감상평 쓰는 것 외엔 따로 없습니다 다만 마지막 시험은 개인적으로 준비를 하지 않으면  시간이 좀 촉박할 것 같긴 합니다"
인간과 종교,이진구,21,Fall,5.0,다른 교수님꺼 듣고 재수강하는데 첨부터 이거 들을 걸 그랬어요... 일단 녹강이라 수업 안 들으려고 했는데 재밌어서 들었어요. 시험 볼 때 오픈북이긴 하지만 필기 조금 해두는 게 시험 볼 때 쓰기 좋습니다! 과제도 어찌저찌 소설 내용이랑 배운 내용 엮어서 썼어요 (독후감 3p 정도) 시험은 키워드에서 시간 많이 써서 서술형 1000자도 못 썼고 개소리썼는데도 에제 주셨어요 ㅠㅠ 감사합니다 재밌었어요!
인간과 종교,이진구,21,Fall,5.0,"오픈북이고 수업시간에 필기 조금만 해놓으면 답안 쉽게 작성할 수 있습니다 과제도 책 내용과 수업시간에 배운 개념들 잘 융합해서 적어 내면 점수 잘 주시는 것 같아요 다만 대면수업으로 돌아가면 시험이 너무 지엽적이라 엄청난 암기량을 요할 것 같네요 배워가는 것은 정말 많은 강의였습니다"
인간과 종교,이진구,21,Fall,5.0,"수업은 녹강이고 말씀이 느리셔서 1.8배속으로 봤어요. 저는 필기본 구한 거 + 작년 재작년 기출 (스랖에 있음) 보고 기말 쉽게 적어냈고, 독후감은 수업 시간에 배운 내용 언급해 가며 적었어요. 분량이 적은 편이라 깊은 이야기를 적지는 않았는데 A+ 주셨어요."
인간과 종교,이진구,21,Fall,5.0,"저는 개인적으로 정말 재미있게 들었던 강좌! 교수님의 은은한 유머가 너무 좋았고 매 수업마다 빵 터지는 포인트가 한 번씩은 있었던 것 같아요 설명도 이해하기 쉽게 하셔서 강의 키고 옆에 속기록 한 후 나중에 시험 직전에 보면 도움 많이 되더라구요 학기말 한 번 보는 기말시험은 타임어택이 심한 편이긴 한데 저는 1500자짜리 문제 분량 다 못채웠는데도 에쁠 받았어요! ㅠㅠ 감사한 마음으로 평 쓰는중 기말 보고 3일 내로 제출하는 독후감도 있는데, 평소 수업 시간에 배웠던 이론이랑 소설이랑 연관지어서 쓰면 좋은 점수 받을 수 있는 것 같아요!"
인간과 종교,이진구,21,Fall,5.0,재밌게 들었던 수업 중 하나입니다 종교에 대한 기본적인 이해를 할 수 있게 된 것 같습니다 시험도 수업 잘 듣고 정리해두면 어렵지 않게 풀 수 있었습니다 서평 과제를 내주시는데 크게 부담도 없고 지정된 책들도 읽으면서 여러 생각을 하게 해주는 좋은 책들이었습니다 성적도 잘 주시는 것 같습니다 굿굿
인간과 종교,이진구,21,Fall,5.0,"종교에 대한 전반적인 내용을 꽤 깊이 있게 다룹니다! 교수님 목소리가 잔잔하시긴 했지만 내용은 흥미로웠고, 정말 객관적인 시선으로 설명해주셨어요. 시험은 비대면 기준 강의 제때제때 듣고 필기노트 정리해서 컨에프로 찾아가면서 보면 무난하게 볼 수 있습니다. (기출들 보고 답 미리 써놓으면 진짜 개꿀. 이번엔 기출에서 많이 나왔어요)  감상문도 그냥 무난하게 적었는데 에플 나왔습니다. 다만 대면 비오픈북 시험이 된다면......? 암기지옥이 될 것 같긴 합니다..."
인간과 종교,이진구,21,Fall,5.0,시험문제 5개? 중에 1문제는 1500자 중에 1200자 정도만 썼는데 에이쁠 감상문도 강의 안듣고 그 부분만 강의 듣고 쓰고 그랬어요 물론 강의는 다 듣고 시험 봤어요 밀리면 좀 많이 빡세긴 한데 시함 잘 못보고 감상문 6시간 컷 냈는데 에쁠..ㅎㅎ 감사합니다
인간과 종교,이진구,21,Fall,5.0,"개인적으로 종교에 대한 지식이 없는 상태로 수강하였는데, 교수님의 친절하고 편향되지 않은 유쾌한 설명과 함께 많은 걸 얻어가는 느낌이었습니다. 정말 좋았습니다."
인간과 종교,이진구,21,Spring,5.0,수업 내용이 매우 흥미로웠습니다. 거기에 로드도 적고 시험은 단 한 번 뿐이었으며 교수님께서 매우 차분하고 재미있게 설명해주셔서 개인적으로 교수님 팬이 되었습니다. 학점도 잘 받았습니다. 굿굿.
인간과 종교,이진구,19,Spring,5.0,기말고사 한 방에 과제는 독후감 하나로 매우 편한 꿀강이에요ㅎㅎ 특히 외우는 거 좋아하는 저에게는 넘 편했던 수업이고 성적도 잘주시는 것 같습니다!
인간과 종교,이진구,17,Fall,5.0,매주 출결 퀴즈 있고 시험은 대면입니다 내용 깔끔해요
인간과 종교,이진구,21,Fall,5.0,수업내용이 재밌고 로드 부담없음. 일주일에 녹강 두개 올라오고 400자 분량 소감문 한편 제출하면 됨. 흥미로운 주제들을 많이 다루고 교수님도 꽤 유쾌하심.
인간과 종교,이진구,21,Spring,5.0,계절학기 수강했는데 로드도 매주 소감문 올리는 것 외에는 없어서 부담없이 편하게 들었어요. 시험은 서술형으로 나오는데 수업 열심히 들었으면 별로 어렵지 않은 질문들이에요
인간과 종교,이진구,20,Fall,5.0,교수님도 좋으시고 수업내용도 매우 알찹니다!!
인간과 종교,이진구,19,Fall,5.0,"수업자체도 재밌는데 성적도 잘주심 사람들이 왜 종교를 믿는지 호기심이 평소에 있었다면 추천!"
인간과 종교,이진구,21,Fall,5.0,"여름학기 수강했습니다. 400자 출석과제 + 기말고사 + 레포트.  키워드 중심으로 공부하시면 무난하게 기말대비 하실 수 있고 레포트에 수업 내용 열심히 녹여쓰니 성적 잘 주셨습니다!"
인간과 종교,이진구,21,Spring,5.0,매주 보고서 400자는 큰 부담이 안됩니다. 그냥 ppt 요약만 했습니다. 기말 과제는 책 하나 읽고 감상문 쓰기이고 기말고사는 ppt 오픈북 시험인데 중간고사를 안봐서 인지 생각보다 양이 방대합니다. 그래도 학점은 잘 주십니다 교수님 최고!
인간과 종교,이진구,21,Spring,5.0,"21 여름  교수님 사랑합니다……  시험도 충분히 풀만하고 채점도 잘 해주시는듯해요.. 최고"
인간과 종교,이진구,21,Spring,5.0,"교수님 사랑합니다 정말 최고예요... 개인적으로 종교에 관심이 많아서 더 그랬는지는 몰라도 강의 정말 재미있고 설명도 아주 쉽게 잘 해주셨습니다. 종교적으로 편파된 부분 하나도 없이 아주 중립적으로 수업해주신 것도 인상깊었어요. 수업 내용 자체도 유익해서 정말 많은 걸 배웠습니다! 강의만 제대로 듣고 필기 약간만 했다면 오픈북이었던 시험은 전혀 어렵지 않았을겁니다! 약간의 타임어택이 존재해서 마지막 논술문제는 급히 쓰긴 했지만요ㅎㅎ 근데 딱 한 가지 단점으로는 교수님 말씀이 느리셔서 1.7배속해도 아주 정확히 들리는 정도ㅋㅋㅋㅋ 마지막에 시험 급해서 2.4배속으로 들었는데도 어느 정도 알아들을 수 있을 정도로(고딩 때 인강 배속에 익숙해져버린 나...) 느리시니 이건 좀 참고하시길... 400자짜리 출결확인 보고서는 가끔 수업 안 듣고 ppt만 보고 썼었는데 별 문제 없이 A+ 받은 걸 보면 그냥 시험만 잘 보시면 학점을 퍼주시는 듯 합니다... 정말 최고예요 진짜 교수님 제가 이 강의는 꿀강이다 아니다랑 별개로 너무 유익하고 즐거웠습니다! 독후감 책도 정말 읽으면서 큰 감명 받았고... 근데 대면이면 내용 다 외우기 힘들 것 같긴 해요... 워낙 많아서..."
인간과 종교,이진구,21,Spring,5.0,로드 거의 없다시피 하고 교수님 강의력 좋으십니다! 중간중간 하시는 농담도 재미있었어요ㅋㅋㅋㅋ 녹강 시간도 길지 않아서 엄청 편하게 들었습니다. 저는 개인적으로 종교에 관심이 있어서 굉장히 흥미롭게 들었습니다. 가벼운 마음으로 들었는데 배워갈 점이 은근 많았습니다. 학점도 잘 주시는 것 같아요. 근데 시험은 서술형 문제 분량이 길어서 약간 타임어택입니다. 어렵진 않아요! 오픈북이라 수업 들으면서 흐름 이해 갈 정도로만 필기 해 두시고 피피티 한두번 훑어보시면 될 것 같습니다
인간과 종교,이진구,21,Fall,4.0,"종교, 죽음, 종교체험, 이상적 인간상 등에 대해서 배웁니다 시험은 기말 한번이고 책 읽고 쓰는 리포트가 한번 있습니다 과제가 하나밖에 없고 시험도 기말 한번이니 로드가 많은 수업은 아닌 것 같아요"
인간과 종교,이진구,21,Spring,4.0,학점은 최고... 이렇게 기말을 망쳤는데 에제라니!!!!! 근데 시험이 너무 지엽적이라 대면하면 조금 힘들듯 ㅠㅠ
인간과 종교,이진구,21,Spring,5.0,"수업 틀어놓고 딴거 공부하거나 롤하고, 15주차 중에 감상문 6편 써내고, 기말 공부 하나도 안 하고 ppt랑 인터넷 검색 열심히 뒤져가면서 시험 치른 대신 싯다르타 열심히 읽어서 서평 써서 내니 비쁠? 살면서 이런 꿀강은 처음 들어봅니다. 먼가 수업 열심히 들었으면 에제 이상도 쌉가능이었을 것 같은데, 그래도 막학기에 학점 날먹해서 감사했습니다."
인간과 종교,이진구,21,Spring,5.0,로드도 큰 부담 없고 강의도 공부한다기 보다는 강연을 듣는다는 마음으로 들었음. 들인 노력에 비해 학점은 매우 만족
인간과 종교,이진구,21,Spring,5.0,근데 꿀강은 맞는듯.. 이정도 했는데 에마면... 나름 좋은듯?
인간과 종교,이진구,21,Spring,5.0,3페이지짜리 독후감 제외하면 사실상 과제가 없어서 너무 편했어요!!
인간과 종교,이진구,21,Spring,5.0,"직전학기 족보를 피해서 나온 느낌이었어요. 수업 속기해놓고 ctrl f하면 되는 시험"
인간과 종교,이진구,21,Spring,5.0,"꿀강! 교수님도 보면 나름 재밌으심ㅋㅋㅋ 로드는 주 1회 400자분량 감상문 + 기말 + 기말독후감 하나인데 다들 넉넉합니다  다만 기말은 다소 지엽적이긴 해서 대면으로 바뀌면 우째될지 모르겠네요"
인간과 종교,이진구,21,Spring,5.0,꿀강은 맞습니다 그냥 제가 못 받아먹었을 뿐이에요...^^ 녹강 좀 제때 들을걸.. 시험은 기말 한 번뿐인데 생각보다 어려우니까 충분히 준비해가세요 교수님 사랑합니다
인간과 종교,이진구,21,Spring,5.0,"과제는 매주 400자 감상문이었는데 수업 복습하면서 생각 정리할 수 있어서 좋았어요. 무교인데다 종교에 대해 아는 게 전무했는데도 듣기 좋았고 설명을 잘해주셔서 이해가 잘 갔어요! 문서로 피피티 내용 정리하고 시험 쳤는데 대충 12쪽 정도 나왔어요. 이걸 대면으로 하라고 하면 버거울 순 있는데 키워드, 흐름 위주로 정리하고 나니까 굳이 ppt를 계속 보면서 시험 칠 필요는 없었어요. 이번에 유난히 지엽적인 게 나왔는데 비대면이라 그런 듯 싶어요 ! 저는 상당히 만족한 강의입니다!"
인간과 종교,이진구,21,Spring,4.0,"장점: 과제- 거의없다 녹강, 강의 나름 재미있다  단점: 셤문제가 지엽적으로 나온다, 쉅시간을 놓치면 셤문제 답을 제대로 못적을 수도 있는 경우가 발생함."
인간과 종교,이진구,21,Spring,4.0,"비대면일때는 좋은 강의인듯 함 강의도 잘하시고 개인적으로 유머코드가 맞아서 뻘하게 웃긴 부분도 있음 근데 이제 대면한다던데 기말고사는 전범위니까 PPT에 나온 용어 한 200개의 의미와 사용상황을 싹다 머릿속에 외워야하고(대충 20만-30만자) 다 외워도 PPT에 사진으로만 등장한 Karl Lahner같은게 나온다고 생각하면... 학점을 잘 주셔도 위험부담이 좀 큰거같음  그리고 강의력이랑은 별개로 난 인문학 특유의 흘러가는 듯한 강의 내용들이 적성에 안맞아서 시험준비때 고생했음 본전공 3개 시험준비하는거보다 인종 시험준비하는게 더 힘들었을정도로  그러니까 나는 종교적 내용에 관심이 없는데 과제도 별로 없고 학점 잘준다고해서 듣고싶다->비추 추천할만한 사람은 종교에 관심있는 사람 or 내가 인간 복사기다!   개인적으로 나한테 안 맞는 적성을 하나 발견하게 해줘서 참 고마웠던 수업"
인간과 종교,이진구,21,Spring,5.0,"종교에 대한 아주 조금이라도 관심이 있거나, 혹은 아예 노베이스여도 재밌게 들을 수 있는 수업입니다! 아직 학점은 안 나와서 학점 평가는 잘 모르겠지만 강의력도 좋으시고 중간중간 농담도 섞어가면서 재밌게 수업하십니다. 과제도 기말과제 하나이고, 시험도 기말고사 한 방이라 큰 부담도 없습니다. 적당히 편하고 즐겁게 듣기에 좋은 수업인 것 같아요ㅎㅎ 그리고 강의 들을때마다 소감문 작성하는 과제가 있는데, 400자 정도여서 별로 부담스럽지 않아요!! 그냥 강의 제때 듣고 느낀 점 작성하면 됩니다. 만약 대면수업이 된다면 아침 수업이 약간 빡셀거 같긴 하네요..! 이것만 아니면 전반적으로 괜찮은 수업입니다"
인간과 종교,이진구,20,Fall,4.0,겨울계절 들었음 종교에 관심이 있다면 유익하고 수업임 교양 수준에서 흥미롭게 가르쳐 주시는데 수업 절반 이상이 기독교 얘기라 좀 아쉬웠음
인간과 종교,이진구,20,Fall,5.0,"겨울학기 들었습니다. 전체적으로 양이 적지 않고 시험도 기말 전범위인지라 조금 부담감은 있지만, 강의 자체가 지루하지 않고 중간중간 농담도 섞어가시며 재미있게 수업하셔서 막 힘들진 않았습니다. 과제도 매주 400자 얼마 안 걸리구요, 감상문도 수업내용 기반으로 쓰다보면 새로운 시각이 트여서 매우 즐겁습니다. 전체적으로 추천할만한 강의입니다."
인간과 종교,이진구,20,Fall,5.0,정말 말 그대로 힐링이었던 교양강의. 녹강인데다가 강의 내용도 딱 교양수준에서 배울 정도라 무척 좋았습니다. 400자 감상평 쓰는 것과 기간 내 수업 듣는 거만 지키면 성적도 잘 주시는 수업! 완전 추천입니다.
