현대사회와 윤리,오근창,21,Spring,5.0,"(A+ 학생의 미화된 수강평이 아니라 A- 학생의 솔직 후기임을 알립니다) 매우 적은 인원으로 진행된 강의였지만 학점은 정해진 비율에 맞춰서 주신 것 같아요 하지만 저는 선생님의 기준과 판단을 존중하고 납득하며 선생님이 너무나도 좋은 분이시라는 걸 알기에 성적에 연연하지 않기로 했습니다 생활과 윤리 과목과 비슷한 내용으로 흘러갑니다 문과 학생들이라면 전혀 어렵지 않게 수업을 들을 수 있어요 피피티 발표 또는 서평 제출을 한 번 해야 하고 기말 보고서 작성이 한개 있고 기말고사도 한번 있습니다 자잘한 과제들은 없어 전혀 부담이 되지 않았어요 힘든 발표를 시키신 적도 없고 선생님께서는 피피티로 수업을 진행하십니다 저는 초등학교 때부터 철학이라는 학문을 좋아했고 도덕이라는 주제에 대해 깊은 고찰을 하는 시간을 갖는 걸 매우 의미있게 생각하기에 수업이 좋았습니다 성향이 맞지 않으신 분들은 지루하실 수도 있을 것 같아요 무엇보다 저는 선생님이 매우 좋았습니다 비록 비대면이라 아주 가끔 선생님께서 넌지시 던지시는 작은 유머들에 크게 반응하지 못했다는 점이 아쉽기도 하지만 크게 특별한 이유 없이 전 그냥 선생님이 좋았어요! 차분하시고 철학이라는 학문에 매우 진지하게 임하시는 모습과 철학에 대한 진심이 매우 잘 느껴져서인 것 같아요 대면 수업으로 선생님의 강의를 들어보고 싶다는 소망이 생겨 나중에 기회가 된다면 선생님의 다른 강의도 듣고 싶어요 물론 그땐 A+를 받을 수 있었으면 좋겠네요ㅎㅎ!  마지막으로 드리고 싶은 말은 이 수업은 철학에 관심과 애정이 있는 분께 추천드려요!  그럼 20000 -(A+를 꿈꿨으나 A-를 받은 학생의 후기)"
현대사회와 윤리,변문숙,20,Fall,5.0,대학 교양 강의가 이런 것이구나를 느끼게 해준 강의. 과제는 조별 발표 혹은 5페이지 보고서 작성인데 본인은 혼자 써서 내는 보고서 선택. 시험도 한 번인데 비대면으로 바뀌면서 오픈북이었고 그렇게 어렵지 않았음. 수업 시간에 교수님께서 이론 설명하시는 것보다 학생들과의 토론의 비중이 높은데 교수님께서 학생들 이야기도 잘 들어주심. 정말 건설적인 토론이 이런 것이구나를 알게 된 수업. 학점도 잘 주심.
현대사회와 윤리,변문숙,20,Fall,4.0,수업내용은 중간중간에 어렵다고 느껴지는 부분도 있지만 배워가는 게 많은 강의에요! 교수님도 그렇지만 수강생분들한테 배워가는 것도 많은 것 같아요.
현대사회와 윤리,변문숙,20,Fall,5.0,대학 수업의 정수..? 시험도 발표도 수업 중 토론도 너무너무 좋더라.. 교수님 좋으신 건 덤
현대사회와 윤리,변문숙,20,Fall,5.0,"빛-문숙교수님... 발표 한번 시험 한번인데 시험 비대면이라 서술형이었음. 오픈북이라 쓰기 좋았음. 시험 전에 한 하루이틀 핵심만 정리하면 됨"
현대사회와 윤리,변문숙,20,Fall,5.0,수업도 올해 들은 것 중 제일 재밌고 유익했습니다. 로드도 별로 안빡세고 편했습니다. 하지만 가장 중요한건 학점이 개쩐다는 것입니다. 수업 출결이 개판인데(지각 3회 이상) A+ 받았습니다!!!! 갓문숙 교수님 사랑합니다♡♡
현대사회와 윤리,변문숙,20,Fall,5.0,"윤리학과 이에 대한 다양한 현대적 쟁점들을 배워볼 수 있는 시간이었습니다. 교수님께서는 나름의 확고한 윤리관을 갖고 계시지만, 이를 전혀 강요하시지는 않으시고 학생들의 다양한 견해를 토대로 수업 토론을 이끌어 가십니다.  수업 참여 점수는 10점인데, 기본 점수가 9점이고 학기 중 딱 한 번만 수업에 참여하면 10점이 됩니다. 중간고사가 없었고, 대신 보고서나 조별 발표 중 하나를 선택해야 했습니다. 교수님께서는 발표 과제에 더 좋은 점수를 부여할 수도 있다고 미리 언급하기도 했습니다. (왜냐하면 발표 과제는 교수님과 비대면으로 발표 방향에 대한 조언을 받을 기회가 한 번 있습니다.)  기말고사는 원래 대면 시험으로 치러질 예정이었으나, 코로나19 감염 확산의 지속으로 결국 오픈북 비대면 시험으로 변경됐습니다. 문제는 크게 3문제고 각 문제당 세부 문항이 있었습니다. 대체로 약술형•짧은 논술형 시험이었습니다. 아마 수업에 성실히 참여하고 PPT 복습한 수강생이면 쉽게 답을 쓸 수 있었을 것입니다.  학점은 교수님께서 진행한 과목 중 가장 A대가 많았다고 합니다. 또 A대 대부분이 A+이었다고 합니다. 저도 A+ 받았습니다."
현대사회와 윤리,김병재,20,Spring,5.0,2020 여름학기에 수강함. 수업은 반은 이론수업 반은 토론수업으로 진행. 과제 1회 기말고사 1회이고 과제는 발표 대체 가능함. 책 1권 읽고 3장짜리 독후감 쓰는 과제라 로드는 거의 없음. 성적 매우 잘 주심. 개인적으로 관심있던 분야여서 흥미롭게 들었지만 아니라면 졸릴 수도 있을거같음. 토론시간 재밌음.
현대사회와 윤리,김병재,20,Spring,5.0,쥐엔장~ 믿고있었다구.~ 킹병재 그는 신인가? 킹병재 그는 신인가?킹병재 그는 신인가?
현대사회와 윤리,김병재,20,Spring,5.0,"※비대면 절평 기준입니다!※ 막 엄청 인기있는 강의도 아니었고 그냥 윤리학 배워보고 싶어서 들었음. 절평일때 들어놓길 잘했다고 생각함. 수업은 주로 규범윤리학+메타윤리학 이론 수업과 그와 관련된 토론 수업. 첨 들으면 어려운데 나중엔 다 이해될 정도로 쉽게 설명해주심. 교수님이 학생들 의견 굉장히 잘 수렴해주시고 그에 대한 질문도 많이 해주심.  과제는 서평 or 발표. 발표는 잘했을 경우 가산점 부여. 로드 거의 없어서 조아용."
현대사회와 윤리,김상연,18,Spring,5.0,에이쁠 받았다 계절학기 개꿀따리 킹갓따 교수님 너무 좋고
현대사회와 윤리,정진범,17,Spring,5.0,학점도 잘 주시는거 같고 생윤러라면 무난무난합니다
현대사회와 윤리,정진범,19,Spring,5.0,"학기 초반에는 이기주의, 이타주의 등 도덕에 관한 내용을 주로 배우고 후반에는 생윤에서 나오는 덕윤리, 배려 윤리 등을 수업하십니다. 나중에는 자유, 평등과 같은 큰 주제를 바탕으로 토론을 진행하게 되는데, 그냥 구경만 하더라도 아주 재미있습니다! 초반에 짧은 서평을 쓰는 과제가 있고, 시험은 중간 기말로 두 번 칩니다. 교수님께서 아주 차분하게 수업을 진행하시고, 여러 논거들을 다양하게 알려주시기 때문에 상당히 유익했다구 생각합니다~"
현대사회와 윤리,정진범,19,Spring,4.0,"중간고사 이전은 수능 생윤 내용을 주로 다룸. 이기주의와 도덕, 의무론, 공리주의. 기말고사 이후는 인권, 평등 등의 현안에 대해서 배움. 기말고사 이후에는 발표와 토론 수업이 있는데 발표는  희망자만 함. 서평 한 번 쓰는 거 있는데 부담스럽지 않고 강의력이 아주 좋으신 편은 아니지만 여러 관점에 대해서 알려주시고 반박하는 근거들도 알려주심. 내용 자체는 흥미로운 편. 수업만 열심히 들었다면 시험도 어렵지 않고 성적도 잘 나오는 편."
현대사회와 윤리,정진범,18,Fall,5.0,"좋은 교수님, 좋은 수업입니다. 출석은 매 수업시간 모든 학생 호명하여 체크하십니다. 중간고사 이전은 이기주의/공리주의/의무론을 다루었고 중간고사 이후는 덕윤리/배려윤리 그리고 사회적 문제들을 다룹니다. 수업 난이도는 크게 어렵지 않으며 특히 고등학교 때 생활과 윤리를 공부하셨다면 익숙한 내용들일 겁니다. 과제는 서평과 발표 중 택1하시면 됩니다. 거의 대부분 서평을 선택하시긴 합니다. 학점은 아주 잘 주시는 건 아니지만 열심히 하면 좋은 학점 받을 수 있습니다. 수업 후반부에 토론이 있긴 하지만 소극적이신 분들도 부담 가질 필요 없는 게 그냥 다른 분들 말씀하시는 거 들으면 됩니다. 상당히 흥미롭고 시험범위도 아니라 편하게 참여하실 수 있습니다. 시험은 큼직큼직한 개념 위주로 외우시면 되고 난이도는 쉬운 편입니다. 수업 정말 좋아요. 생각해볼 거리도 많고 교수님도 착하고 좋으십니다. 꼭 들으세요!"
