스페인어권 문화의 이해,장재준,19,Spring,1.0,"2022년 계절학기 수강생입니다. 시험보기 전이고 성적 나오기전에 작성합니다  정말 대단한 수업입니다. 3시간 통강의 한학기 수업이면 14번 수업 + 기말고사 이렇게 시험을 보는게 정상이지만 16번 수업 + 기말고사 이렇게 수업을 진행하셔서 3시간 수업을 두번 더 진행하셨습니다.(휴강 날이 있어서 보강하는 것도 아님) 심지어 이것도 정말 많이 줄인거라는거. 애초에 학기 초까지는 20번 수업 + 8/5 기말고사를 진행하겠다고 공지하였었습니다. 이유는 ""한학기에 스페인과 라틴 아메리카를 담아낸다는건 말이안된다""는 이유. 막판에 교수님이 지치셨다고 조금 줄이기는 했지만 타 수업보다 3시간 수업을 두번 더 진행하였고 종강도 현저하게 늦습니다.  문제는 이번 학기만 그런게 아니라 이전 학기에도 8월 넘어서 종강했었다고 합니다.  정말 화나는 부분은 이게 정보 전달이 정말 알차고 해서 그런거면 이해를 하겠는데 교수님 말 없이 지각하시고 쉬는시간 20~30분씩 가지고 하는 시간을 아끼면 이렇게 길게 수업을 하지 않아도 되는거라는 점입니다. 수업 내용도 삼천포로 빠지는 내용들을 제외하면 충분히 정해진 수업시간 내에 끝낼 수 있는 부분입니다. 스스로도 ""내가 왜 이얘기를 하고 있었나"" 하십니다  물론 교수님이 유쾌한 부분이 있고 자체는 스페인어권에 대해서 잘 알고계시는 것 같지만 이처럼 마음대로인 수업방식은 정말 별로였습니다.  영화도 집에서 미리 보고오도록 시키시고 하는데 어째 수업시간은 점점 늘어나는지  수업내용도 흐름이 없다는 느낌을 많이 받았습니다. 교수님 본인은 흐름을 만들고자 올리브>올리브 나무가 그려진 칸딘스키 작품>칸딘스키>스페인 예술 이런식으로 진행하시는데 문제는 이게 한 ppt 하루 수업에서 이런식으로 왔다갔다 한다는거. 음식을 다루다가 예술을 다루다가 잡탕밥 같은 느낌의 수업이었습니다  다른 교수님의 퀄리티 높은 강의 들으시는걸 추천드립니다. 추천하고 싶지도 다시 보고싶지도 않은 수업이었습니드"
스페인어권 문화의 이해,장재준,19,Spring,3.0,"2021-여름학기 아랫분들이 좋은 말씀 많이 써주셔서 저는 단점 위주로 얘기해보려고 합니다. 일단 교수님께서 질문을 많이 하시고 즉각적으로 답을 하길 원하시는데, 당신이 원하시는 답변이 아닌 경우 따뜻하게 받아주시지 않습니다. 그래서 그런지 개인적으로 질문에 대답하기가 조금 꺼려지기도 했습니다. 그리고 이렇게 대답 잘 안 하면 단체로 학점 F라고 말씀하시는데, 물론 그냥 흘러 들으면 되는 말인건 알지만 대학교에서 학점으로 협박(?)하는게 좋게 들리진 않았습니다. 게다가 교수님께서 지각을 상당히 자주 하시는데 그에 대한 별다른 사과나 설명이 없으셔서 나중엔 그냥 그러려니 했습니다. 하지만 과제 없는거 좋아하고 달달 암기하는데 자신있다 하시는 분들이 들으시면 딱 알맞는 수업일 것 같습니다. (암기할 양이 정말 많습니다. 특히 이번엔 중간 없이 기말 한 방이라서 더 많았습니다.) 나름 스페인이랑 라틴 아메리카에 대해서 배워가는 것도 많아서 교양은 확실히 쌓였다는 느낌입니다."
스페인어권 문화의 이해,장재준,19,Spring,5.0,2021 계절. 교수님 재밌고 내용 유익하고 과제 없고! 조별 모임 친목하고! 좋은 강의였습니다. 다만 영화 보고오게 하시는데 영화가 많고 다 지루해요..
스페인어권 문화의 이해,장재준,19,Spring,5.0,"2020 여름  교수님 꿀잼이시고 로드 적긴 한데 수업참여 많이 하길 바라세요 그거에 대한 스트레스가 없다면 추천합니다"
스페인어권 문화의 이해,장재준,19,Spring,5.0,"2020-S 진짜 존잼 !! 교수님 말 한 마디 한 마디가 웃김 !!"
스페인어권 문화의 이해,장재준,19,Spring,4.0,"수업이 너무 재밌고 갸꿀임  피피티 양이 많아서 기말칠때는 빡세긴한데 교수님이 재밌고 좋아서 용서해드림 ><"
스페인어권 문화의 이해,장재준,19,Spring,5.0,"B+ ~ A- 정도 예상하고 있었는데 A0가 떠서 깜짝 놀랐네요. 교수님 수업 굉장히 재밌고 아래분들 말처럼 교수님께서 말하는걸 좋아해서 가끔가다 수업이 삼천포로 빠지지만 공부하다 보면 스페인과 라틴아메리카 여행 뽐뿌 생깁니다.  저는 공부를 녹음 들으면서 내용 다시 정리하고 정리한거 두번 정도 읽고 시험장에 들어갔는데 단답형이나 객관식에서 생각보다 막히는 문제들이 많더군요. 교수님이 보라는 영화, 읽으라는 문서 열심히 안읽어서 그런가보다 하고 학점 기대 별로 안했는데 학점 공개 마지막날에 힐링 제대로 합니다"
스페인어권 문화의 이해,장재준,18,Spring,4.0,Ppt 외워야 할 양이 많지만 수업시간에 필기 열심히 하고 달달 외우기만 하면 시험 잘 볼 수 있는 과목. 변별력을 위해 교수님이 스치듯 지나가면서 이야기한 것이 시험에 나올 수 있다. 꼼꼼하게 외우는게 중요한 듯. 어쨋든 들으면 스페인어권에 대해 기본상식이 많이 쌓이고 여행가고 싶어진다.
스페인어권 문화의 이해,장재준,18,Spring,4.0,양이 와울게 많고 가끔가다 삼천포로 빠지는 일도 잇지만 그럭저럭 재밋고 스페인 여행가고싶게 만드는 수업
스페인어권 문화의 이해,강성식,21,Spring,4.0,"1. 족보 없이 들을 수 있는 수업은 아닌 거 같아요 + ppt 공유 안 해주시고 교수님 생각이 많아서 속기 필수입니다. 시험이 초지엽이라서 속기랑 족보 없이 대충 듣기만 하면 시험 정말 어려울 거에요  2. 교수님이 비판적인 사고와 약간 거친 말투로 수업하시는데 이런 거 괜찮으면 새로워서 들을 만한 수업이고 아니면 듣기 힘들 거 같아요 3. 그럼에도 불구하고 강평이 4점인 이유는 속기랑 족보만 1일 봤는데도 학점이 비플이 뜨더라고요...  학점 미화! (강의 거의 안 들음) 진짜 학점 천사셔서 수업 잘 듣고 어느 정도 공부하실 생각만 있다면 에플 쉽게 받아가실 거 같아서에요!"
스페인어권 문화의 이해,강성식,20,Fall,4.0,"스페인어권에 대한 전반적인 이해를 주로 다루지만, 때로 한 수업을 완전히 한국 문화와 엮어 강의하시는 경우도 많습니다. 교수님의 의견이 상당히 많이 개입하는 수업이고, 그런 부분들이 시험 문제로 나오기도 합니다."
스페인어권 문화의 이해,강성식,20,Fall,3.0,"족보 없는데 학점은 잘 받고 싶다, 라면 듣지 마세요 나중에 스페인 가서 써 먹을 수 있는 흥미진진 문화 맛보기! 를 원한다면 듣지 마세요. 수업내용에 한국의 정책에 대한 교수님의 견해가 자주 포함되고 시험에도 출제되는데 개인적으로 다소 편향된 의견이라고 판단되어 불편했습니다. 심지어 수업 목표가 다양한 시각을 지향하시는 것이라 더욱... 정치성향이 중도~보수다, 듣지 마세요.^^"
스페인어권 문화의 이해,강성식,20,Fall,4.0,스페인어 문화권의 이야기와 한국 이야기가 거의 1:1 비율로 진행됩니다. 시험은 매우 지엽적이어서 족보가 필요합니다. 속기록도 작성하셔야 합니다.
스페인어권 문화의 이해,강성식,20,Spring,5.0,"저도 이번 학기 최고의 수업이었습니다 ㅜ 비대면이라 로드0에 시험1번 기말로 학점 결정나긴했는데 수업 너무 재밌었고요.. 학점도 a+주시고.... 우리 전공 교수님이 이 교수님 같았으면 얼마나 좋았을까 ㅠ 내 전공학점 눈물나네 ...."
스페인어권 문화의 이해,강성식,20,Spring,5.0,족보 있으면 닥추 에쁠 못 맞을 수가 없음. (여기서 말하는 족보는 기출문제 + 강의록) 매 학기마다 똑같은 수업 하셔서 강의록 보고 있으면 그거 그대로 따라 읽으심. 족보 없으면 공부 열심히 해야됨.
스페인어권 문화의 이해,강성식,20,Spring,5.0,초반엔 녹강이라 그런지 조금 지루해서 집중해서 듣지는 않았는데 지엽적으로 나온다는 에타 선배님들 말에 동영상 하나하나 2배로 돌려들으면서 속기함. 속기하면서 듣다보니 꽤나 흥미로운 내용이 많았고 교수님이 유럽 문화와 한국 문화에 대해 새로운 관점을 던져주시는 것 같아 좋았음. 교수님 의견에 전부 동의할 수는 없지만 유익한 시간이었던 것 같음. +전반적으로 스토리텔링식으로 수업을 하시기 때문에 수업만 잘 따라가다 보면 내용안 자연스럽게 습득됨 하지만 시험이 정말 지엽적이기 때문에 속기한 내용 전부 다 알고 있어야 함 막 달달 외운다기 보다는 시험 전에 한번 훑고 가는 정도면 될 듯?
스페인어권 문화의 이해,강성식,20,Spring,5.0,"제 기준에서 이번 학기 최고의 교양 수업 너무너무 재밌었고 유익했어요. 교수님이 진짜 모두까기 인형이기는 한데, 그러한 태도에 이유가 있고 덕분에 새로운 관점에서 생각하게 돼서 좋았어요. 수업 내용이 워낙 좋아서 거기에만 충실하고 시험 공부 거의 안하고 10문제 정도 안풀었는데도 에이쁠!!!! 갓성식 사랑합니다"
스페인어권 문화의 이해,강성식,20,Spring,3.0,비대면 입장에서 마이크안들려서 너무 힘들었음.. 혼자서는 ㄴㄴ
스페인어권 문화의 이해,강성식,18,Spring,5.0,"시원시원하시고, 멋있으시고, 상당한 츤데레. 딕션과 발음 마인드까지 모두 다 찰떡이십니다. 수업이 재밌는것은 더 말할 필요도 없습니다. 들어 본 교양 중 가장 개성넘치는 수업이었습니다. 시험은 당연히 나올 것 같은 내용이 안나옵니다. 하지만 수업 플롯을 잘 따라가셨다면 한두문제를 제외하면 모두 쓸만한 정답입니다. 그냥 상식적으로 생각하시면 될 듯 합니다. 선생님의 사고 흐름을 깊게 체화하시면 좋을 것 같습니다.  워낙 뭐랄까 또박또박하셔서 집중력이 흐트러지지 않는 수업이니 그냥 가서 들으시면 됩니다. 대학까지 와서 꿀을 빨려던 자신을 반성하게 되는 수업. 듣고나면 괜히 뿌듯한, 참지식의 현장입니다 :D"
스페인어권 문화의 이해,강성식,19,Fall,4.0,"수업은 정말 재미있고 여러 생각을 하게 만들었어요! 다만, 아쉬운 점은  시험 문제가 생각보다 많이 지엽적이더라구요..농담인 줄 알았는데 시험에 나오는 경우도 있었어요..ㅠㅠ"
스페인어권 문화의 이해,강성식,19,Fall,3.0,사람들이  다 너무 잘해서 조금만 시험 못봐도 바로 에이쁠 ㅂㅂ임
스페인어권 문화의 이해,강성식,19,Fall,5.0,족보 있으면 무조건 꿀강입니다 워낙 시험이 지엽적이기에 족보가 없다면 학점을 일순위로 생각하시는 분께는 추천하지 않습니다
스페인어권 문화의 이해,강성식,19,Fall,5.0,"시험문제 엄청 지엽적인데 탈강의는 없는 듯 합니다. 대체 언제 이런걸 말씀하셨는지 생각되는 문제들도 다 언젠가는 언급하고 넘어가신 내용이긴 합니다...저는 에이쁠 나오긴 했는데 수업 내용 전부 속기해서 나름 꼼꼼하게 외운 편이라 완전 꿀강이라고 보긴 힘들 것 같습니다. 그래도 연도나 복잡한 용어 같은거를 달달 외울 필요 없는건 좋습니다. 과제도 별로 안 복잡하고, 시험도  공부할 시간 넉넉하고 세세하게 외우면 성적 잘 받아갈 수 있을 것 같긴 하네요."
스페인어권 문화의 이해,강성식,19,Fall,4.0,"시험 범위 자체는 그렇게 많지 않고 올단답식이라 다른 수업에 비해 부담은 적은 것 같음 그러나 특히 기말고사가 엄청 지엽적으로 나오므로 세세하게 외워야 함 세세하게 외웠으면 성적 잘 받을 수는 있었을듯 본인은 그렇게까지 나올 줄 몰라서 잘 안 외웠더니 망함 수업은 재밌게 들을만 하지만 정말 스페인어권 문화를 배우고 싶은 거라면 다른 수업 듣는 게 나을 듯 다른 말 많이 함 본인은 독강에 족보도 없어서 공부하기 힘들었음 세 번까지 빠질 수 있는데 독강이라 빠지지도 못 하고 녹음본 들어도 교수님이 웅얼대시는 경향이 있어서 안 들림 독강은 비추"
스페인어권 문화의 이해,강성식,19,Fall,3.0,"족보를 많이 타는 듯 하는데 족보를 구하기 힘들어요. 너무 지엽적이고, 피피티도 안 올려주셔서 공부하기 힘들었네요. 족보있으면 듣고 아니면 듣지 마세요."
스페인어권 문화의 이해,강성식,19,Fall,5.0,"깜빡이 없이 go straight, turn left 관악의 최고 띵강 인정합니다"
스페인어권 문화의 이해,강성식,19,Spring,3.0,시험에 중요하다고 생각한건 하나도 안 나오고 이런게 왜 나오나 싶은게 나옵니다 그만큼 엄청 지엽적이에요ㅎㅎ ... 초수강에 족보 없이 공부하니 저는 매우 힘들었습니다 그래도 성적은 쁠몰이긴 한듯요 로드는 부담없는 간단한 조사하기 수준이고 성적은 어차피 시험으로 갈립니다
스페인어권 문화의 이해,강성식,19,Spring,5.0,"스페인어권, 중간고사 전까지는 스페인을 그 이후에는 중남미 국가를 배웁니다. 수업시간에 모든 중남미 국가를 다루지 않으므로 다루지 않는 국가 여섯 군데는 직접 조사해 보고서를 작성합니다. 위키피디아의 도움을 받아 하루 컷 가능합니다. 공결 처리 없는 대신 5회 결석까지는 불이익이 없고 출석부 돌리는 방식이라 지각은 곧 출석입니다. 시험은 지엽이긴 하지만 외우라는 것 외의 인명 연도를 내시진 않습니다. 저는 족보 없이 공부했는데 족보를 타는 것 같다고 하더라고요. 쁠몰 아니었으면 족보 타는 문제 때문에 에이쁠 어려웠을 것 같습니다. 가능하면 구하시길 추천합니다."
스페인어권 문화의 이해,강성식,18,Fall,5.0,진짜 갓성식ㅠㅠ 제가 사랑하는 교수님이었습니다 그냥.. 강의 스타일도 제 스타일이고 저는 수업도 너무 재밌게 들어서ㅋㅋㅋㅋ 꿈에도 나오셨어욬ㅋㅋㅋㅋㅋㅋ 모두까기 인형은 맞지만 나중에는 교수님 철학이 이해돼서 재밌게 잘 들었습니다 교수님 오래오래!!!! 강의해주세요!!!!!
스페인어권 문화의 이해,강성식,18,Fall,4.0,교수님에 대한 소문을(모두까기인형ㅎㅎ) 듣고가서엄청 재밌을줄 알았는데 생각만큼 흥미진진하지는 않았어요ㅠ 명성대로 시험문제는 엄청 지엽적이고 저두 개망한줄알았는데 a+받아서 약간 당황스럽네요
스페인어권 문화의 이해,강성식,18,Fall,5.0,"과제는 국가 조사인데 금방 할 수 있어서 거의 과제는 없다고 보시면 되고 출결도 3번까지는 빠질 수 있는데 수업 시간 자료 이티엘에도 안올려주시고 말씀 하시는 곳에서 나와서 안 빠지시는게 좋아요.  수업시간에 언급하신 내용은 거의 다 나온다고 생각하셔야 해요. 그래도 스토리식 수업이 잘 맞으면 이 수업 추천해요."
스페인어권 문화의 이해,강성식,18,Spring,5.0,시험 지엽적이긴 하지만 강의가 매우 재미있고 성적도 쁠몰로 주세요 ㅎㅎ 족보도 꽤 타는 것 같습니다.
스페인어권 문화의 이해,강성식,17,Spring,5.0,"스문이 들으실 거면 강성식 교수님 추천해요! 일단 먼저 말씀드릴 게, 수업 분량이 많고 시험은 지엽적으로 나옵니다. 그런데  스문이라는 강좌 자체의 특성이 그러니까요. 그래도 사람 이름이나 연도 이런 세세한 것까지는 외우지 않아도 된다는 장점이 있습니다.   그런데 호불호가 갈릴 수 있는 부분이, 스페인어권 문화의 이해라고는 하지만 강성식 교수님은 한국사회와 문화, 유럽과 미국에 대해서도 꽤 비중 있게 다루시는 편입니다. 비판도 많이 하시고요. 그래서 정말 스페인 문화만 알고 싶다! 이러면 실망할 수도 있는 여지가 있다고 봅니다.   그런데 저는 그런 점도 좋았습니다. 일단 기본적으로는 스페인어권 국가들의 문화를 다루는 데다가, 한국인으로서 세계를 바라보는 시각에 대해 생각해볼 수 있게 하시거든요. 말이 좀 빠르신 편이긴 하지만 강의력 자체도 좋으시고, 말씀도 재밌게 하시는 편이고요. 생각보다 폭넓은 분야의 상식도 얻어올 수 있어서 인상 깊게 들은 수업이었습니다.   단지 독강은 비추합니다ㅜㅜ 말씀이 빠르시고 시험이 지엽적이기 때문에 노트북 필기를 하는 게 좋은데 혼자 하기에는 버거워서요. 친구와 같이 들으면서 필기를 나눠서 하든가 부족한 부분을 채워준다든가 하시면 좋을 것 같습니다.   덧붙이자면 시험이 지엽적이라고는 하지만 교수님이 알게 모르게 강조하신 부분에서 다 나와요! 평소에 필기 열심히 하시고 시험 때 쭉 훑어보면서 키워드 위주로 공부하세요. 드랍자도 많고 쁠몰이시기 때문에 좋은 성적 받으실 수 있을 거예요.ㅎㅎ   출석은 잘 안 부르시지만 수업 내용이 워낙 많은지라 한 번 빠지면 손해니까 수업은 잘 나가시고요. 단편적인 사실들의 나열보다 스토리가 있는 강의가 좋다, 로드 없는 쁠몰 강의가 듣고 싶다 하시면 꼭 이 강의 들으세요! 개인적으로는 다시 한 번 듣고 싶은 강의였어요. (과제는 단순 조사에 본인 의견 1페이지 정도 덧붙이는 과제 하나였어요! 부담은 거의 없었고요.)"
스페인어권 문화의 이해,강성식,16,Spring,2.0,"너무 지엽적이에요 ㅠㅠ 쁠몰이라서 끝까지 들었는데 쁠몰아니었으면 진작에 드랍했을 거 같네요.."
스페인어권 문화의 이해,최은경,24,Spring,5.0,"정말 재밌게 듣고 있습니다. 교수님께서 정말 친절하게 설명해 주세요."
스페인어권 문화의 이해,최은경,22,Fall,5.0,"강의 굉장히 재미있고, 교수님도 너무 친절하시고 과제도 뭐 없고 시험도 할만하고 성적도 잘주시는듯한 완벽 그 자체"
스페인어권 문화의 이해,최은경,22,Fall,5.0,시험을 잘 본 편은 아니었던 것 같은데 에이쁠 받았어요! 스페인이랑 아메리카 등에 대해서 역사와 문화를 알아갈 수 있는 좋은 수업이었습니다 시험 범위 피피티가 좀 많고 지엽적인 문제도 있었지만 유익했어요! 교수님 강의력은 좋으신 것 같은데 말이 빠르셔서 가끔 이해하지 못하는 부분도 있었습니다ㅠ
스페인어권 문화의 이해,최은경,22,Fall,5.0,"벼락치기를 하는 바람에 성적이 처참하게 망했지만 후회하지 않는 강의입니다. 수업 내용 자체가 유익했고, 부담없이 재밌게 들을 수 있는 교양이었어요. 시험은 외울 것은 많으나 여유롭게 준비하면 될 것 같습니다."
스페인어권 문화의 이해,최은경,22,Fall,4.0,"우선 교수님이 굉장히 활발하고 밝은 성격이십니다! 조별발표는 하기만 하면 점수를 주시는 것 같습니다. 시험은 단답형 50문제이고 피피티 장수로는 시험범위가 많긴 하지만, 피피티 장마다 글이 그렇게 많지 않고 문제도 대부분 핵심 단어 위주여서 2-3일 공부하면 충분할 것 같습니다. 그런데 개인적으로 수업 자체는 체계적이지 못하다고 느껴져서 조금 아쉬웠습니다. 가볍게 들을 암기교양을 찾는 분께는 추천드리고 싶습니다!"
스페인어권 문화의 이해,최은경,22,Fall,5.0,"중간은 평균+6, 기말은 아마 90 중반이었고 에이쁠 나왔습니다! 다들 암기 엄청 열심히 하실 줄 알고 에제 나오면 어쩌나 걱정했는데 다행히 에이쁠 나왔네요ㅎㅎ 교수님 감사합니다ㅠㅠ 라틴아메리카에 대해 무지했는데 덕분에 다양한 국가에 대해 이해할 수 있는 수업이었습니다. 시험은 단순 암기이고 중요 키워드 위주여서 피피티 정리하고 암기하는 것만 했습니다. 재미있는 꿀강이에요!"
스페인어권 문화의 이해,최은경,22,Fall,5.0,진짜 꿀강입니다.. 일단 과제는 조별 발표 한번밖에 없는데 여러명이서 해서 부담 전혀 없어요. 시험은 단답형 50문젤라 서술형보다 훨씬 쉽게 느껴졌어요!! 시험범위 ppt가 방대해서 처음에는 어떻게 공부해야되나 막막한데 교수님이 중간중간 리뷰 해주시고 시험에는 거의 중요한 포인트 위주로 나와서 할만해요. 중간 기말 각각 이틀 정도 공부해서 중간 100 기말 아마 90 후반대 받고 A+ 받았습니당 완전 추천해요!!!!!!
스페인어권 문화의 이해,최은경,22,Fall,5.0,"중간고사는 평균+2 였고 기말은 그럭저럭 본 것 같은데 에이쁠 감사합니다~ 성적 아주 후하게 주시는 것 같아요 말이 빠르시고 설명이 방대하실 때가 있긴한데 리뷰해주시는 것만 잘 듣고 며칠 투자해서 암기하면 성적 잘 받을 수 있습니다!  이 강의 덕분에 세계를 바라보는 시야도 넓어진 것 같고 이정도면 꿀강인 것 같네요"
스페인어권 문화의 이해,최은경,22,Fall,5.0,"중간 거의 꼴찌하고  기말도 그냥저냥 본 거 같은데 비쁠 떴어요  교수님 사랑합니다 ..... 중간고사 보고 중간값 평균도 알려주시고 바로 시험지 주시고 체크도 해요 수업도 재밌게 잘 해주시고 리뷰도 맨날맨날 해서 수업 놓쳐도 다시 잘 들으면 회복할 수 있는거같아요 과제는 조별발표 한 번 있는데 어렵지도 않고 재밌게 준비할 수 있어요 다들 스문이 들으세요"
스페인어권 문화의 이해,최은경,19,Spring,5.0,"교수님이 아주 유쾌하시고 재미있습니다 수업의 질이 아주 높다고는 못하겠는데 그래도 가볍고 즐겁게 상식 채울 수 있는 수업...저는 만족했습니다. 팀플 하나 빼고는 과제도 아예 없음. 일단 그냥 마음이 편하고 재미있어요....태풍같이 거친 전공과 대학글쓰기로 가득찼던 이번학기의 쉼터가 되어준 수업...ㅠㅠ 시험문제도 그렇게 어렵진 않아요. 단답식이고 하루이틀 빡세게 공부하면 성적 잘 받을 수 있습니당...그래서 에이받기 엄청 힘들줄 알았는데 생각보다 공부 안하는 분들이 많더라고요...? 아무튼...그렇습니다"
스페인어권 문화의 이해,최은경,19,Spring,5.0,"교수님이 엄청 재밌어요ㅋㅋㅋㅋㅋㅋ 중간중간 혼자 웃음 참느라 힘들었음. 수강평에 엄청 지엽적으로 나온다고 해서 걱정했는데 전날 밤새는 걸로 충분한 정도인것 같아요!  당장 기억나는 문제 복기해보자면 중간고사 땐 알타미라 동굴화, 코바동가전투, 산티아고 데 콤포스텔라 대성당, 아돌포 수아레스, 플라테레스크?양식, 마드리드의 난리법석, 시도니아 백작?, 파야스 등이 답이었던 문제. 그리고 알 안달루스 이전 민족들에 대해 묻는 문제가 기억나네요.  기말고사 때는 전부 평이한 수준이었어서 그나마 까다로웠던 문제가 콜럼버스의 항해배경 5가지, 아스테카 문명이 몰락한 이유 3가지 적는 문제였습니다.   성적은 엄청 빨리나왔는데 기말고사 끝난 날에 바로 나왔습니다. 중간고사 평균은 88점이었고 기말은 모르겠네요. 다들 화이팅!"
스페인어권 문화의 이해,최은경,18,Fall,4.0,"수업을 아주 재미있게 하신다.  앞에 수업 2개는 엄청 많이 쨌지만 스문이 들으러 학교 나왔다. 내용이 쉽고 재미있다 보니 다들 엄청 열심히 듣는다. 그래서 시험도 다들 잘 친다.. 모두가  a를 받을 수는 없는 법. 변별력을 위해서 엄청 지엽적인 내용들이 나온다.  내신 공부하듯이  달달 외워야 할 듯 하다.  나는 대충 중요한 것 같은 개념만 외우고 씨쁠을 받았다. 그리고 수업이 재미있긴 하지만 엄청 세상을 보는 눈이 넓어진다거나 교양이 깊어진다거나 하는 느낌은 아니다. 텍스트로 치면 나무위키같은 교양이다. 적당히 재미있으면서 얕고 넓은 지식을 얻을 수 있다."
