스페인어권 문화의 이해,김선이,21,Fall,5.0,"중간은 조별발표로 대체되고 기말 시험 한번입니다! 설명 주어지면 그에 대한 답을 단답형으로 쓰거나 빈칸 채우는 문제 정도였고, 전혀 지엽적이지 않았습니다.. ppt에 있는것만 나왔고 그중에서도 중요하다싶은거만 골라서 나와서 지금와서보면 속기본도 필요없었던 것 같네요! 조별발표는 큰 부담 없었구요 교수님께 사전에 메일 보내면 가이드라인도 잡아주셨습니다! 수업내용도 되게 알차고 재밌는 교양 느낌? 이야기 위주에요! 문화부터 정치에 이르기까지 교양수준에서 다양한 내용을 다루고,  중간중간 영상자료 되게 많아서 지루하지 않구요 교수님 강의력도 좋으신 편입니다! 발표나 시험 둘다 되게 쉬운 편이라 출석 중요합니다! 변별력 없는거 같아서 좀 걱정했는데 성적 잘나왔구요ㅎㅎ 중간에 영화보고 퀴즈푸는 보너스과제+중간대체발표+기말시험 말고는 로드 없어서 부담도 적었고 수업도 재밌었고 전 만족한 수업이었습니다! 전 추천이여ㅎㅎ"
스페인어권 문화의 이해,김선이,21,Fall,5.0,시험 매우 쉽습니다... 발표 내용은 시험에 반영은 안되는것같아요 출석 감점이 커서 그것만 조심하시면 될 것 같네요 시험이 지엽적이라고 해서 ppt엔 없는 교수님 설명도 암기하고 그랬는데 그럴 필요는 없고 적당히 이해하시면 돼요 단답형+빈칸채우기라 시험부담은 없습니다
스페인어권 문화의 이해,김선이,21,Fall,5.0,"중간 없고 조별 발표로 대체됩니더 시험이 쉬운데 그래서 성적이 어떻게 나올지 애매하네요  참고로 교수님이 강의록에 앖는 부분을 수업 시간에 필기해주시는데 그부분에선 시험 하나도 안나왔습니다 국기, 각 국가 중요인물, 미술가 등등 외우는 게 중요합니다"
스페인어권 문화의 이해,김선이,21,Spring,5.0,조별과제 한 번 있는데 크게 변별력은 없는 것 같음. 기말 점수랑 출석이 제일 중요한 듯. 기말 시험이 주관식 단답형인데 어렵지 않아서 실수하거나 순간 이름이 생각나지 않으면 학점이 바뀔 수 있음. 그래도 교수님 강의 재밌게 교양 쌓는 느낌으로 들을 수 있었음!
스페인어권 문화의 이해,김선이,21,Spring,3.0,시험 한 번 보는데 다들 잘 봐서 그런지 학점은 딱히 ㅎ..
스페인어권 문화의 이해,김선이,21,Spring,5.0,이 강의 왜 안들어요.....? 강의평 안쓰려다가 이렇게 좋은 교수님과 강의는 널리 알려져야한다고 생각해서 씁니다. 시험은 기말 한번에 지엽적으로 내지 않으셔서 중요한 인물이나 사건 위주로 암기하면 됩니다! 평소에 수업 열심히 들었어서 전범위인데도 시험공부 별로 힘들지 않았습니다. 무엇보다 강의 내용이 너무너무 재밌었고 교수님도 말솜씨가 굉장히 좋으셔서 처음 접하는 라틴계 국가들에 대한 내용들을 흥미롭게 잘 습득할 수 있었습니다! 호기심에 신청했던 강의인데 한학기동안 너무 재밌었네요 김선이 교수님 다른 수업도 있다면 꼭 듣고싶습니다.
스페인어권 문화의 이해,김선이,21,Spring,4.0,"한번 지각하고 시험 2문제 틀리니 에제 나옴 스페인이나 라틴 국가에 관심도 전혀 없었고 아는것도 없었는데 수강신청에서 잡고 싶은 과목 못잡아서 남는과목 신청해서 들었는데 기대 이상으로 흥미 있는 수업이였음. 스페인어에도 관심이 생기고 나중에 여행 갈 일 있으면 가볼까 하는 생각까지 들 정도로 재미있었고, 이해도 잘 되게 설명해주셔서 외국에 관심 하나도 없는 사람도 기말고사 공부하면서 이해는 베이스로 깔고 암기도 할게 별로 없게 느껴졌음. 1학기 내용을 정리하면 에이포 3페이지정도 나오고 여기서 시험문제가 다 나오지만 이름을 순간 헷갈렸더니 훅훅 점수가 떨어진다는 점이 아쉬웠음. 그래도 강사님은 너무 좋으십니다 친구들한테도 여기저기 추천하고 다니는데 꼭 들어보시면 좋겠습니다"
스페인어권 문화의 이해,김선이,21,Spring,5.0,이번학기 최대 꿀강임. 로드가 거의 없다는 게 최대 장점인데 글 쓰는 거 하나도 없고 조별로 발표하는 거 한 번에 기말 한 방이 끝임 성적도 절평으로 주시는데 과제나 시험이 어렵지 않아서 에이대 받는 건 정말 어렵지 않음 교수님도 젊으시고 강의력도 좋음 내용 재밌고 성적까지 만족스러웠음
스페인어권 문화의 이해,김선이,21,Spring,1.0,"이 정도면 숨은 꿀강입니다 중간고사가 없었고 (발표과제로대체) 그럼에도 생활원예같은 1000페이지가넘는 암기량에 비하면 자애로운 피피티장수입니다 전 수업도 제대로못들었었고 벼락치기했는데 3개정도틀렸었고 B+이라고떠서 좌절하고 슬펐었는데 갑자기 오늘들어가보니 A0로 바뀌어있네요??오호^_^ 북개가 대면이 되는순간 이 강의는 북개를 능가하는 ssap꿀강이 될것입니다 수업끝날때 영화도 보여주셔서 흥미진진해요"
스페인어권 문화의 이해,김선이,21,Spring,5.0,"이 시대 최고의 강의입니다. 내용 부담없고 교양도 쌓이고, 학점도 잘주십니다."
스페인어권 문화의 이해,김선이,21,Spring,5.0,물론 제 점수는 b+이지만… 기말고사 전체 빈칸 중에 틀린건 별로 없는데 다 n개 이상 맞춰야 점수 주는 부분점수 없는 문제에서 몇개 나갔더니 점수가 낮게 나온 것 같네요.. 그래도 교수님 수업은 정말 좋았습니다! 강의식이긴 하지만 딱딱한 방식 아니었고 각 국가별 역사나 정치 문화를 이야기처럼 해주셔서 흥미롭게 들을 수 있었어요! 로드도 중간 대신 팀플 하나랑 기말고사인데 팀플도 어려운건 아니고 그냥 한 국가씩 선정해서 발표하는 방식이었습니다! 전반적으로 라틴아메리카에 대해 많이 알아갈 수 있었고 카메라는 다 키고 얼굴 보이게 해야합니다! 교수님 친절하시고 강의력 좋으세요!
스페인어권 문화의 이해,김선이,21,Spring,5.0,"강의력 좋습니다. 내용과 시험 쉽습니다. 고등학교 역사 내신 시험 생각하시면 됩니다. 라틴아메리카 국가와 스페인의 역사와 문화를 공부합니다. 중요 인물 이름, 사건 흐름, 구성요소, 국기 등을 잘 암기하시면 됩니다. 과제는 팀플로 각 주제에 대한 PPT발표입니다."
스페인어권 문화의 이해,김선이,21,Spring,5.0,학점느님이세요!!!이름이 어려워서 그렇지 내용은 나름 흥미롭습니다 중간 없이 기말보고 중간대체 템플발표과제있었습니다 에이쁠 받았습니다!!
스페인어권 문화의 이해,김선이,21,Spring,3.0,"내용은 좋으나 성적을 잘주지 않습니다 상식수준이라고 하셨는데  이번학기 사람들이 잘 공부했는지 한두개 틀려도 성적이 엄청 낮네요… 충격받ㅇ..았어…"
스페인어권 문화의 이해,김선이,20,Fall,4.0,"수신 잘못해서 신청했기도 했고 노네임이기도 해서 좀 걱정했는데, 넘넘 괜찮았던 강의에용!! 스페인어권 국가들(스페인, 아르헨티나, 멕시코 등등) 하나하나에 대해 배우는데 주로 문화 위주로 배우고 역사나 정치 부분도 같이 배워요! 솔직히 거의 관심도 없고, 잘 알지도 못한 라틴 아메리카에 대해 알아가고 이해하게 된단 것 자체가 유익하다 생각해요! 세계의 큰 부분을 차지하니까요ㅎㅎ  교수님도 친절하시고 강의력도 좋았어요. (다 줌 실강입니다) 글고 각 나라 배우고 나서 관련 영화를 조금씩 보여주시는 것도 좋았구요. 로드도 거의 없고 중간고사 대신 팀플 발표 있고, 기말고사 한 번 있었어요! 기말이 좀 디테일하고 지엽적이긴 한데 전 괜찮았어요! 에이쁠 받았습니당. 너무 걱정말고 들어보셔도 좋을 것 같아요!"
스페인어권 문화의 이해,전미연,22,Spring,5.0,"명강은 아니지만 꿀강임은 확실합니다.  출석, 조별 활동 한 번, 시험 두 번만 잘 보면 되고, 수업 열심히 듣는다면 한 시험 당 15시간 정도 공부하시면 충분히 다 맞추실 수 있습니다. 성적도 너그럽게 주십니다. 교수님도 굉장히 친절하고 따뜻하신 것도 또 하나의 장점입니다.  강의는 ppt읽어주십니다."
스페인어권 문화의 이해,전미연,22,Spring,5.0,"수업내용은 스페인의 역사, 문화, 라틴아메리카의 역사, 문화를 다룹니다.  배울때는 양이 많아보일 수 있지만, 시험 직전에 교수님께서 ppt의 대부분을 시험범위에서 빼주셔서 실제로 공부할 양은 정말 적습니다! 대학 와서 이렇게 따수운 수업은 처음이었습니다. 교수님께서 학생들에 대한 애정과 배려가 넘치셨습니다. 단순히 지식만을 얻어간다기보다는, 타자를 이해하는 시각을 배울 수 있었던 수업이었습니다. 기회가 된다면 꼭 들으시길 추천드립니다."
스페인어권 문화의 이해,전미연,22,Spring,5.0,일단 수업 하나도 안듣고 시험 전에 찝어주는 강의만 듣고 1회독도 다 못돌리고 시험봤는데 찢어주는 거에서만 나오다시피해서 부담 엄청 적음. 로드나 조별활동도 그냥 피피티 만들고 발표하는거 1번이라 부담 적음. 학점은 시험도 다 찝어준거에서 나오고 그래서 대부분 잘본것같고 조별활동도 다 비슷하게 준것같음. 하지만 본인 거의 공부 안하고 시험 전에 찝어준거도 1회독 다 못하고 시험봤는데 비쁠.
스페인어권 문화의 이해,전미연,22,Spring,5.0,"교수님 너무 천사십니다✨️ 이 수업 듣고 스페인이 더 좋아졌어요....💜 항상 학생들을 배려해주시고 사랑한다고 말씀해주셔서 정말정말 좋았던 수업입니다:)"
스페인어권 문화의 이해,전미연,22,Spring,5.0,"과제는 조별발표밖에 없고 시험은 2번 봅니다. 시험문제는 단답형, 서술형이 섞여나오는데 시험 전에 교수님이 중요한 부분을 알려주셔서 부담이 적습니다. 수업도 스페인어권의 문화와 역사를 전반적으로 다루기 때문에 흥미로웠습니다. 다른 분들께도 꼭 추천드리고 싶습니다."
스페인어권 문화의 이해,전미연,22,Spring,5.0,"교수님 진짜 착하시고 학생들 많이 배려해주세요!! 22년도 1학기에는 로드가 스페인 관련 주제로 조별발표 10~15분짜리 하나만 있어서 부담이 거의 없었어요. 시험은 단답형, 약술형으로 된 중간, 기말 두번인데 중간에는 단답형이 많았고, 기말에는 주로 약술형 문제가 나왔어요. 문제도 교수님이 짚어주신 범위 내에서 거의 다 나와서 시험 공부도 편하게 할 수 있었던거 같네요."
스페인어권 문화의 이해,전미연,20,Spring,5.0,"교수님 진짜 천사세요!!! 로드도 진짜 적고 시험도 반타작한 것 같은데__ 저에게 A0를 주시고~~ 대면 수업이면 더 좋았을 것 같네요."
스페인어권 문화의 이해,전미연,20,Spring,5.0,"음 학점을 안 보더라도 충분히 교수님의 열정이 느껴진 강의였고, 설명도 다양하게 잘 해주심 과제는 조별발표 10분짜라 하나랑 중간 대체과제였는데, 발표도 본인 원하는 주제로 할 수 있었고, 대체과제도 발표랑 연계되는 과제여서 좋았음 기말도 범위 내에서 정리를 해 주셔서 생각보다 쉽게 공부함. 그리고 에쁠뜰줄 몰랐는데 떠버림 ㄷㄷ  학점이랑 상관없이 충분히 들을 가치가 있는 교양입니다. 무엇보다 교수님이 착하시고 열정도 넘치셔서 좋았습니다"
스페인어권 문화의 이해,전미연,20,Spring,5.0,수업 듣는 내내 힘들어서..잔 적도 많았는데. 시험도 몇문제 모르겠던데 이렇게 에이플을 던져주시니 성은이 망극하옵니다
스페인어권 문화의 이해,전미연,20,Spring,5.0,"갓 미연 시험 몇개 틀린거같아서 좀 불안했는데 에이쁠 던져주심 그냥 갓 그자체....ㅠㅠㅠㅜㅜㅠ꼭 들으셔요"
스페인어권 문화의 이해,전미연,20,Spring,5.0,교수님 천사 나중에 시험 정리해주신데서 다 나옴 다만 개인적으로는 스페인어권의 현재 상황에 대한 강의를 기대하고 심청했는데 주로 역사와 문화에 초점이 맞추어져 있었다는 점이 조금  아쉬웠다. 그래도 강의 자체는 정말 좋았어용
스페인어권 문화의 이해,전미연,20,Spring,5.0,"이번엔 싸강이라서 그런지 중간은 안보고 발표 한 번, 보고서(발표했던 내용 확장해서 쓰면 됨) 한 번, 그다음 기말 하나. 진짜 천사 그 자체. 시험도 교수님이 짚어주신거에서 거의 다 나옴"
스페인어권 문화의 이해,전미연,19,Fall,5.0,스페인 관련 수업을 듣고 싶은데 이 교수님이 보이면 그냥 넣으셔야해요 ㅠㅠ 항상 학생들 입장에서 생각하시려고 하셔서 시험 일정이랑 범위도 조절해주시고 시험 문제 어떻게 나올지가 아니라 '뭐가' 나오는지 가르쳐주시고 학생들 팀플 부담된다고 하니까 바로 없애버리시고... 여튼 무조건 들으셔야합니다 ㅠㅠ
스페인어권 문화의 이해,전미연,19,Fall,5.0,"전미연 교수님ㅠㅠ 너무 좋습니다. 일단 교수님 성품이 너무 좋으시고 항상 학생들을 배려해주십니다. ㅠㅠ 감동.. 시험은 단답식, 서술식 으로  된 중간 기말이 있었어요. 그리고 관김있는 주제로 발표ㅠ한번 있습니다! 학점도 잘 잘 주시고! 전반적으로 좋았어요 :)"
스페인어권 문화의 이해,전미연,19,Fall,5.0,교수님이 넘 친절하셔용 학점도 잘 주십니다!! 시험도 솔직히 문제 거의 다 알려주시고 딱 적당한 난이도라 공부한 만큼 학점 받아가는거 같아요
스페인어권 문화의 이해,전미연,19,Fall,5.0,"전미연 교수님 왜 다들 평을 안쓰죠...? 설마 너무 좋아서 본인만 알고싶어서...? 교수님 쏘스윗하시고 수업도 자율적이게, 부담안가게, 행복하게 들을 수 있게 해주시고, 마지막날에 수고했다고 피자사주시고, 시험도 어렵지 않게 학생 입장 배려해서 내주시는데 왜 아무런 평도 없죠? 학점 못받아도 이 교수님 만나뵙게 되었단 사실이 너무 행복했는데 학점도 정말정말 관대하게 주시네요  ㅠ 시험 진짜 말아먹었는데 말아먹은 것 대비 아주 잘받음 ㅠㅠㅠ"
스페인어권 문화의 이해,조영실,20,Spring,3.0,"다른 강좌의 강의평을 보면 불만이 많으나 본인은 괜찮았음 개인차가 존재하겠지만 친절하려 노력하시는것같음 다만,  과제 부담스럽고 강의력도 그닥임 최악은 공지, 수업, 성적발표 항상늦음 성적은그래도잘주셨음 에마예상.에플받음"
스페인어권 문화의 이해,박은영,19,Fall,4.0,"팀별 발표 과제 하나있고 시험 2번있습니다 강의력이 정말.. 이해하기 힘듭니다.. 교수님은 좋은 분이신것 같은데.. 녹음본을 다시 듣는데도 이해하기 어려웠습니다  아 ppt가 수업안들으면 이해하기 정말 어렵게 만들어져있습다"
스페인어권 문화의 이해,박은영,18,Fall,2.0,"교수님은 착하신듯하지만 수업을 알아듣기 힘들다. 뻥안치고 힘들다. 전달력이 안좋으시다. 시험 2번이고 그냥 달달외워서가면되는데 약간 내가 나를 열심히 가르치는 느낌임 ..ㅠㅜㅠㅠㅠ"
스페인어권 문화의 이해,Sneed Paul Michael,17,Fall,4.0,교수님 너무 좋아요! 진심으로 남미국가들의 문화를 알려주시려고 매우 노력하십니다!! 덕분에 항상 과제는 있고 생각보다 성적도 잘 안나옵니다.
스페인어권 문화의 이해,장재준,23,Winter,5.0,"교수님께서 스페인이랑 라틴아메리카에 대한 인사이트가 정말 많으심. 본인이 관심있게 듣고 궁금한 거 질문했으면 얻어갈 수 있는 건 많을 것이라고 생각.   꿀교양은 아님. PPT에는 거의 사진 밖에 없고, 말씀하시는 내용 기억하는 게 중요. 배워가고 싶고 노력한 만큼 성적 받고 싶으면 듣는 걸 추천. 투입 대비 결과 중요시 하는 사람한테는 비추천.   강의평 보고 매우 지엽적일 것이라고 생각했으나 시험은 그렇게 어렵지 않았음. 계절학기라 그럴 수도 있지만 매우 쉬웠던 것 같음. 오히려 강의평 보고 쫄아서 다 외웠는데 굵직한 것만 물어본 느낌. 다만 마지막 약술 서술형 문제는 읽기자료 안 읽으면 못 풀었을 듯.   유일한 불만은 시험 일정을 정말 마지막에 잡고, 수업 전날 저녁 23시까지 보강 잡은 것. 다음 날 아침에 다른 과목 시험이랑 랩 수업 있는 학생들도 있는데 이건 좀..."
스페인어권 문화의 이해,장재준,23,Winter,5.0,"엥?????이걸 에쁠을 주신다고????? 만수무강하십쇼 사랑합니다 교수님"
스페인어권 문화의 이해,장재준,23,Fall,2.0,"평이 다들 좋네.. 난 너무 별로였음 사족이 너무 많으심."
스페인어권 문화의 이해,장재준,23,Fall,5.0,관악 명강의로 꼽을만큼 개인적으로는 재밌었다 질문식을 궁금해하는 학생이라면 들을 때 누구보다 재밌게 들을 수 있음
스페인어권 문화의 이해,장재준,23,Summer,5.0,여러분들의 무관심 속에서 라틴아메리카는 오늘도 ~
스페인어권 문화의 이해,장재준,22,Winter,4.0,"성적은 너그러운 편인 것 같은데 다른 선택지가 워낙 많은 과목이니 반드시 고민해보시고 다른 분들도 살펴보시고 들으시길 바라겠습니다. 일단 하고 싶은 이야기가 워낙 많으셔서 일찍 끝날 경우는 거의 없다고 보시면 됩니다. 오히려 늦게 끝나는 걸 당연하다고 생각하시고 그냥 마음 포기하고 있는게 편할거라고 봅니다. 즉 계절 들을 때 연강으로 하면 상당히 골치 아파질 가능성이 크니 주의하십쇼. 로드도 가벼운 편이라면 가벼운 편입니다. 중간,기말만 보고 이번 겨울에는 중간 대체 과제로 대체를 했는데(이것도 진도를 더 나가고 싶으셔서 그랬던 거였음, 계절에 들으면 다시 이럴 가능성이 있고, 심지어 휴강도 없는데 보강을 한 상태였으니 반드시 주의 바람) 이 대체 과제는 하루정도 투자하면 끝낼 수 있는 정도였음. 시험은 결국 기말 한번이었고 스페인 파트도 빼고 봤는데 난이도가 쉽게 느껴지진 않으니 주의하길 바람, 그리고 양이 일단 엄청남 본인은 걍 녹음본 한번 들으면서 피피티랑 같이 내용정리를 하고 시험보러갔는데, 양이 A4 40장 이상 나왔음. 에이 이게 나온다고? 싶은게 나오니 반드시 유의하시고 로드는 없는데 사실상 암기 변별력 싸움이니 그런 것에 자신 있으신 분들이 들으시면 될듯. 아는게 너무 많으셔서 중구난방으로 이야기가 확장되고, 강한 억양을 가지고 학생들이 대답할 때까지 같은 질문을 여러번 하시기 때문에 이런 것에 대한 호불호도 갈릴 수 있기도 함. 개인적으로는 불호여서 좀 듣고 있기 힘들었음.. 그래도 나름 배워가는 건 있는 과목이라고 생각하고 최악까진 아니라고 보는게 드랍자가 좀 있어서 그런진 모르겟는데 성적 엄청 잘 주셨네요."
스페인어권 문화의 이해,장재준,22,Winter,5.0,"성적 공개되자마자 헐레벌떡 강의평 쓰러왔습니다 ㅎㅎ 교수님 에이쁠.. 정말.. 감사합니다 …ㅜㅜ 솔직히 적지 않은 양의 시험범위를 공부하고, 과제 제출까지 하느라 정말 힘들었는데 한 달 내내 고생한 게 싹 씻겨져 내려간 것 같네요 ㅎㅎ   로드는 거의 없습니다! 영화 한 편만 보면 되었어요. 수업방식은 정말 3시간 내내 .. 말씀을 정말 많이 하십니다. 피피티 분량이 정말 많고, 교수님께서 전달하고자 하는 내용이 정말 많으셔서 속기 치는 게 가장 좋은 방법인 것 같아요. 안타깝게도.. 저는 속기를 잘 못 치는 편이라 녹음한 거 다시 들으면서 필기 놓친 거나 수업 흐름 다시 이해하면서 복습했습니다. 주제를 가지고 관련 지을 수 있는 내용에 대해 이리 갔다가 저리 갔다가 수업하시는 편입니다. 사람마다 느끼는 바가 다를 수 있지만, 경우에 따라 약간 두서가 없다고 느끼실 수도 있을 것 같아요. 이런 수업 방식 때문인지, 시험 범위가 정말 많습니다. 외울 게 정말 많아요. (관악 최고 암기 대회..라고 칭할 수 있습니다..) 그리고 수업 시간에 말씀하신 세세한 부분까지 시험에 다 나옵니다 ㅜ 그래도 이번 시험에서는 스페인 파트를 제외하고 라틴 아메리카 부분만 출제하셨습니다. 또한 모든 성적에서 마이너스(-)를 제외하고 평가해주신다고 하셨습니다.   시험 형식은 크게 세 가지로 나눌 수 있는데, 객관식 단답형 서술형입니다. 객관식은 4문제..? 정도 밖에 되지 않고 단답형은 꽤 많았습니다. 저는 개인적으로 객관식과 단답형이 더 어려웠는데(너무 지엽적이어서 답 못 쓴 것도 꽤 됐습니다) 배점이 2,3점으로 작아서 다행이었습니다. 서술형은 관련 키워드나 주제 주고, 아는 대로.. 다 쓰는 형식이었습니다. 시험 시간이 한시간 반이었는데 저는 어떻게든 관련된 내용 많이 쓰려고 하다보니 약간 시험 시간이 부족했던 것 같습니다. 과제는 중간대체 과제인데 하루 날 잡고 밤 새면 되는 정도의 양입니다. 사실 과제에서 점수 변별력을 내시는 것 같지는 않습니다."
스페인어권 문화의 이해,장재준,19,Spring,5.0,"2022 여름학기 수강  - 추천: 기존에 스페인이나 라틴아메리카에 관심 있으신 분이면 완전 몰입해서 들을 수 있는 강의입니다. 문화 전반적인 부분을 간략하게 다루는데, 정치/역사.지리/예술(미술.음악.건축.축제) 등 다양한 방면에 대한 교양을 얻어가는 느낌입니다. (다방면을 포괄덕 적으로 다루다보니 교수님께서는 '당연한 상식이다'라고 말씀하시는데, 학생들은 '처음 들어본다...' 하는 부분이 가끔 있긴 합니다.) 워낙 좋아하는 내용이라 엄청 열심히 공부해서 성적이 너그러운가에 대한 평가는 못하겠지만, 공부 열심히 했으면 충분히 변별 잘 될 난이도(2022 여름 기준 기말고사 한방)로 시험 내주십니다! 거기다 로드도 적은 편입니다. 영화 두세편 정도를 봐야 하긴 하는데, 시험 한방에 보고서나 팀플 발표 같은 과제가 아예 없는 것까지 감안하면 매우 부담 안 되는 양이라고 생각합니다. 제일 큰 매력은 교수님 유머감각이 저세상이에요... 보통 여름철에 3시간짜리 통강은 죽어나가는데 교수님 드립 때문에 시간이 엄청 금방 지나갑니다. 웃음 참느라고 힘들었어요;  - 비추천: 다만 계절 수강인원도 많지 않고, 저 포함해서 기존에 스페인어나 해당 분야 지식이 있거나 관련 지역 거주 경험 있는 분들이 없진 않아서, 쌩노베로 '무조건 A+/A0를 받아야겠다!' 하는 분들은 힘들 수 있을 것 같습니다. 그리고 스페인이나 라틴아메리카에 관심이 없는데 들으시려는 분은 꼭 말리고 싶습니다. 위에서 말했듯 다방면을 다루려 하시기에, 칼같이 카테고리를 분별하시지 않고 위에서 무작위로 물을 부어내리듯 수업을 진행하셔서 플로우가 유연합니다. 역사 이야기를 하다가 갑자기 축구 이야기를 하고, 또 미술 얘기로 순식간 넘어가서 다시 역사로 돌아오는 그런 느낌이요. 그런 부분들에 관심이 있는 사람이라면 '아 이게 여기서 이렇게 연결되는구나, 흥미롭다'하고 들을 수 있지만, 아니라면 '결국 다 외워야되는 건데 연결성이 그렇게 짙은건 아니지 않나' 의심하며 듣게 될 듯합니다.  - 결국 수업을 관통하는 주제는 스페인의 '다양성', 라틴아메리카의 '다양성'인 것 같습니다. 교수님께서도 해당 부분에 역점을 둬서 수업하시니 서술형 부분은 거기를 중심으로 대비하시면 부담이 덜하실 듯 - 객관식과 단답형은 세세한 부분까지 외우셔야 합니다."
