고급영어: 문화와 사회,Ashley Dawe,21,Fall,3.0,6명이서만 수업해서 강의평을 남기기 조심스럽지만... 매 수업마다 1-2번씩 조별로 이야기를 나누고 교수님이 수업에서 학생들이 활발히 의견내는 것을 선호하시기에 말하는 거 좋아하는 사람들만 들으세요..ㅎㅎ 만화책 읽고 분석하는데 수업 내용은 재미있었어요. 성적은 정말 정직하게 절평 그대로 준 것 같습니다.
고급영어: 문화와 사회,Abigail Joo Young Shin,22,Fall,5.0,"띵강...

자잘한 과제가 많고 (매주 인스타그램으로 포스트 업로드 및 댓글 달기), 화요일 수업 시간에는 비대면인 대신 UofMichigan 학생들이랑 교류하는 시간을 가지는 지라 스피킹/소통에 대한 부담이 있지만, 

그것들만 버텨낼 수 있다면 관악의 띵강 중 하나임이 분명합니다. 중간 에세이 조져서 평균도 못 받았고 기말 페어 에세이도 썩 잘 받지 못했는데... 발표 점수 잘 받았다고 결국 에제를 주시는 갓 아비게일 교수님... 

내용도 알차고, 개인적으로는 미국 대학 학생들이랑 교류하는 게 아주 재밌었습니다. 서울대에서 언제 또 이런 경험을 해보겠으요. 에세이 2회인데 분량 적고 초고 피드백 디테일해서 부담 크지 않고, 발표 2회인데 이것도 인당 5분 분량이라 어렵지 않아요~ 고영을 치워야 하는데 알찬 수업 좋은 학점 함께하고 싶다면 아비게일 문화와사회 강추합니다,,"
고급영어: 문화와 사회,Abigail Joo Young Shin,22,Fall,5.0,"미국에 관한 흥미로운 기사와 유튜브 영상을 통해 수업하며 미국 문화에 있어서 정말 새롭고 많은 점을 배울 수 있었습니다 특히 미국학생들과 매주 있는 링크 세션이 유익했고 에세이 초고 꼼꼼이 피드백해주시는 점이 매우 좋았습니다!
평가기준에 세부적인 기준을 다 알려주셔서 그것들만 잘 챙기면 학점 잘 받을 수 있는 것 같아요"
고급영어: 문화와 사회,Abigail Joo Young Shin,22,Fall,5.0,She was the best professor who I ever met.
고급영어: 문화와 사회,김예리,21,Spring,4.0,들었던 대로 교수님의 발음 비롯한 여러 가지가 초반에는 많이 거슬렸는데 뒤로 갈수록 편안한 수업이 됨. 매주 영상이나 기사 읽고 response 올리는 것만 열심히 하면 나머지 할 건 별로 없었던 듯? 고영 치고 이정도면 매우 꿀강이 아닌가 생각이 듭니다
고급영어: 문화와 사회,김예리,21,Spring,5.0,"개인적으로 과제부담 적고 진짜 꿀강이었다고 생각합니다.
매주 영상을 보거나 글을 읽고 느낀점 쓰기가 있기는 합니다만 1-2시간 집중하면 금방 끝낼 수 있습니다. 수업은 조별 토론 + 강의 식으로 진행되는데, 매주 response 쓰는 거 성실히만 해가면 문제 없이 이야기할 수 있는 수준이라 부담은 적습니다. 학생분들 영어실력은 전체적으로 다 좋으신 건 사실이나 회화실력을 평가하는 수업이 아니기 때문에 크게 걱정하실 필요는 없을 것 같아요. 가장 중요한건 중간/기말 글쓰기 과제인 것 같습니다. 시험은 없고 이번 학기에는 중간 과제가 기말때 쓸 에세이 outline 작성하기 였습니다. 중간은 진짜 하루 날잡고 어느정도 성의만 보이게 쓰시면 좋은 점수 받으실거에요. 기말의 경우 교수님께서 최종 과제 제출 전에 피드백 주시니 그걸 잘 참고하면 좋을 것 같네요. (그렇지만 초안을 제출하지 않았다고 불이익이 있는 건 절대 아닙니다) 전체적으로 Final paper만 좀 열심히 쓰면 A+받을 수 있을 겁니다. 

+참고로 교수님께 뭔가 상의할 일이 생기면 꼭 수업 끝나고 바로 말씀드리는 걸 추천합니다. (이메일/메세지 확인 잘 안해주셨어요)"
고급영어: 문화와 사회,김예리,21,Spring,4.0,"대체로 모든 강의평이 다 잘 얘기해주고 있듯이, 수업의 경우 발음이 처음에 좀 듣기 어려울 수 있는데, 적응이 서서히 되긴 합니다. 거의 매 수업마다 조별 discussion과 discussion 내용을 전체 학생들과 공유하는 시간이 포함되어 있는데, 영어 speaking 실력이 너무 좋으신 분이 많아서 토종 한국인인 저는 조 토론을 정말 걱정했지만, 오히려 말하기 연습하는 좋은 기회로 삼으려고 의견 개진을 열심히 했어요

과제는 중간 레포트+기말 에세이, 발표 1회, Response (글 읽고 생각 4~5줄 이상) 6개 작성이 다였습니다. 중간 에세이는 적당히 쓰고 적당히 받았으나 기말 에세이를 주제도 바꾸며 열심히 써서 A+ 받을 수 있었습니다. 기말 에세이 반영 비율이 40%나 되어서 이게 컸던 것 같습니다. 교수님께서 참신한 주제 또는 탄탄한 근거(논리성, 신뢰성)를 좋아하시는데, 특히 논리적 근거를 잘 챙기는 게 중요할 겁니다."
고급영어: 문화와 사회,김예리,21,Spring,3.0,"과제- 중간 기말 레포트, 발표, 영상이나 기사 보고 매주 느낀점 적기 (고영 중에선 로드 적은 편인듯)

수업-발음이…좋으시지는 않지만 시간이 지나다보면 크게 불편하지 않습니다. 교수님 성격은 정말 좋으신 것 같고요, 수업마다 줌 소회의실에서 15분 정도 의견 나누며 토론했습니다.

학점-비율 채워 주시는 것 같아요. 수업, 과제 모두 적당히만 했는데 A는 안 주시더라고요.

고급영어 수업 특징상 정말 영어가 유창하신 분들이 많습니다! 학점을 떠나 그분들이랑 같이 이야기 나누며 영어 말하기를 연습할 수 있어서 좋았던 것 같습니다. 출석이 빡세고 레포트 두 방으로 학점이 완전히 결정되는 수업이라는 점을 고려하면 좋을 것 같습니다."
고급영어: 문화와 사회,김예리,20,Spring,3.0,"고급영어 중에 과제가 적은편이라는 말은 이거 하나 밖에 안들어봐서 모르겠지만, 그렇다고 하여 결코 만만하게 보고 수강신청할 정도로 적은 로드는 아님. 

또한 비대면 수업의 경우 거의 매 수업마다 조별로 조원들과 토론을 해야하기에 이럴줄 모르고 수강신청한 입장에서는 힘겨웠음. 하지만 다루는 내용이 굉장히 흥미롭고 영화도 재미있으며 다른 영어 잘하는 학생들 발음도 듣고 교수님도 착하셔서 그냥저냥한 수업. 

하지만 다시 듣고싶지 않다."
고급영어: 문화와 사회,김예리,20,Spring,3.0,"1. 고영답게 영어 실력이 출중한 분들이 정말 많음. 

2. 다만 화려한 영어 실력과 중간/기말 점수가 비례하는 건 아님. 교수님이 수업시간에 언급하시듯이, 영어 실력보다는 학생의 논리력과 아이디어 위주로 평가하심. 

3. 교수님의 영어 발음이 좋은 건 아니지만, 수업에 큰 지장은 없음. 사실 수업 시간에 가르치시는 내용과 중간/기말 에세이는 전혀 무관...ㅎ 차피 학생 필력으로 쇼부치는 거

4. 비율은 공개하지는 않으셨으나, 나름 깐깐하게 주신 듯. 중간,기말 리포트 신중하게 써서 에이쁠 받음.

결론: 고영 치고는 나쁘지 않은 강의. 특히 나 같은 고영 턱걸이들에게 추천!"
고급영어: 문화와 사회,김예리,20,Spring,5.0,"나도 바로 밑 강의평에 동의! 고영 치고는 로드도 별로 없고, 기말 에세이 한방으로 결정되는 수업이었음. 근데 이번 학기 한정으로 줌강의인데도 다들 완전 열심히 했고 중간은 성적도 다들 비슷했다고 하셔서, B 받았으면 좀 억울했을거 같긴함ㅠ 나는 기말에세이 쓰는데 다행히 주제도 주장도 처음부터 좋다고 해주셔서, 일주일 정도 영혼과 시간을 갈아넣어서 써서 A+받음"
고급영어: 문화와 사회,김예리,20,Spring,5.0,"교수님 영어 발음이 그렇게 좋으신 편은 아니지만 그렇다고 전달력에 심한 문제가 있을 정도인지는 모르겠음
오히려 구사하시는 어휘나 문장 수준은 높은 편이고, 가끔 insightful한 말도 많이 해주셔서 재밌었음
그리고 다른 고영에 비해 로드도 무난한 편이고, 절반 A 절반 B 준다지만  그건 다른 고영도 비슷함
뭐 밑에서 학생들 편애한다고 하는데 그런 건 잘 모르겠고,  성적도 점수 기준에 맞게 합리적으로 잘 주신 것 같음
평소에 response 안 빼먹고 쓰고 중간 기말 에세이 조금 공들여서 썼더니 A+ 나왔음
고영 무난하게 치우고 싶으면 추천함"
고급영어: 문화와 사회,김예리,20,Spring,2.0,교수님 참 착하신데 ㄹㅇ로 발음이 너무해... 싸강이라서 더 집중하기 어려웠음 ㅠㅠ
고급영어: 문화와 사회,김예리,20,Spring,4.0,"줌실강, 자잘한과제랑 자율적 발표참여보다는 기말에세이 영향이 큼, 대신 기말에세이 제출전에 first draft(평가 반영안됨)제출하면 피드백해주시고 고쳐서 최종본 낼수있게 해주심! 무난한 고영이었음"
고급영어: 문화와 사회,김예리,20,Spring,1.0,학생들 편애가 있는 편이고 인문대 고학번들이 거의 성적 독식해서  성적 잘나오기 힘들음.  수업 에서 요구하는 것 다 하고 중간 기말 열심히 봐도 기말 에세이가 점수 결정에 영향이 커서 내용이 본인 마음에 들지 않으면 점수 꽤 까임.
고급영어: 문화와 사회,김예리,19,Spring,3.0,평소엔 별 부담이 없다가 기말에세이 한방이라는 느낌이 들었다.
고급영어: 문화와 사회,김예리,19,Spring,4.0,매주 5-6줄 문학작품 감상& 중간 ㄱ말 리포트와 발표로 학점 결정. 딱 2학점으로 적당한 무난무난한 고영 쉅. 학점은 잘라주심 본인은 에제.
