고급영어: 문화와 사회,Ashley Dawe,21,Fall,3.0,6명이서만 수업해서 강의평을 남기기 조심스럽지만... 매 수업마다 1-2번씩 조별로 이야기를 나누고 교수님이 수업에서 학생들이 활발히 의견내는 것을 선호하시기에 말하는 거 좋아하는 사람들만 들으세요..ㅎㅎ 만화책 읽고 분석하는데 수업 내용은 재미있었어요. 성적은 정말 정직하게 절평 그대로 준 것 같습니다.
고급영어: 문화와 사회,서주희,20,Fall,5.0,"교수님이 고르신 테마에 맞는 문학 작품들을 읽고 이약하는 수럽이었습니다. 문화와 사회보다는 문학과 사회가 더 맞지 않나 싶을정도로 매주 모든 내용을 문학을 통해 소화하는게 그게 좀 힘들었어요. 그래도 시험도 엄청 어렵지 않고 과제도 많이 않아서 좋습니다. 특히
교수님이 너무 좋으세요. 이번 학기 들은 수업 중 가장 많은 걸 배워가는 수업입니다. 영어 잘하시면 추천해요."
고급영어: 문화와 사회,서주희,20,Fall,4.0,"이번 학기는 Black Lives Matter이라는 테마를 가지고 수업을 했습니다. 수업 내용 자체가 흥미로웠고 수업 내 reading 자료들도 재밌어서 이번 학기에 좋아했던 수업 중 하나였습니다!
중간고사 기말고사 둘 다 비대면으로 보았는데 단답형+서술/논술형이었고 시험은 평소 수업 시간에 필기를 잘 해두었다면 괜찮은 난이도였습니다. 과제는 3번 etl에 게시물 쓰는 게 있었고 학기에 한번 발표가 있습니다. 두 번 정도 퀴즈도 봤는데 퀴즈는 주어진 읽기자료를 읽기만 하면 무조건 다 풀 수 있을 정도로 간단한 내용이었어요.
그리고 진짜 중요한 게 교수님이 너무 좋으세요😊😊😊 친절하시고 수업 준비나 진행도 정말 잘 하십니다. 학생 한 명 한 명 한테 모두 마음 써주시는 게 느껴질 정도여서 너무 좋았어요."
고급영어: 문화와 사회,서주희,20,Fall,5.0,"전면 비대면 강의로 진행되었습니다. 평가는 출결 + 영화평 1회 + 퀴즈 2회 + ETL 게시물 3회 + 발표 1회 + 중간/기말고사로 이루어졌습니다. 이렇게 쓰고 보니 뭐가 많았네요. 영화평은 목록 중 영화 한 편을 골라 수업 내용과 연계해서 글자 크기 12/double space로 A4 3매 내외 작성하는 형식이었습니다. 퀴즈는 학기 중 2번 그 주 리딩한 내용에 대해 확인하는 형식이었는데 미리 언제 무슨 작품에 대해 퀴즈를 볼 것이라고 알려주시고, 정말정말 간단한 내용 확인이기 때문에 그 때 읽어만 가시면 됩니다. ETL 게시물은 한 학기동안 주어진 리딩 중 최소 3개에 대해 두어 문단 정도 자유롭게 작성하면 됩니다(+ 다른 사람의 게시물에 대해 최소 2개의 댓글도 달아야 합니다). 발표는 수업의 큰 주제(미국의 인종차별, 흑인들의 문화 등)와 관련된 주제 중 자유롭게 선택해 수업 중 10분 내외로 실시하게 됩니다. 발표와 관련해 교수님과 미리 면담을 진행하고 (비대면) 그때 이런저런 조언도 해주십니다. 중간/기말고사에는 수업시간에 배운 것 중 역사적 사실에 관해 묻는 질문과 작품을 분석하라는 질문 등이 나옵니다.
이번 학기 주제는 'Black Lives Matter'로 미국 흑인들의 역사와 문화 전반을 다루었습니다. 시의적절한 내용이기도 했고, 제가 잘 몰랐던 부분이기도 해서 흥미롭게 들었습니다. 수업 중에는 소설이나 시 같은 문학 작품뿐만 아니라 Frederick Douglass의 연설문, 록산 게이나 벨 훅스의 에세이, 힙합 음악 등 다양한 텍스트를 다룹니다. (매주 읽어야 하는 리딩 양이 그렇게 많지는 않습니다.) 교수님이 착하고 친절하시고 화면에 가끔 고양이도 등장합니다. 다른 고영 수업들은 안 들어봐서 비교하기는 어렵지만 주제가 취향에만 맞으신다면 충분히 재밌고 즐겁게 들으실 수 있는 수업이라고 생각합니다 : )"
고급영어: 문화와 사회,이은경,20,Fall,4.0,"로드가 많습니다. 약 20페이지 분량 리딩이 거의 매 주 요구되고, 학기 중 10분 pt 1회 있었으며 중간/기말 시험과 함께 vocab test도 보아야 합니다. 잔잔한 스트레스를 자주 겪는 느낌이었습니다.

수업은 대학원 스타일입니다. 리딩 분량에 대해 소그룹을 짜서 리더가 문제제기와 논의를 취합해 간단하게 발표하는 식입니다. 저같은 경우는 영어 공부를 오랫동안 쉬면서 말하기가 낯설어진 탓에 이런 수업이 연습에 도움이 되어 좋았지만, 이미 bilingual에 가까우신 분들은 특별히 효용을 느끼진 못할 것 같아요.

성적은 절대평가 스타일로 부여한다고 말씀하셨고, 기말 직전 개인 컨설팅에서 어느 정도 범위의 성적을 예고하셨으며 그대로 잘 주셨습니다.

소규모 토의식 수업인 덕분에 저학번/타과생 분들과 다양하게 의견 나눌 수 있고 스피킹 연습이 가능했던 점, 결석도 있었고 quiz 응답이 불성실했던 적이 많았는데 성적이 너그러우신 점 등 저는 비교적 만족스럽게 들었습니다.  취업 준비 일정과 겹치는 부담을 말씀드렸더니 기말 제출일도 미루어주셨습니다 ㅜㅜ 다만 리딩 기피하시는 분들은 피하시는 게 좋을 것 같아요!"
고급영어: 문화와 사회,이은경,20,Fall,4.0,"다른 평에 나와있듯이 로드가 많아요
매주 리딩 과제가 있고 발표 단어시험이 있어요
수업 방식은 학생들이 참여해서 토론하는 것이 주를 이루는데 저는 이 과정이 좀 힘들고 고통스러웠지만 얻는 것은 많았다고 생각해요
토종 한국인이라 영어 발음도 안 좋고 말하기에 익숙하지 않지만 이렇게라도 시키지 않으면 할 기회가 없으니까요...
학점은 아직 안 나와서 모르겠지만 워낙 잘하시는 분들이 많아서 걱정되긴 하네요
교수님의 강의 방식은 좋은데 과제를 조금 줄여 주셨으면 좋겠어요"
고급영어: 문화와 사회,이은경,20,Fall,1.0,로드는 일단 ㅈㄴ많고 전반적으로 매 수업마다 리딩 있으며 자잘한 과제에 퀴즈에 발표에 시험에 뒤질 거 같고 강사님은 수업을 아예 안하심. 학생들이 준비해서 알아서 토론하고 발표하고 질문하고 강사님은 진짜 뭐 하시는 건지 모르겠음. ㄹㅇ그리고 내 발언을 이해를 하시기는 하는 건지 알아듣기는 하시는 건지 말을 하면 피드백이나 평가는 절대 없고 그냥 okay하고 넘어가시고 이럴 거면 도대체 수업을 왜듣는지.. 수업을 하시는 매우 드문 날에는 그냥 테드 토크 틀어주고 보라하고 정말 이렇게까지 의미 없는 수업 처음 들어봄. 강사님께서 영어실력도 떨어지시고 미국 다년 간 살아온 사람으로서 느낀 거지만 발음도 어색하고 말하시는데 어법도 틀리고.. 물론 그러실 수 있다고 충분히 생각해왔지만 중간고사 문제에 말도 안되는 문법이 틀려있고 문장에 주술 안맞고 문장에 동사가 없는 등 기본적으로 문제 자체를 검토를 안 한 느낌. 그냥 수업 자체에 별로 열정도 없고 존나 날로 먹으려고 하는 느낌 오지게 강한데 학생들한테는 요구하는 건 존나게 많음 절대 듣지 마셈
고급영어: 문화와 사회,조충환,20,Spring,1.0,"하.... 지금 6/29까지 제출해야하는 과제 하는데, 겁나 현타 오네요... 이런 수업하고 돈 받으면 정말 세상이 아름다워보일 것 같습니다. 
관심 1도 없는, 한류 케이팝 케이드라마 이딴 주제로 정말 무의미한 통계수치 나열하고 전문성1도 없는 수업을 들으니 진짜 고통스러웠습니다. 무슨 Adaptation project 이런건 또 왜 하는지... 매 수업시간마다 소그룹 만들어서 팀플 시키는 것도 진짜 하... 할 말은 많지만 안 하겠습니다..."
고급영어: 문화와 사회,조충환,20,Spring,3.0,"평가가 다들 진짜 안 좋네요. 저도 사실 이번 학기에 가장 스트레스 많이 받았던 과목이 이 수업이었습니다.. 진짜 언제 질문이 들어올지 몰라서 수업 1시간 15분 동안 항상 긴장해 있었고, 그래서 아이러니하게도 모든 과목 통틀어서 가장 집중한 수업이긴 했어요.. 모든 과제가 힘들었지만 전 배운 건 충분히 많았던 수업이라고 생각합니다. 다만 진짜 요구하시는게 엄청 많았던 것뿐....."
고급영어: 문화와 사회,조충환,20,Spring,2.0,위의 강의평에 동의합니다. 상당히 많은 과제량에 다른 과목에 투자할 시간까지 뺏겨버렸습니다. 아무리 로드가 빡센 고급영어라지만 좀 그렇네요. 고급영어임에도 학점을 비율로 채워주시겠다고 하시는 교수님......
고급영어: 문화와 사회,조충환,20,Spring,1.0,"진짜 미쳤습니다. 개빡칩니다. 이 수업 절대 듣지 마세요.배우는거 하나도없고, 매 수업마다 시덥잖은 과제내고, 이 수업 때문에 제 이번 학기가 망했습니다."
고급영어: 문화와 사회,정유미,20,Fall,5.0,"아랫분 말씀에 적극 동의합니다. 과제도 정말 없다시피 하고,  여러모로 학생들을 많이 배려해주신다는 인상을 강하게 받았습니다. 특히 학생들 발표나 중간고사에 대해서도 꽤 꼼꼼하게 평가를 해주시는데 웬만하면 칭찬위주로 하시면서도 짚어야할 사항은 꼭 짚어주시더군요. 부담도 적고 선생님도 친절하신데 이전학기엔 뭔가 상황이 좀 달랐던걸까요? 심지어 학점도 규정된 사항 이내에선 최대한 잘 주시려하는것 같던데말이죠. 전 모든 면에서 만족했습니다."
고급영어: 문화와 사회,정유미,20,Fall,5.0,"20년 2학기 수업 수강했고, 이번 학기 주제는 Dystopia였습니다. 매 학기 하나의 주제를 선택하고 그 주제에 대한 여러 내러티브에 대해 배우는 형식의 수업인 듯 합니다. 개인적으로 강의계획서에 디트로이트 비컴 휴먼이 있는 것을 보고 신청했는데, 게임을 내러티브로 넣은 것은 이번이 처음이라고 하시네요. 이런 시도를 하시는 교수님들 자체가 거의 없는 것 같아서 여기서 저는 이미 교수님을 좋아할 수 밖에 없었습니다.

로드는 정말 게으른 제가 보기에도 매우 적었습니다. 과제는 성적에 들어가는 것은 없었고, 굳이 따지면 매 수업 전날에 읽은 내용에 대해 트위터로 트윗을 두 개씩 써서 올리는 것인데, 하다 보면 관성으로 하게 되기도 하고 자연스럽게 수업 내용에 대해 반강제로 생각하는 기회도 됩니다. 시험은 중간의 경우 take-home이었고 기말은 final paper/project를 하나 하는 것이었기 때문에 부담이 매우 적었습니다. 그리고 자신이 선택한 작품에 대해 15분 정도의 발표를 하는 것이 이 수업에서 하는 전부입니다. 나머지는 매 수업이 토론식으로 (하지만 학우들 참여도가 낮은 편이라 완전한 토론이라고 보기는 애매하고, 수업 당 한두번만 자기 생각 말하는 거로도 참여도가 가장 높은 편) 이루어지기 때문에 발표나 의견 표출로 참여도를 측정하십니다.

밑에 강의평들이 너무 부정적이고 이 수업이 너무 마음에 들었던 입장에서 앞으로도 이 교수님 수업을 듣고 싶어 좀 길게 써봤는데, 적어도 비대면 상황에서 정유미 교수님 수업은 가장 꿀이면서 얻어가는 것도 충분한 수업이라 생각합니다. 말을 더듬으신다는 평이 있었는데, 중간에 umm같은 추임새를 하신 적은 있지만 거슬리는 정도는 전혀 아니었고 영어 실력이나 발음도 최소한 준 native정도이시기 때문에 영어를 잘 못하시는 교수님들을 생각하면 저는 오히려 매우 편안했습니다. 무엇보다 착하시고 학생들을 좋아하신다는 점도 느껴지는데, 강의평들이 너무 단편적이고 부정적이어서 나름의 변호 아닌 변호를 해보게 되었네요. 개인적인 사정으로 다음 학기에는 듣지 못하겠지만, 앞으로도 이 교수님 수업을 꼭 듣고 싶다는 생각이 들었습니다! (물론 제가 이 교수님과 잘 맞는 것일수도 있긴 합니다) 교수님 꼭 만수무강 하시길..."
고급영어: 문화와 사회,정유미,19,Fall,3.0,"교수님께서 초보라 아쉬워요. 말을 많이 더듬으시고...
빡센편은 아니지만 배워가는 내용이 거의 없어서 아쉽습니다."
고급영어: 문화와 사회,정유미,19,Fall,1.0,고영 많이 있는데 굳이 이강의를?????  그냥 듣지 마세요
고급영어: 문화와 사회,정유미,19,Fall,2.0,학점 개 짜게 주고 시키는 거 개 많음. 시키는 거 다 했고 절대평가 인데  성적 잘 안줌
고급영어: 문화와 사회,안현아,19,Spring,5.0,교수님께서 친절하시고 학생들을 많이 배려해주세요! 고영 자체가 절대평가라 부담도 많이 없고 좋습니다ㅎㅎ 수업시간에 열심히 참여하고 지각 안하고 적당히 퀴즈 잘보면 무난하게 A대 주시는 것 같아요 👍
고급영어: 문화와 사회,임현량,19,Spring,4.0,"다른 고영 안들어봐서 모르겠지만 개인적으로는 로드가 좀 있다고 생각합니다.  개인프레젠테이션 15분, 중간고사, response paper 2개, final research paper, final research paper 관련 프레젠테이션 5분, 퀴즈 2번이 전체 로드였습니다. 수업 자체는 유익하고 교수님도 좋으십니다!  발표를 최대한 할 수 있도록 도와주시고 학생들을 아껴주시고 신경써주십니다. 수업 시간에 상당히 힐링할 수 있고 내용도 재밌습니다. 그렇지만 절평인걸 고려했을 때 학점을 후하게 주시는 편은 아닌 것 같습니다ㅜㅜ"
고급영어: 문화와 사회,임현량,19,Spring,4.0,"로드는 그렇게 안많고, 퀴즈도 거의 공부 안했는데 그럭저럭 잘 나옴. 대신 수업시간에 하는게 좀 많음. 한번씩 돌아가면서 디스커션 준비해와야되고(주제 리스트 줌) 수업 늦게끝나는일 잦음. 그래도 디스커션할때 아무말해도 최대한 존중해주려고 하시는게 보여서 너무 좋았다!"
고급영어: 문화와 사회,임정인,18,Spring,3.0,"절대평가인데... 생각보다는 점수받기 힘들어요.
아주 흥미롭지는 않고요 그냥 영어 리딩/스피킹  자신있고 에세이 기본은 쓴다 싶으신 분들만 들으세요. 
은근히 수업 내 조별활동이 많은데 조원끼리 학번차도 많이나서 어색한 경우가  왕왕 생겨요. 너무 스트레스 받지 마시고 해야될 것만 하세요. 어차피 성적엔 반영이 안돼요.
시험은 그냥 읽기자료 꼼꼼히 여러번 읽고 중요개념만 잘 탑재되있다면 파트원은 풀만 해요. 대신에 파트 투는 평상시에 교수님의 강의를 잘 듣고 성향을 어느정도 캐치하셔야 유리하고요. 이번강의는 남녀평등, 성고정관념 타파, 특히 여성의 성적 대상화에 대해 많이 말씀하셨던걸로 기억해요!
정리하면 피해아할 수업은 아니지만 그렇다고 적극 추천하진 않아요. 교수님께서 친절하신 분이고 미국 문화  특히 광고나 언론에 대해 알아볼 수 있다는데 의의를 두시길."
고급영어: 문화와 사회,Nick Clements,23,Fall,4.0,"블랙미러 수업 들었습니다. 

교수님이 하지 말라는 것만 안 하면 (수업 시간에 폰으로 딴짓하기, 말씀 하실 때  집중 안 하기..) 좋은 수업입니다. 

과제는 늘 수업 전까지 블랙미러 한 편 보고 오기, 혹은 짧은 글 하나 읽어오기입니다. 가끔 과제에 대한 퀴즈를 보긴 하지만 정말 기초적인 질문들이라 걱정하실 필요는 없습니다. 그 외에 비교및 분석 글쓰기 과제 2개 있습니다. 

시험은 중간 한 번. 수업시간에 교수님이 다룬 테마들과 아이디어들만 잘 복습하면 시험은 무난함."
고급영어: 문화와 사회,Nick Clements,23,Summer,1.0,로드 엄청 많고 중간에 화장실도 못 가게 하시는 꼰대 교수님. 얻어가는 건 솔직히 진짜 영어 말하기 많이 하는 거 말고는 거의 없고 성적도 그냥 잘라서 주시는 듯.
고급영어: 문화와 사회,Nick Clements,22,Spring,1.0,"로드 개많고 얻어가는 건 없음
교수 꼰대임
걍 다른 거 들으셈"
고급영어: 문화와 사회,Nick Clements,22,Fall,5.0,"Black Mirror 강의 들었습니다
일반고 나온 이과생이라 토론(discussion), 특히 영어식 토론 경험이 전혀 없는데 주제도 흥미롭고 분위기도 열정적이라
좋았습니다
영어로 비판적 읽기하는 수업이어서 조금 피곤한 점도 있습니다. 과제가 많다고 느끼기는 했는데 저는 이런 것이 처음이라서 그런지 대부분 재미있게 했습니다. 학점은 잘라서 주신다고 하시기는 하는데 저는 에제 받았습니다.
반에 영어잘하고 말 잘하시는 분들 많아서 얻어가기 좋은 수업이었습니다"
고급영어: 문화와 사회,Nick Clements,22,Spring,5.0,"블랙미러 강의 들었고 좋았음.
단 로드는 상당한편이니 참고"
고급영어: 문화와 사회,Nick Clements,22,Fall,4.0,"Black mirror 강의 들었습니다
매 수업 때마다 블랙미러 한 편씩 보거나 수업 때 할 리딩 읽어가야 하는데 크게 부담이 될 정도는 아니에요
에세이 2회에 조별 발표까지 있어서 로드가 적지는 않지만 영어 실력 향상 + 언제 이런 걸 해보겠어~ 느낌으로 버텼습니다.
Group discussion이 매 수업의 반 이상을 차지하는데 ‘영어로 말하는 게 너무 두렵다’인간이 아니라면 괜찮아요!
성적도 열심히 하는만큼 나오는 듯
수업 만족은 5점이지만 저는 갠적으로 로드가 다른 고영듣는 친구들보다 많았던 게 좀 힘들어서 0.5점만 빼고 싶네요"
고급영어: 문화와 사회,Nick Clements,22,Spring,5.0,블랙미러 강의 들었는데 너무 좋아요~~~~~ 영어 울렁증 없으면 들으세요!!
고급영어: 문화와 사회,Nick Clements,22,Spring,3.0,"의예과 학생이 듣기에는 적절하지 않은 수업입니다. 고급영어 과목의 공통적인 특성인가 싶지만 에세이 2회, 5분 가량의 발표  1회, 기말고사 한번을 봤는데 수업 시간에도 항상 discussion questions를 주고 조원들끼리 영어로 토의를 하게 하셨습니다. 수업에 대한 교수님의 열정은 잘 느껴졌지만 고영을 하나 들어야 하는 의예과라면 다른 걸 듣는 것을 추천드립니다."
고급영어: 문화와 사회,Nick Clements,22,Spring,4.0,"미국 선거제도와 대통령에 대해 배우는 수업이었습니다. 해내야 할 것은 별로 없어서 좋았지만 수업 전에 읽을 것이 좀 많았습니다. 학기 중 한번 팀을 만들어 kickoff라고 미국 대통령을 골라 그에 관해 발표를 해야하는 활동이 있었습니다. 
    수업은 기본적으로 교수님께서 30분 정도 내용을 설명해주시고 남은 시간은 조에서 조원들끼리 학습지를 바탕으로 이야기를 나누었습니다. 말하는 비중이 수업에서 차지하는 비중이 매우 높다고 생각되기에 참고하시길 바랍니다. 
   매 수업마다는 아니지만 수업 전에 간단히 4문제를 풀기도 했습니다. 문제의 난이도 자체는 매우 쉬웠고 내용은 수업 전에 읽으라고 한 부분에서 나왔습니다. 보통 miller center에서  특정 대통령의 campaigns and elections, domestic affairs, foreign affairs 부분을 읽었습니다. 꽤나 많은 내용을 담고 있어서 조금은 부담이 되었습니다. 저같은 경우에는 읽는데 한시간 정도 걸린 것 같습니다. 
   글쓰기 과제가 2개 있었습니다. 하나는 미국 역사에서의 선거를 비교하는 글쓰기와 대통령을 비교하는 글쓰기 였습니다. 기억상으로 전자는 800, 후자는 1200 이었던 것 같습니다. 교수님께서 글쓰기에 필요한 유인물을 자료방에 올려주셔서 많은 도움이 되었습니다.
   총평으로 미국 대통령에 관심이 있으신 분이시라면 추천합니다. 그리고 만약에 듣기로 결정했다면 먼나라 이웃나라 미국 편을 읽어보시길 추천합니다. 빠른 시간 안에 수업 내용에 대한 감을 잡을 수 있고 과제할 때 주제 선정할 때도 도움이 쏠쏠하게 됩니다. ."
고급영어: 문화와 사회,Joel J. Park,21,Fall,3.0,"교수님이 많이 마이웨이입니다.
미국 학생들과 이야기할 수 있는 기회는 매우 좋은데 교수님이 과제함을 늦게 올려주신다든가 갑자기 수업 시간을 변경하다든가 과제를 종강 일주일 전에 갑자기 내주든가 할 수는 있습니다."
고급영어: 문화와 사회,Joel J. Park,21,Spring,4.0,"일단 오직 이 강의에만 있는 특장점!! 미시건 주립대학 학생들이랑 줌 화상으로 언어교류 문화교류를 할 수 있다는 게 정말 귀한 기회라고 생각합니다. 이것 때문에 들었고 들은 보람 있었어요. 비교문화연구 발표가 두 번 있어서 시험을 대체하는데 둘 다 조별입니다. 조별... 과에 따라 다르게 생각하실 수도 있지만 일단 저는 조별의 ㅈ자도 없는 과 학생이라서 여기서 처음 조별에 데여 봤습니다. 마음 맞고 딱 믿는 친구들이랑 스터디하는 거랑 비교가 안 됨... 조는 랜덤으로 두 번 짜는데 처음 발표 조는 너무 좋은 분들이고 다들 열정도 있으셔서 그냥 작업량에 죽을 것 같긴 했는데 조원분들한테 참 많이 배우고 결과도 아주 만족스럽게 나왔습니다. 그런데 두 번째 조때문에 의예과 학생들 일반에 대한 편견이 생겨버렸습니다... 조 안에는 졸업학기이심에도 너무 열심히 해 주신 감사한 선배님도 계셨지만 프리라이더들 때문에 진짜 스트레스 컸음. 물론 교수님께서 조별의 장단점을 모두 고려하시는 분이라 팀점수 개인점수 각각 주신 뒤 합산하셔서 해당 과제 등수는 나쁘지 않게 나왔는데요, 성적 문제가 아니라 모두가 열심히 하지 않는 한 조별은 진행해 나가는 것자체가 엄청난 스트레스라는 걸 배웠습니다. 조별이 무려 두 번인데 비중도 커서 프리라이더로 인한 스트레스까지 더 커지는 점땜에 4점드립니다... 교수님과 강의에 대해 말하자면 배우는 게 많습니다. 근데 미국 문화와 사회에 대해서보다도 앞으로 번듯한 사회인이 되기 위한 방법? pt 전략, 설문조사 방법론, 레포트 및 메일 형식 이런 게 더 많이 남네요 그리고 잡소린데 시험기간 겹칠 때 큰 과제 하나 끝나면 고생했다고 그 다음 날 수업 일찍 끝내 주시는 거 서윗했음"
고급영어: 문화와 사회,Joel J. Park,21,Spring,4.0,"여름학기

결론부터 말하자면 굉장히 알차고 뿌듯한 수업이었어요! 월수금 3시간 꽉꽉 채워서 수업하는 게 아니라 주 1회는 University of Michigan 친구와 줌으로 만나서 얘기하는 시간으로 빼주셨고, 나머지 시간은 교수님의 강의 말고도 미시간 측에서 해주는 특강이나 여러 활동들로 채워질 때가 많았기 때문에 수업 자체는 하나도 빡세지 않습니다. 다만 중간/기말 시험이 없는 대신에 이것저것 크고작은 과제가 참 많았는데요.. 주요한 과제로는 (1) 미시간 친구가 내가 사는 도시로 여행온다고 가정하고 여행 일정표 ppt로 만들기 (2) 미시간 친구에게 한국 음식 한 가지를 직접 만들면서 소개하는 영상(5~10분 분량) 만들어서 보여주기 (3) 미시간 친구에게 외국 음식을 추천받고 그 음식을 직접 먹어본뒤 블로그 형식의 글 작성하기 (4) 팀플로 final presentation 발표 (5) final reflection paper (전반적으로 수업 듣고 느낀 점이나 개인적으로 성장한 점을 a4 2.5쪽 정도로 정리) ...가 있었습니다. 특히 저 5개 중 3개가 거의 마지막 주에 다 몰려있어서 시험이 나았을 수도 있겠다 하는 현타가 잠깐 왔었네요..ㅎㅎ 그치만 미시간 친구랑 매주 얘기하는 건 정말 즐거웠고 외국에 한번도 안 살아본 저로서는 색다른 체험이었어요! 그리고 로드와는 별개로 또 학점은 섭섭하지 않게 주시는 느낌입니다. 발표랑 페이퍼 둘다 개망했다고 생각했는데 a+ 주셨네요 감사합니다 조엘팍 ㅠ 여기 강의평 보니 정규학기 중에는 좀 더 로드가 많은 느낌인거 같은데 눈 딱 감고 계절로 치우기도 좋고 수업 커리큘럼도 상당히 알차기 때문에 결론적으로는 추천드립니다."
고급영어: 문화와 사회,Joel J. Park,21,Fall,5.0,2021년 여름에 수강했어요. 수업을 굉장히 잘하시고 재밌는것도 많이 해요! 그리고 시험도 없어요 ㅎㅎ 완전 꿀입니다~~
