예술과 지식재산,조정욱,22,Fall,5.0,"시험은 그리 어렵지 않았구요
지식재산권법에 대해 자세히 알 수 있어서 좋았어요!
중간에 마술사분 오셔서 특강했는데 재밌었어요^-^"
예술과 지식재산,조정욱,22,Fall,5.0,"법 수업을 들어보고 싶어서 신청했던 수업이었습니다. 고학번 선배들이 많아서 초반에 엄청 긴장했었는데, 교수님께서 수업을 차근차근하게 나가주셔서 수업 따라가는 데에 있어서 어려움은 없었습니다. 시험은 중간, 기말 보는데 난이도가 높지는 않았습니다. 수업 내용만 잘 따라가시면 어려움 없이 문제는 쉽게 풀 수 있을 것이라 예상합니다."
예술과 지식재산,조정욱,22,Fall,5.0,전반적으로 누구에게나 추천할만한 좋은 수업입니다. 저작권법의 주요 지점들을 어문/미술/음악저작물 등등 각 저작물 종류별로 실제 판례와 함께 살펴볼 수 있습니다. 수업내용 외에도 법학개론 느낌으로 인사이트를 주시려고 노력하는 점도 인상 깊었습니다. 다만 교수님이 현업 변호사님이시다보니 세 시간 내내 긴장도 있는 수업이라기보다는 루즈해지는 시간들이 있었던 것은 사실입니다. 그래도 제가 들어본 법 관련 수업 중에는 가장 좋았습니다. 시험에서 실수하지만 않으면 학점도 후하게 주십니다!
예술과 지식재산,조정욱,22,Fall,4.0,"수업 자체는 되게 괜찮았던 것 같습니다.
다루는 내용도 흥미로웠고 교양 수준으로 적합한 것 같습니다.
법을 다루기 때문에 살짝 까다롭게 느껴지는 사람도 있을 것 같기는 한데, 저는 오히려 재밌었습니다.
1점 깎인 이유는 (사실 0.5점만 깎고 싶긴 한데) 교수님이 꼼꼼하시거나 똑부러지거나 하시지는 않습니다. 수업 말고도 하시는 일이 되게 바쁘셔서 정신이 없으셔서 그런 것 같기는 한데, 궁금한 점에 대한 확실한 답변을 받기가 쉽지는 않았습니다.
그래도 학점도 잘 나왔고 재밌었습니다."
예술과 지식재산,조정욱,22,Fall,5.0,이름 호명해서 질문하고 답변하는 걸로 출석 확인하는게 좀 스트레스일 수 있으나 학점으로 치유됨
예술과 지식재산,조정욱,22,Fall,5.0,"매 수업 시간 출석 겸해서 학생들에게 질문을 하거나 의견 발표를 시키시고, 따로 확인은 안 하지만 예습을 과제로 내심. 시험은 중간, 기말 두 번 보는데 중간고사 객관식 정답이 모두 4번이라서 이게 맞나... 제출하기 전까지 진짜 고민 많이 했던 기억이 남. 기말고사는 중간고사보다 아주 조금 어려웠고 서술형도 있었음. 못봤다고 생각했는데 학점은 잘 주신 듯."
예술과 지식재산,조정욱,22,Fall,1.0,"감사합니다 GOAT
대단합니다, GOAT.
숭배합니다, GOAT.
수고하셨습니다, GOAT.
당신의 헌신과 열정이 또다시 학생을 고통으로 이끌었습니다.
(성적은 아직 안 나왔습니다.)"
예술과 지식재산,정상조,23,Fall,5.0,"출석: 종이가 앞에 놓여져 있고 그 종이에 자신의 이름 옆에 사인하는 방식으로 출석체크를 진행합니다. 저는 지각을 꽤 많이 했는데, 지각 반영도 안 하셔서 출석은 비교적 많이 널널한 편입니다!

수업: 교수님이 그 주의 주제와 관련해 저작관법 관련 내용과 사례를 설명해주시고 이후 그 주제에 대해 레포트를 쓰게 될 학생들이 간단히 발표를 하는 식으로 진행했습니다. 후반부에는 그냥 교수님이 계속 설명해주셨는데, 시험을 안 보다 보니 다른 일을 해도 상관은 없습니다. 하지만 교수님이 관련 분야에서 저명하신 분이기도 하고, 조교님도 전문가셨기 때문에 저작권법 자체에 관심이 있다면 들어볼 만 합니다. 중간에 특강도 한 번 했던 걸로 기억합니다.

평가: 기말과제 한 방이었고, 중간에 자신의 주제 관련해서 발표 두 번을 하게 됩니다. 발표 후 교수님과 조교님이 피드백을 주시는데, 저는 이 피드백이 기말과제를 하는 데에 도움이 정말 많이 됐습니다! 중간발표는 평가에 포함되지 않는 것 같습니다. 성적도 열심히 노력한 것만 보이면 잘 주시는 것 같습니다!!"
예술과 지식재산,정상조,23,Fall,5.0,진짜 수업 한번도 들은 적 없고 걍 앉아서 혼자 딴짓만 함. 병결도 많았음. 근데 기말 페이퍼 한 방에다 A-떠서 이정도면 너무너무 만족 ㅎㅎ
예술과 지식재산,정상조,23,Fall,5.0,"진짜 교수님이 인자하십니다!!
피자도 두 번이나 사주시고, 특강도 유익했네요! 수업 내용 자체에서 배운 것은 많지 않지만, 중간/기말 대체 레포트 쓰면서 스스로 많이 발전했던 것 같아요! 조교님도 너무 친절하시고 레포트 초안 피드백도 잘해주세요. 로드도 레포트 쓰는 과정에서 어떻게 쓰고 있는 중인지 2번 발표하는게 다에요! 다만 교수님 정년이 얼마 안 남으셔서 내년에도 열릴 지는 모르겠네요.. 학점은 후하게 주시는 것 같습니당"
예술과 지식재산,정상조,21,Fall,4.0,시험 전혀 없고 로드는 사실상 기말 한방입니다. 중간에 계획서를 발표하는 것 하나를 제외하면 로드가 없습니다. 먼저 설명을 해주시고 다른 분들 발표하는 것 편안하게 들으면 끝. 수업 내용도 기말 과제를 작성하는 것에 크게 연관이 있어보이지 않고 관심있는 분야만 들었음. 기말 레포트 한방인데 성적은 무난하게 주시는 듯
예술과 지식재산,정상조,21,Fall,5.0,"기말 보고서 주제 선정을 위한 중간 발표, 기말 보고서 내용에 대한 기말 발표, 기말 보고서 제출만 하면 됨
기말보고서 열심히 쓰면 성적은 잘 주시는 듯"
예술과 지식재산,정상조,21,Fall,5.0,출결은 zoom이름을 학번->이름으로 해두면 알아서 체크하신다. 강의에 관하여 이메일로 문의하면 새벽에 보내지 않는 한 당일 몇시간 안에 답장주신다. 새벽에 보내도 아침에 확인하시고 답장 보내주시고 성적 관련해서도 엄청 빠르게 처리해주신다. 발표도 과제도 빡빡하신분은 아니니 안심하고 듣자!
예술과 지식재산,정상조,21,Fall,5.0,"로드 없이 에이쁠.. 진정한 꿀교양
감사합니다 교수님 ㅎㅎㅎㅎㅎㅎ"
예술과 지식재산,정상조,21,Fall,5.0,오전 1교시 수업이라 출결이 조금 빡셌지만 수업 자체는 카메라를 안켜도 돼서 좋았고 내용도 꽤 유익했습니다. 시험은 없었고 과제는 중간 발표 2회에 기말 레포트입니다. 딱히 부담 없었어요. 학점은 뭐^^ 이 수업의 알파이자 오메가라고 할 수 있겠네요. A+ 감사합니다 교수님 ㅎㅎ
예술과 지식재산,정상조,20,Fall,2.0,"딴거 다에쁠받았는데 이거 비쁠뜸ㅠ
로준생들 많아서 학점 따기 개빡셈
교수님 눈높이 맞춰 쓰려면 실질적 로드 매우많음"
예술과 지식재산,정상조,20,Fall,5.0,"보고서 21페이지 썼고 에이쁠받음
수업들은적 없고 줌키고 비디오 끄고 잤음... 발표는 대충해도됨 별로 점수에 반영 안되는듯
대신 기말보고서에 정성들이면 학점 한번에 잘받아갈 수 있어서 꿀강임"
예술과 지식재산,정상조,20,Fall,4.0,중간 기말 없고 중간 레포트도 없고 발표 두번 기말 레포트가 평가의 전부. 학점의 기준을 알 수 없지만 논리가 있는 주장을 적절한 (많은) 사례 연구를 통해 풀어내면 학점을 적당히 받아갈 수 있던거 같음. 코로나로 인해 zoom 실시간 수업이었지만 체감상 금 공강. 수업도 의지를 가지고 듣는다면 재미있었을 듯.
예술과 지식재산,정상조,20,Fall,3.0,"꿀강인것은 확실하나 성적기준을 알 수 없음..
나 왜 비쁠.."
예술과 지식재산,정상조,20,Fall,3.0,학점 기준 모르겠음 로드는 매우 적으나 기말 페이퍼 한방이라 은근 스트레스받음
예술과 지식재산,정상조,20,Fall,3.0,"로드 꿀
배워 가는 건.. 시험이 없는데도 개인이 수업에 얼마나 집중하느냐에 따라 다를 듯
학점은 랜덤임 잘나온 사람도 못나온 사람도 이유는 모르는 수업 여기는 학점 잘나온 사람 후기가 많은 거 같은데 타싸이트 강평 보면 피해자들도 많음 참고하시길.."
예술과 지식재산,정상조,20,Fall,5.0,"와나 왜에이뿔이냐
강의? 들은적없음
발표? 당일에준비 졸라대충함
보고서는 열다섯장정도 자기생각 많이담는게 중요한듯
아무튼 사랑합니다"
예술과 지식재산,정상조,20,Fall,4.0,"기말레포트 한방입니다. 발표 2번이 있긴한데 1인당 3분이라 전날에 간단하게 해도 됩니다. 저는 레포트 쓰기 직전까지 주제를 못 정하고 있었어서 대충 교수님 피드백 듣는다는 생각으로 준비했었습니다. 
통강이지만 강의는 1시간정도이고 굳이 필기할 필요없이 가볍게 들으시면 됩니다. 남은 시간은 다른 분들 발표로 채워져서 널널했습니다.
학점은 랜덤 같아요. 저는 잘 받긴했는데 다른 분들꺼 보고 성적 나오기 직전까지 재수강만 면하자고 생각했었거든요. 20장 넘게 쓰신분들도 많았는데 저는 주제가 참고논문 할만한 논문이 거의 없어서, 제 생각만 주구장창 써서 겨우 10장 맞춰서 냈습니다. 교수님이 본인 생각을 많이 담으라고 피드백해주셨는데 그 점이 통한것같기도 하고...
암튼 저에게는 꿀강이었지만 사바사가 심한 것 같아요"
예술과 지식재산,정상조,20,Fall,3.0,"보고서 열심히 썼다고 생각했는데 비쁠이네요...
로드는 거의 없어서 에이대 맞으면 ㄱㅇㄷ이지만 보고서로 학점이 결정돼서 기준을 명확히 알 수 없는게 좀 아쉬운 것 같아요ㅠ 강의평 보니까 쁠몰도 아닌 것 같고... 꿀강까진 아니라고 생각합니다...!"
예술과 지식재산,정상조,20,Fall,5.0,"너모좋아용
강의는 제법 흥미로워
가볍게 말그대로 교양으로 듣기 좋음
과제는 최종레포트 한방이고 마감은 종강 후라서 학기중엔 여유좀 누릴 수 있음. 중간브리핑 두번만 준비하면 됨
그냥꼬옥들어주면되"
예술과 지식재산,정상조,20,Fall,3.0,"나왜 에마냐..
로드는 없는데 왜 에마지
잘 모르겟음"
예술과 지식재산,정상조,19,Fall,5.0,"여러분 이건 무조건 들으세요
일단 교수님이 출석 겁나 널널하게 종이돌리고 중간 기말 없고 기말에 대체레포트 하나랑 3분짜리 발표 2개가 끝임, 심지어 피피티도 필요없고 조교님 상담이나 교수님 코멘트 딱히 의미없음 그리고 학점 겁나 잘주심 내가 에이쁠 떴는데 왜인지는 모르겠음 걍 들으셈 이건 관악을 떠나기 전에 무조건 들으셈 심지어 출석 놓치면 끝나고 조교님한테 말씀드리면 끝임 체감 금공강 ㅆㄱㄴ 무조건 들으셈"
예술과 지식재산,정상조,19,Fall,4.0,"본격 출첵 없는 꿀강
법대 교양이지만 출첵 없고 레포트 내는 거랑 중간점검용 발표만 하면 됨. 학점 어떨진 몰라도 숨꿀"
