탁구초급,이도흥,23,Winter,5.0,"강사님 착하고 재미있음
사람들도 다들 좋아서 힐링하면서 쳤다"
탁구초급,권준혜,23,Fall,5.0,"출석만 잘하면 에쁠 주심 
횟수만 간신히 채우고 자세는 많이 부족했는데,, 초급이어도 고수 많아서 걱정했지만 학점 잘 주셔서 무한한 감사,,"
탁구초급,권준혜,23,Fall,5.0,"명실상부 관악 초급탁구 일타강사
조원도 많이 만나보고 탁구 실력꺼지 일취월장 가능할뿐더러
성적까지 잘 주셔버리니 또 듣고싶다는 생각뿐입니다"
탁구초급,권준혜,23,Fall,5.0,탁구 재밌게 잘 가르쳐주시고 사람들이랑도 친해질 수 있어서 좋아요!
탁구초급,권준혜,23,Fall,5.0,탁구 겁나 못 하는데 무난히 S 받았습니다 피드백도 많이 주시고 감사합니당
탁구초급,권준혜,23,Fall,5.0,"공도 제대로 못 치던 저를 이 정도까지 탁구 칠 수 있게 성장시켜주신 교수님 감사합니다ㅠㅠㅠㅠ
교수님도 너무 따숩고 좋으시고, 한 학기동안 교수님과, 학우들과 재밌게 치다 보면, 공도 똑바로 맞추지 못하는 초보도 기본은 하는 사람으로 성장할 수 있는 좋은 시간이 될 거예요. 저도 잘 치는 편이 아니었지만 성적도 잘 주시니 너무 걱정하지 마시고 권준혜 교수님 탁구 들으세요!"
탁구초급,권준혜,23,Spring,5.0,출석만 잘 하시면 성적도 잘 받아갈 수 있는 것 같습니다. 주기적으로 조를 바꿔가며 다양한 사람들과 시합할 수 있어서 좋았습니다.
탁구초급,권준혜,23,Spring,5.0,탁구 규칙+경기 영상 감상문 쓰는 간단한 중간 과제랑 실기 기말 있는데 걍 출석 잘하고 열심히 하면 기말 잘 못봐도 에쁠 주십니당 조도 계속 바꿔서 다양한 분들이랑 칠 수 있어요 넘 즐거웠음 최고!!
탁구초급,권준혜,23,Spring,5.0,"성적도 시험 웬만큼 보면 에이쁠 주십니다
권준혜 교수님 짱 !!
한 학기 동안 힐링 수업 잘 들었습니다"
탁구초급,권준혜,23,Spring,5.0,"로드 거의 없고, 출석 잘하고 성의를 보이면 쉽게 A+ 받아갈 수 있습니다. 열심히 가르쳐 주셔서 수업도 좋았습니다."
탁구초급,권준혜,23,Spring,5.0,"탁구 들으려고 하시면, 꼭 이 강의로 들으세요!!

중간 과제 1번(탁구 경기 하이라이트 시청 후 짧은 감상과 탁구 규칙에 대한 3장짜리 리포트 작성) + 기말고사로 구성되어 있는 데, 중간 과제도 정말 하나도 부담되지 않는 수준입니다.

수업 방식은 2주마다 3-4명으로 구성된 조를 나누고, 조별로 돌아가면서 교수님과 1대1로 포핸드, 백쇼트, 백핸드 커트, 포핸드 커트 등등을 배웁니다. 교수님께서 일대일 수준에 맞게 다 알려주시기 때문에 정말 사소한 것 하나하나까지 배울 수 있었네요

정말 다른 강의평에서처럼 교수님께서 카리스마도 있으시고, 동시에 정말 유쾌하셔서 수업 분위기도 너무 좋았습니다~

출석만 꼬박꼬박 잘하고, 수업 참여만 잘하면 성적은 정말 잘 주십니다"
탁구초급,권준혜,23,Spring,5.0,"탁구 이 수업 들으세요.
선수출신 선생님이 하시는 탁구 수업이 몇 개 없는데 이 수업이 그 중 하나입니다. 선생님이 선수 출신이셔서 수업이 전문적이고, 개인 맞춤으로 가르쳐주시는데 도움이 많이 됩니다.
선생님이 카리스마 있으신데 유쾌하셔서 수업도 재밌어요.
출석 잘 하시고 수업시간에 배운 대로 시험 보시면 성적 잘 받으실 수 있을 거예요.
이 강의 추천합니다!"
탁구초급,권준혜,22,Fall,5.0,"탁구 태어나서 처음 쳐봤는데 생각보다 되게 재밌게 수업 들었습니다!
엄청 친절하게 잘 알려주시고 생각보다 많은걸 배워가는 수업이에요
조원들도 잘 만나서 되게 재밌었어욤"
탁구초급,권준혜,22,Fall,5.0,저는 탁구를 해 본적이 없는데 이 수업에서 많은 걸 배워서 매우 만족합니다
탁구초급,권준혜,22,Fall,5.0,기말시험 망했는데 에이쁠 주셨어요… 그저 빛이십니다 출석이 중요한듯 해요
탁구초급,권준혜,22,Fall,5.0,열심히 하고자 했으나 기말 시험을 망쳤음에도 패스를 주셔서 너무 감사했음. 수업도 굉장히 깔끔하게 진행됨. 주로 조별 1대1 수업과 그거 하는 동안 다른 조는 개별 플레이 시간을 가지는 것으로 매번 수업이 진행됨. 탁구 많이 치고 싶다 하는 분께 추천드려요 과제도 간단한 에세이 내는거 하나뿐이어서 부담 없습니다.
탁구초급,권준혜,22,Fall,5.0,"바쁜 학기 중 잠시 쉬면서 재밌게 탁구 칠 수 있었던 시간이었습니다.
이번 학기는 조도 2주마다 계속 섞였는데 다양한 분들과 쳐보면서 친해지기도 해서 더 좋았습니다.
저는 원래 탁구를 너무 좋아해서 자세를 제대로 잡고 싶었는데, 교수님께서 전체적으로 정말 알차게 가르쳐주셨고 최대한 개인에게 알맞게 가르쳐주셨습니다.
(물론 교수님은 한 분이신데 학생 인원은 많다 보니 엄청 자세한 지도를 받기는 수업 한계상 어렵습니다.) 
서로 도와드리면서 치다 보니 학기말에는 다들 어느 정도 랠리를 잘 하시는 것 같아요!
평가는 탁구 경기 및 규칙 정리하는 간단한 보고서 하나와 기말 평가로 이루어집니다. 공 넘기는 것과 상관없이 수업 중에 열심히만 같이 탁구 치시면 충분합니다!
성적도 A+! + 언젠가 커피 얻어먹으러 가겠습니다 :)"
탁구초급,권준혜,22,Fall,5.0,"보고서 한번에 실기 시험 한번입니다
저는 평소에 탁구를 좋아하고 그럭저럭 치는 편이라 재밌게 들었습니다. 조원들이랑 친해지는 기회도 되어 좋았구요. 근데 교수님께서 잘 알려주시고 잘 치는 분들이랑 같이 치다보면 잘 늘어서, 한 번 쳐보고 싶었는데 아직 한번도 안 쳐본 분들이라도 금방 배우실 수 있을 거에요!
출석만 잘하면 성적도 잘 주시는 것 같습니다
에이쁠 잘 받아가요~!"
탁구초급,권준혜,22,Fall,5.0,"체육교양 탁구하시면 여름에도 시원한데서 할 수 있고 겨울에도 상대적으로 따뜻한 곳에서 칠 수 있어요. 수업은 주차별로 여러 스킬들 배우고 중간은 대체보고서 2장짜리, 기말은 실습이고 수업만 잘 참여하면 에이쁠 가져갈수있습니다"
탁구초급,권준혜,22,Fall,5.0,"너무 좋아요! 강사님께서 열정있게 잘 알려주시고 예쁘십니다.
탁구 기본기를 정말 잘 배울 수 있었어요
학점도 정말 잘 주십니다.. 잘 못하시는 분들도 A+ 가져가실수있어요~"
탁구초급,권준혜,22,Fall,5.0,"너무 잘 배웠습니다.
기본적인 그립 포핸드 백핸드를 배우고 커트서브와 스매싱까지 나간 뒤 학생들 선호조사를 통해 기말고사 시험 종류를 정합니다.
학점도 잘 주시는 것 같고 무엇보다도 학생 편의를 최대한 배려해주셔서 한학기 잘 배운것같습니다."
탁구초급,권준우,23,Summer,5.0,탁구 경험 하나도 없고 아는 게 하나도 없었던 내가 에플 받은 이 수업. 교수님께서 엄청 친절하심.
탁구초급,권준우,23,Winter,5.0,"겨울계절 9시 수업이라 출석 다하고 하라는거 다하면 에쁠입니다(출석 50%)
기숙사 사시는 분들은 달달하고 재미있게 학점 챙겨가기 좋을 거에요 출석도 15분 늦게 부르세요
휴강도 은근히 많았고(총 3번), 파트너랑 자유롭게 탁구치면 되는 거라 재밌어요
과제는 탁구공 튀기기, 파트너랑 탁구공 주고받기인데 횟수가 상당히 많아서 처음에는 좀 부담스러웠지만 하다 보면 어찌저찌 됩니다
마지막 과제는 파트너랑 탁구공 주고받는데 시간제한이 있어서 빡셌지만, 교수님께서 기준을 대폭 완화해주셔서 정말 융통성 있는 좋은 분이라고 느꼈습니다
때로 아침에 일어나기 힘들기도 했지만 그래도 즐겁게 탁구를 배워갈 수 있어 좋았습니다ㅎㅎ"
탁구초급,권준우,23,Summer,5.0,"교수님이 너무 친절하시고 재밌어요
주어진 과제만 성실하게 하고 교수님이 시키시는것만 잘하면 성적도 잘 주십니다 출석도 너그럽게 봐주시고요!
여름학기 최고 꿀강 추천합니다~~"
탁구초급,권준우,22,Summer,5.0,"22-여름학기 수강했습니다
초급 수업이지만 잘 치시는 분들이 많으셨습니다
중간이나 기말 과제가
왔다갔다 파트너랑  핑퐁하는거 50개,100개 영상촬영해서 제출하면 끝입니다. 출석은 지각 한번하고 다 성실히 했더니
에쁠 나왔슴다 개인적으로 탁구 처음 해보는데 자세 배울 수 있어 좋았어요"
탁구초급,권준우,21,Fall,5.0,"교수님 너무 착하시고 재밌으시고 너그러우십니다
성적도 잘 주시고 한사람씩 친절하게 봐주세요
한 학기 힐링수업이었습니다"
탁구초급,권준우,21,Fall,5.0,"21-겨울
교수님은 진정한 천사입니다.. 수업을 들으신 분들은 왜일지 알 것입니다.. 수강생들과도 되게 잘 놀아주세요"
탁구초급,권준우,21,Fall,5.0,"2021-겨울학기 수강

30명으로 시작했으나 첫시간부터 드랍자가 절반이 넘어서 최종적으로 한 15명...? 으로 끝났습니다
하지만 그래서 탁구대도 엄청 편하게 쓰고, 교수님께서 하나씩 잘 봐주셔서 너무 좋았습니다

교수님이 되게 유쾌하시고 친절하게 잘 알려주셔서 탁구 생초보도 진짜 편안하게 탁구 잘 배워갔습니다
또 대부분의 시간은 파트너나 주변 분들하고 같이 탁구를 자유롭게 치는 시간을 주셔서 수업이라기 보다 놀다 오는 기분이었습니다 ㅋㅋㅋ

거기다가 휴강도 은근 많고, 시험도 영상 찍어서 제출이라 너무 편-안했으며, 학점도 ""나에게 학점 올려달란 메일을 보낼 일은 없을 것이다. 더 이상 올라갈 곳이 없을 것이기 때문""이라는 명언을 마지막 시간에 해주시면서 달달하게 A+ 하사하시네요!

수업 강추합니다!! 교수님 최고!!!!!"
탁구초급,강상욱,23,Summer,5.0,"여름 계절들었는데 너무 재밌었고 교수님도, 같이 수강하는 학우분들도 너무 좋았습니다!
너무너무 재밌었어요 학점도 후하시고요"
탁구초급,강상욱,23,Summer,5.0,"저는 너무 재밌게 잘 들었습니다!! 
여기서 만난 분들이랑 잘 어울려서 수업 끝나고도 종종 만나서 탁구치고 술먹고 해서 너무 좋습니다 ㅎㅎ
교수님도 엄청 친절하시고 한명한명 자세교정도 해주셔서 정말 좋았습니다
여태까지 했던 체육교양 중에서 단연 최고였습니다😍"
탁구초급,강상욱,23,Summer,2.0,"적어도 계절에는 비추, 아는 사람 없으면 더더욱ㅇ
교수님이 가르쳐주시는게 거의 없고 원하는 파트너랑 알아서 치거나 복식게임 위주로 진행됩니다. 완전 초짜는 아니지만, 제대로 배운게 없고 자세 피드백도 거의 없어서 그냥 운동신경으로 눈치껏 치는 느낌이었습니다."
탁구초급,강상욱,22,Winter,5.0,계절로들었는데 너무재밌었어요!! 다들 들으세여
탁구초급,강상욱,21,Spring,1.0,"계절학기 수강생입니다. 다른건 필요없고, 치는법을 알려주실때 학생이 잘 못하면 한숨을 푹푹 내쉬면서 짜증조로 가르쳐주시는데, 상당히 별로였습니다. 난생 처음 탁구를 배워본다, 운동신경이 부족하다 하면 이 수업 안들으시는걸 추천드립니다. 탁구 자체에 대해서도 깊이있게 배우기 어려웠던 수업이었습니다."
탁구초급,강상욱,21,Spring,5.0,2021 겨울 계절 수강. 초급 수준에 맞게 가르쳐 주시면서도 진짜 재밌게 배울 수 있었음. 다만 같이 칠 친구가 없다면 초반에 좀 뻘쭘하겠다는 생각이 들기도... 계절이 아니라 대면 정규학기에 들었다면 조 사람들이랑 좀 친해지고 전반적으로 분위기 좋게 친해질 수도 있었겠다 싶은 강의.
탁구초급,강상욱,21,Spring,5.0,21년 겨울계절로 들었는데 개꿀잼. 마지막에 팀전하는데 진짜 재밌음ㅋㅋㅋ 교수님 완전 친절하시고 최고~ 살짝 츤데레 서타일
탁구초급,강상욱,21,Spring,5.0,탁구 재미있게 배울 수 있는 꿀강. 탁구 못 치는 사람도 실력이랑 상관 없이 에이쁠 받을 수 있음. 출결만 만점이면 에이쁠.
탁구초급,강상욱,21,Spring,5.0,"교수님 너무 친절하시고 같이 수업받는 사람들과 토너먼트로 탁구하는 것 자체도 재밌었어요
추천드립니다 정말 꿀빨수있는 좋은 강의"
탁구초급,강상욱,21,Spring,5.0,완전 재밌어요. 추천합니다. 교수님도 좋고 수업도 좋아요.
탁구초급,강상욱,21,Spring,5.0,교수님 쾌남이시고 출결만 잘 챙기면 개꿀강좌. 여름에 체교 들으실 분은 탁구 추천. 실매라 살도 안타고 덜 더움.
탁구초급,강상욱,21,Spring,5.0,"교수님께서 친절하고 친근하게 잘 가르쳐주시고
수업도 정말 재밌습니다!"
탁구초급,강상욱,21,Spring,5.0,탁구 기본기에 대한 친절히 설명해주시고 학생들에게 친근하게 다가와주셔서 매우 좋았음.
탁구초급,강상욱,21,Spring,5.0,수업내용 너무 친절하게 설명해주셔서 재밌게 잘 들었어요!!
탁구초급,강상욱,21,Spring,5.0,"최고에요 교수님도 친절하시고 재미있습니다!!!
대면 진행했습니다"
탁구초급,강상욱,20,Spring,5.0,교수님도 친절하시고 수업도 재밌었습니다!!
탁구초급,강상욱,19,Fall,5.0,😊😊😊😊😊😊😊😊😊😊😊
탁구초급,송영훈,17,Fall,5.0,"17-겨울 수강
교수님 너무 좋으세요! 가서 즐겜하다 오시면 A+ 확정인 수업입니다. 포핸드 백핸드 조금 배우고 랠리하고 게임했습니다."
탁구초급,박철욱,23,Fall,5.0,재밋고 성적 잘 주심 수강생들과 친해지기도 좋은 강의! 보고서는 사실상 반쪽 정도...
탁구초급,박철욱,23,Fall,5.0,"기말 단식경기 10패 출석 만점으로 에제 받았습니다
원래 잘 치시던 분들이 많아 에이쁠 받기는 조금 힘든 것 같은데 배워가는 건 많은 강의였습니다!
교수님이 좋으세요
출석은 수업 끝날 때 부르십니다"
탁구초급,박철욱,23,Fall,5.0,"초심자도 부담없이 즐길 수 있는 교양 과목입니다.
중간 평가는 포핸드, 백핸드 각 10번 테스트
기말 평가는 리그전입니다."
탁구초급,박철욱,22,Fall,5.0,"초보라서 s/u로 들었습니다
수업은 자세나 기술 가끔 알려주시고 대부분 조를 짜서 함께 연습하고 경기하는 형식으로 이루어집니다
로드도 없고 교수님 친절하셔서 탁구 좋아하시거나 배우고 싶은 분이라면 추천해요!!"
탁구초급,박철욱,23,Spring,5.0,"이 수업 진짜 재밌어요. 보고서는 한개 써야하는데, 엄청 짧아요. 교수님도 착하시고, 추천합니다"
탁구초급,박철욱,23,Spring,5.0,역시 체육교양은 탁구초급이 쵝오 s/u로 돌렸는데 괜히 돌린 것 같기도 함 성적 매우 잘 주심!
탁구초급,박철욱,22,Fall,5.0,"기말 단식경기 11패 했는데 에이쁠
로드는 거의 없는 수준"
탁구초급,박철욱,22,Fall,5.0,저는 지레 겁먹고 s/u 신청하긴 했는데 다른 후기들 보니까 그냥 다른 평가방식 선택했으면 에이쁠 받을 수 있었을듯 하네요.. 강사님께서 약간 초보자 맞춤으로 라켓 잡는법부터 차근차근 알려주십니다. 저도 초보자라 그냥 부담없이 재미있게 수업 들을 수 있었어요. 그리고 따로 같이 듣는 사람이 없어도 그냥 랜덤으로 자기 짝을 정해주시기 때문에 새로운 사람들 여럿 만날 기회도 있었네요.
탁구초급,박철욱,22,Fall,5.0,"탁구를 오래 쳐본 경험이 있는 고인물의 입장에서, 초급부터 중급까지 많은 사람들과 탁구를 오래 쳐보고 싶은 마음에 신청한 수업이었습니다. 교수님의 수업 진행 방식이 좀 더 유동적이면 그 안에서 더 다양한 것들을 할 수 있었을 것 같은데, 수업마다 너무 한정된 활동을 동일하게 반복하는 느낌이 있어서 아쉬웠습니다. 하지만 초보자 분들이 기본기를 탄탄하게 쌓는 데에는 최적의 지도를 하셨다는 생각이 들고, 초급 교양 수준에서 최적의 강의라는 생각이 들어서 추천합니다!!"
탁구초급,박철욱,22,Fall,5.0,"학점 정말 잘주십니다. 초보자인데 에이쁠 받았습니다. 
마지막 3주간 다른 수강생분들과 경기를 하고 그게 기말고사로 들어가는데 저는 이 방식이 아쉽긴 했습니다. 개인적으로는 더 배우고 연습할 수 있었으면 했어요"
탁구초급,박철욱,22,Fall,5.0,출석은 직접 호명하시고 과제는 중간대체 과제 한개인데 30분컷 가능. 시험은 중간에 포핸드 백핸드 랠리하는거 기말은 리그전으로 진행됩니다. 차근차근 기초부터 알려주셔서 초보자도 잘 할 수 있으나 고인물도 꽤 많습니다. 새로운 사람들과 친해지기 좋은 강의는 아닙니다.
탁구초급,박철욱,22,Fall,5.0,"탁구 초보였는데 에플 떴어요 꿀강
로드는 없구 중간에 무슨 반페이지쯤 쓰면 되는 보고서 써야하는데, 30분도 안 걸립니다~"
탁구초급,박철욱,22,Fall,5.0,"재밌고 교수님 친절하심
사람 만나기에 좋은 강의인지는 딱히 모르겠음
고인물 많으니까 초급자고 잘 못하면 에쎈유 전환하고 맘편하게 듣는 걸 추천
평가 방식은 작년 후기랑 같았음"
탁구초급,박철욱,22,Fall,5.0,"탁구 전혀 칠 줄 몰랐는데 잘 배우고 갑니다.
탁구 군대에서든 학창시절이든 어디선가 배워오신 수강생분들 꽤 계심.
그러나 그분들 때문에 성적에 크게 손해갈 정도는 아님(어차피 1학점이기도 하고...).
널널한 강의. 수강 추천합니다."
탁구초급,박철욱,22,Fall,5.0,재밌는데 탁구 고인물이 꽤나 있어서 에쎈유가 좋음 교수님 친절하심
탁구초급,박철욱,22,Spring,5.0,부담없이 들을 수 있는 탁구 수업. 다만 수강생 대부분이 초급자는 아닌 듯했음.
탁구초급,박철욱,21,Fall,5.0,초급자도 잘 배울 수 있도록 하십니다! 그런데 학생들마다 실력 차이가 너무 커서 초급자분들은 어려움이 있을 수 있습니다.. 중간고사는 포핸드와 백핸드 각각 10번 넘기면 되는거라 노력으로 가능한데 기말고사는 3주에 걸쳐 경기 진행하는 것에 대한 승률로 점수를 매겨요.. 초급자분들도 실력이 늘지만 잘하시는 분들도 똑같이 늘으셔서 따라잡기는 힘듭니다ㅠㅠ 탁구 초급자분들은 S/U로 듣는걸 추천합니다~
탁구초급,박철욱,21,Fall,5.0,"기초부터 차근차근 알려주십니다. 매주 즐겁게 칠 수 있고, 마지막엔 경기도 하면서 실력이 많이 늘었습니다. 추천합니다!"
탁구초급,박철욱,21,Spring,5.0,교수님께서 탁구 기본부터 차례대로 알려주셔서 초급자가 듣기에 좋은 강의인 것 같습니다. 함께 수강하는 분들과도 친목 도모하기 좋은 수업인 것 같습니다!!
탁구초급,박철욱,21,Spring,4.0,"교수님도 너무 착하시고 학생 배려 잘해주세요!!
에쁠 나올줄 알았는데 에제 나온건 살짝 미스지만 그래도 추천
2021년 1학기 들으신 학우분들 고생하셨어요 다들 착하시고 짱짱"
탁구초급,홍차옥,22,Fall,5.0,교수님이 대단하신 분이고 너무 좋으십니다..탁구 못치는데도 교수님이 넘 좋으셔서 마지막까지 잘 수강했습니다
탁구초급,홍차옥,22,Fall,5.0,체육수업이라서 과제에 찌든 학교생활중에 운동하는 느낌으로 가볍게 듣기 너무 좋은 수업입니다. 또한 선생님도 국가대표 출신이셔서 자세 같은것도 잘 알려주시고 너무 좋으십니다! 과제는 탁구에 관한 설명 기말레포트 2장 쓰는게 끝입니다 모두들 힐링 운동하면서 1학점 챙겨가세요
탁구초급,홍차옥,22,Fall,5.0,"그저 갓...
학점 잘 주시고 일단 편하게 즐길 수 있는 수업이라 좋음. 탁구 좀 칠 수 있으면 최고의 꿀강이자 명강"
탁구초급,홍차옥,22,Spring,5.0,"정말 재밌고, 성적도 잘 주시고, 이번학기 제일 만족스러운 수업
체육교양중에서도 체력부담 없이 좋은듯"
탁구초급,홍차옥,20,Fall,5.0,교수님 친절하시고 조원들과 재밌게 칠수 있어요
탁구초급,홍차옥,21,Fall,5.0,"레포트 한번 시험두번이 끝입니다
교수님 좋아요"
탁구초급,홍차옥,21,Fall,5.0,솔직히 에이쁠 받을 실력은 아니라고 생각했는데... 교수님 감사합니다... 수업마다 4인 1조로 탁구칩니다 조 잘 만나는 것도 은근 중요한듯
탁구초급,홍차옥,21,Fall,4.0,"교수님 짱! 탁구는 홍차옥 교수님!
사람들이랑 친해지면 재미있어요."
탁구초급,홍차옥,21,Fall,5.0,"중간 포핸드, 기말 백핸드로 공 넘기는 거랑 중간 레포트가 있습니다. 이외에는 거의 로드가 없고 편안한 마음으로 조원들과 탁구 경기를 하면 됩니다. 교수님도 올림픽 메달리스트 출신으로 친절하게 자세나 노하우 등  잘알려주십니다."
탁구초급,홍차옥,21,Spring,5.0,"이번 학기 힐링강의
교수님도 학생들 아주 배려해주시고 조원들 잘 만나면 행복한 한 학기 보낼수 있을듯"
탁구초급,홍차옥,20,Fall,5.0,"교수님 엄청 친절하시다
다음에는 꼭 비대면 아닐때 탁구고급으로 듣겠어!"
탁구초급,홍차옥,20,Fall,5.0,"수신이 좀 빡세지만, 수강하시면 후회는 절대 안합니다. 교수님 너무 친절하시고, 수업은 재밌어요."
탁구초급,홍차옥,20,Fall,5.0,"체육치고 과제가많다
중간을 주졌는데 기말에 적당히 하니 에제받음"
탁구초급,홍차옥,20,Fall,5.0,실력이야 말할것 없는 근본 국대출신에 친절하시고 열정도 있으시다. 탁구를 할거면 안들을 이유가 없는 교수님.
탁구초급,홍차옥,19,Fall,5.0,올림픽 메달리스트한테 배울 수 있는 기회!!!!!!
탁구초급,홍차옥,20,Spring,5.0,"학생들 잘 챙겨주시고, 꼼꼼하게, 그리고 재밌게 가르치시려고 노력하시는, 개인적으로 제일 존경하는 교수님 중 하나입니다. 탁구를 배우시고 싶으시거나, 혹은 이미 배웠고 더 배우고 싶으신 분들 아무나 이 교수님께 들으셔도 정말 좋은 경험 하실거에요!"
탁구초급,고경아,18,Spring,5.0,여러가지 기술들을 배울 수 잇고 시합도 같이 할 수 잇어서 재밋엇다
