인문사회계를 위한 수학 1,이영민,19,Fall,5.0,"수학을 좋아한다면 도전하세요. 혹여나 실패하더라도 교수님을 탓하지말고 자신을 탓하기 바라며.

진정항 명강."
인문사회계를 위한 수학 1,이영민,19,Spring,5.0,"얻어갈 것이 많은 하지만 무지막지한 난도를 자랑하는, 해석개론과 정수론, 암호 관련 수학까지 넘나드는 흥미진진한 수업.
카디널리티, 엡실론 델타, 코시 정리, 토메 함수 등을 학습함."
인문사회계를 위한 수학 1,이영민,19,Spring,3.0,"명강인가? 
👉  ☆☆☆☆☆
꿀강인가?
👉 ☆
총점
👉 ☆☆☆"
인문사회계를 위한 수학 1,이영민,19,Spring,4.0,수업내용이 어렵습니다. 특히 중간고사 범위에는 인문사회계와는 정말 관련 없는 것이 아닌가하는 내용들이 많습니다. 그러나 그런 내용들은 많이 응용하는 수준이 아니라 교수님이 말씀하신 흐름대로 잘 이해했는가의 여부만을 확인하는 정도의 문제로 내십니다. 중간고사 난이도는 공부만 했다면 정말 무난무난했으나 기말고사는 정말 어려웠습니다. 기말만 오픈북이었으나 크게 의미가 없을정도로 어려웠습니다. 다만 그만큼 얻어가는 것은 정말 많은 강의라고 생각합니다.
인문사회계를 위한 수학 1,이영민,19,Spring,5.0,"고등학교 때 이과 애들은 잘만 배우는 거 문과라고 못 배운 한을 풀기 위해 수강했습니다... 아직 많이 부족하지만 미적분 기초를 닦기 위해 한 학기 동안 노력한 보람이 있는 강의였어요. 그리고 가장 중요한 건 교수님이 귀엽습니다. 하...

배우는 것: 위에 있는 교재 한 번 훑어보시면 알 수 있어요. 기본적으로 배우는 내용은 이 책 내용이에요. 그런데 교수님 열정이 대단하신 덕분에(?) 그 바깥의 새로운 세계도 살짝 맛보기로 보여주십니다. 수체계(실수의 완비성 공리...), 집합(셀 수 있는 무한집합 등), 복소평면에 정다각형 작도하기, 다차원 적분 등 책에 없는 내용을 가져오셔서 설명하시고 시험에도 철저하게 반영됩니다. 고등학교 때 미적분II를 공부했다고 꿀강일거라고 생각하면 크나큰 착각입니다! 배울 때는 이런 거 왜 배우나 했는데, 교수님이 떡밥 풀고 회수하는 걸 정말 잘 하세요. 다 이유가 있어서 배웠던 것이라는 걸 깨달으면서 배우는 입장에서는 정말 재미있었어요.

난이도: 하나도. 안. 쉬워요. 
쉽다고 하는 사람이 있다면 그냥 대단하다고 칭찬해주세요. 수업 듣기 전에는 긴장 빡 하는 게 현명한 것 같습니다. 어차피 이 강의 꿀빨려고 듣는 게 아니라 진짜 수학 배우려고 듣는 거잖아요 ㅎㅎ
수업 따라갈 때 머리가 하얘지는 경우가 다반사였어요. 교수님의 강의력 문제라기보다는 진도 속도는 정해져있고 조금이라도 헷가닥하면 중간에 큰 구멍이 생겨서 그런 거 같아요. 녹음을 써보기도 했지만 목소리가 크지는 않으셔서 도움이 크게 되지는 않았어요. 그럴 땐 일단 칠판에 적힌 수식을 무조건 받아 적고 나중에 곰곰이 생각해보는 식으로 공부했던 것 같아요.주변에 겹강러들 있으면 이해 안 되는 부분 서로 질문하면서 공부할 수 있어서 좋을 거예요!
시험은 예전 강의평과는 다르게 적절하게 난이도를 조절해주시는 것 같아요. 딱 만점의 언저리에 평균이 걸리고 사분위수도 적절하게 나왔던 거 같아요. 아무도 못 풀어서 좌절하거나 너무 쉬워서 공부한 게 아깝거나 하지는 않아요. 알려주신 개념을 확인하는 수준의 문제가 큰 비중을 차지하고 있어요. 물론 판가름은 적용을 요구하는 문제에서 나는 것 같아요. 적용이나 아이디어가 필요한 문제도 사실은 (수업시간에는 잘 사용하지 않는) 교재의 예제와 본문 연습문제(교수님의 말씀에 따르면 각 단원 말미에 붙은 연습문제들은 너무 어려워서 출제에 참고하지 않으신다고 해요)에서 대부분 커버가 되더라고요. 노력하는 문돌이에게도 희망을 주시는 갓영민... 기출도 꼭 풀어보세요! 비슷한 아이디어가 반복되기도 해요. 수업시간에도 기출의 중요성을 언급하신 적이 있습니다. 중간은 범위가 좁고 책 없이 시험 봤고, 기말은 범위가 넓고 오픈북으로 시험을 봤어요. 기말 때는 교수님이 대충 학생들 문제 푸는 거 보시더니 거의 두 시간에 가깝게 추가 시간을 주셨다는...

로드: 시험 직전까지 복습과 정리, 체화를 미루어 둔다면 ‘무과제’라는 타이틀이 무색한 극한의 로드를 체험할 수 있을 것입니다... 애초에 계단식 커리큘럼이라 앞 내용이 제대로 안 되어 있으면 뒤의 수업이 외계어처럼 들릴 뿐만 아니라, 나가는 내용의 양이 어마어마하기 때문에 정리를 미루어 두고 존재를 잊고 있다 보면 시험 직전에 적지 않은 드랍 충동을 느끼게 될 거예요. 특히 기말 때는 오픈북이라고 해서 필기 정리해두었더니 서른 쪽 정도 나오더라구요... 이 교양 공부하느라 다른 교양에 투자할 시간을 뺏길 것이 거의 확실해요. 그만큼 미적분 기초를 닦고 싶은 분들이 수강하면 불만 없이 뿌듯한 경험이 될 것 같아요.

*출석은 안 부르나 출석은 안 하면 그대로 시험에 반영되는 마법... 그리고 시험에 꼭 1문제씩 출석 문제를 넣으셨어요. 기출 보니 이번 학기에 새로 생긴 거 같네요."
인문사회계를 위한 수학 1,이영민,19,Spring,3.0,"솔직히 에이플 받았다고 쉽다고 하시는 분들은 약간 자기 자랑하시려는 마음 있으신 것 같은게, 절대 수업이 쉽지만은 않음. 진도도 빠르고 교수님 목소리도 작으신 편이라 필자는 녹음하고 수업 내내 집중하고 나중에 계속 복습하며 개념 체화하며 공부함. 그렇게 공부하고 나면 시험은 배운 거 잘 습득했다면 중상 이상은 볼 수 있게 내신듯. (그렇게까지 어렵진 않고 반 이상은 개념 습득 잘했는지 체크하는 정도) 
다만 여기서 완전 최상까지 가려면 시간 할애를 더 하거나 (교재 문제 풀어보고 개념을 응용해서 문제 적용할 수 있을 때까지) 기본적으로 수학머리가 좋아야하는듯. 필자도 문돌이에서는 수학 꽤 잘하는 편이었는데 여기서는 중상정도 한 것 같음. 문돌이 중에서도 수학 잘하시는 분들 많음. 쨌든 교수님 자체는 굉장히 귀엽고 따뜻하신 분이긴 함. 가끔 웃기려고 노력하시는 것도 귀여움.
그치만 절대로 쉬운 강의는 아니고, 학점 안나와도 상관 없으면 괜찮지만 학점 신경쓰면 다른 교양에 투자할 시간 꽤 줄이고 인사수에 투자할 각오는 해야함. 정수론 아주 기초부터 안 배웠던 수학까지 배울 수 있던 것 자체랑 교수님 성품은 좋았으나 시간 투자를 너무 많이 요했던 듯."
인문사회계를 위한 수학 1,이영민,19,Spring,5.0,"강의가 그닥 어렵지 않고 문과인데도 무리없이 따라갔음
성적은 당연히 에이플 받았고 드랍자 포함하는듯
내가 에이플을 받았는데 그정도는 아닌것같아서
암튼 유머러스하고 유익한 강의입니다"
인문사회계를 위한 수학 1,이영민,19,Spring,4.0,"저는 개인적으로 수학을 좋아는 하는데 엄청 못하는 스타일입니다..겁없이 덤볐다가 한학기가 매우 힘들었어요 ㅎㅎㅎㅎ 그래도 확실히 얻어간건 정말 많아요. 근데 저처럼 수학적 감각 없으신 분들은 정말 공부 많이 하실 각오 하고 들으셔야 해요. 로드만 정말 하나도 없다뿐이지 전 수업 따라가기도 벅찼어요. 그래도 교수님의 훌륭한 드립력과 열정 때문에 수업은 진짜 재밌었습니다 ㅎㅎㅎ 교수님 그리고 생각보다 되게 친절하셔서 놀랐던 기억이.. 아무튼 수학 배우고 싶으시면 들으시고, 학점 신경쓰시는 분이라면 절대 비추합니다. 괜히 절반이 드랍하는게 아니에요 ㅋㅋㅋ"
인문사회계를 위한 수학 1,이영민,19,Spring,3.0,교수님은 좋으시고 과제랑 출결도 딱히 없지만!!! 내용이 좀 어려웠어요ㅠㅠ  딱히 인문계를 위하지 않는 느낌.... 남는 건 많지만 학점이 젤 중요하다!이면 굳이..?? 란 강의
인문사회계를 위한 수학 1,이영민,19,Spring,5.0,강의내용이 조금은 낯설지만 수업에서 충분히 집중한다면 유익한 강의가 될거라 생각합니다. 다만 수학이라는 과목의  특성상 개념이해와 문제적용과정 자체에 필수적으로 상당한 시간이 필요하다고 생각됩니다. 공부할 열의와 시간만 가지고 있다면 로드없는 이 강의를 추천합니다. 교수님의 재미진 입담은 덤입니다.
인문사회계를 위한 수학 1,이영민,19,Spring,5.0,강의 빡세게 하십니다. 이과생 기준으로 수업한다고 보는게 맞음. 그리고 문과가 안배운 거 있는데 고등학교에서 배웠다고 하는 사람들 때문에 더 빡세졌습니다. 아마 각오하고 들어오셔야할듯. 그래도 교수님 재밌으십니다.
인문사회계를 위한 수학 1,이영민,19,Spring,5.0,"절반이 드랍했지만 드랍자 미포함ㅎㅎ 학점생각 안한다면 관악의 명강,  아니면 듣지마시길
그래도 교수님 귀여워서 5점"
인문사회계를 위한 수학 1,이영민,19,Spring,5.0,"이영민 당신 60명중 30명 드랍했는데도 드랍자 미포함이라니 정말 귀엽기때문에 5점을 줄수밖에 없어.. 여러분 성적 안나오고 강의 겁나 어려운데 배워가는건 많아요 성적 상관없으면 들으세여,, 당신 선대 내가 쫒아갈거다!"
인문사회계를 위한 수학 1,이영민,19,Spring,3.0,"유익한 건 맞지만 꿀강은 아닌 것 같다.
수업때 교재를 활용하시거나 진도를 좀 천천히 나간다면 좋을 것 같다. 
한학기 낭비했다는 생각은 아니지만, 저는 앞으로 이 교수님은 되도록 피하려구요."
인문사회계를 위한 수학 1,이영민,19,Spring,5.0,"완전 꿀강인데 저평가된 강의
어려운거 가르치지만 호기심 채우기는 충분
강의 내용도 차근차근 빌드업되서 알고보니 이걸 배운 이유가 이것때문임~ 이런 느낌
학점 안나와도 노후회"
인문사회계를 위한 수학 1,이영민,19,Spring,1.0,수학을 이과생 수준으로 너어어어어무 좋아하지 않는이상 절.대.듣.지.마.세.요. 교재에 없는 어려운 내용을 배우는데다 진도가 넘 빨라요... 굳이 이런걸 배워야되나 싶은것도 많고...
인문사회계를 위한 수학 1,이영민,19,Spring,5.0,"왜 다들 안 좋아하시지...
진짜 좋으신 분이고
많이 가르쳐주시고
저희 수준도 잘 알아서 어려운건 적당히 넘어가주시고
수학자들의 자학?개그도 선사하시고
3월 14일은 파이데이라고 빅파이를 나눠먹었음.
ㄹㅇ좋은 교수님
입실론델타를 아주 기막히게 잘 설명하심.
애들 많이 드랍하니까 존버하라고
너희들이 손해보는건 절대 없을거라고
알려주심. 안심하고 수업들었음.
ㄹㅇ좋은 교수님."
인문사회계를 위한 수학 1,이영민,18,Spring,2.0,교수님이 아시는 건 많은데 전달할 의지가 없는듯. 어렵게 가르침. 시험은 배운데서 나온다지만 웬만큼 공부해서는 못푸는 문제들임. 성적은 점수대로 칼같이 짤라주심.
인문사회계를 위한 수학 1,이영민,17,Spring,3.0,진짜 개어려움ㅋㅋㅋㅋㅋㅋㅋ 이상한내용 막가르치시고 그렇지만 교수님이 막깐깐하게 애들 잡는 스타일은 아닌듯 앵간라면 A정도 나옴ㅋㅋㅋㅋㅋ 물론 공부를 앵간히 많이해야함 사실 인사수때메 1학기 삶의질이 매우 낮았음
인문사회계를 위한 수학 1,이영민,17,Spring,1.0,"제발듣지마셈. 드랍자가 많은데도 안나오고,  마이너스까지 다 채워줌."
인문사회계를 위한 수학 1,계승혁,21,Spring,5.0,진심 개조졌는데 A- 받음. 과제는 많은데 모든 인사수는 원래 과제가 많음. 강의력 개좋음.
인문사회계를 위한 수학 1,계승혁,21,Spring,5.0,"in kye we trust
네 차례의 과제 전체에서 2점, 두 차례의 시험 전체에서 10점 감점되었고 A+ 받았습니다.
이과수학 과정에서 크게 벗어난 건 테일러전개나 복소수 관련 논의밖에 없어서, 예상 외로(?) 수월하게 들었습니다."
인문사회계를 위한 수학 1,계승혁,21,Spring,4.0,기말 범위가 너무 어려워서 열심히 쓰기만 하고 평균보다 훨씬 아래로 나왔는데 에마 나왔습니다 .. 그 전에 엄청 열심히 하긴 했지만 아무튼 학점은 잘 주시는 것 같아요 근데 독강은 좀 힘들어요 제가 독강했는데 도움 요청할 곳이 별로 없어서 죽을 뻔 했습니다 ! 빨리 드랍할 걸 계속 후회했는데 성적 보니까 끝까지 있길 잘했다는 생각이 듭니당.. 이게 미화되는건가 싶네요 사실 학기 중에는 최악이었습니다 가장 스트레스 받는 강의였어요
인문사회계를 위한 수학 1,계승혁,21,Spring,5.0,"We trust in kye🙏
수학 놓은지 1년만이라 두려웠는데 수업만 잘 듣고 교재만 열심히 풀면 에제 받을 수 있습니다~ 머리가 좋다면 에쁠도 가능할수도.. 기출은 교수님 홈페이지에 다 있으니 찾아서 푸시면 돼요 생각보다 엄청 비슷하게 나옵니다!"
인문사회계를 위한 수학 1,계승혁,21,Spring,4.0,자드가... 안돼... 분명 백지를 냈는데... 이미 드랍자가 너무 많아서... 자드가 안돼...... 그대로 B가 나왔어......
인문사회계를 위한 수학 1,계승혁,21,Spring,4.0,"일단 수학에 재능이 없는 편이라서 처음부터 끝까지 이해하는 것에도 시간이 꽤 걸렸습니다. 과제는 얼마나 시간을 들여서 이해하고 풀이 꼼꼼히 작성하는가에 달렸고, 시험은 이번 학기 들은 수업 중에 가장 오래 준비한 것 같네요. 드랍자가 매우 많았어서 성적은 잘 나온 편인 것 같아요. 배울 점도 많도 한데, 교재의 해설이 너무 허술해서 제가 맞게 풀고 있는건지 파악하기가 쉽지 않았습니다. 그리고 녹화된 강의의 음질이나 화질이 좋지 않아서 여러번 돌려봐야했던 불편함도 있었어요. 그래도 전반적으로 배울 점 많은 수업이었습니다."
인문사회계를 위한 수학 1,계승혁,21,Spring,5.0,"매주 녹강을 듣고 댓글로 출석을 하는 형태입니다. 과제는 네번 나왔고요. 시험은 중간 기말 두번 봤어요. 과제를 풀면서 공부해두면 시험을 준비할 때 도움이 됩니다. 과제 풀이를 적을 때 꼼꼼히 적어야하는 것 같아요. 시험도 마찬가지고요!
학점은 적당히 잘 주시는 것 같아요. 좋았습니당"
인문사회계를 위한 수학 1,계승혁,21,Spring,5.0,"수학을 좋아하고 잘하지만 인문계를 온 학생들 중에 편안히 공부하고 좋은 학점 받아갈 생각 하신다면 들으세요.

편안히가 아니라 열심히 공부하고자 한다면 수학 1 수강을 추천합니다. 특히 고교 이과 미적분을 공부하고 온 입장에서 새로 배우는 내용이 너무 적은 것 같네요."
인문사회계를 위한 수학 1,계승혁,21,Spring,5.0,"유일하게 공개된 통계치 '기말고사 만점은 170점, 평균은 134점'. 성적은 대체적으로 잘 주시나 21년 1학기 기준 A+는 중간기말 합 220+/240 정도 받아야 하는 것으로 보입니다. 추후 수강생분들께 도움이 되었으면 합니다."
인문사회계를 위한 수학 1,계승혁,21,Spring,5.0,"2021년 1학기 기준 2000년대 촬영된 영상으로 수업 진행 (녹화강의), 출석은 그냥 공지사항 게시물에 일주일 안에 댓글 달면 됨. 고등학교 이과 수학(6~70%) + 그 범위 넘어서는 수학(2~30%) 내용 구성. 이영민 교수님 수업과 다르게 교재(교양을 위한 대학수학)에 충실한 편. 대신 교재가 은근 오류도 있고 특히 정답 및 해설이 아주 부실함.
평가는 중간 기말 각 35%, 과제 및 기타 30%인데 출석은 반영 안하는듯. 대신 결석 1/3 넘게 하면 F. 과제는 중간 기말범위 각 2회 총 4회인데 시간 꽤 오래걸리고 힘듦. 대신 시험과 관련있어서 공부한다고 생각하면 됨.
전통적으로 경제학부 학생들이 많이 듣는데, 친구랑 같이 들으면 서로 물어보는데 좀 편할 듯 싶으나 독강이면 하나하나 조교한테 물어보기도 뭐하고 어려움이 있을 듯.
성적 통계는 거의 공개 안하고 기말고사 평균점수만 알려줌. 이번학기는 총 50명대 수업에서 20명 가까이 드랍했는데, 확실히 고등학교 때 문과 수학 좀 했다고 해서 다 버틸만한 수업은 아님. 경수 수기응 경위수같은 과목처럼 전필도 아닌 교양이라 드랍 안한 사람들은 대체로 고여있음. 성적은 드랍자 포함으로 주시는듯. 다른 사람들이 드랍 많이하면 자드 못함.
대신 학점은 잘 주심. 상대적 위치에 비해 잘 주신다는 뜻이라 본인이 수학 잘한다고 생각 안하고 학점 생각하면 그냥 안 듣는걸 추천"
인문사회계를 위한 수학 1,계승혁,21,Spring,5.0,"인문계 학생이 다룰 만한 수학 범위를 한 번 쭉 훑는 데 의의가 있는 수업이라고 느꼈습니다. 수학을 원래부터 꽤나 하신 분들은 수업 동영상을 보고 복습만 조금 한다면 수월하게 따라갈 듯 싶고, 그렇지 않은 분들도 교재를 꼼꼼하게 읽다보면 이해가 어렵지는 않을 것 같습니다. 다만 과제가 총 4회로 자주 있는 편이고, 정확하게 풀이를 쓰는 과정이 약간 까다로웠습니다. 그래도 그 모든 과정이 미화될 만큼 학점은 잘 주시는 것 같습니다. 대면으로 수업이 이루어졌다면 훨씬 장점이 많은 수업이겠지만, 비대면으로 이루어져 살짝 아쉬웠습니다."
인문사회계를 위한 수학 1,계승혁,21,Spring,5.0,학점 잘 주시고 수업도 흥미롭습니다. 문제 푸는 과제가 있지만 어차피 시험 공부하려면 풀어야하는 문제들이라 부담스럽지 않습니다.
인문사회계를 위한 수학 1,계승혁,21,Spring,5.0,"문제풀이 숙제 4회 정도 있기는 한데 강의 들으면서 미리 풀어놓으면 크게 부담은 안 됨. 다만 풀이 과정을 꼼꼼하게 쓰는 걸 요구하셔서 귀찮기는 함.
출석체크는 매 주 들어야 하는 강의 범위와 관련된 이야기를 올려주시는 곳에 소감 적는 건데 큰 부담은 안 됨. 다만 주차가 지나갈수록 늘어나는 드랍자 수와 줄어드는 댓글 수를 볼 수 있음.
그래도 설명도 잘 하시고 학생들이 조금이라도 똑똑해지길 바라시는 느낌이 들어서 한 학기 동안 재밌게 잘 들었음. 학점도 잘 주시니 강추!"
인문사회계를 위한 수학 1,계승혁,21,Spring,5.0,교양치고는 확실히 수학이라 문제푸는 숙제가 많습니다 꽤 시간이 걸려요. 그래도 내용은 녹강기반이라 따라갈 수 있는것 자체가 좋은 것 같아요.. 경제학부는 하면 추후 수업들의 이해에 있어서 직접적인건 아니지만 분명 도움은 됩니다. 학점은 아직 안나왔습니다만 그렇게 나쁘게 주실것 같지는 않습니다. 뒤로갈수록 좀 어려워져서 드랍자가 꽤 많거든요.
인문사회계를 위한 수학 1,계승혁,21,Spring,4.0,숙제가 조금 많긴하지만 강의력 좋으시고 깔끔하십니다.
인문사회계를 위한 수학 1,계승혁,19,Fall,3.0,"교수님 유머가 좋고 인간미를 보이셔서 그나마 웃으면서 들었던 수학수업. 수업 스타일은 적은 범위를 꼼꼼히 하기보다 넓은 범위ㅡ뺄거 빼고ㅡ 를  광범위하게 해서 못 끝낼 것 같앗던 책 한 권을 끝을 보긴 하는 방식. 수업시간에 이거 시험에 낸다 하신 건 진짜 내심. 조교가 문풀하는 시간 잇는데 그때 풀어준 문제도 꼭 하나씩 시험에 나옴. 중간중간 문풀 과제 6번 걷고, 시험도 3번이나 쳐서 할 것은 많앗지만, 내용 자체를 자세하게 파고들진 않아서 공부가 어렵진 않앗당"
인문사회계를 위한 수학 1,계승혁,19,Fall,4.0,"수업 내용이 2차시험까지는 적당히 공부하면 따라갈만했던 것 같아요 3차는 열심히 죽어라 해야됐구,,"
인문사회계를 위한 수학 1,계승혁,19,Fall,5.0,교수님 친절하시나 조교 한 분이 까칠하십니다.
인문사회계를 위한 수학 1,계승혁,19,Fall,5.0,"교수님 진짜 귀여우심
성적 잘 주심
수업 생각보다 재밌음"
인문사회계를 위한 수학 1,계승혁,19,Fall,5.0,"교수님이 귀여우시다
시험 완전 못본줄알았는데 학점을 생각보다 잘주신다"
