인문사회계를 위한 수학 1,이영민,21,Fall,1.0,"명강도 아니고 꿀강은 더더욱 아님
시험 보고 학점 나오면 생각이 바뀔까봐 미리 평가함.
전반적으로 수업이 교수의 독백을 우리가 듣고 있는 느낌임. 학생에 대한 배려 따위는 눈꼽만큼도 없음.

1. 수업시간따위 지키지 않음. 기본 5-15분씩 늦게 끝내고 마지막 날에는 30분 넘게 늦게 끝내줌. 시계를 못 봤다면 또 몰라, 시간 넘은 것을 알고 있으면서도 지키려는 의지가 전혀 없음. 다음 수업 있는 학생들이 일어나서 짐 싸고 나가는데 절대 신경쓰지 않음. 쓸대없는 말만 줄여도 시간 안에 끝낼 수 있지만 그러지 않음. 마지막날까지 오바타임 하는거 보고 미치는 줄 알았음
2. 수업이 의식의 흐름대로 진행됨. 수업 자료를 그대로 읊는 교수도 별로지만 준비를 전혀 안 해오는 교수는 더 별로라는걸 깨닫게 해준 강의임. 교수님이 워낙 똑똑하셔서 준비 안 하고도 수업을 진행할 수 있는건 알지만 수학 수업인 만큼 생각나는 대로 풀다 보면 과정이 이상하거나 답이 이상한 경우도 있음. 예시가 생각나지 않아서 고민하는 경우도 있었고 상수랑 수식이 섞여서 상수 c와 cos를 혼동하신 경우도 있었음. 그리고 본인이 생각나는 대로 추가 내용을 설명하시다 보니 강의 전체에 흐름이 없음. 뭘 가르쳤고 뭘 안 가르쳤는지도 모르심. 책 순서대로 진도를 나가는 것도 아님. 진짜 교수님 마음대로
3. 글씨를 잘 못 쓰시고 글자가 너무 작음. 둘째줄에만 앉아도 알아볼 수가 없음. 본인도 이 사실을 알고 계심에도 전혀 개선하려는 노력이 없고, 따로 강의 자료를 나눠주는 것도 아니라 수업이 그냥 암호 해독 수업같음
4. 대면 수업 강행, 백신 접종 배려 없음. 확진자가 많이 나와 시험도 비대면으로 돌리는 수업이 많은 와중에 끝까지 대면수업을 강행함. 미술/체육 수업이나 외국어 수업처럼 대면 수업이 꼭 필요한 과목이 아님에도 학생들에게 물어보지도 않고 대면 수업을 함. 백신 결석은 인정 해주시나(애초에 출첵을 안 하심) 수업 자료가 없고 수업 녹화를 안 하기에 수업을 쌩으로 날려먹어야 함. 물론 녹화를 안 하는 수업들이 많은건 알고 있음. 그러나 책이나 강의 자료도 없이 그냥 하는 수업 중에 이렇게 조치를 전혀 안 하는 수업은 처음임.
5. 이유 없이 늦은 종강. 14일이 기본 종강인 상황에서 16일까지 수업하고 17일날 시험봄. 연휴 휴강에 대한 보충은 이미 해놓고 이유 없이 종강이 늦은 것도 어이가 없음.

배우는 내용은 많지만 내용이 그닥 쓸모있는 것도 아니고 정리되어 있지도 않으며, 배우는 과정에서 너무 스트레스 받아서 절대 추천하지 않는 수업."
인문사회계를 위한 수학 1,이영민,21,Spring,4.0,인문사회계로서 수학에 대해 많은 것을 배울 수 있었음. 시험 때 시간은 필요에 따라 넉넉히 주시니 최대한 진득하게 풀고 있는 게 중요할듯 비마 밑으론 거의 안주시는듯하다
인문사회계를 위한 수학 1,이영민,21,Spring,5.0,정말 배워갈게 많은 강의입니다. 이과수학과 그를 넘은 범위까지 다루시니까요. 과제도 없어서 시험기간때 빡세게 공부하면 좋은 학점 받을 수 있습니다
인문사회계를 위한 수학 1,이영민,21,Spring,4.0,"자드 절대 불가
그러므로 꼼꼼히 들을 것
수업은 매우 열정적이심
다만 교재 진도를 중구난방으로 나가셔서 벼락치기하다간 지옥을 맛볼수있음"
인문사회계를 위한 수학 1,이영민,21,Spring,5.0,"다항함수 외의 미적분을 처음 배우는 문과생이라면 꽤 어렵게 다가오겠지만, 깔끔한 강의력 덕분에 언젠가 해야 할 공부라면 지금 시작하기 딱 좋은 간단한 강의. 또한 기말 시험에서 자신의 수학적 감각을 가늠해볼 수 있다."
인문사회계를 위한 수학 1,이영민,21,Spring,5.0,중간 q3+25.5 기말 q3+23.75 A+ / 교수님이 진짜 좋으신 분입니다. 처음에는 어려운 내용이 많아 질문을 많이 했는데도 귀찮아하지 않으시고 오히려 격려해주셔서 너무 감동받았습니다. 기출을 올려주시기 때문에 기출 한 번 풀어보시고 수업 복습만 하면 좋은 학점 받는게 어렵지 않습니다. 채점기준이 명확해서 수업뿐만 아니라 시험에서도 얻어가는게 너무 많았고 교수님 인품이 너무 훌륭하십니다.
인문사회계를 위한 수학 1,이영민,21,Spring,4.0,"B+
다시 듣는다면 청강한다. 수업은 재밌지만 성적은 그닥 재밌지 않음."
인문사회계를 위한 수학 1,이영민,21,Spring,4.0,정말 알차고 재밌는 수업입니다. 근데 내용이 너무 헤비해서 다른 수업과 병행하기 힘들었던 것 같습니다. 들으시려면 각오하세요..
인문사회계를 위한 수학 1,이영민,21,Spring,4.0,"교수님께서 수학에 대한 열정이 엄청나시고 고등학교 때는 접해보지 못했던 다양한 내용들을 알려주셔서 의미 있는 수업이기는 하지만 그만큼 열심히 해야 어느 정도의 성적을 받을 수 있는 것 같습니다. 이번 학기에는 이과 미적분 관련된 내용보다 해석학 내용이 훨씬 많았던 것 같아요. 중간고사는 배웠던 개념, 증명을 얼마나 제대로 알고 있는지, 그리고 그 개념을 이용하여 조금의 응용을 할 수 있는지 위주로 문제를 내시고, 기말고사는 수업시간에 알려주시는 공식들을 토대로 심화 응용을 할 수 있는지 묻는 문제들이 대부분입니다. 얻어가는 것은 많지만 그만큼 열심히 노력해야 하는 강의라고 생각합니다."
인문사회계를 위한 수학 1,이영민,21,Spring,4.0,"이 앞. 절망 있음.

셤 이틀 전까지 사랑하던 강의.
셤 이틀 전에 고등학교 미적분을 한 큐에 끝내는 강의.(보강으로.)
그래도 재밌었다. 
q3+0.5, q2+4
a-"
인문사회계를 위한 수학 1,이영민,21,Spring,5.0,수업 재밌구 내용도 흥미로움 열심히 하면 점수도 앵간 받을수 있음 본인은 중간 열심히하고 기말때 시간없어서 몰아 듣다가 망했더니 학점은 좋지 않았지만..... 교수님 강의력이 좋으셔서 재미는 있었고 수업들은거 후회는 안함
인문사회계를 위한 수학 1,이영민,21,Spring,5.0,"교수님 감사합니다
깔끔한 수업에 시험 평가방식도 전 좋아요
시간에 쫓기거나 그런것없이 아는대로 쓸수있어요"
인문사회계를 위한 수학 1,이영민,21,Spring,4.0,"갓영민
수업이 진짜 너무 재밌음
내 머리는 안 재밌음...
그래도 시험 한 4일전부터 빡세게 몰아서 복습하니까 A는받았음
이미 다른 분들도 얘기하셨지만.. 과제도 출석도 없고 오직 수업 두번으로 평가함. 더 재밌을수도 있었을텐데... 너무 다른 얘기를 많이 하시다가 진도를 늦게 나가서 아쉬웠음...ㅠㅠ 미적분을 제대로 배우고 싶었는데 정수론?을 더 많이 배운듯... 그렇지만 강의력 짱이고 정말 좋다!! 비상경사회대생이고, 수학을 잘하지는 못하지만 좋아해서 들었음. 후회X"
인문사회계를 위한 수학 1,이영민,17,Spring,3.0,"문과라 그런지 몰라도 수학이 꽤 어려움;
중간 Q2 밑이길래 자드하려고 기말 던졌는데 비쁠 나옴
성향은 잘 맞았는데 내용이 넘 어려웠음"
인문사회계를 위한 수학 1,이영민,20,Fall,5.0,"로드: 대면 중간시험, 대면 기말시험

평가방식: 대면 중간시험과 대면 오픈북 기말시험으로 평가합니다! 시험 문제는 etl에 올려주시는 족보로 파악해볼 수 있어요! 족보와 유사한 문제가 나오니만큼, 족보 풀어보는 건 필수! 아 맞다, 시험 시간이 중간 3시간, 기말 4시간이었으니 초콜릿 준비를 하시면 좋아요... 

수업방식: 강의식으로 수업을 진행합니다! 실강 수업이에요. 고등학교 때 수학을 좋아한 친구라면, 인사수를 적극 추천합니다! 범위는 이과 수학 ~ 미적분학 기초(ex-테일러 방정식)를 다룹니다. 내용이 어려우니 낯설고 힘들어서 욕하면서 배우긴 했으나, 수업을 수강하고 나니 수학을 공부할 기초를 쌓은 느낌이었어요! 만약 관심 있으시면 제가 적극 도와드릴게요!! 

학점: 극악한 교수님 ^^.. 절대 C+ 안주십니다. 비마까지 꽉꽉 채워서 주시는 교수님..

한줄평: 수학을 좋아한다면, 이건 꼭!"
인문사회계를 위한 수학 1,이영민,20,Fall,5.0,"교수님 말씀처럼 힘들게 등산할 때는 아무것도 눈에 안 들어오지만 오르고 나면 이런 풍경이 있었구나 알게 되는 강의입니다!
이번 학기 기준으러 힘겹지만 따라갈 수 있는 내용이고 정말 배우는 건 많습니다. 결론적으로 저신이 얼마나 수학에 진심인지 변별할 수 있는 강의라고 생각해요.
그리고 어떤 식으로든 이과 수학 베이스가 있는 학우들이 유리할 수밖에 없는 것은 사실입니다."
인문사회계를 위한 수학 1,이영민,20,Fall,5.0,"학점을 잘 주지만 꿀강은 아닌  강의, 또한 부정할 수 없는 명강. 교수 중에서는 탑클래스라고 확신하는 강의력. 무엇보다 재밌음. 선대들으러 간다!"
인문사회계를 위한 수학 1,이영민,20,Fall,5.0,이번학기에는 해석학스러운(?) 내용을 거의 안가르치셔서 좀 나았던거 같긴 합니다만 어쨌든 강의평만큼 어렵지는 않았습니다. 수업 내용에서 시험이 거의 그대로 나오기때문에 수업내용을 숙지하고 수업에서 든 예시들을 외워두다시피 하는게 중요합니다. 저는 수학을 잘하는 편이 아닌데도 시간투자를 많이하여 최고점을 받았습니다. 한학기동안 고통스럽기도 했지만 돌이켜보면 얻는게 참 많은 강의였고 나중에 영민교수님 수업을 더 들어볼 생각입니다.
인문사회계를 위한 수학 1,이영민,20,Fall,4.0,정말 어렵지만 그만큼 얻어가는 게 많은 강의였습니다! 남은 게 많은 거 같아요. 공부를 하는 과정이 조금 벅찼지만 듣길 잘했다고 생각 중입니다 다만 수학을 조금이라도 좋아하는 분이 들으셔야 좋을 거 같아요 전 수학을 좋아한다고 생각했는데도 몇 번이나 그만 두고 싶었습니다..
인문사회계를 위한 수학 1,이영민,18,Spring,5.0,"빛-영민...
진짜 얻어가는 거 많은 수업이에요 
특히 상경분들은 들어보시길"
인문사회계를 위한 수학 1,이영민,20,Spring,5.0,어려움 재밌음 시간 투자 많이해야함 하지만 지금 아니면 수학 언제 배워보겠어요 들읍시당
인문사회계를 위한 수학 1,이영민,20,Spring,2.0,너무 어렵습니다. 수업의 절반이상이 교재내용 밖인데 전부 시험범위입니다. 단순히 이과 고등학교 수학정도라고  생각하고 가면 큰코 다칩니다.  숙제는 없지만 수업 내용을 이해하고 따라가는 것 자체가 시간이 엄청 소모됩니다.
인문사회계를 위한 수학 1,이영민,20,Spring,4.0,"일단 너~무 어렵습니다.ㅠㅠ
교재 밖 내용까지도 설명을 하셔서 따라가기가 힘들기는 하지만 시험은 딱 수업내용에서 숫자 바꿔 나오는 정도입니다. A대 받기가 어렵지는 않아요..  단순히 호기심이나 '고등학교 때 나는 수학 좀 잘했어'라는 마음으로 선택할거면 .. 말리고 싶네요"
인문사회계를 위한 수학 1,이영민,20,Spring,5.0,"이번학기 에타에서 핫한 걸로는 생실 뒤를 이은 그 교양!!! 보강을 9시간 때린 그 교양!!!이지만 정말 저는 이 수업 들으면서 너무 즐거웠습니다. 배운 것도 정말 많고, 배운 것 만큼 열심히 공부하니 에이쁠로 보답받은 것 같습니다.  저같은 경우 중간 123,  기말 118정도 받았는데, 한 상위 15프로 선이면 에이쁠을 주시는 것 같습니다. 다만 수강하시는 분들은 주의하셔야하는게, 교수님은 여러분의 자드를 정말 싫어하십니다. 기말고사가 백지여도 비마를 주시는 영민좌.... 수강신청하셨다면 자드 말고 공부를 선택하세요. 워낙 절대적 점수컷이 낮아서,  충분히 q2선 언저리 정도는 엎을 수 있습니다."
인문사회계를 위한 수학 1,이영민,20,Spring,5.0,"개돼지가 아니라면 이정도는 알아야 한다. 공감합니다. 
이해가 될때까지 공부하다보면 정말 희열을 맛볼수 있다."
인문사회계를 위한 수학 1,이영민,20,Spring,5.0,"일단 저는 중간고사 Q3 5점 정도 넘기고(문제 하나치 점수), 기말고사는 Q3를 18점 넘겨서 (문제 세개 반 치 점수, 사실 여기서 거의 에쁠 확정) 에쁠 받았습니다! 교수님 감사합니다 ㅠ
수강자 성향: (내용은 전혀 그렇지 않지만) 대학교에 온 인문사회계열 학생들을 위한 수학 수업을 지향하기 때문에 1학년 학생이 많은 편이고, 그렇다고 재학생이 적은 것은 아닙니다. 그중에서도 경제학부 학생들이 많은 편이더라고요. 
저는 고등학교에서 이과 수학을 배운 적이 한번도 없지만, 어떠한 곳에서든 이과수학을 경험한 분들이 조금 더 유리하거나 공부에 수월한 면이 있지 않을까 싶습니다...! (저같은 노베도 노력하면 에쁠이 나오기도 해요) 
배우는 것 및 시험: 이번학기는 코로나 사태로 비대면으로 진행되어 2019학년도 대비 양이 좀 줄었다고 하시던데, 그래도 많았습니다ㅠ 여기에 이걸 다 나열해도 당신의 공부에는 소용이 없어요 매년 조금씩 내용과 범위, 출제 포인트가 바뀌니 그때그때 수업 열심히 듣고 복습 잘하는 게 최선인듯! 내용은 확실히 어렵긴 합니다. 
중간고사의 경우 개념과 증명을 열심히 암기하면 어려운 편은 아니었고, 기말고사가 찐 응용 ㅎㅎ 그래도 필기 열심히 하면 그대로 적을 수 있는 문제들도 꽤 내신 것 같았어요!
로드: 명목적인 로드는 0 (그냥 중간기말만 있음)이지만, 실제로 내용을 이해하고, 복습하는 데에 상당한 시간이 걸립니다. 
학점: A0 이상의 학점을 노리시는 경우에는 잘 주시는 편은 아닌 것 같아요! 제가 중간기말 합 Q3를 23점이나 넘겨서 잘받은 편이고 에타 보니까 저보다 두문제 가량(10점 정도) 더 틀리신 분은 에제 나온 걸 보면 4.0이상의 학점은 잘라 주시는 듯.. 하지만 나머지 인원을 모두 A- 부터 B-_로 뿌려 주셨답니다! (교수님이 이번에 자드 관련해서 언지를 주셨는데 그것땜에 재수강 기회를 주지 않고 다 비마행 ㅠㅠㅠ 자드러들 진짜 불쌍하긴 했어요 ㅠ)
그 외 기타 중요사항: 1. 교수님께서 중간기말 기출문제를 직접 주시는데, 기출 숙지만 해도 비슷한 느낌의 문제가 반복되는 경향이 있어요.  2. 교수님 항상 수업 늦게 끝내십니다... 그냥 뒤에 연강 잡지 마세요.."
인문사회계를 위한 수학 1,이영민,20,Spring,5.0,솔직히 시험은 어렵지만 강의평 본 사람들은 애초에 그런걸 감안해서 수강신청했어야 했다고 생각함. 강의력은 최고고 이번 학기 비대면이라 더 많은 것을 못 배운 게 아쉬울 따름.
인문사회계를 위한 수학 1,이영민,20,Spring,4.0,존버는 승리합니다! 로드 적은 학기에 듣기를 추천합니다. 성적 잘받으려면 중간기말 공부에 시간을 충분히 써야되기 때문에... 수학 잘한다 싶은 사람들끼리 공부하는건데 교수님은 정말 난도에 상한이 없습니다... 수강신청 할때로 돌아가면 다시 신청은 안할 것 같지만 만약 신청했으면 끝까지 존버하세요 꼭! 그래도 소소한 장점은 수학 가형 풀 수있어요ㅋㅋ
인문사회계를 위한 수학 1,이영민,20,Spring,5.0,"물론 정말 힘들고 따라가기 벅찬 강의였지만, 지나고 보니 남는건 가장 많은 수업이었습니다. 수학을 좋아하는 문과생이라면 꼭 들어볼만한 강의라고 생각합니다. 이영민 교수님 감사합니다!"
인문사회계를 위한 수학 1,이영민,20,Spring,3.0,"영민좌의 강의에 대한 열정은 대단하시고 강의력도 좋으신 편입니다. 다만 보강 3시간 3회는 선을 좀 넘으셨다는 생각이 들긴 했습니다. 
암튼 교수님은 정말 좋으십니다. 그러나 강의가 워낙 빡셉니다. 능력이 되어 많은 걸 얻어가는 분도 계시지만 여러분이 반드시 그 사람이 되리라는 보장은 없다는 것을 염두해두시길 바랍니다. 전자면 정말 좋겠지만 후자의 경우 한학기 내내 이 과목으로 스트레스 받으셔야 할겁니다."
인문사회계를 위한 수학 1,이영민,20,Spring,5.0,"솔직히 갓직히 배우는 내용의 흥미로움이나 교수님 강의력 면에서는 탑입니다. 교수님 열정도 정말 대단하시고 강의도 정말 알아듣기 쉽게 잘해주십니다.
다만 넘치는 열정으로 한 학기동안 다루시는 내용이 조금 많은 편이라 아래의 수많은 원성(...) 이 있는 것 같네요.... 그래도 수학을 좋아하는 문과생이라면 꼭 들어볼만한 수업이랍니다. 얻어가는 게 많아요."
인문사회계를 위한 수학 1,이영민,20,Spring,4.0,"중간 보고 바로 자드한건 훌륭한 선택이었다.
2학기때 다시 봅시다!"
인문사회계를 위한 수학 1,이영민,20,Spring,2.0,흠.....좀무라고 해야하나... 내가 멍청한건가.... 나만 이해못했나.... 솔직히 일반고에서 와서 더 그런지 몰라도 진짜 힘들었다... 첫학기에서 투자하는 단위 시간당 점수 아웃풋이 가장 안 좋은 과목.... 내가 수학에 소질이 없는 거일수도 있는데.... 일단 듣고 싶으시면 그전에 이과 수학은 한번 풀어보시는게....음... 좋지 않을까 사료됩니다. 뭐 저라면 굳이 들을 필요까지야 있나???라고 생각하(게 됐)지만... 뭐 저도 다들 그렇게 얘기해주실 때 무작정 수신했으니 뭐 들으시겠다면 막지 만은 못하겠네요.... 일단 교수님은 수학을 사랑하십니다.... 저는 수학을 사랑하지는 않습니다.... 예... 뭐.....흠...... 그래서 수학을 정말 학문으로 사랑하시고 싶으신 문과생이라면 들어보셔도 된다고 말씀은 드릴수도 있을....것.....같네요....예.....어쨌든 많이 힘듭니다... 각오하고 들으세요...
인문사회계를 위한 수학 1,이영민,20,Spring,5.0,"알려주고 싶어하시는게 매우 많아 수업시간 풀로 채우면서도 보강도 많이 하심
수업내용 굉장히 방대해서 공부 착실히 해야함
그만큼 배워가는것도 많고 교수님 열정도 너무 좋았음
신세계의 입구를 맛볼수있음
힘들긴하지만 과거로 돌아가도 다시 선택할 강의."
인문사회계를 위한 수학 1,이영민,20,Spring,3.0,밑친구랑 ㄹㅇ 똑같음 자사고에서 수학하면 나였는데 중간고사 점수보고 출첵도 안하고 있다ㅋㅋ
인문사회계를 위한 수학 1,이영민,20,Spring,3.0,"나는 고등학교 때 수학을 매우 잘했다. 자사고에서 수학으로 날 따라올 친구가 없었다. 자연스럽게 난 인사수를 선택했다. 결과는
엌ㅋㅋ 재수강할라고 출첵도 안함ㅋㅋㅋㅋ루삥뽕"
인문사회계를 위한 수학 1,이영민,20,Spring,2.0,"s...t....a...y...

타 대학 수학과 2~3학년 이상 친구들도
""이게 왜 '인문사회계'를 위한 수학이야? 나도 잘 못하겠는데?""
하고 측은한 표정으로 혀를 차는 강의

2020-1 기준 보강 3시간씩 3회 총 9시간
개인적으로 수학 좋아해서 잘 들은 강의다만,
보편적인 기준으로는... 죽어나가는 수업
다시 말하지만 왜 '인문사회계'를 위한 수업인지 그 이유를 모르겠음"
인문사회계를 위한 수학 1,이영민,20,Spring,4.0,"강의 따라가실수 있다면 꿀강입니다. 다만 수업의 흐름이  되게  힘듭니다ㅠㅠ 따라서  초월함수 등에 대해 어느 정도 경험이 있거나  수학에 흥미가 있으신 분들에게 추천합니다! (교재를 병행하시는게 정신에 이로울듯합니다)
그래두 교수님께서 전보다 학생들의 학점을 후하게 주시려 하는것같아 버티면 명강+약긴의 꿀이 될듯합니다~"
인문사회계를 위한 수학 1,이영민,20,Spring,4.0,"강의 내용 자체는 남는게 많고 흥미롭습니다.
하지만 이 강의를 들으실거면 바로 뒤에 연강은 잡지 않으시길 권해드립니다."
인문사회계를 위한 수학 1,이영민,20,Spring,4.0,"교수님께서  열정 넘치시고 강의도 흥미로웠습니다. 다만 강의를 너무 열심히 하시는 바람에 10분, 20분 정도 수업을 더 하시는 경우가 많았습니다. 싸강이라 다음 수업 듣기가 조금 애매했어요. 판서 읽기가 힘들 수 있고 진도도 빠르게 나가시지만 배우는 건 많은 것 같습니다."
인문사회계를 위한 수학 1,이영민,20,Spring,4.0,"개인적으로는 좋습니다. 사이버강의임에도 딱히 불편함은 없고, 강의력 또한 훌륭하십니다.
다만 이 강의를 들어라라고는 못하겠는게, 매우 어렵고, 딱히 인문사회계 진로를 위한 수학은 아닌 것 같습니다."
인문사회계를 위한 수학 1,이영민,20,Spring,3.0,교수님이 교재와 상관없이 넓은 범위를 가르쳐주십니다. 수업은 흥미롭지만 사이버강의일 경우 비추합니다. 화질 문제로 필기가 안보여 어려움이 증가합니다.
인문사회계를 위한 수학 1,이영민,19,Fall,5.0,"강의 내용이 어렵긴 하지만 남는 건 많은 강의입니다. 질문 드렸을 때 답변도 꼼꼼히 해주시고, 수업 내용을 열심히 복습하면 문제 푸는 게 많이 어렵진 않습니다. 과제는 없지만 공부 자체가 로드인지라 전공 수준으로 갈아넣어야 하는 강의인데, 그래도 학점을 꽤 잘 주시니 존버하면 승리하실 겁니다."
인문사회계를 위한 수학 1,이영민,19,Fall,4.0,교수님 너무 귀여우시고 강의도 잘 해 주십니다. 조금 어려워서 못 따라가기도 했지만 어려운 만큼 남는 것도 많은 수업입니다. 열심히 하면 좋은 성적 받을 수 있으니까 한번 들어보시면 좋겠습니다!
인문사회계를 위한 수학 1,이영민,19,Fall,5.0,"방금 성적 떳네요
중간 기말 둘다 q3 조금 넘기니 에쁠 ㅜㅜ
이영민 교수님 사랑합니다 ㅜㅜ

교수님 강의력 정말 좋으시고 얻어가는 것도 정말 많은 강의입니다! 다만 다루는 내용이 정말 방대하고 빠르게 진도를 나가시기에 예습 복습 열심히 할 각오는 하셔야해요 ㅜㅜ 저는 이과수학을 이미 공부했었고 학기 중에 스튜어트 미적분이나 해석개론 책 등 가끔 참고하면서 공부하니까  시험 때 공부 별로 안해도 나름 잘 받은 거 같아요.. 수업 때 하시는 관련 주제 인터넷 검색해도 내용 많이 나오니 그것도 참고하시면 도움 많이 될거 같습니다

이번 학기에는 전반부에는 수체계 관련해서 순서공리,  체, 유한체, 해석개론 맛보기로 입실론델타, 실수의 완비성 공리,  최소상계 공리 등, 미적분 관련해서는 디리클레 함수, 토메함수, 리만적분, 그리고 르베그 적분과 측도론에 대한 간단한 아이디어, 집합론 관련해서는 카디널리티를 학습했습니다

후반부에서는  지수, 로그, 쌍곡함수, 역쌍곡함수,  삼각함수, 역삼각함수 등 초등함수의 미적분,  이와 관련한 테일러 전개,  삼각치환법 그리고 비초등함수인 감마함수에 대한 간단하게 배웠습니다. 그리고 이에 더해 아주 간단한 선형 미분방정식의 풀이법, 무한급수의 수렴판정, 오일러-마스케로니 상수, 복소지수함수의 개념,  복소평면,  드무아브르의 정리,  복소평면에의 정다각형 작도 가능성,  극좌표 미적분,  이중적분, 삼중적분의 개념,  구면좌표계에 대해  학습했습니다.
한 학기 동안 정말 방대한 내용을 나가는만큼, 얻어가는 건 정말 많았습니다 ㅎㅎ 교수님이 수업시간에 수학 관련해서 풀어주는 썰들(ex 세상에서 가장 아름다운 수식인 오일러 항등식,  미적분의 역사, 가우스, 오일러, 아르키메데스에 대한 이야기, 작도 불가능성 문제와 관련된 썰들)도 너무 재밌었습니다

문과생들 중에 수학을 좋아하고, 수학이 필요한 학과 or 진로를 생각하고 있는 학생들에게 정말 강력 추천합니다
학점도 잘라서 주시고 진도가 정말 빠르지만 빡세게 한다면 못할 건 없습니다

정말 최고의 강의였고 내년에 수학이나 선대 여시면 그때도 이영민 샘 강의를 들을 생각입니다 ㅎㅎ 
한 학기 동안 정말 감사했습니다 교수님!"
