인문사회계를 위한 수학 1,이영민,23,Spring,5.0,"어차피 난이도에 대한 설명은 강의평들의 반응만 봐도 알 수 있으므로 논외로 하고, 교차러(미적러)가 이 수업에 얼마나 유리한지 말씀드리려 합니다. 보통 1학년 분들이 많이 들으시니까요.

중간, 기말로 나눠서 이야기드리면
중간: 0 ~ ε(입실론)% 유리
기말: 30% 정도 유리

 먼저 중간고사 범위에서는 고등학교 미적분을 배웠다고 해서 유리한게 없습니다. 이 교수님 수업 들어본 사람들은 입실론이라고 쓴 이유를 알겁니다. 그저 수학에 좀 더 친숙하다는 점 정도가 도움됩니다. 순수 대학수학 내용 위주로 수업나갑니다. 기말 범위에선 그래도 초월함수에 익숙하다는 점이 도움 많이 됩니다. 고등학교에서 배운 테크닉은 따로 공부안해도 된다는 점에선 유리합니다. 하지만 어차피 수업은 그거 따따따블 수준으로 나갑니다.

 결론. 문이과 불문하고 어차피 수학 좋아하고 열심히 하는 사람한테 유리합니다. 모두가 첨 들어본 내용들 위주로 수업을 나가기 때문입니다. 서울대생으로서 내 한계를 도전해보고 싶다면 추천하는 강좌입니다. 수학에 대한 흥미가 있는 사람이라면 재미가 없을수 없는 수업입니다."
인문사회계를 위한 수학 1,이영민,23,Spring,1.0,드랍하러 갔는데 계속 듣기엔 너무 늙은 것 같다고 말해서 상처받음. 그때 23살이었는데 고학번이긴 해도 강의 하나 듣기에 늙은 나이가 어딨나...ㅡㅡ 백세 시댄데 교수님이 말을 좀 막하는 것 같음
인문사회계를 위한 수학 1,이영민,23,Spring,5.0,"저는 우리 이영민 교수님을 조금 변호해 드리고 싶습니다.
""살면서 이런거 언제 또 보겠냐 하는 것을 한번쯤 보여주고 싶다."" 이 말씀이 교수님의 수업을 관통하는 하나의...원리라고 하면 좋을까요?
교수님의 의식의 흐름대로 수업하는 것에 대한 불만 섞인 강평을 몇 개 보았습니다만, 교수님의 수학에 대한 열정과 더 많이 가르쳐주고자 하시는 의지를 고려한다면, 교과서의 수순을 따라가지 않는다는 것이 교수님의 수업에 한 치의 흠이라도 될 수 없다는 것을 확신할 수 있습니다.
더불어 난도가 지나치게 높다는 지적에 대해서도, 높은 난도를 정당화하는 교수님의 전달력과 강의력이 버티고 있다는 점을 상기하고 싶습니다. 대치동에 던져놔도 안 꿀려요 진심. 또, 높은 난도의 내용을 가르치시더라도, 그 모티베이션이 ""고등 수학에서 나오는 개념들을 왜 가르치는 것인지, 그 배경에는 어떤 문제들과 테크닉이 깔려있는지""이기 때문에 뜬금없다는 생각이 전혀 들지 않습니다. 만약 뜬금없다는 생각이 드신다면, 아직 이해가 덜 된 것이므로 다시 한번 읽어봐 주세요. 
글씨가 작아서 안 보인다는 지적에 대해선 할 말이 딱히 없네요. ""앞자리에 앉아서 보세요.""
다만, 교재는 구매하지 않으시는걸 추천합니다. 차라리 미적분학1을 구매해서 레퍼런스 용도로 보세요."
인문사회계를 위한 수학 1,이영민,23,Spring,5.0,"수학에 관심있는 사람은 정말 재밌게 들을 수 있는 강의, 다만 난의도가 높기에 공부한만큼의 성적이 따르지 않을수도 있음"
인문사회계를 위한 수학 1,이영민,22,Spring,4.0,"수학을 좋아하기도 하고 경제학에 쓰일 수학을 미리 학습하고 싶어 수강했습니다. 결론부터 말씀드리면 경제학과는 거리가 조금 있고 상당히 빡센 교양입니다. 중간은 판서 내용 위주로 출제되어 정리를 제대로 암기하는 전략, 기말은 교재 문제들을 응용해서 출제되어 문제를 많이 풀어보는 전략을 가져가야 좋은 성적을 받을 수 있습니다. 교수님께서 하나라도 더 알려주려는 의욕이 강하셔서 수업 시간을 종종 넘기면서 설명하십니다. 공부를 열심히 하면 얻어가는 것이 많은 강의입니다. 시험 100%로 승부를 보겠다 하시는 분들은 추천드립니다."
인문사회계를 위한 수학 1,이영민,22,Fall,5.0,"학교 측의 실수인지는 모르겠지만 모종의 이유로 이번 학기는 5명이서 소규모로 진행했던 수업입니다. 첫수업때 저밖에 안 들어와서 폐강 위기라고 하셨을 때는 놀랐지만 어찌저찌 수업은 진행 되었습니다. 사실 저는 수학 정말 못하는데, 그럼에도 강의를 정말 즐겁게 진행해주셨고, 많이 배려해주셔서 한 학기 내내 감사했습니다. 공부를 소홀히 했던 제가 너무 죄송스럽네요. 오늘 시험에서 제대로 풀지 못해 죄송했습니다. 이영민 교수님 최고….!"
인문사회계를 위한 수학 1,이영민,22,Spring,4.0,수업을 듣고보면 정말 '인문사회계'를 위한 수업이 맞는지 궁금해지는 난이도... 그럼에도 많은 것을 얻을 수 있는 강의입니다. 수학에 자신있는 분들만 수신하시길
인문사회계를 위한 수학 1,이영민,22,Spring,4.0,"전반적으로 어렵지만 얻어가는 것은 많은 강의
수학을 좋아하는 문과생이라면 충분히 들어볼만함"
인문사회계를 위한 수학 1,이영민,22,Spring,3.0,"중간에 드랍했지만 드랍 전까지 느낀 강의평 남기겠습니다.
계산 위주의 수학이라기보다는 증명과 수학에서 당연시 하게 넘어갔던 부분을 꼼꼼하게 재확인하는 강의라고 생각합니다. 미적분을 배웠다면 초반에 쉽게 따라갈 수 있을 거라고 생각합니다. 그러나 증명과 하나하나 꼼꼼히 따져보는 걸 귀찮아하시는 분이라면 정~말 비추합니다. 그리고 교수님께서 앞에서 판서하시는데 뒷자리에 앉으면 잘 들리지 않습니다. 강의노트같은 것들이 제공되지 않기에 유의해야할 것 같습니다."
인문사회계를 위한 수학 1,이영민,22,Spring,5.0,"중간고사 범위는 교재 외에 있는 내용에서 힘줘서 내는 편이고, 기말고사 범위는 교재 내에 있는 부분이 많이 나옵니다. 판서가 잘 보이진 않지만 강의력이 좋으셔서 수업에 몰입이 잘 됩니다
내용이 가볍진 않지만 여러 주제를 폭 넓게 강의 해주셔서 배워가는게 정말 많고 학점도 충분히 잘 주십니다! 힘들다는 강의 평도 많지만 수학을 좋아하셨던 분이라면 들어서 웬만하면 후회하지 않으실 것 같습니다!"
인문사회계를 위한 수학 1,이영민,22,Spring,5.0,"성적을 꽤 잘 주시는 편인 것 같습니다
중간: Q3+8
기말: Q3+17 
-> A+ 받았습니다"
인문사회계를 위한 수학 1,이영민,22,Spring,5.0,"경제수학 공부에 도움이 될 것 같아 수강했는데 그렇지는 않았습니다. 오히려 인사수 기말고사에서 경제수학 내용을 썼네요… 사실 수업도 따라가기는 쉽지 않습니다. 적어도 저는 강의 듣자마자 다 이해하지는 못했습니다. 그날 배운 것들을 바로 복습하는 것이 필수적인 듯합니다. 
 그럼에도 이 강의를 드랍하지 않았던 것은 그만큼 재미있었기 때문입니다. 솔직히 앞으로 살면서 한 번도 안 쓸 것 같은 내용이 대부분입니다. 하지만 지금까지 당연하게 여겼던 내용을 수학적으로 뜯어보고 그 과정을 이해하는 것은 형용하기 힘든 즐거움을 선사합니다. 평소에 수학 자체를 좋아했던 분들에게는분명히 만족그러는 경험이 될 것입니다.

 시험 어렵다고 들으신 분들이 꽤 있을인데요 문제 하나하나를 살펴보면 충분히 해볼 만합니다. 그러니 떠도는 소문만으로 이 강의를 거르는 우는 범하지 마시길 바랍니다.
  다만 성적을 잘 주시는지는 솔직히 모르겠습니다. 에제끼지는 많이 봤는데 에쁠은 정말 드뭅니다. 로스쿨 준비하시는 분들은 이 점 염두에 두셔야 할 겁니다."
인문사회계를 위한 수학 1,이영민,22,Spring,3.0,"일단.. 수학을 잘 하는것과 이 강의는 크게 연관성이 있는지 모르겠음..
일단 난 경제학부고 적어도 경제학에서 가장 수학적인 계산 위주인 미시경제, 경제수학 다 A+맞고 왔고 수능 수학도 100이니까 아 양학 씹가능이지 않을까 하고 들어왔는데 진심 그게 아님ㅋㅋㅋㅋㅋㅋ

물론.. 자만심에 공부 많이 안한 내 탓도 있는데
본인이 수학 좀 한다고 무조건 에제이상 뜰거라는 나같은 생각은 안 했으면 좋겠다 싶음

중간 q2-4.5
기말 q3-7.5
B+"
인문사회계를 위한 수학 1,이영민,22,Spring,5.0,"수학 좋아하면 로드없는 힐링 명강, 아니라면 시험 미친 빡센 강의.
출석은 안부르시지만 한 번이라도 안나갈시 다음 수업 따라갈 수가 없을 것. 시험은 확실히 빡세지만 그건 모두한테 동일하므로 하다보면 어떻게든 됨."
인문사회계를 위한 수학 1,이영민,22,Spring,4.0,"중간 q1과 q2사이 기말 q2 살짝 넘김 B+

확통 문돌이고 수능 수학도 그렇게 잘 본 편은 아닙니다 그렇지만 수학을 좋아해서 그리고 명강이라는 추천 때문에 듣게 되었는데 솔직히 말해서 인사수 때문에 1학기 삶의 질이 매우매우매우매우매우 낮았습니다 다른 수학 잘하는 분들을 보면서 벽을 느끼기도 했고 나만 이해 못하는건가 하는 생각도 들고 얘 때문에 시험 직전에 눈물 몇바가지 쏟고 그랬습니다 (지금 생각해보면 왜그랬나 싶은데 첫 학기라 고딩 마인드 못 벗어나서 그랬을지도) 그래서 별 하나 내립니다 .... ㅎㅎ .... 그렇지만 정말 .. 교수님 강의력 하나는 부정할 수 없이 미쳤습니다 떡밥 던지시고 나중에 회수하면서 미적분학?의 기본 틀을 가르쳐주셔서 너무 좋았습니다 수업은 진짜 한번도 안 졸고 재밌게 들었는데 ... 그치만 복습과 시험 공부는 너무 고통스러웠습니다 명목상 로드는 없지만 수업 완벽히 이해 + 문제 풀이까지 포함하면 로드가 없다고 말할 수는 없을 것 같습니다 그렇지만 이 강의를 들은 건 후회하지 않고 더 열심히 수학 공부하고 싶다는 의지가 생겼습니다 자드 안되는 과목으로 알고 있어서 중간 시험 보고 닥치고 기말 잘봐야겠다하고 공부 열심히 했는데 시험 전날에 이제부턴 C도 주신다고 하길래 제발 C는 안받고 싶었는데 B+을 주시네요 학점은 엄청 후하신 거 같습니다

시험은 중간고사는 대부분 증명을 암기해야하고 기말은 오픈북이지만 훠어어얼씬 어렵습니다 .. ^^ 시험 1주 전쯤에 족보 나눠주시고 족보에 있는 문제 그대로 내는 거에 아무런 양심의 가책 못느낀다고 말씀하시니 족보도 꼭 풀어보세요! 학점 리스크를 감수하고도 수학에 대한 열정 있으면 추천합니다 수학 잘하면 더할 나위 없이 좋고요 ~ 일단 난 아니었음 
++) 그리고 저 같은 사람 있을까봐 ... 중간 심하게 조졌어도 기말 비중이 더 크고 기말 때 다같이 못보니까 열심히 공부하시면 만회할 수 있습니다"
인문사회계를 위한 수학 1,이영민,22,Spring,4.0,"솔직히 쉽지는 않습니다. 그치만 배워가는 게 그만큼 많습니다. 
A가 꼭 필요하신데 나는 미적 선택자가 아니었고 수학에 대한 이해력이 탁월하지도 않다(고등학교 기준 아니구요 서울대 학생들과 경쟁하는 사이에서도 탁월할 수 있는지를 말하는 겁니다.) 하시는 분들은 예복습 일주일에 한번이라도 꼭 하시는거 추천드려요. 교재 문제도 꼭 다 풀어 보시기를 권합니다."
인문사회계를 위한 수학 1,이영민,22,Spring,5.0,"신 그는 이영민인가?
신 그는 이영민인가?
신 그는 이영민인가?"
인문사회계를 위한 수학 1,이영민,22,Spring,5.0,"이영민 그는 신인가?
이영민 그는 신인가?
이영민 그는 신인가?"
인문사회계를 위한 수학 1,이영민,22,Spring,3.0,다른건 모르겠고 판서가 좀 이런말해도될지 모르겠지만 *떡같으셔서 한학기 내내 열받았음 수학 빡대가리라 수업때 이해 못하고 집가서 복습해야되는데 판서가 그래서 복습에 시간 세 배로 듦 성적 잘 받은 강의평 릴레이 위에 쓰려니까 민망하긴 한데 고등학교때 수학 그저그랬던 나는 공부 열심히 한다고 되진 않았음 ㅋㅋ ㅠ 수학 못하는데 열심히 해보고 싶으신 분은 꼭 앞자리 앉으세여.. 그리고 드랍을 하세여...
인문사회계를 위한 수학 1,이영민,22,Spring,5.0,"성적보고 26동 연구실 방향으로 세 번 절했읍니다.
문과생 기준 수업이 어렵긴 한데 악으로 깡으로 버티면 성적은 나옵니다. 이렇게 후하실 줄 몰랐습니다.
수업 자체도 수학에 흥미가 있다면 재밌습니다. 경제학이 전공인 저도 경제학에 어떻게 써먹겠다는 생각보다 그냥 재밌어서 들었습니다.
교수님이 수업에 열정적이십니다. 많은 것을 알려주시겠다는 열정이 보입니다. 하지만 그로 인해 늦게 마치는 것이 일상이 된 건 좀 아쉽습니다. 시간만 잘 지켜주시면 50점짜리 강의가 될 것 같습니다.
Q3 - 9
Q3 + 4
A0"
인문사회계를 위한 수학 1,이영민,22,Spring,5.0,"수학을 좋아한다면 must-take class임. 교수님이 우리의 수학적 지적 호기심을 매우 많이 충족시켜주심. 수능에서 미적분 봤다거나 해서 깝치면 큰코다치기 쉬움. 고등학교 과정 따위 잊어버리고 겸손한 마음가짐으로 임할 것. 
중간 Q3 + 2.75
기말 Q3 + 0.25
 최종성적 A0"
인문사회계를 위한 수학 1,이영민,21,Fall,5.0,"오픈북이었던 덕분에 복습 없이 시험 전날에 공부 시작해서 중간, 기말 모두 q3보다 조금씩 더 높은 점수 받았고 에쁠 받았습니다. 에제 정도 예상했는데, 교수님 성적 기준이 너그러웠거나, 중간 기말을 모두 잘본 사람이 거의 없었거나인데.. 둘다 였지 싶습니다. 

교수님 강의력이나 강의내용 굉장히 만족스러웠구요, 필기 열심히 하며 들었습니다. 수업 내용이나 시험 문제 모두 본인이 고등학교 때부터 수학에 자신없던거 아닌 이상 못따라갈 난이도는 전혀 아니라 생각합니다.

다만, 저는 경제학부생인데, 경제수학 등 향후 전공 공부에 도움이 될까 하여 이 수업을 들을까 하는 분들은 그닥 추천하진 않습니다. 이 수업의 큰 비중을 차지하는 해석학 부분이나, 초월함수의 미적분 부분 모두 웬만한 전공 수업에서 쓰일 일이 없기에..  하지만 순수 호기심에 들어볼까 고민하시는 분들은 강추합니다."
인문사회계를 위한 수학 1,이영민,22,Spring,3.0,"수학 잘 못하는데 미적분은 좋아했음
중간 틈틈이 복습 + 4일 공부하고 q2 q3 중간
기말 한번도 안보다가 하루 밤새니까 q1
성적 비쁠

진짜 맨날 늦게끝내주셔서 멀리서 연강들으러 뛰어가야하는게 고역이었음... 5분정도면 이해하는데 수업시간 끝나고 나서 하나만 더 얘기할게요~ 할 땐 진짜..."
인문사회계를 위한 수학 1,이영민,22,Spring,5.0,"본인은 이과 생활을 한 적이 있었고,  A대 받았음
하지만, 무지성으로 '대학 왔으니 수학 하나쯤은 들어봐야지!' 하는 어리석은 꿈을 꾸는 자가 있다면 stay...!"
인문사회계를 위한 수학 1,이영민,22,Spring,5.0,"정시로 왔다면 이해할 수는 있음
이해 못하면 예습 복습 하면 되고

본인은 수업은 이해했고 시험은 하루 공부하고 b+ 낭낭하게 챙겨갔음
물론 공부 열심히 하면 A+ 가볍게 가져감(동기왈)

얻어가는 것도 많고 재미있음"
인문사회계를 위한 수학 1,이영민,22,Spring,5.0,"중간 기말 각각 q3+a(a>=10)
22 수능 확통 선택자인 평범한 문과 학생입니다.
악명이 높지만.. 수학에 대한 저변을 단번에 넓힐 수 있는 훌륭한 교양 강의라고 생각합니다.

이 강의는 고등학교 수학 교육 과정과 매우 밀접하게 연관되어 있습니다.
우선 수업이 '미적분'에 큰 비중을 두고 있다는 점에서, 
고등학교 때는 공부하지 못했던 선택 과목 '미적분'을 전반적으로 공부할 수 있는데 가장 큰 의미가 있다고 생각합니다.
그리고 수업을 듣다 보면 고교 수학에 등장하는 여러 가지 떡밥(?)들의 실체를 확인할 수 있는데, 대표적으로
수(상)과 수2에 자주 등장하는 삼차식 x^3-3x+1이 왜 그렇게 특별한지, 
확통 통계파트 개념에만 소개되고 문제에서 전혀 다루지 않는 정규분포 수식에는 어떤 의미가 담겼는지,
무한집합의 종류를 규정할 수 있고 이것이 적분을 엄밀하게 정의하는 것과 어떤 관련이 있는 지를 배울 수 있었습니다.

저는 수업을 들으며 고등학교 수학 지식과 강의 내용을 연결하는데 초점을 두었고, 
연결고리를 하나씩 발견해 나가는 과정에서 흥미를 느꼈습니다. 

시간의 제약으로 증명없이 깔고 설명하는 부분들이 있긴 합니다. (오일러의 편미분 교환법칙, 이중적분 등) 
그리고 시험 문제에서는 열심히 공부하더라도 맞추기 힘든 '직관에 의존한' 문제가 종종 등장합니다. 
(미분방정식을 찍어 맞추는 문제는 좀 아닌 것 같습니다 교수님.. ㅎㅎ)

그럼에도 이 강의를 통해 이번 학기 수학하는 즐거움을 얻었습니다.
대학 수학 강의의 양과 깊이는 확실히 고등학교 때와는 다르다는 것을 느낄 수 있었던 시간이었습니다. 
교수님 감사합니다~!"
인문사회계를 위한 수학 1,이영민,22,Spring,5.0,이과 교차러입니다 낭낭하게 학점 챙겨갑니다~
인문사회계를 위한 수학 1,이영민,22,Spring,3.0,수업은 재밌고 유익함. 그치만 공부하면 아는 것 같다가도 문제는 하나도 안풀림.
인문사회계를 위한 수학 1,이영민,22,Spring,3.0,씁 강제 재수강. 할듯. 나는 공부를 했었다.. 교수님 글씨 입실론 만함. 수업 재밌는데 못알어먹음. 난 바부야.. 담에 또봐요 힝
인문사회계를 위한 수학 1,이영민,22,Spring,5.0,자드 안해주는건 그의 배려였다.. 던지고 자드할지 심각하게 고민중인 시험전날..
인문사회계를 위한 수학 1,이영민,22,Spring,5.0,"타코야께닮은 교수님의 정말 유익한 수업을 들을 수 있어 행복한 1학기였습니다 정말 재수강을 해서라도 또 듣고싶은 그런 수업입니다 
그치만 제 성적은 아주 심각하고 q1은 커녕 0점에 가깝습니다 심지어 저는 공부를 했었습니다"
인문사회계를 위한 수학 1,이영민,22,Spring,5.0,"시험 의외로 평이함
학점 드랍포함으로 주면 희대의 꿀강이 됐을 것"
인문사회계를 위한 수학 1,이영민,22,Spring,5.0,"22학년도 수능 미적100점 교차러입니다. 강계에 명시된 범위가 대부분 고등 미적분 범위와 겹치길래 꿀 빨려고 왔는데, 첫날부터 5주차에 이르기까지 고등 미적분을 뛰어넘는 난해한 증명 위주의 정리만 가르치시길래 그냥 드랍했습니다. 수1 수2 확통만 공부하고 오신 분들은 정말 힘드실 겁니다. 또, 앞서 언급했듯 강계 범위대로 수업하지 않는다는 점도 감안하셔야 합니다."
인문사회계를 위한 수학 1,이영민,22,Spring,5.0,교수님의 시크한 블랙유머가 너무 제 취향이어서 수업은 정말 시간가는 줄 모르고 들었습니다. 그치만 정말 너무 빡셉니다. 잠깐만 정신줄을 놓아도 다시는 돌아올 수 없는 강을 건너게 될 정도로요. 출석이 없다 뿐이지 한 강의라도 빼먹는 순간 다음 수업을 결코 이해할 수 없을 겁니다. 난 수학 좀 잘 하는데 생각해서 오면 정말 지옥 같을 겁니다. 본인 진로에 수학이 필요없다면 솔직히 안 듣는 걸 권해요
인문사회계를 위한 수학 1,이영민,22,Spring,5.0,교수님 재밌으심. 내용도 알참. 출결도 없음. 근데 어려움. 난 멍청이라 드랍할꼬얌..
인문사회계를 위한 수학 1,이영민,22,Spring,4.0,"“나는 경제학부니까 이 정도 수학은 들을 수 있겠지?”
“나는 비상경 문과이지만 수학을 들어서 남들과 차별화를 두겠어!”
“그래도 서울대 들어왔는데 학문의 기초인 수학 정도는 배워둬야지!”
“ㅋㅋ 난 확통 보고 들어왔으니까 이 강의 듣고 미적분 배워야겠다!”

…4월에 드랍하든지, 6월에 B-가 적힌 성적표를 받든지 둘 중 하나는 확실함. 미적분은 그냥 혼자 인사수 책 사다가 하시든지 타 교수님 인사수 강의 열리면 도전하세요. 교수님 강의력은 뛰어나신데 공부하기 다소 힘드실 거에요."
인문사회계를 위한 수학 1,이영민,21,Spring,4.0,"음.. 많은 분들이 명강이라길래 저도 도전해봤으나,, 결과는 좋지 않았습니다.. 물론 배우면서 이런걸 사람들이 생각하는구나~ 신기하다~~라는 생각을 많이 했었고 재밌다고 생각되는 부분들도 많았지만,, 제가 공부를 열심히 안 해서 그런지 이해 안되는 부분들이 많았습니다 ㅠ 그래서 수학이 재밌어보여서 듣는건 비추..합니다..! 물론 교수님의 강의력은 정말 최고이십니다!!(재미도 있으세요!!)"
인문사회계를 위한 수학 1,이영민,22,Spring,4.0,초반에 우리가 여지껏 수학이라고 생각해온 산수를 하면서 은연중에 받아들이고 있던 근본을 배웁니다. 주로 공리와 정리 등을 배우는데 어떤 수가 어디에 존재한다와 같은 형식의 존재정리 위주입니다. 본격적인 미분법을 배우기 전까지는 논리의 흐름와 유도과정을 '외우는' 게 중요합니다.
인문사회계를 위한 수학 1,이영민,21,Fall,3.0,"과제 없고 출석점수 없고 오로지 시험만 잘 보면 되는 fancy한 강의. 시험은 수업에서 다룬 내용 안에서 충실하게 나오는듯. 교수님이 문과생들 대상으로 여러가지 내용들을 많이 가르쳐주고 싶어하시는 것 같음. 저번학기 족보도 시험 전날에 직접 제공해주심

 다만 ppt나 문서로 된 강의록이 없고 교과서 외 내용도 많이 나오는 편인 건 좀 주의할 필요가 있음. 그래서 필기가 중요한데 책상 위 비말차단 가림막 + 종종 입실론만해지는 판서 때문에 가끔 필기하기가 어려움. 

학점은 후한 편인 듯. 자드 못하게 하신다길래 화끈하게 B-로 수렴할 줄 알았는데 생각보다 잘받음 개꿀

내용은 어렵지만 본인이 흥미가 있으면 들어볼 만할 것 같음"
인문사회계를 위한 수학 1,이영민,21,Fall,4.0,수학은 정말 재밌지만 내 성적은 정말 재밌지 않네... 그래도 선대 따라가고 싶게 만드는 매력 이게 이영민?
인문사회계를 위한 수학 1,이영민,21,Fall,4.0,"강의의 장단점은 다른 강의평 보시면 충분히 알게 되실테니 경제학부 학생의 입장에서 쓰겠습니다. 수학 최대한 안 쓰면서 졸업하고 싶은 경제학부 분들에게는 비추입니다. 웬만한 수업은 간단한 미적분, 그래프 그리기, 좀 더 나가면 선대 정도로 해결되는데(사실 선대도 거의 안 씁니다.), 굳이 이 수업을 들으면서 정수론, 온갖 삼각함수, 미방 기초,  극좌표 등을 추가로 배울 이유가 없습니다. 취향 안 맞으면 끔찍한 수업입니다.
근데 강경수, 전경통, 뭐 암튼 수학 많이 쓰는 과목들 듣고 나가고 싶으면 이 강의를 1학년 때 듣는 걸 추천합니다. 첫 번째 이유는 개같이 어려운 내용도 차근차근 악깡버 하다보면 사실 별로 어렵지 않다는 걸 몸으로 체험할 수 있는 좋은 기회이기 때문이고요. 두 번째로는 강경수, 전경통의 개같이 어려운 problem set을 풀기 위한 기초 수학을 단단히 다질 수 있는 시간이기 때문이고요. 세 번째로 취향만 잘 맞으면 수학에 대한 흥미가 좀 생기기 때문입니다. 아무튼 로드가 빡센 수업임에는 틀림없으니 1학년 때 이 강의를 듣고 싶다면 꿀교양이랑 체육이랑 경원 경투 같은 것만 좀 섞어서 15학점 이내로 들으시고요. 벼락치기 할 생각은 버리시고요. 틈틈이 교과서 연습문제 풀면서 준비하시면 너무 힘들진 않으실 겁니다. 전 벼락치기 하다가 죽는 줄 알았습니다. 그리고 강의에서 말씀하신 예제는 다 받아적으셔야 합니다. 저는 뒷 수업 때문에 나가느라 하노이탑 문제 설명 듣지도 못했는데 시험에 매우 큰 비중으로 나오더라고요... 성적은 중간 기말 q3 넘기고 에쁠 받았습니다."
