기후변화와 건강,최경호,22,Spring,5.0,매주 다양한 연사가 오셔서 강의하는 방식이라 흥미로운 내용도 있고 지루한 내용도 있긴 했지만 매주마다 새로운 느낌은 있었음. 시험은 강의마다 중요한 내용 위주로 나오고 그렇게 큰 부담까진 아님. 나머지 로드는 팀플밖에 없는데 드랍자가 꽤 나와서 왠만하면 괜찮은 성적 받을 수 있음. 기말이랑 팀플밖에 없다는 점에서 과학교양 치우기에 이 정도면 만족함.
기후변화와 건강,최경호,19,Spring,2.0,"매 수업마다 기후변화와 관련된 각종 분야 (외교, 사회심리, 의학, 기술 등)의 특
강을 듣고, 조별 과제로 ‘기후변화’와 ‘건강’이라는 키워드와 관련된 주제를 선정해
연구하는 과목입니다. 기후변화에 관심이 많았기에, 관련 지식을 얻고 건설적인 프
로젝트를 할 수 있다는 사실에 매력을 느껴 이 과목을 수강했으나,, 기대가 컸던 만
큼 실망도 컸습니다.
비추천하는 이유는 다음과 같습니다.
첫째, 강의 내용이 피상적이었습니다. 저는 기후변화에 대해 제가 상식으로 기존에
알고 있는 것 이상의 지식을 얻고 싶었으나, 수업을 듣고 나서는 ‘기후변화는 대응
가능한 문제다’라는 피상적인 수준의 배움밖에 얻지 못하였습니다.
둘째, 들인 노력에 비해 학점이 불만족스러웠습니다. 매주 수업 전 팀티칭을 위해 관
련 논문을 읽어가야 했으며, 조별 연구 프로젝트를 위해 약 2달 간을 이 과목에 매진
해야 했으나, 돌아오는 것은 불만족스러운 학점 뿐이었습니다. 더욱이 제가 납득할
수 없었던 것은 40%를 차지하는 연구 프로젝트 성적을 채점하는 기준조차 공개되지
않았다는 점입니다.

아주 개인적인 견해로, 성적은 기말 한방으로 변별하는 듯 합니다. 제가 조별과제 준비하느라 시험 망쳐서 학점 말아먹은 케이스.. 수업 PPT + 논문 위주로 암기하세요."
기후변화와 건강,최경호,19,Spring,5.0,"드랍자 많음+쁠몰때문에 학점 잘주시는편입니다
시험범위 ppt 범위도 제 기준에는 많지 않았어요
그리고 매주 교수님이 달라서 그 시간에서 제일 중요한거만 잘 들으면대용
기말도 성적반영비율 낮아서 크게 부담없음!!"
기후변화와 건강,최경호,19,Spring,5.0,"쁠몰이라 상위권에 들면 부담없이 A+ 가져가는 구조
조별토론은 첨엔 준비많이하다가 시간지날수록 굳이 학점에 다이렉트로 들어가는게 아니기때문에 많이 준비할 필요없고 적당히 했음
앞에 나가서 토론점수 매기는거 아니고 교수님 시킬때  손들고 질문하거나 조장이 입잘털면 점수 받음
기말은 너무 많이 준비하지말고 교수님 별로 제일 강조했던 개념 위주로 할걸그랬음ㅜㅜ"
기후변화와 건강,최경호,19,Spring,1.0,"도 망 쳐
빠드익선 
기약없는 횟수의 팀플과 답없는 분량의 기말 시험에 치이고 싶지 않으면 도망칠것"
기후변화와 건강,최경호,19,Spring,1.0,"1.기말 분량 미쳤음 매번 다른 교수님 들어오셔서 그런지 다들 시험에 대한 생각 없이 강의하시기 때문에 하고싶은 말씀 다- 하셔서  기말 때 부담 매우매우 큼 (반영비율 원래 강계에는 높게 책정되어있었는데 나중에 낮춰주고서 그나마 다행이었음)
2.수업은 교바교 매우 심함. 재밌는날은 재밌고 재미없는 날은 졸려서 미칠 것 같았음
3.팀플 ㅈㄴ 열심히 했는데 탑3 안에 못들어서 그런지........

총평 > 이과 교양 채울려면 딴거 들어"
기후변화와 건강,채준석,21,Fall,5.0,"팀티칭 형식의 수업이고, 기말한방입니다. 한학기동안 매주 수업 시작 후 30분동안 조별 토론을 하는데, 사실 토론아니고 각자 조사해온거 토의 정도이므로 토론 정말 싫어하는 저도 잘 들을 수 있었습니다! 기말 조별발표 하나 있는데 10분내외라 크게 부담없고, 그날 다른 조 발표듣고 질문 하나정도만 하면 플러스 점수 주시는 듯 합니당! 매주 수업을 대강 듣고 중요해보이는 부분만 공부하세요! 아예 안듣고 ppt보면 분량이 너무 많아서 드랍하고 싶어집니다! 대강 들어서 귀에 꽂히는 부분만 일부 공부해가면 충분할 것 같아요 :)"
