대학영어 1,김은아,21,Spring,5.0,"그저 빛 갓은아 교수님

☆교수님 진짜 학생들 배려 많이 해주심. 
1. 발표 순서랑 시험 날짜 정할 때에도 학생들 일정 괜찮은지 물어봐주심
2. 수업하면서 자유롭게 학생들에게 수업 내용 관해서 질문 던지실 때가 있는데, 학생들이 좀 버벅대거나 약간 논리적으로 이상한 부분이 있어도 민망하지 않게 너가 하고 싶은 말이 이거구나, 나도 그 점에서 동의해 이런 식으로 말씀해주심. 
3. Worksheet 과제가 거의 매시간 있는데, 그 중에서 몇가지 문제들은 조별로 이야기를 나누라고 하시고, 줌 소회의실을 만들어주심. 모든 조들을 다 돌아보시면서 이야기도 잘 들어주시고 어려운 부분 이야기하면 힌트도 주시기도 하고, 뭔가 논의할 점이 있다 하는 건 조 회의 끝나고 수강생 다같이 이야기해보자고 하셔서 수업시간 내에 어려운 점들 거의 다 해결해주심. 

☆수업 준비 정말 꼼꼼히 하셔서 겅부 안 하면 죄송할 지경임.
1. 코로나 관련해서 다루는 수업 때에는 자료도 엄청 최신거, 뉴스랑 통계 이런 거 다 정말 유의미한 것들로 보여주셔서 정말 좋았음. 영상 자료랑 사진 등등 전부 다 가독성 좋고 발음 속도 좋고 알짜배기 자료들만 딱딱 보여주셔서 진짜 공부할 맛 났음.
2. 수업 진행도 정말 매끄러움. 교수님 계획이 다 있으신 것 같은데 융통성도 좋으신게 수업 듣다보면 다 느껴져서 진짜 감사함. 

☆시험이나 과제 관련
1. 시험문제는 정말 수업 시간에 배웠던 단어, 글 worksheet 복습만 열심히 하면 다 맞출 수 있음. 이상한 문장 가져와서 빈칸 채워넣고 이런 문제 1도 없고, 수업시간에 교수님이 말씀하셨던 예시 같은 거 잘 적어놓으면 시험 보면서 자동으로 답이 적힐 것임. 
2. 과제는 자잘자잘하게 매시간 있는편. worksheet이 대부분임. 어려운 거 아니고 짧으면 10분 길면 30분 정도 걸리는 수준. 간혹 자료조사 필요한 부분이 있기도 함. 아주아주 가끔.



☆요약: 대영은 갓은아 교수님이다. 무조건 1픽으로 잡아라."
대학영어 1,김은아,21,Fall,4.0,"무난무난한 대영입니다
어차피 대영은 로드 많은데 김은아 교수님 수업 들어도 좋은 것 같아요
대영 수업 자체가 듣는다고 해서 영어 실력이 오르지는 않고 .. 로드는 많습니다 그래도 할 일 다 열심히 하면 에이쁠 받을 수 있어요"
대학영어 1,김은아,21,Fall,4.0,"ㅋ역시 다들 나만 빼고 영어 다 잘하지…? 
교수님 친절하시고 좋으세요 원래 대학영어가 다 그런진 모르겠지만 수업 특성상 지루할 수는 있어요
중간 땐 공부 했고 중간 이루오는 수업도 안 들었는데 기말 건적이 더 잘 나왔어요 근데 둘 다 반평균보다 훨씬 이하ㅋ ㅠㅋ
제가 부족한 탓입니다…흐그흐륵흑흐슥흣그흫ㄱ 영어 공부 해야겟따"
대학영어 1,김은아,18,Fall,5.0,"따뜻하신 분이셔서 기억에 오래 남습니다!
학생의 이야기에 정말 귀기울여주셨던 분이세요!
갓은아쌤 ㅠㅠ"
대학영어 1,김은아,21,Spring,5.0,"조모임은 대영 특성상 어쩔 수 없이 많습니다만, 굉장히 편하게 수업 진행 해 주시려 노력하십니다. 감사하다고 말씀드리고 싶네요"
대학영어 1,김은아,21,Spring,5.0,팀플이 많아서 좀 힘들긴 했지만 교수님이 하라는거 잘 따라가면 학점은 잘 주시는거 같습니다
대학영어 1,김은아,21,Spring,5.0,"딱히 배워가는 건 없지만 진짜ㅜ 학점 너무 잘 주심. 그리고 너무 친절하심.  중간 89점, 기말 (모르지만 3점짜리 하나 빼고 다 쓰긴 함), 개인발표 99점, 단체 발표 (모름), email writing (모름. 근데 진짜 파파고 돌려서.. 망함), writing lab 글쓰기 교실 (감점 없었음), speaking lab 시험 잘 봄 (점수는 모르지만 감점 없었을듯), 출석(지각 1번) 이었는데 A+임. 진짜 97-100% 만 에쁠이라길래 (절평이라) 불가능이라고 생각했는데 음.. 뭐.. 약간의 조정이 있었나봄. 학점은 잘 주시는 듯. 그리고 중간 기말고사는 내용 파악 제대로 하고 discussion question같은거 다루는거 있으면 미리 답변 생각해가면 서술형은 다 쓸 수 있음. 단어만 꼼꼼히 외워두면 될듯. 같이 듣는 분들이랑 소회의실로 이야기하는 시간이 많았는데 (거의 매 수업마다 20분 이상) 같이 수강하는 분들이 좋았어서 딱히 매우 어색하거나 불편하진 않았음. 오히려 내적 친밀감 생김. 교류가 많다보니 대면이었으면 더 재밌었겠다 하는 생각이 드는 강의임. 막판에 기말고사만 대면으로 봐서 아쉬웠음."
대학영어 1,김은아,21,Spring,4.0,"수업 자체는 교과서 외에 자료도 많이 준비하시기에 꽤 들을만한 수업인 것 같습니다. 영어를 못하고 싫어하기에 중간, 기말 다 공부를 제대로 안해서 시험은 망했고 글쓰기 교실까지 기한 까먹어서 학점도 C+정도 나올거라 생각했는데 생각보다 학점은 잘 나와서 괜찮았습니다. 그리고 매 수업마다 자잘자잘한 과제가 있었는데 과제는 30분이면 다 할 수 있는 정도 수준이었고 딱히 검사하시진 않았습니다. 그냥 빨리 대영 치워야겠다하는 분들에게 좋은 수업인 것 같습니다.
교훈: 글쓰기 교실은 미리미리하자."
대학영어 1,김은아,21,Spring,5.0,"학우분들이 다들 착하셔서 수업 듣는 게 즐거웠고, 교수님도 너무 스윗하십니다. 사실 내용이 그렇게 어렵지는 않아서 영어 잘 못해도 따라가는데 어려움이 없습니다. 스피킹랩 한 번 결석해서 점수 잘 못 받을 줄 알았는데 에이쁠 뜬 걸로 보아 학점도 잘 주시는 듯 합니다."
대학영어 1,김은아,21,Spring,5.0,"중간고사 70점 중반으로 망치고 발표 적당히 못하고 기말 적당히 잘 본거 같았는데 A0.. 학점 대만족

수업 부담 없이 잘 들을 수 있음
중간기말 있고 발표 한두번정도 있는데 발표에서는 변별력 있을 정도로 점수가 차이 나게 부여되는 것 같지는 않아서 결국 중간기말이 학점을 결정할 듯 함"
대학영어 1,김은아,21,Spring,5.0,"교수님이 너무 좋으세요! 친절하시고, 발표가 살짝 빡셌던거 빼면 좋았어요 저는 적당히 공부해서 A0 받아갑니다 이정도면 학점느님이라고 생각해요!"
대학영어 1,김은아,21,Spring,5.0,"과제라기에는 그냥 조사해오기, 생각해오기 이런 거라 검사도 없고 과제도 없음 분명 영어로 하는 수업인데 왜이렇게 편안하지…? 교수님께서 엄청 친절하게 설명 다 해주심 두 번의 발표가 부담이긴 하지만 그거 제외하면 재밌게 들었던 수업 :)"
대학영어 1,김은아,21,Spring,5.0,"개인발표1, 팀플 발표1,
그 외에 자잘한 과제 없음
교수님 너무 좋으시고 학생들 배려 많이 해주십니다.
시험망했는데 성적 진짜 후하게 주시네요ㅠ
근데 아랫분 말대로 크게 얻어가는건 없어요.
그래도 대영중에 가장 꿀강의라 생각합니다."
대학영어 1,김은아,21,Spring,5.0,너무 친절하십니다.  수업을 잘 따라가지 못하는 학생도 잘 배려해주십니다.
대학영어 1,김은아,20,Fall,4.0,고등학교 영어 수업 같음. 교수님 친절하시고 그냥저냥 부담없이 대영 치울 수 있는 수업~~~ 하지만 얻어 가는 건 없음
대학영어 1,김은아,20,Fall,5.0,"대영 그 자체. 교수님께서 매우 친절하시고 학생들을 잘 배려해주심. 시험 두 번에 과제는 발표 두 번(개인/그룹), 이메일 글쓰기 등등 있음. 로드는 기초교양 수준에 적절한듯. 들으면 손해볼거 없음. 굿굿"
대학영어 1,김은아,20,Fall,5.0,"정말 잔잔하고 조곤조곤한 수업. 그냥 대영의 정수같은 느낌? 의 수업이었어요. 과제는 진짜 가벼운 걸로 두 세개 정도 있었고 기말 팀플 한 번 있었는데 저는 팀원들 너무 잘 만나서 재미있는 주제로 재미있게 발표했네요. 로드는 전혀 부담되지 않았어요! 시험 중간고사는 80점 후반대였는데 기말을 좀 잘 봤어요! 점수는 모르지만. 다른 과제들도 100점만점에 95점 이상 받았네요.

학생들에게 수업과 관련한 질문을 던지세요. 학생들이 영어로 말할 수 있는 기회를 주시는 것 같은데 이 때 많이 참여하셨으면 좋겠어요. 저는 그래서 그런지 이번 학기에 말하기가 조금 늘었다는 생각이 들었거든요.

학점 천사.. 개인적으로 계산해봤을 때 A- 나 A0일 것 같았는데 A+을 선사해주셨구요... 진짜 교수님 조곤조곤하게 하나하나 정말 친절히 잘 알려주셔서 유독 힘든 이번 학기에 제 힐링 수업이었네요ㅠㅠ 대영 들으실 분들 제발 김은아 교수님 수업 들으세요 꼭!!!"
대학영어 1,김은아,20,Fall,5.0,영어 못해서 정말 걱정 많았는데 학점 잘 주신 것 같아요! 교수님도 정말 좋아요!
대학영어 1,김은아,20,Fall,5.0,대영 중 가장 부담 없고 또 잘 참여할 수 있는 수업이라고 생각합니다. 학점도 후하게 주시는 것 같구요.
대학영어 1,김은아,20,Fall,5.0,"얼렁뚱땅해서 학점을 잘받진 못했지만 교수님은 천사세요
말 많이해야해요 대신 주제도 가볍고 재밌는 것만 하고 분위기도 편해요"
대학영어 1,김은아,20,Fall,5.0,교수님 너무 친절하시고 영어 좀 못해도 부담없이 들을 수 있어요ㅎㅎ 성적도 잘주셔서 꼭 추천드립니다!
대학영어 1,김은아,20,Fall,5.0,엥 미친 학점 실화인가 시험 진짜 조졌는데... 선생님 정말 감사합니다 최고
대학영어 1,김은아,20,Spring,5.0,비록 영어를 굉장히 못하는 사람이지만 다양한 활동들을 하며 영어를 알려주셔서 얻어가는 것이 많은 수업입니다 그리고 학점은 대충 비율 맞춰서 주시는 것 같아요
대학영어 1,김은아,20,Spring,5.0,김은아 교수님  항상 학생들 생각해주시는게  보여서 너무 좋았습니다. 되게 인간적으로 좋으신분입니다...(대면 수업이었으면 교수님 직접 뵐 수 있어서 더 좋았을 것 같네요ㅠㅠ) 시험도 수업시간에 다룬 리딩 리스닝 내용 전반적으로 제대로 알고있으면 수월하게 풀리고 학점 자체도 수업만 잘따라오면 괜찮게 나오는것 같습니다.
대학영어 1,김은아,20,Spring,5.0,학점을 떠나서  너무 수업 내용도 좋고 많은 부분이 좋았습니다 ㅎㅎ 킹은아에요~ 학점은 아마 비율은 맞춰서 주시는 것 같아요 ^^
대학영어 1,김은아,19,Fall,5.0,"갓은아 교수님,, 대영이 자잘한 과제 많기로 유명한데 교수님은 처음 소개발표, 글쓰기, 기말발표가 전부였여요! 그 중에서도 킴플은 기말발표밖에 없어서 부담도 덜하고 무엇보다도 학생들 말하기 독려해주시고 의견 다 존중해주시는 교수님이 최고이십니당!! 시험도 수업시간에 잘 듣고 시험치기전에 단어조금 외우고 그냥 한번 훑었고, 과제도 성실하게 열심히 해서 A+받았어요~ 대영은 김은아 교수님 완전 추천드려요!"
대학영어 1,김은아,19,Fall,4.0,"교수님 되게 착하고 차분하신 분이에요
다시 들어도 교수님 수업 듣고 싶네요"
대학영어 1,김은아,19,Fall,5.0,"최고의 교수님ㅠㅠ
너무 친절하시고 부담도 없이 수업에 참여할 수 있어서 너무 좋았습니다ㅠㅠ"
대학영어 1,김은아,19,Fall,5.0,교수님이 정말 좋으셨어요!! 매 수업마다 조별로 모여서 이야기하는 시간이 있지만 크게 부담가질 필요는 없는 것 같아요
대학영어 1,김은아,19,Fall,5.0,"교수님 진짜 좋아요ㅠㅠ 친절하시고 수업 준비도 너무 잘해주시고,, 영어 잘못해서 처음에 대영수업 긴장했는데 설명도 이해하기 쉽게 해주시고 최고였어요,,,, 조모임이 좀 귀찮긴 해도 덕분에 친구들도 많이 사귀고 좋았어요!! 과제는 거의 없고 안해가도 오히려 조모임 잘 참여하라고 독려해주시는듯하고 성적은 노력한만큼 나오는것같아요!"
대학영어 1,김은아,19,Spring,5.0,"2019  여름 계절 수강함
시험 전날 시험 범위 1회 정독했는데 A+ 줌
과제나 조모임 있기는 한데 괜히 부담 안가지면 개꿀"
대학영어 1,김은아,19,Spring,5.0,갓. 저는 공부 안 하고 논 학기라 학점은 포기했는데 수업 자체는 재밌고 편하게 들음. 재수강할지는 모르겠는데 한다면 다시 듣고픔
대학영어 1,김은아,19,Fall,4.0,"여름계절로 들었음
과제는 거의 없음
팀플 한번이랑 개인발표 한번 시험 두번임
시험은 평소에 주시는 핸드아웃 성실히 풀고 단어만 잘 외워놓으면 됨 걍 영어로 논술시험본다고 생각하셈
다만 채점 겁나 빡빡하게 하심 이렇게까지 채점 깐깐하게 하시는 분은 처음봤음..물론 교수님이 안좋다는건 아님! 교수님은 수업 잘하시고 학생들 신경도 많이 써주셨음
결론 : 교수님도 좋고 강의도 좋은건 맞지만 성적을 뿌리지는 않는다. 학점은 끊어서 주시는 듯"
대학영어 1,김은아,19,Fall,5.0,"갓은아 과제 사실상 거의 없음 수업도 재밌음
학점도 잘 주심 밑에 분 말이 백퍼 맞음"
대학영어 1,김은아,19,Fall,5.0,김은아 교수님 진짜 너무 좋으심ㅜㅜ수업 빡세지도 않고 과제도 중간중간에 프린트 풀어와라 이런 거밖에 없음. 개인발표 한 번 조별발표 한 번 있는데 그냥 적당히 열심히 하면 됨. 시험은 다양하게 내시는데 단어 외우고 내용 외워서 쓸 수 있는 문제랑 길게 자기 생각쓰는 문제 이렇게 나왔던 것 같음. 시험 전 날 하루 공부하고 에제받음. 김은아 교수님 인간적으로도 너무 좋은 분임 사랑...
대학영어 1,김은아,19,Spring,5.0,"진짜 갓은아 교수님이다..
처음 새내기라 입학식때문에 수업겹쳐서 조심스레 메일을 보냈었는데도 참 따뜻하게 답장해주셨어
숙제도 별로 없고 수업을 영어로만 사용하긴 하지만 중학교 영어학원같은 느낌인데 배우는건 꽤 많고 또 교수님자체도 되게 평소  내가 가지고 있던 교수님 이미지의 편견을 깨주신 분이야. 진짜 좋으시고 준비도 많이 해주셔서 더더욱 정이 가는 교수님이야"
대학영어 1,김은아,19,Spring,5.0,"아직 학점 나오기 전인데 쓴다.
왜냐면 진짜 학점에 상관없이 너무 좋은 강의거든...

진짜 교수님 조교님 다 인격적으로 너무 좋으시고 수업도 재밌음. 교수님 목표가 대영 같은 반끼리 친하게 만드는 거라 수업시간에 무작위로 조 짜서 서로 얘기도 많이 하고 재밌는 얘기는 발표하고 그럼. 낮 많이 가리면 좀 힘들수도 있지만 분위기가 너무 좋아서 결국 다  친해지게 되어있다.

수업 내용도 좋고 시험도 다 수업때 했던 것만 나와서 수업 잘 듣고 복습 잘 하면 시험점수 무난히 나올 듯.
로드는 다른 대영이랑 다 똑같은데 가끔 자잘한 거 내주심. 수업시간 3분전에 시작해도 다 할 수 있는 수준이니 걱정 ㄴㄴ

그냥 근본부터 좋은 강의임... 갓은아 교수님 최고bb"
대학영어 1,김은아,18,Spring,5.0,"김은아 교수님.. 12년동안 영어의 E만 봐도 학을 떼던 저에게 영어가 얼마나 재미있는 과목인지 알려주신 분이심. 매번 강의 때마다 준비 정말 열심히 해오시고 수업도 잘 알아들을 수 있게 차근차근 설명해주셔서 매번 시간이 진짜.. 영어가 이렇게 재미있어도 되나? 싶을 정도로 재밌었음.

과목이 대영인 만큼 로드는 적지 않은 편이지만 다른 대영에 비해서는 꽤 널널한 편! 영어 글쓰기 2번 + 개인발표 1번 + 조별발표 1번 + 중간기말 + 스피킹랩 시험 이게 다였는데 글쓰기도 부담스럽지 않은 주제였고 발표도 5분 남짓이라 그렇게 숨막힐 정도의 로드는 아님. 중간기말 공부는 그냥 교재랑 수업시간 유인물 몇 번 읽으면 다 풀 수 있을 정도. 성적은 3/4/3 비율맞춰서 주시는듯.

근데 진짜 대영이라는 과목을 떠나서 영어에 흥미를 붙여주신 유일한 교수님.. ㅠㅠ 평소 영어에 관심 없는 분이라도 한번 들어봄직한 강의임. 서울대에 온 거 잘한 일이라는 생각이 들게 해주시는 교수님. 꼭꼭 들으세요. 그리고 대영은 무조건 1픽..."
대학영어 1,김은아,18,Spring,3.0,교수님은 좋으시다. 그러나 팀플 조원이 쓰레기였는데 거를 방법이 마땅히 없었다.
대학영어 1,김은아,18,Spring,5.0,김은아 교수님 밑에분들 말씀해주신것처럼 수업 항상 열심히 자료준비해오시고 정말 신경을 많이 쓰신 티가 납니다. 또 영어만 배우는게 아니라 많은 배경지식들? 도 배울 수 있어서 좋구 저에게는 힐링시간이었던거같아요ㅎㅎ 또 모둠활동? 조별활동이 매 시간있고 조도 매일달라져서 진짜 제가듣는 수업중에 같은반 사람들이랑 친해질수 있는 기회도 많고 이야기도 많이할 수 있어요! 제가 원하던 수업방식과 거의 일치했어요! 막판에 발표랑 글쓰기과제? 가 좀 겹치는 편이긴 했는데 평소에는 과제가 거의 없는편이고 마지막 기말보기전에만 좀 열심히 하시면 될거 같아요! 뭐 엄청 열심히 하진 않았지만 참여도 열심히 하려도 노력했엇긴한 거에 비해서 성적은 만족할만한게 나오진 않았지만 그래도 전 강추드립니다
대학영어 1,김은아,17,Fall,5.0,대학영어1이든 2든 김은아 교수님을 정말정말 추천드려요ㅠㅠ 학교들어온 이례로 수업준비 정성껏 잘해오시고 강의력 이렇게 좋은 교수님을 못봤어요!! 정말 착하시고 엄마 같으셔서 수업때 졸고그래도 걱정해주시고..암튼 교수님은 정말 최고시고!! 그만큼 저도 수업을 잘따라가게되고 공부도열심히하니까 중간 기말성적이 상위권이어서 에이쁠받았네요! 대영1인만큼 로드가 꽤있지만 그건 다른 교수님들도 마찬가지니까 어쩔수없는 부분이구요.. 교수님 보고싶네여...
대학영어 1,김은아,17,Spring,5.0,"저는 개인적으로 정말 좋았어요
수업이 너무 어렵지도 않고 쉽게쉽게 수업하시고 교수님이 수업 관련해서 다른 자료들도 많이  보여주시고 하셔서  재밌는 영어수업이었습니당~ 과제 꼬박꼬박해가고 시험준비에 그렇게 시간 안쏟고 그냥 중간기말 그럭저럭 잘 봐서 A+받았어용"
대학영어 1,박채윤,19,Fall,4.0,"한국분이신데 거의 원어민이시고 차근차근 천천히 말을 하시는 분이라 편하게 들었습니다!
글쓰기 1회, 팀발표 2회, 시험 2번의 로드였고 다른 대영 수업에 비해 로드가 적은 편이었던 것 같습니다."
대학영어 1,박채윤,19,Fall,5.0,"전반적으로 강의가 느긋하고, 주어진 주제에 대해 옆 파트너와 야기 하는 시간이 많았습니다.

  처음엔 아침부터 영어로 대화하고  종종 공개적으로 발표해야하는 것이 힘들었지만, 익숙해질수록 오히려 더욱 즐겁고 수업에 몰입해서 시간을 빠르게 보낼 수 있었습니다.

 수업은 전체적으로 교재의 단어 파트, 리딩 파트, 간단한 영작 파트 골고루 진행되었습니다.  (본문을 한 줄 한 줄 분석하지 않고, 빠르게 나가서 편했습니다. )

 로드는 대영답게 영작, 글쓰기 교실, 랩 말하기 시험, 영어 프레젠테이션 등 많았습니다. 개별적으로는 크게 어렵지 않았으나, 다른 과제와 몰릴 경우 몸이 많이 피곤할 것 같습니다. 따라서 로드가 조금 널널한 학기에 수강할 것을 추천드립니다.   : )

 시험은 빈칸 채우기, 틀린 문법 고르기, 간단한 영작, 교과서 본문에서 다룬 핵심 요소 3-5가지를 외우고 5줄 정도의 짧은 글쓰기가 있었습니다. 빈칸의 경우 6-8개 내외이고 중간 중간 힌트도 주셔서 어렵지 않았습니다. 문법의 경우도  본문에 여러 단어에 표시가 되어있고, 그 중 객관식으로 한 개 고르면 되는 거라 전혀 어렵지 않았습니다. 다만, 영작의 경우 주의해야 할 것이 본문 혹은 리스닝 스크립트에서 다룬 중요 포인트를 외워가셔야 한다는 점입니다. 예를 들어 '네팔의 한 조직이 여성에게 지원한 것 5가지'를 서술하시오.' 이런 문항이 있을 수 있습니다. 챕터가 많지 않기 때문에 사전에 무엇이 나올지 쉽게 예상할 수 있습니다.

 성적은 제 기준에서 매우 잘 주셨다고 생각합니다. 저는 중간 고사에서 문제를 잘못 읽어  250점 만점에 30점을 통으로 날렸습니다.  중간값, 평균보다 모두 낮았지만, 기말고사 및 다른 로드로 보충한 결과 A제로를 받았습니다."
대학영어 1,박채윤,19,Fall,4.0,"대영1은 학점 비율 채워줘야 해서 어느 수업이든 학점 비율은 똑같을 것 같네욤 
교수님이 푸근(?)하시고 친절하십니다 ㅎ 발표과제 대본 외우는게 좀 부담이었지만 준비하는 데 오래 걸리지않앗고 랩수업때 시간 주셔서  괜찮았습니다 
시험은 살짝 내신처럼? 나오긴 하는데 전날에 내용 잘 외우고 단어 좀 외우면 됩니다 
초반에 글쓰기과제가 있으니까 영어글쓰기 교실 과제랑 겹치지않게 하세용  
전반적으로 만족스러운 강의였습니다"
대학영어 1,박채윤,18,Fall,5.0,"여름 계절에 들었습니다!
즐겁게 수업했고 여유롭게 공부했습니다.
선생님 따스하시고 좋은 분이라는 걸 수업 중에도 느꼈지만 학점으로도 느꼈습니다. 추천합니다 :)"
대학영어 1,박채윤,18,Fall,4.0,"19 여름학기에 수강했습니다!
일단 교수님 정말 천사세요ㅠㅠㅠ 메일 답장도 친절하시고, 글쓰기 피드백 등등 저희에게 너무나도 나긋나긋하게 대해주시고 배려해주십니다!  
로드는 글쓰기 한번, 조별발표한번, 중간/기말 이 정규 로드고,
랩실시험 한번, 글쓰기 교실 한번이 끝이에요!
출결은 한번 결석까지 인정해주셨습니다
글쓰기 점수도 사실 낮았고, 중간도 평균 이하였는데 에제 받은 걸로 받은걸로 보아 ㅠㅠㅠ 교수님 정말 학점 후하게 주시는 것 같아요 ㅠㅠㅠㅠ
다만 너무 나긋나긋 하셔서 수업이 가끔 졸리고...(근데 짝이랑 말하는 시간이 많아서 계속 졸리진 않아요)
시험이 고등학교 내신처럼(영영풀이 단어쓰기나 빈칸 채우기, 아니면 지문 내용 외워서 작성하기 등등) 나오는 편입니다!
그것 외에는 정말 추천하고 싶은 교수님이에요!"
대학영어 1,박채윤,18,Fall,5.0,여름학기에 들었는데 과제도 적고 선생님이 매우 천사시다...!
대학영어 1,박여선,22,Spring,2.0,"총 4학기 다닌 지금까지 중에서 최악의 강의
발표(영어 프리스피킹)못하는 사람은 듣지 마세요. 
대학영어1이지만 서울대는 서울대인지라 학우분들이 대체로 영어를 잘 하십니다. 저희 분반에는 기본적으로 프리스피킹 되는 분들이 절반 이상이었어요. 
저는 그저 한국식 영어만 잘하는 사람이라 스피킹 실력이 제로인 편이었습니다. 
매시간 토론이 기본이라 영어로 말하는 것에 자신 없는 사람은 꽤 고통스러운 한학기가 될 것입니다. 
최종 발표를 한번 하는데 그때 대본 없이 발표를 하고 교수님이나 학우분들 질문에 영어로 답할수도 있어야합니다(따라서 주제를 너무 어려운걸로 잡지는 마세요)

스피킹랩 조교님께서는 워낙 친절하셔서 이부분은 만족스러웠습니다. 

학생들 편애가 좀 있으신 것 같습니다. 3명 정도 교수님께서 좋아하시는 학생들이 있었는데, 그 학생들에게만 눈에띄게 잘해주시는게 보입니다. 

60학점 이상 들었지만, 제 유일한 B+이자 가장 낮은 학점.. 
어짜피 대영 치워야하니 재수강만 면하자는 생각으로 버텼네요"
대학영어 1,박여선,23,Spring,5.0,친구 사귈 수 있는 좋은 강의~~ 발표준비는 열심히 하세요. 학점에 영향 꽤 주는듯?!
대학영어 1,박여선,23,Spring,4.0,"텝스에서 운이 좋아 대영1이 뜬 사람 입장에서는 힘든 강의였습니다. 다만 교수님 때문에 힘든 점은 거의 없었고, 대학영어라는 과목 자체가 힘든 과목이라고 생각합니다.
시험이 좀 어렵긴 했어요."
대학영어 1,박여선,23,Spring,3.0,시험 아무리 잘봐도 마지막 발표 못하면 많이 깎이니 주의하세요
대학영어 1,박여선,23,Spring,5.0,나름 재밌게 들었습니다! 발표 별로 신경 안쓰고 시험 공부만 열심히 해서 시험 잘 보니 성적 잘 주셨어요~
