대학영어 1,Christopher Hemann,21,Fall,3.0,"학점은 잘 주시는 것 같아요 A+을 잘 주시는 진 모르겠는데
수업 인원 50% A는 확실히 주심.

피드백이 정말 꼼꼼하시고
영어라 더 그렇게 느껴지는 진 모르겠는데
메일 말투가 정말 날카로우심…

교수님 날카로운 말에 상처 안 받을 자신 있는 분들한텐 강추
그냥 과제 2개만 하면 됨"
대학영어 1,Christopher Hemann,21,Fall,3.0,"영어못하는편은 아니라고 생각하는데 교수님과 기준 안맞으면 성적 잘안주는 듯 되게 깐깐하게 채점매심 그래도 피드백이 정확해서 얻어가는건 많을수도.. 그리고 랩보다 소회의실 토론 많이시키심ㅎ
본인은 에세이둘다 b떴는데 마지막 말하기를 괜찮게봤는지 a뜨긴함 빨리 치워야하면들으세요 로드거의 없음 글고 교수님캠에 등장하는 고양이가 귀여움"
대학영어 1,Christopher Hemann,21,Fall,1.0,"로드 적음. 200~350자 정도의 글쓰기 두번에 토론 한번하면 끝낼 수 있으며, 학점은 적당히 잘 주는 편인것 같음. 다만, 백신 맞고 아파서 결석하는 상황에서도 양치기소년이라는 둥의 인격적인 모독을 주는 메일을 서슴지 않고 보내는 편. 이를 감안하고도 대영 치우는게 목표인 사람들에게는 추천하겠음."
대학영어 1,Christopher Hemann,21,Fall,3.0,본인 기준 너무 강요해서 그거 캐치 못하면 영어 잘해도 성적 받기 힘듦. 첫 과제에서 망해도 나머지에서 잘하면 에쁠 받을 수 있기는 함. 로드는 매우 적음. 대영 특 설문조사하는건데 이 수업은 안해도 됨.
대학영어 1,Christopher Hemann,21,Fall,4.0,과제 주면 뭐할라고 하지말고 그냥 하라는대로만 하세여
대학영어 1,Christopher Hemann,21,Spring,5.0,"글쓰기 과제를 내주는데, 이 때 교수님의 의도를 잘 파악해서 거기에 잘 맞춰서 쓰는 것이 중요합니다. 무엇보다 수업시간에 말을 많이 하는 것을 강조하십니다. 마지막 평가로 조별 토의를 하는데, 대본이 아니라 생동감 있게 말하는 것과 다른 조원의 말에 논리적으로 반박하는 것에 점수 비중을 많이 두십니다."
대학영어 1,Christopher Hemann,21,Spring,5.0,"전 만족스럽게 듣고 주변에도 추천한 강의입니다. 지목되었을때 아무 말이라도 하면 큰 문제는 없는듯 합니다.
특히 시험이 아예 없어서 큼직한 과제 3개만 하면 되서 나름 꿀이라고 생각합니다"
대학영어 1,Christopher Hemann,21,Spring,4.0,교수님이 너가 뭔말을 하는지 모르겠다고 하는 숨간 자존감이 많이 깎이는 기분이 들었어요
대학영어 1,Christopher Hemann,21,Spring,5.0,"여름학기 수강
로드 글쓰기 두개 + 토론 시험
토론 시험 부담 될 것 같다고 생각할 수 있으나 전혀 부담없음
글쓰기도 그냥 깔끔하게 쓰면 되는 듯 거의 한시간도 투자 안했음 수업도 잘 안들어서 교수님이 생각하는 좋은 글쓰기가 뭔지 정확히 모르나 그냥 평소에 사람들이 생각했을 때 이글 깔끔하다 라는 전개방식으로 쓰면 될 듯 A- A0 받고 총 최종학점 에제나옴 개꿀"
대학영어 1,Christopher Hemann,21,Spring,5.0,"여름학기 수강
1. 생각보다 매우 널널하다. 토론하는 게 살짝 어색할 수 있지만 전혀 부담은 아니다. 학기 중 두 번 있는 과제 제외 수업 전에 뭔가를 준비해갈 필요도 없고 그냥 생각나는 거 와랄랄라 말하면 된다. 그리고 조원들을 잘 만나면 좋겠지만 아니더라도 본인이 하고픈 말 그냥 하면 된다. 조원들도 그러면 오히려 아주 좋아한다. 덜 어색하거등
2. 랩 스피킹 조교님 정말 천사시고 똑부러지신다. 스피킹 시간은 개인적으로 힐링타임이었다
3. 교수님의 고양이가 매우 귀엽다. 아주 격하게 쓰다듬고 싶었다
4. 나 영어 못한다. 발표도 한 번도 안 했다. 시험도 과제도 그냥 설렁설렁 했다. 근데 에마 받았다. 학점느님ㅠ
5. 졸업을 위해 대영을 치워버려야 하는 고학번이라면 추천한다."
대학영어 1,Christopher Hemann,21,Spring,5.0,"여름 학기 수강 A0
영어로 말도 잘 못하고 (진짜 2문장 중에 한 번은 더듬거림) 과제 성적도 썩 좋은 편은 아니었고(첫 과제 B0 두 번째 과제 A+/ 과제 성적이 아주 널뛰는 이유가 첫 과제에서는 교수님이 피피티에서 제시한 전개 방식?을 잘 안 따라가서 그런 것 같아요. 두 번째 과제는 피피티에 나온 전개 방식이랑 문장 간의 논리를 진짜 철저하게 따졌습니다.)기말 토론도 몇 번 논리 지적 받고 딱히 잘했다는 생각 안 들었는데 좋은 점수가 나왔습니다. 히만 땡큐 앤 ㄹㅓ뷰
아 그리고 랩실 조교님을 빼놓을 수 없습니다. 조교님 엔젤."
대학영어 1,Christopher Hemann,21,Spring,5.0,"여름 수강
Repeat after me. ""Hak jeom neu nim"""
대학영어 1,Christopher Hemann,21,Spring,4.0,"부끄럽지만 영어를 그리 잘하지 못하는 문과학생이라 걱정이 좀 많았습니다. 아니나다를까 글쓰기 능력이 처참하여.. 수업을 아무리 열심히 들어도 둘다 비쁠을 받았더라구요.. 그리고 따로 10퍼센트 차지하는 글쓰기 과제도 피드백이 그리 좋지않았어요 ㅎㅎ.. 그래서 좀 걱정이 많았는데 다행스럽게도 마지막 토론시험과 10프로의 스피킹랩에서 좋은 점수를 얻어서 마지막엔 에마를 주셨네요ㅠㅠㅠ 그저 감사할뿐이죠.. A는 꿈도 못꿀줄알았는데. 수업은 전반적으로 스피킹을 정말 많이 시키셔서 말하기에 자신이 없으신 분들은 그리 추천하진 않습니다. 그치만 저는 개인적으로 말하기도 크게 자신은 없었지만 스피킹 랩과 수업시간에서 좀 적극적으로 참여해서 나름 한 학기동안 실력이 크게 늘은 것 같다는 느낌을 받았어요. 다만 글쓰기 과제는 교수님 ppt를 꼼꼼하게 보시고 마치 중간고사, 기말고사를 준비한다는 느낌으로 시간을 많이 투자하셔야 할 것 같네요.. 저는 글쓰기를 못함에도 불구하고 둘다 하루만에 과제를 끝내버려서 결과가 더 좋지 않았던 것 같습니다. 아 그리고 스피킹랩은 중간고사만 보고 끝나서 너무 좋았어요ㅠㅠㅠ무엇보다 스피킹랩 선생님 정말 천사세요....힐링. 그리고 토퍼교수님 화면에 가끔 등장하는 말괄량이 고먐미....도 힐링이에요ㅠ 아무튼 로드가 별로 없고 교재도 필요없어서 대영 치우기엔 적당한 과목인 것 같습니다!"
대학영어 1,Christopher Hemann,21,Spring,3.0,"글쎄요 지나치게 좋은 평이 많아서 과대평가된 것 같아 간략히 적습니다. 글쓰기 과제 2개 + speaking lab(시험은 중간만 존재) + writing lab + group discussion(기말고사) 이렇게 평가가 진행됩니다. 매 수업 정말 열심히 준비해오시고 수업 시간이 남거나 모자라는 일 거의 없이 칼 시작 칼 끝입니다. 글쓰기 과제 성적은 한번 잘 받으면 대체로 다음 글도 잘 받지만, 한번 못받으면 다음 성적을 잘 받기는 대체로 어렵습니다. 그리고 기말고사의 비율이 생각보다 큽니다. 글쓰기 2개 성적이 둘다 처참했는데 기말고사에서 순위를 뒤집은 것 같은 성적을 받았습니다. 사실 별로 추천하고 싶은 수업은 아닙니다. 수강생이 전반적으로 열심히 하는 분들이 없으면 상대적으로 좋은 평가를 받긴 좋으나 열심히 하는 분들이 많다면 성적 받기 어렵습니다. 분반 운을 꽤 타기 때문에 이점 생각하시면 좋을 것 같습니다. 그리고 수업 도중, 혹은 기말고사든 말을 할 때 발언의 contents를 중시하지는 않는 편이고 attitude, 혹은 전달 방식을 더 중점적으로 평가하십니다. 알맹이 없는 내용이라도 최대한 문장이 되도록 말하고, 열심히 참여하시면 됩니다."
대학영어 1,Christopher Hemann,21,Spring,5.0,"교재 살 필요 없음
과제 적음
지필시험 없음
수업 내용 유익함
조교님 착하심
학점 잘 줌"
대학영어 1,Christopher Hemann,21,Spring,5.0,교수님 사랑합니다  학점 뜨자마자 왔어요 저는 수업에서 영어 못해서 엄청 더듬고 했는데도 a0 받았고 과제도 거의 없고 수업도 배울점이 많았습니다. 수업 열심히 참여만 하면 학점 잘 주시는것 같아요!! 과제 별로 하기 싫고 수업 안에서 하는 토론 잘 참여하실 수 있으면 정말 좋은 강의인 것 같습니다.
대학영어 1,Christopher Hemann,20,Fall,3.0,"주변에서 호평 많이 듣고 기대를 너무 해서 그런지 그 이하의 수업이었지만 기대 안 하고 그냥 대영 해치울 생각으로 들으면 나름 괜찮은 것 같다. 
토퍼가 내는 큰 과제 두번에 기말 토론 한 번이라서 크게 과제 부담없이 수업을 들을 수 있다. 다만 교수님이 의도하신 바를 캐치하는 게 너무너무 중요한데 캐치하기가 꽤 어렵고 (피피티에 나와있다고 하더라도) 캐치해서 나만의 생각으로 글로, 또 말로 옮기는 건 또 다른 문제다. 열심히 노력하는 게 좋은 성적으로 절대^^ 이어지지 않는다. 명확한 기준과 공정하게 채점하려고 노력하시는 점은 좋았다. 수업 준비도 열심히 하심.
함께 수강한 수강생분들 정말 좋았지만 매 시간 논리에 맞는 스피킹을 해야한다는 게 꽤 부담이 되기 때문에 스피킹에 자신이 없는 사람들에게 굳이 이 강의를 추천하지는 않는다. 스피킹에 자신이 없으니 이 강의를 통해 말 트고 자신감 얻겠다! 절대 이렇게 되지는 않더라. 밑밑분들 강의평 참고하시면 될 것 같다.
수업은 편히 들을 수 있고 자잘한 과제 없고 그나마 에이를 오싶퍼 준다는 게 꽤 큰 장점인 것 같아서 별 세 개임!"
대학영어 1,Christopher Hemann,20,Fall,5.0,"엥 솔직히 4별점 4.5 이상은 나와야하는 강의같은데 아래 보니까 후기가 좀 갈리네요. 

-수업: 아마 분반마다 분위기가 좀 달랐던 것 같아요. 제가 수강한 반은 분위기 좋았던 것 같은데요... 질문하시는거에 잘못 대답한 경우에 좀 더 생각해보라고 말씀하시기는 하는데 그럼 그냥 멋쩍게 헤헤웃다가 다른 학우분들 발표하시는거 듣고 있으면 답이 생각나더라구요. 그럼 그 때 다시 발표하면 됩니다. 

-과제:  과제는 워낙 정형화되어서 ppt보고 구조 파악하고 그대로만 쓰면 됩니다. 그게 첫 과제때는 파악이 덜 되어도 두번째 쯤 되면 파악이 됩니다.

-토론: 토론은 제가 영어 스피킹을 못해서 가장 걱정했던 부분인데 영어 실력으로보면 엉망진창 얼렁뚱땅 말했지만 아마 영어 스킬보다는 내용과 논리를 중요시하시는 것 같습니다. 

-성적: 과제1 에제 과제2 에쁠 토론 모름 지각1인데 에제 받았어요. 성적발표되고 나서 직접 메일 주셔서 에쁠을 주고싶었으나 네 랩성적이 보정불가능한 정도라 에제라고 (ㅠㅠ)친절히 설명해주셨습니다. 

랩수업이 낫다고 하시는 분들 많은데 저는 오히려 둘다 열심히 했는데 랩 때문에 성적 깎인케이스에요ㅠㅠ"
대학영어 1,Christopher Hemann,20,Fall,5.0,"저처럼 수업 안듣고 과제만 적당히 하는 수강생들에겐 개꿀이었습니다^^
과제 총 세개(에세이 2, 토론1)밖에 없고 시험도 없는데 무조건 들어야죠~~ 솔직히 밑의 강의평대로 교수님이 원하는 스타일로 작성해야 좋은 점수 받을 수 있는 건 맞습니다. 하지만 이 부분은 교수님이 수업 때 충분히 설명하셨고, 받아들이는 건 자기 몫이라고 생각합니다. 교수님의 강의력은 제가 수업을 들었다면 되게 의미있게 다가왔을 것 같습니다. 저도 제 방식대로 써서 에세이 두개 비쁠 비제를 맞아서 학점에 대한 미련을 버렸는데 토론을 잘했는지 최종학점 에마라니요ㅠㅠ 진짜 천사십니다. 학점 잘 안나오신 분들은 토론 시험에서 미리 대본을 만들고 읽다가 교수님께 적발되서 점수가 많이 깎이신 것 같네요. 에쁠은 힘들지만 에제 에마 받긴 쉬워보입니다(50퍼 꽉 채워서 에이 주십니다).
아무튼 대영1은 절.대.히.만.해."
대학영어 1,Christopher Hemann,20,Fall,5.0,"저는 재밌게 들었던 수업입니다
지각 한 번 + 첫번째 글쓰기 과제 에마 + 두번째 글쓰기 과제 에쁠 + 세번째 조별토론 모름 = 최종 에쁠 나왔습니다(20명 중 11명 에이 주셨다 합니다)

교수님이 강의력이 좋으시고 수업 내용도 깊이 있는 내용이라서 배울 점도 있었다고 생각합니다. 글쓰기 과제 분량이 진짜 적고 토론은 수업시간에 준비할 시간을 따로 주시기 때문에 대영 치고 로드 부담은 거의 없다고 봐도 무방할 듯 합니다. 제 생각이긴 하지만 비대면 기준으로 수업시간에 발표를 더 많이 하거나 조별 토론에 열심히 참여한다고 가산점이 있는건 아닌 것 같고 그냥 교수님한테 지목 당했을 때 대답 못해서 감점 당하지만 않으면 되는 것 같습니다. 

단점이라면 교수님이 고집이 세시고 학생들을 대놓고 답답해하시는게 느껴지는 경우가 많아서 아메리칸 꼰대 느낌입니다.. 원하는 방향성이 지나치게 확고하신 것도 맞고요
다만 그 방향성을 수업시간에 아주 자세히 설명하고 가르쳐주셨기 때문에 뭐라 할 부분은 아니라고 생각합니다 저도 첫과제를 굉장히 열심히 했는데도 불구하고 원하는 점수가 안나와서 화났던 기억이 있는데 이 수업 들으실 분들은 '열심히' 또는 '잘' 하는 것보다 수업시간에 교수님이 제시하신 가이드라인과 평가기준을 충족하시는 게 중요할 것 같습니다.. (첫 과제는 특히나 점수를 짜게 주시니 첫과제 점수가 잘 안나와도 그냥 그러려니 하셔도 될 것 같습니다. 학기 중에는 평가가 너무 박해서 스트레스를 받았는데 최종성적을 받고보니 개별 과제 점수가 짜다고 해서 최종점수가 짜진 않은 것 같습니다)

로드 부담 없고 수업도 재밌어서 5점 드립니다"
대학영어 1,Christopher Hemann,20,Fall,5.0,"밑의 강의평이 너무 혹독해서 평가 남깁니다.. 저는 오히려 교수님의 수업을 듣고 영어에 대해 자신감을 가지게 되었어요.. 참고로 저는 영어를 너무 못하고, 오히려 같은 분반에서 수업을 듣는 학우분들의 영어 실력에 주눅이 들었어요.. 밑에 분께서 질문을 다시 한 번 묻거나(인터넷 문제는...잘 모르겠네요..)몰라서 대답을 못하면 점수를 깎는다고 하셨는데, 이건 이미 오리엔테이션에서 교수님이 강조하신 부분이었어요. 틀리더라도 일단 말을 하는 연습이 중요하고, 자신의 생각이 논리적으로 전개되는게 더 중요하다고요.(대영 수업에 겁을 먹어서 첫교시에 강조하신 부분을 많이 읽었어요..)저는 오히려 틀린 답을 말해도 잘 정리해주시는 교수님께 감사함 마음이 들었습니다. 
그리고 확실히 과제를 채점하는 기준은 엄격하다는 생각이들었어요. 하지만 이는 과제가 2번밖에 나오지 않으니 어쩔 수 없는 점이에요. 처음 과제 성적은 잘 안나와서 슬펐는데, 알고보니 그 기준은 채점표와 ppt를 잘 살펴보면 찾을 수 있었습니다. 두번째 과제에서는 채점표와 ppt, 그리고 첫번째 과제에서 고쳐주신 부분을 참고하니 좋은 점수를 얻었습니다.
밑에 분들의 말은 이해하나 이렇게 박한 평가를 받을 교수님은 절대 아닙니다. 정말 강의력도 좋으시고, 첫번째 과제의 성적이 안좋더라도 이는 반영비율이 낮다고 다음 과제를 열심히 하라고 격려를 해주셨어요! 뭐라하신게 전혀 아닙니다. 밑에분께서 노력한만큼 가져가지 못하는 강의라 평가하셨는데, 저는 오히려 다른 대영 수업을 들었으면 노력할 새도 없을 것이라 생각합니다.
참고로 고양이는 사랑입니다."
대학영어 1,Christopher Hemann,20,Fall,2.0,"이번 학기 수강생입니다.
아래 수강평 쓰신 분들에게 매우 공감하는 바입니다.
질문에 대한 이해를 하지 못해서 혹은 인터넷 연결 문제로 재질문를 할 경우, 점수가 깎입니다. 오히려 아예 동문서답을 하는 편이 점수가 깎이지 않더군요. 학문의 본질보다는 수업의 진행에 더욱 중점을 두는 듯 해보였습니다. 학점과 로드때문에 들었다고는 하지만, 몇 없는 두 개의 과제 점수는 나락입니다. 학점도 잘라주신다고 선언한 판국에, 과제 점수 반영이 높은 학점이 잘 나올리 만무합니다. 평소 영어에 자신감이 없는 편은 아니었지만, 이 수업을 듣고 영어 실력에 대한 자괴감이 듭니다. 아래 강의평 중 ‘못하는 걸 이해 못하십니다’를 체감하는 바입니다... 열심히 노력해서 수업이 아니라는 것을 뼈저리게 느낍니다. 수업에 있어 영어를 잘해도 좋겠지만 그것보다 더 중요한 것은 교수님의 세계관에 맞는 기준을 충족하는 것이라고 봅니다. 열심히 노력해서 대가를 바라시는 분은 이 수업 추천하지 않습니다. 교수님의 기준을 충족할 자신이 있으신 분들(누군지는 아직도 모르겠지만)만 들으세요. 랩 수업 교수님은 못해도 오히려 자신감을 주시는 편입니다. 랩 수업은 귀찮았어도 기분 나쁜 수업은 아니었고 가끔은 힐링이 되곤 했습니다. 토퍼 교수님께는 죄송하지만 가끔 인터넷 선을 건드리는 고양이의 냥냥펀치만이 수업 중 저의 한줄기 빛이었습니다.."
대학영어 1,Christopher Hemann,20,Fall,2.0,"밑 강의평에 정말 공감 많이 합니다.. 
자신감이 떨어지는 수업이에요 갈수록 말도 잘 안 나오고.. 제 실력이 잘못된건지 의심하게 되는 수업..?
교수님이 매번 랜덤으로 발표 시키시는데 조금이라도 주저하거나, 모르는 내용이라 답 못하면 바로 점수가 깎입니다. 
글쓰기도 정말 열심히 기준 맞춰서 작성했지만 A 나온 적이 없었습니다. 점수 매겨지는 모든 것에는 교수님이 추구하는 게 깐깐하게 있는 것 같은데 맞추기 정말 어렵습니다. 
그리고 못하는 걸 이해를 못하십니다. 자신감이 점점 떨어지고 교수님께 못하는 애로 낙인찍혔다는 느낌이 확실히 들어서 이겨내고자 수업 시간 전에도 몇 시간 동안 자료를 보면서 미리 말할 것까지 다 적어두기도 했는데 그런 노력이 안 먹히는 기분이었습니다. 
스피킹랩 선생님은 정말 좋으셨습니다. 오히려 스피킹랩 선생님께서는 자신감을 높여주려고 노력하시는 분 같았습니다. 
수강생들은 정말 좋았지만 괴로운 수업이었습니다. 그리고 노력하고도 점수 따기 어려운 수업은 처음이었습니다.
영어 실력이 뛰어나고 말을 정말 주저 없이 잘하시는 분들께 추천하겠습니다.
그게 아니시라면 고양이고 뭐고 속지 마세요"
대학영어 1,Christopher Hemann,20,Fall,1.0,진짜 별로에요. 성격이 원래 주눅드는 성격은 아닌데 본인이 정해논 기준이 뭔지도 잘 모르게 해놓고 그 기준에서 벗어나서 이야기하거나 레포트 쓰면 점수 확깎이고 뭐라고 합니다. 기준이 뭔지.. 참 제대로 설명을 해주세요. 이 수업 듣고 원래 있던 자신감이 지하를 뚫고 내려갔습니다. 진짜 비추 듣지마세여
대학영어 1,Christopher Hemann,20,Spring,3.0,"무난하긴 한데 딱히 추천하지는 않아요
로드가 많지는 않지만 수업 시간마다 영어로 토론을 매번 하게 되니조금 부담스러울수도 있어요"
대학영어 1,Christopher Hemann,20,Spring,4.0,"글쓰기가 교수님이 원하는 방향성이 딱 있어서 조금 실수하면 점수 확 깍임 ㅠㅠ
에제 받긴 쉬우나 에쁠 받긴 어려움 ..
그래도 대영치곤 과제도 적고 재밌었다고 생각합니다"
대학영어 1,Christopher Hemann,20,Spring,5.0,"2020-S
강의력, 성적, 고양이 3박자가 완벽합니다.
A 50퍼센트 이하만 주도록 하는 규정이 있는데 50퍼센트 채워주셔서 처음에 26명, 최종 23명이었는데 13등까지 A주셨습니다. 최하점이 B0로 이번에 C이하는 아예 안주셨다 하셨고, 다만 A-는 주십니다.
대영 특성상 성적 뿌리는 과목은 아닌데 이정도면 잘주시는 편 같습니다.
 무엇보다도 로드가 굉장히 적습니다. 스피킹 라이팅 빼면 과제1,2,3 빼고 자잘한 숙제조차 전무합니다. 
 그리고 설명을 잘하십니다. 못알아듣고 질문하면 풀어서 더 쉽게 말씀해주십니다. +상당히 훈훈하심...
 마지막으로 고양이가 출몰해서 교수님한테 치대는데 졸라 귀엽습니다. 매번 고양이를 들어올려서 뒤쪽으로 치우시는(?) 교수님도 귀여우십니다. 꼭 들으시길 추천드립니다."
대학영어 1,Christopher Hemann,20,Spring,3.0,"여름계절 들었는데 갓토퍼는 아닌듯.. 이번에 A도 50프로로 한정하셔서 원래 점수대로면 A받으셔야했던 분들도 B+로 깎였다고 공지도 하셨고 100-97점 이면 A+, 이런 식으로 절대평가 그 자체였다. 근데 문제는 기준이 엄청 엄격하신 것 같다.. 교수님이 원하시는 특정한 방향성이 있는데 그걸 잘 캐치하지 못하면 노력과는 상관 없이 점수 확 깎인다 ㅎ.. 수업도 열심히 듣고 가이드라인도 열심히 읽었는데 원하시는 방향성 캐치하기 어려웠다..^^..근데 못 캐치하면 점수 확 깎이고 절대평가에 따른 점수를 부여받고 50프로에서 딱 잘라서 그 밑은 B로 내리셨다.. 일반 수업이랑 비교하면 괜찮을지 모르겠지만 예전처럼 학점 퍼준다는 절대 아닌듯. 교수님깨서 지난 학기들에 자신이 A를 너무 많이 주셨다고 더 엄격한 기준을 적용하겠다고 하셨음. 수업은 나름 괜찮았고 과제 양도 많진 않았다. 교수님 고양이도 귀여웠다. A+은 받기 정말 어려운 것 같고 교수님만의 방향성을 잘 잡을 수 있을 것 같은 분들은 들으세요"
대학영어 1,Christopher Hemann,20,Spring,5.0,"Thank you Topher!  I'm happy to meet you in this class❤
대영1인데 로드 거의 없고, 수업시간에만 열심히 하면 문제 없어요. 
의견 나누고 말하는 게 수업 주 내용이라 그런 거 부담스러우면 비추지만 진짜 재밌고 유익한 수업입니다. 교수님도 여러 뉴스 찾아보시고 피피티 만드시고 영상 보여주시면서 수업 준비 열심히 하신 것 같아요. 20명 수업인데 매 수업마다 랜덤조로 토의하고 그래서 수업 듣는 친구들이랑도 친해지기 쉬워요! 성적은 열심히 하면 잘 주시는 것 같아요. 전 개인적으로 과제 2개 A0, B+ 받고 토론 약간 망친 것 같고, 태도 점수도 살짝 깎였는데 에제 받았어요. 개인적으로 비제나  비뿔일줄 알았는데 잘 주셨어요. 막 에쁠 퍼주거나 에이 퍼주시는 건 아니고, 기준에 맞춰서 점수 주시는데 나쁘게는 안 주세요."
대학영어 1,Christopher Hemann,20,Spring,4.0,"토퍼 교수님 너무 좋아요
고양이도 너무 귀여워요

수업은 보통 짧은 영화클립 보거나 신문기사 돌아가면서 읽고 자기 생각 나누는 방식으로 진행돼요
이때 소회의실 들어가서 조원들끼리 얘기하는데, 비록 온라인이었지만 얘기할 기회가 많아서 어느 정도는 친해질 수 있었던 것 같아요

이 수업은 대영1 인데도 로드가 거어어어어의 없어요
참여도나 출결도 점수에 반영되지만, 비중이 큰 건 두 번의 글쓰기 과제와 기말 토론 시험이에요
아무래도 글쓰기 잘하시는 분들이 학점 따기에는 더 유리했을 것 같네요

수업 정말 재밌고 유익해요! 영어로 말하는 것에 대한 두려움도 많이 사라진 것 같아요
영어로 말하는 거에 크게 거부감 없고 글쓰기 자신 있으신 분들에게 완전 추천해요!!"
대학영어 1,Christopher Hemann,20,Spring,5.0,어니 토퍼 진짜 좋아요 이 수업을 비대면으로 들은게 진짜 한입니다ㅠㅠㅠ 조별로 토의하는게 수업의 대부분을 차지하구요 말하는거 좋아하시면 정말 좋아요 같이 수업듣는 분들이랑도 친해져서 너무 좋구요!!  그리구 토퍼 좋아요... .. 진짜... 기말도 없고 평소에 조원끼리 하던 토의가 기말이구요...  학기 통틀어서 과제도 두개밖에 없고 전 이번학기 최고의 선택이라구 생각해요!!
