대학영어 1,모윤숙,21,Fall,5.0,"- 출석과 참여를 중요시하는 분입니다.

- 지각 및 결석한 적 없고, 참여 잘했으며(수업당 최소 한마디씩하려고 노력), 과제는 모두 기한내에 제출했고, 소회의실에서는 영어만 사용했습니다.

- 중간은 평균보다 10점 높았고, 기말은 열심히 공부했는데 못본 느낌이라 걱정했는데 A+받았어요!

- 단어퀴즈는 세번봤는데 한회당 다섯문제 정도 출제되었고, 최소 한문제씩은 틀렸어요! 단어퀴즈 못봤다고 많이 걱정하지 않아도 될 것 같습니다.

-반분위기: 저희 반은 좋았습니다. 다른 분반에서는 과제 안했는데 해왔다고 거짓말했다가 들통난 분이 여러명이라고 교수님이 화가 나셔서 과제한 후 ETL에 찍어올리라고 하셨습니다. 반분위기에 따라 학점부여 방식에 차이가 있다는 평을 봤는데 다른 분반 학생의 학점을 몰라 판단하기 어렵네요. 아무튼 제 학점에 반분위기가 악영향을 줬을 가능성은 없습니다. 

- 스피킹랩은 10점, 글쓰기교실은 9점이었습니다. 본수업은 평가항목이 많아 하나 망쳤다고 걱정할 필요없지만, 스피킹랩과 글쓰기는 그대로 반영 때문에 신경을 좀 더 쓰셔야 할 것 같아요.

- 개인발표와 그룹발표는 비대면이었지만 대본을 외워서 했습니다. 다른분 발표할때 보니 대본 읽는 게 티나더라고요. 저도 아는데 교수님이 모르실리 없을거라 생각합니다.

- 이메일 작성과제는 ETL 영상보고 그대로 작성했습니다. 점수는 모르지만 대문자, 줄바꿈에 주의해서 작성했기때문에 깎였을 것 같진 않습니다.

- 기영이고 반에 영어 잘하는 사람이 많게 느껴져서 걱정했는데, 학점을 보니 노력하면 좋은 학점 받는 수업이라고 생각합니다."
대학영어 1,모윤숙,21,Fall,5.0,교수님 인품이 너무 좋으셔요 항상 친절하시고 배울점이 많은수 업이에요
대학영어 1,모윤숙,21,Spring,5.0,"대면이었으면 더 재밌었을 거란 생각이 드는 유일한 수업!
교수님도 친절하시고 반 분위기가 좋아서 수업 내내 즐거웠어요 다만 자잘한 과제(지문 읽어오기, 학습지 채우기 등)가 종종 있는데 어쩌다 한 번 검사하면서 체크하시니 과제는 그냥 미리 해두시길... 학점도 나쁘지 않게 주십니다"
대학영어 1,모윤숙,21,Spring,5.0,"갓윤숙.. 과제가 아예 없는 편은 아니나 교과서 한페이지 읽어오기 프린트 한장 풀어오기 정도라 기억만 하면 수업 전 10분 안에 끝낼 수 있는 분량입니다 
발표 두번도 한번 개인 한번 팀플인데 개인은 준비할 것도 별로 없었고 팀플도 4시간 안쪽에서 다 끝나요
시험은 중간보다 10점 정도 잘봤었고 (근데 교수님 말씀하시기로는 아주 못 본 몇 명이 있는거지 나머지는 다 비슷비슷하다고 평균을 믿지는 말라 하셨어요) 기말은 하루 공부하고 봤는데 에이쁠 떴습니다
교수님 인품도 너무 좋으셔서 따뜻한 수업시간이었어요
대영 치우면서 너무 귀찮지 않고 학점도 잘 받을 수 있는 기회입니다..!"
대학영어 1,모윤숙,21,Spring,5.0,"윤숙모 겨수님 수업 외않들어?
1. 수업: 일주일에 두 번 zoom 수업+ 스피킹랩 zoom 수업(이정승 선생님)
2. 평가: 퀴즈 4~5번(사전에 공지해주심)+개인 발표(MBTI 활용 자기소개)+팀 발표(배운 내용 관련 자유 주제)+중간고사+기말고사
3. 태도점수(?): 지각 한 번 정도는 봐주시지만 그 이후부터는 check 하시고, 출결을 중요시하시는 듯함. 수업 중 한국어 사용 NONO(특히 소회의실에서 조심^^) 숙제를 내주실 때가 있는데 이것도 안 해가면 check 하심. 정확히는 모르겠지만 발표하거나 질문에 대답, 다른 학우분들 발표 경청하고 질문하는 것도 check 하시는 듯함. 
4. 스피킹랩: 스피킹랩도 완전 좋았음. 조교님도 유쾌하시고 중간평가 한 번만 봄. 하라고 하신 거 다 하고 소회의실에서 small talk 나누는 거 재밌음.
5. 소감: 교수님 수업 준비 정말 열심히 해오시고 따뜻하셔서 우리 분반 분위기가 좋을 수 있었던 것 같음. 영어 못해도 말하려고 노력하고 수업 적극적으로 참여하면 학점 잘 주시는 듯함. 2021 최대 업적 윤숙모 교수님 대영 들은 것. 
6. 학점: 수업 열심히 듣고 적극적으로 참여하려 하고, 퀴즈와 과제 준비 꼬박꼬박 했음. 시험은 고등학교 때만큼은 아니지만 video 대본 만든 거+교과서+노트정리 중심으로 교수님께서 공부하라 하신 거 열심히 했더니 평균보다 10점 높게 받았고(중간) 최종적으로 A+ 받음. 갓갓갓윤숙."
대학영어 1,모윤숙,21,Spring,5.0,교수님이 학생들을 배려하며 수업하시는 거 같았습니다! 그리고 영어를 못해도 말하려고 노력하는 자세를 더 중요시 여기는 것 같습니다!  재수강 각오하고있었는데 잘나와서 깜짝 놀랐습니다.. 한학기 잘 배우고 갑니다 ♥
대학영어 1,모윤숙,21,Spring,5.0,"343보다 훨씬 잘주는건 모르겠지만 분명 잘주십니다~
그리고 열심히 참여하면 어느정도 점수는 받아가실 수 있어요
교수님이 잘가르쳐 주시려는 모습에 별 5개 올려요.
성적이 안좋은건 시험을 못본 내 탓.."
대학영어 1,모윤숙,21,Spring,5.0,"중간 성적은 평균보다 7~8점..? 낮았고 기말은 나름대로.. 열심히했음. 과제같은건 하라는건 다 했는데 퀄은 그냥 내기만 하자 수준이라 씨쁠에서 비마 예상했는데 비쁠 주셨어요 ㅜ..감사합니당
교수님께서 되게 말을 많이 시키시고 기영 출신이라 좀 힘들었지만 교수님 자체는 좋은 분이시고 성적도 생각보다 너무 잘주셧음 감동"
대학영어 1,모윤숙,21,Spring,5.0,"분반 분위기도 좋았고, 교수님께서 친절하세요! 영어 잘 못하는데 나름 열심히 했더니 A-네요. 나온 성적은 중간, 스피킹랩, 이메일이었는데, 중간은 평균보다 9점 높았고, 스피킹랩이랑 이메일에서 몇 점 깎였어요. 성적과 관계없이 재미있고 즐거웠어서 5점 드립니다."
대학영어 1,모윤숙,21,Spring,4.0,로드많지만 괜찮은 대영수업이다. 개인적으로 난 좀 빡세다고 여겨 4점줌
대학영어 1,모윤숙,19,Fall,5.0,나 기영출신인데 그냥 적당히 공부해서 적당히 시험보니까 a뜨더라. 참고해라
대학영어 1,모윤숙,19,Fall,5.0,아랫분 수강평이 이해 안되는데 과제가 자잘하게 있는건 대영 특징이라 어쩔 수 없고 수업을 제때 끝내는 것은 당연한 것입니다. 그리고 급한 일이 아니면 수업 중 자리 떠나지 않는 것은 교수님에 대한 학생의 예의라고 생각합니다. 19년도에 들었는데 영어를 싫어하는 학생(본인)임에도 불구하고 재밌게 잘 들었습니다. 교수님께서 상대적으로 수업에 참여한 학생들에게 더 잘해주려하시고 배려해주십니다. 성적 역시도 제 성적과 과제 및 발표를 생각했을때 3:4:3보다 잘 주시고 합당하데 주신 것 같습니다. 좋으신 교수님이시고 수업 재밌게 들었는데 교수님께서 이유같지 않은 이유로 평가 절하 당하는 것 같아 남깁니다.
대학영어 1,모윤숙,20,Fall,1.0,"학점은 열심히 한만큼 잘 주십니다. 근데 시험 이외에 자잘한 과제가 거의 매 시간 있다고 보면 됩니다. 수업시간은 무조건 꽉 채우시고 대체로 시간이 오바돼서 끝나고, 수업 중간에 잠깐이라도 자리비우면 굉장히 싫어하십니다. 그리고 학생들의 건의사항은 잘 안들어주시는 편인 것 같습니다."
대학영어 1,모윤숙,20,Fall,5.0,영어를 잘 못하는데 일단 입을 열고 소리를 내면 끝까지 들어주신 점이 좋았습니다. 저는 수업 참여를 열심히 한 것 같진 않지만 학점이 잘나온 것 같네요... 아래에서 교수님이 까칠하다고 하신 부분에 대해서는 그렇게 느끼셨을 수도 있지만 대체로 친절하셨던 것 같아요. 과제는 거의 매일같이 나왔지만 대부분이 단어 뜻 매칭하기 혹은 교과서에 3~4문제 푸는 정도로 본문 읽고 5분도 안걸렸던걸로 기억해요. 같은 학기에 다른 대영 수업을 들은 친구가 얘기한걸로 들었을 때 과제도 적고 공지도 올려주시고 영어에 자신이 없는 분들이 듣기에 괜찮은 것 같습니다!!
대학영어 1,모윤숙,20,Fall,5.0,"자잘한 과제들은 많은데(2주에 1~2번) 거의 20분안에 끝납니다.
큼직한 과제들은 다른 대영에 비하면 오히려 편한 편이라고 알고있어요.
시험은 고등학교/중학교 내신처럼 수업시간에 배운것들 달달 외워서 가면 좋은 점수 맞을 수 있습니다. 영어 실력과는 큰 관계 없어서 기영둥이인 저한텐 좋았어요.
아랫분이 교수님 까칠하다고 하셨는데 저는 까칠하다는 느낌은 별로 없었어요. 저는 반대로 온화하시다고 느꼈었는데 강의평보고 좀 의아했습니다. 학생들 이름이나 과제 어떤거 했는지 전부 상세하게 기억하고 계십니다. 수업 시간에 다른 짓하거나 규정에 어긋나는 행동 할 때(특히 몰래 한국어 사용, 토론 때 가만히 있기)는 화내셔도 그 외에는 잘 챙겨주시려합니다.
성적도 잘 주신거 같아요."
대학영어 1,모윤숙,20,Fall,1.0,"저는 학점은 예상대로 받았구요, 학점과 별개로 교수님을 추천드리고 싶지 않습니다. 
원래 그러신 분인지는 잘 모르겠으나 말투가 매우 날이 서 있으셔서 매사에 화나신 거 같은 느낌을 받았고, 대영 필수 로드 외에 자잘한 로드(다음 수업 본문 읽고 문제 풀어오기)가 많고, 본인의 착오나 실수로 피해 본 학생(글쓴이 본인)에게 사과하지 않는 것에 당황했습니다. 큰 사건은 아니었으나 실망스러웠습니다."
대학영어 1,모윤숙,20,Spring,5.0,왜 이렇게 평이 안좋은지 모르겠어요!! 영어로 수업하시지만 학생들이 이해할 수 있게 배려해주십니다 또한 줌수업이라 수업 분위기가 어색해질 수 있는데 항상 편한 분위기로 풀어주셨어요 학생들 의견 다 들어주시고 최대한 학생들의 부담을 덜어주려고 하셨어요 퀴즈나 시험이 지협적으로 나와 당황했지만 그 문제를 못 풀어도 학점은 굉장히 잘 나왔구요 수업시간에 집중하고 잘 들으면 학점 잘 나옵니다~!~
대학영어 1,모윤숙,20,Spring,1.0,"교수님의 수업방식도 마음에 들었고 로드도 간단하여 강의평을 믿고 듣길 잘했다고 생각했습니다. 수업도 열심히 참여했고 조별활동이나 랩 활동에서도 꾸준히 참여하는 태도를 보였는데, B0를 받아서 좀 충격이었습니다.. 교수님은 정말 좋으신 분이지만 학점을 생각하신다면 그렇게 추천드리지는 않아여..ㅎ"
대학영어 1,모윤숙,20,Spring,5.0,"안 좋은 평이 있어서 호다닥 써봄. 교수님 굉장히 친절하시고, 학생들 이해하려고 노력하시는 게 눈에 보일 정도로 배려심 있으신 분임. 그런데 이 수업의 평이 극과 극인 이유를 추측하자면, 태도점수로 학점이 갈리는 느낌이라서 그런 것 같음. 수업 시간에 교수님 말씀 잘 따라가고 호응하면 점수 기본적으로 괜찮게 나오는데, 교수님께서 경고하시는거 안 고치거나 딴짓하는 거 보이면 점수 확확 내려감. 꽤나 자주 보는 퀴즈도 단어랑 관련된 간단한 난이도고, 로드도 배우는 거랑 관련된 것만 조금 있고, 그래서 변별력도 거의 없으니 당연하게도 태도 점수가 학점을 좌우하게 됐다고 생각함.그래서 결론적으로는 조금 졸려하더라도 집중하려고 노력하는 모양새만 보이면 꽤 괜찮은 점수 나오고, 아예 포기하거나 대충하는 모양새가 느껴진다 싶으면 높은 점수는 안 바라는게 마음이 편할듯 하다."
대학영어 1,모윤숙,20,Spring,1.0,"교수님 두얼굴이십니다
앞에서 잘해주시고 착하셔도
뒤에서는 b-주십니다"
대학영어 1,모윤숙,20,Spring,1.0,기본적인 공지사항을 잘 안올려주셔서 코로나 시대 비대면 강의에는 별로
대학영어 1,모윤숙,20,Spring,5.0,"교수님이 너무 좋으신 분이에요. 친절하시고 수업 분위기도 좋았어요. 대영 기본 로드? 외에는 없던 것 같아요. (시험, 점수에 들어가는 발표과제)  시험 유형은 마치 고등학교 내신시험처럼 나와서 오히려 영어 베이스 없어도 그냥 시험공부 열심히하면 만회 가능이에요. (단어외우기, 교과서 본문 공부 이런거) 만족이었어요 완전! 수업 다시 들어도 모윤숙 교수님 수업 들을 것 같아요."
대학영어 1,모윤숙,20,Spring,4.0,로드는 그냥 대영 평균정도임 자잘한거 시키는게 많긴했는데 할만은 했음 50프로 A라기에 기대하고 중간도 절반안에 들고 발표도 열심히 준비하고 기말도 열심히 공부했는데 B+... 성적기준은 잘 모르겠지만 그래도 교수님 엄청 착하심
대학영어 1,모윤숙,20,Spring,5.0,"솔직히 이 교수님이 로드가 많았다고 말하면 안 되는게, 대영에서 필수적으로 필요한 로드 외에의 로드는 다른 대영에 비해 현저히 적었습니다. 또한, 교수님께서 학생을 배려해서 진도도 천천히 나가주시는 건 정말 감동이었습니다. 필수교양에서 이 정도로 편하게 수업 들을 수 있는 교수님은 모윤숙 교수님밖에 없을거라고 생각합니다. 한 학기동안 정말 감사했습니다!"
대학영어 1,모윤숙,19,Fall,5.0,학생들에게 애정을 갖고 계신게 느껴져서 한 학기 감사했습니다. 로드도 적고 성적도 잘 주셔요!
대학영어 1,모윤숙,19,Fall,5.0,"그저 빛...
영어ㅈㄴ못하는데(기영둥이였음) a+받아갑니다....공부하루전부터 시작했구 지각X 결석 랩한번이었어용
절대 윤숙해"
대학영어 1,모윤숙,19,Fall,4.0,교수님이 굉장히 친절하시고 좋으심. 첫 시간에 반의 50퍼센트를 A대 성적을 준다고 하심. 과제도 다른 반에 비하면 적은 것 같고 시험도 프린트랑 교재 위주로 공부하면 됨. 다만 유튜브 자료를 따로 공부하는 게 좀 귀찮. 성적은 A0나 A- 예상했으나 의외로 B+. 중간은 평균보다 13점 높았으나 기말은 모르겠음. 일단 치운다는 생각으로 들었기에 딱히 미련없이 좋았던 수업.
대학영어 1,모윤숙,19,Fall,5.0,"교수님께서 진짜 친근하시고, 학생 한명한명 기억하고 돌봐주시는게 느껴져서 좋았음. 조별로 토론하고 이야기하는 시간이 많은 편인데 덕분에 같이 수업듣는 분들이랑 친해질수 있어서 그것도 나름 좋았음.
로드는 조금 빡센면이 있는데 그건 대영 특성상 어쩔수없는거 같고, 시험은 유튜브 많이 보고 문법보다는 어휘랑 텍스트 내용 위주로 공부하면 될듯.
과제는 거의 만점일거고 중간은 평균보다 20점정도 높았고 기말은 평균정도로 예상되는데 A+이니까 학점도 후하게 주심
그저 갓-윤숙"
대학영어 1,모윤숙,19,Fall,4.0,본인은 에마. 중간 평균 기말 평균?(점수 공개 안하심). 과제는 아마 다 만점 일 거라고 예상. 다만 대영은 모두 열심히 해서 시험 점수로 재수강을 예상하고 있었는데(또 워낙 칼같이 주신다고 해서) 생각보다 후하게 학점을 주심. 교수님은 정말 열심히 하심.  로드는 대영이니 꽤 많음. 시험도 많이 지엽적이지만 대영으로서 나쁘지 않다고 생각함. 같이 듣는 사람들이 중요할 듯.
대학영어 1,모윤숙,19,Fall,4.0,"중간 정말 많이 못 보고, 기말은 평균 정도 친 거 같습니다!
교수님 덕분에 수능 이후로 하지 않았던 영어를 다시 시도해 볼 수 있었으며, 결과적으로 학점이 생각보다 잘 나와 교수님께 너무 감사하네요 ㅎ"
대학영어 1,모윤숙,19,Spring,5.0,"시험 두번 다 공부를 안해서 지금 대영1 재수강하고있는 학생입니다.
왜 곁에 있을 땐 몰랐을까요, 모-윤숙 교수님은 천사라는 것을,,,
학생 이름 한 명 한 명 다 외워서 불러주시고
영어로 말하는 게 부담스럽지 않은 분위기로 만들려고 노력하시는게 눈에 보입니다.
지나고서 알았지만 다른 교수님 수업보다 훨씬 분위기가 좋아요!
교수님께서 따듯하시니 학생들도 다들 둥글둥글 편안한 분위기로 수업 들을 수 있었던 것 같아요.
정말 갓-윤숙 교수님입니다 고민말고 수강신청하십쇼 다들!"
대학영어 1,모윤숙,19,Spring,5.0,"대영 치고 로드가 적었던 강의인듯.
시험도 수업시간에 반복을 많이 시켜주셔서 시험전날 한번씩 보고갔더니 중간은 90점 넘었던듯(기말은 안알려주셔서 모르겠다.)
개인발표, 팀발표 합쳐서 두번인데 대영마다 다 하는거라 그렇게 로드가 많다고 느끼지 못했음.
수업도 재밌는 방식으로 하려고 애쓰시는 교수님이라 좋았고 학생들과 편안하게 소통하려고 노력하시는 모습이었음. 왜 유명하시지 않은지가 그저 의문
갓-윤숙"
대학영어 1,모윤숙,19,Spring,5.0,"본인 주변 사람들이 대영1들을 때 할거 많다고 죽어나가는거 많이 봤는데 이 수업은 비교적 로드 적은 것 같고, 교수님 정말 좋으신 분이고,  시험 준비도 조금만 하면 성적 잘 나옴."
대학영어 1,모윤숙,19,Spring,3.0,로드가 좀 있지만 교수님은 되게 좋으세요 시험은 두번 봤고 개인 발표랑 조별 발표도 했습니다
대학영어 1,모윤숙,19,Spring,5.0,"내가 영어를 싫어한다는 것 빼고는 좋았던 수업
로드가 많은 편도 아니었고 시험도 알려주신 부분만 공부하면 그리 어렵지 않았다. 무엇보다 학생들의 이름을 전부 외우셔서 알아서 출첵를 하시고 학생들과 얘기도 많이 나누시려고 하는 등 학생을 신경써주시는 착한 교수님이다. 다만 기말고사 점수를 안 알려주셔서 학점까지 잘 주신건지는 잘 모르겠다."
대학영어 1,모윤숙,19,Spring,5.0,"어차피 한 번 듣게 될 대학영어1 이라면,  이 교수님의 강의를 들으시길 추천드립니다. 로드는 생각보다 빡세지는 않았습니다. 과제나 발표는 시간적으로 여유 가지고 준비하시면 큰 어려움 없이 해결하실 수 있을 거예요. 시험은 중간 기말 두번 보는데,  교수님께서 보여주시는 동영상 많이 보시고 책 본문 내용,  수업시간에 다룬 단어들 열심히 공부하시면 좋은 성적  받을 수 있습니다. 교수님도 어머니처럼 포근한(?) 느낌이셔서 좋았습니다."
대학영어 1,모윤숙,19,Spring,5.0,"성적 나오기 전에 평가쓰겠습니다...
로드는  나쁘지 않아요. 중간에 자잘한 숙제를 내주시거나 예고없이 단어 퀴즈 같은거 보는데 태도 점수에 반영이 된다더군요. 그리고 개인발표랑 그룹발표 한번씩 합니다. 교수님은 뭔가...엄마...같...뭔가 포근한.... 좋으신 분 같아요. 시험은 교과서 본문이랑 유트브 영상 등등에서 나옵니다. 문제는 좀 지엽적인 느낌인데 꼼꼼하게 보시면 잘 보실 수 있을꺼에요."
대학영어 1,모윤숙,18,Fall,4.0,"일단 로드가 많은 편은 아니라고 생각합니다. 과제도 발표 준비나 글쓰기 외에는 하나도 없었고, 주변 다른 대영 듣는 친구들에 비해서는 널널했다고 생각해요. 교수님 수업도 전반적으로 괜찮았고 한 학기 큰 부담없이 들었던 수업이었습니다. 
다른 대영 친구들이 시험 문제가 수업시간에 배우지 않은 것들이 나왔다고 하던데 이 수업은 그러지는 않아요. 다 수업시간에 배운 지문들과 교수님께서 알려주신 자료로부터 나옵니다. 다만 시험은 영어 잘하는 사람이 좋은 점수를 받는다 이런건 못 느꼈어요. 문제가 살짝 지엽적으로 나오거든요.
단점을 꼽자면 시험 중간값을 알려주지 않으셔서 본인이 어느 정도의 등수인지 알 수가 없어요. 과제 점수 역시 마찬가지이고, 발표점수는 본인도 본인 점수도 모릅니다. 
그래도 별점 4점인거 보이시죠?! 나쁘지 않은 수업이에요 추천하겠냐고 물으면 추천하고 싶은 수업이네요."
대학영어 1,모윤숙,18,Fall,3.0,"일단 기본적으로 대영이다 보니 로드가 적은 것 같진 않아요ㅠ 글쓰기 두번  발표 두번이랑 스피킹랩 평가 있는데 두번째 발표는 팀플이고, 글쓰기 과제의 경우 소위 말하는 꿀강은 두번째 글쓰기가  처음 쓴거 고쳐서 내는 경우도 봤는데 모윤숙 교수님은 아닙니다.  저는 개인적으로 글쓰기에서 영어로 된  레퍼런스만 쓸 수 있는 거랑  APA스타일로  출처표시하는 게 번거로웠어요. 시험은 중간고사 기말고사 두번 있는데 고등학교 내신처럼 문장 순서 맞추기, 빈칸 채우기 같은 거 나오니까  거기 맞춰서 준비하시면 될 듯하네요. 교수님이 시험에 나온다고 하시는 유튜브 영상 비중이 생각보다 크니까  여러 번 보시고요"
대학영어 1,모윤숙,18,Spring,5.0,"일단 교수님이 정말 포근한 엄마같으시구요^^평소 과제는  거의  없다고보면돼요!!
 수업시간에 다 못했을경우 다음시간까지 지문 한번 읽어오는정도이고 

글쓰기 평가에는 글쓰기 과제 두번(2~300자) 이 있고 

말하기 평가에는 ppt발표가 두번있는데 한번은 짧게 부담없이 하는거고 기말전에 조별로 하는 피피티가 있는데  이것만 조금 신경써서 하면 크게 부담되는 과제는 없어요!!스피킹랩 말하기 평가(2인 1조 10분 이내)는 준비할 시간 다 주시고 대빵 쉬워요~책에 있는거 그냥 스크립트로 만들면 됨ㅎㅎ


시험은 평소에 본문 단어 잘 알아놓고 수업시간에 나갔던 유투브 영상 많이 들으시면 문제 없을것같아요~"
대학영어 1,Dylan Williams,22,Fall,5.0,"수강평의 말들이 정확. 자잘자잘 할 것 많아서 귀찮긴 한데 크게 부담스럽진 않았고, 시키는 것만 잘 안 까먹고 하면 에제-에마는 진짜 쉬울 듯… 기말도 사실상 오픈북이라 큰 부담 없고 … 기말 발표 정도가 좀 빡셌던 듯. 본인 에제!!! 에쁠은 진짜 확실히 어렵지만 에제 에마는 쉬운 !!! 그리고 교수님 개 귀요미입니다"
대학영어 1,Dylan Williams,22,Fall,5.0,"교수님은 너무 착하십니다
근데 이것저것 할 것이 조금 많고 과제도 많아요
대부분은 다 만점에 기말에서 조금 깎이고 발표 점수 조금 깎였는데 에제 나왔네요"
대학영어 1,Dylan Williams,22,Fall,5.0,"교수님 정말 온화하십니다. 평가에 할게 많다는 얘기가 많은데 숙제하는 기분으로 하면 될 듯 합니다. 저는 1시간 공강 시간 활용해서 후루룩 해치워서 그런지 부담이 큰 편은 아니었는데 제 일정이 바빴다면 조금 부담이 됐었을 것 같습니다. 안해온다고 감점은 없었는데 수업 들을라면 하긴해야해서 사실상 필수입니다. 그래도 한학기 성실하게 수업 참여한 기분이 들어서 좋고 또 교수님이 정말 좋은 분이셔서 전 만족합니다.
교수님 질문 잘 받아주시고 매우 친절하십니다!! 영어 못해서 좀 걱정이 많았는데 다 이해해주시고 알려주시니 걱정하지 않으셔도 됩니다."
대학영어 1,Dylan Williams,22,Spring,4.0,"교수님 세상 친절하고 시키는거만 하면 무난하게 A0는 주는 과목, 근데 조별과제할때 나 혼자 모든걸 다 하는 경우가 가끔 생기긴 함"
대학영어 1,Dylan Williams,22,Spring,3.0,어려운 건 아닌데 귀찮은게 진짜 너무 많아요..거의 매주 클래스룸으로 조금씩 제출해야할 것들이 있었고 매 수업시간마다 예습해가서 조별활동해야합니다.. 그래도 교수님 진짜 스윗하세요. 과제 피드백도 하나하나 해주시고 발표할 때 살짝 막히면 정리해서 말씀해주세요. 기말은 쫌 쉬운편 같습니다. 교수님이 알려주신 페이지만 한번 읽고가면 될 정도. 학점은 다들 열심히 하는데 절대평가라서 다행이네요. 그냥 열심히만 꾸준히 하면 에제나 에마는 받기 쉬워요.
