미적분학 2,김다노,23,Fall,4.0,"강의는 제대로 들은 적이 없어서 코멘트는 못 하겠으나, 가끔 칠판을 보면 미적분학 범위를 아득히 벗어난 내용을 소개하고 있깄 했음.
기출 충실하게 풀면 성적은 잘 나옴.
수학 분반 반영해서 성적 조정하는 건 확실함."
미적분학 2,김다노,22,Fall,4.0,강의가 관념적인 경향이 있으나 강의력 괜찮고 성적도 잘 주시는듯
미적분학 2,권혜승,23,Fall,4.0,"수리, 통계, 물천 학생들이 공통으로 듣는 마지막 강의로, 다변수 미적분학 내용을 다룹니다. 미적분학을 처음 배우는 사람이 따라가기에는 벅차다는 과목 특성이 있으며 특히 권혜승 교수님께서의 판서는 큰 대신 지우는 주기가 빠르셔서 따라가기 좀 어려웠습니다. 교수님께서도 지우고 나서 지우지 않을걸 하면서 다시 쓰시는 경우도 있었습니다. 평가는 교양수학 전체가 함께 보는 시험 2회가 사실상 전부이며 출결은 전자출결로 했습니다. 원래 시험 문제 중 대부분은 수학 2와 거의 유사하나 일부 문제를 교수님께서 출제하시는 것으로 압니다. 이번 학기의 경우 증명 문제는 따로 나오지 않았다는 점이 특이했던 것 같습니다. 특히 기말고사의 경우 부분점수가 넉넉하지 않았으며 기말고사가 중간고사보다 배점도 크고 난이도도 어려우니 기말고사 준비를 철저히 하시면 좋을 것 같습니다. 학점의 경우 미적분학 분반 2개를 합쳐서 넉넉하게 주신 것 같습니다. A+이 20프로 정도 된 것으로 압니다만 그래도 수학 2보다는 컷이 많이 높습니다. 전반적으로 다변수 미적분학에 대해 배우는 나름 고난도의 강좌였다고 생각합니다."
미적분학 2,권혜승,23,Fall,5.0,"미적분학은 어차피 운영은 공통으로 되는 거고, 설명은 잘 하시는 편입니다."
미적분학 2,권혜승,23,Fall,4.0,권혜승 교수님은 국밥 같이 든든한 강의를 해주신다. 문제는 나...
미적분학 2,권혜승,23,Fall,5.0,"교수님 인품 좋으시고 잘 가르쳐주십니다.
출석은 전자출결인데 학기에 딱 1번 전체 부르셨네요."
미적분학 2,권혜승,22,Fall,5.0,강의력은 괜찮으신 편 같은데 다루는 내용이 많다보니 진도가 빠른 감이 있습니다. 특히 처음 미적분학 배우는 분들은 예습해오는 것이 편할듯 합니다. 출석은 전자 출결이지만 출석률이 너무 낮으면 호명하십니다.
