초급중국어 2,류창교,19,Spring,4.0,"교수님 정말 좋으신 분임.
로드가 빡셈.
교재 달달외우면 되는데 그게 어려움ㅋ"
초급중국어 2,류창교,19,Spring,3.0,"절평이라고 기대했었는데, 학생수가 너무 적어서 폭망
중국어는 그냥 암기과목이라고 생각하세요
수업시간이나 lab 시간에 회화도 많이 하긴 하는데 결국 학점은 시험으로 다 결정 나서...
lab도 사실상 조교님 질문에 중국어로 빠르고 완벽하게 대답해야 하기에 사실상 이것도 결국 암기
그냥 외우세요 교재 본문, 단어, 문법, 예문, 추가 표현... 뜻, 간체자, 성조까지 전부!
과제는 주기적으로 교재 workbook이 나가는데 사실 수강생들끼리 자진 확인이라 부담 ㄴㄴ
예습 퀴즈도 보는데 이것도 비중이 눈곱만해서
출석도 한 번 빠지는 건 이유 불문 봐줘요
그래도 교수님은 정말 좋은 분이에요 최대한 절대 평가 기준에서 학점 잘 주려고 노력하시고요
결론은 학생수가 너무 적거나 고인물이 2인 이상 존재한다면 절대 평가는 오히려 독이 될 수 있습니다"
초급중국어 2,류창교,18,Fall,5.0,"절평이었어요
쪽지시험하고 워크북 숙제가 매주 있어서 과제가 적은 편은 아니었어요
시험은 책 내용만 나와요"
초급중국어 2,류창교,18,Fall,5.0,절대평가라 좋았어요  퀴즈가 여섯번이라 자동으로 공부가 되더라구요...
초급중국어 2,이윤희,20,Fall,4.0,"아래 분의 평가에 좀만 덧붙이자면, 시험이 제 기준에는 조금 어려웠습니다(특히 작문). 작문 시에 단순 암기를 넘어서 여러 문장과 문법에 대한 응용이 필요합니다. 다만, 중간기말 모두 아리송한 것이 많았어도 성적은 높게 나와서 채점기준은 그다지 깜깐하기진 않기에 암기만 해도 충분히 좋은 성적을 받을 수 있습니다. 그냥 무난무난한 초중2강의"
초급중국어 2,이윤희,20,Fall,4.0,"수업은 1주일에 zoom으로 1번 모여서 25분 정도 실시간으로 진행하시고 1시간 30분 정도 분량의 녹화강의를 etl에 올려주셔서 문법과 작문을 수업하셨습니다.
원래는 주마다 쪽지 시험이 진행되는데 이번에는 etl오류가 많아서 많이는 못하고 2번 했습니다.
시험은 중간 기말을 보는데 진짜 책 안에서만 시험 문제가 나옵니다. 책 안에 있는 문장과 지문을 다 외우시면 돼요.
학점은 잘 주시는 지는 모르겠습니다.
그냥 잘 잘라서 주시는듯"
초급중국어 2,정진선,21,Fall,4.0,과제가 너무 귀찮은건 맞아욤 근데 저는 그렇게 나쁘지 않았어요! 미리 강의듣는 만큼 수업 일찍 끝내주셔서 좋았고 학점도 적당히 잘라 주시는거 같아요
초급중국어 2,정진선,21,Fall,4.0,나쁘진 않은데.. 생각보다 로드 많은 거에 비해 학점 잘 주시는 건 아닌 거 같아요..!
초급중국어 2,정진선,21,Fall,1.0,그냥 초중은 이쌤만 피하면 될듯ㅎㅎ 매주 과제에 성적도 잘라주시고 채점 과정도 애매함 그냥 듣지마세요
초급중국어 2,정진선,19,Spring,5.0,학기 중에 짜잘하게 은근 할 게 많지만 전공도 아니고 자신이 배우고 싶은 언어에 그정도 노력과 재미를 부여하지 않는 건 우리학교 학생의 태도가 아니라고 생각합니다. 선생님께서 매주 피피티와 동영상도 만드시고 1대1로 발음교정도 해주시면서 엄청난 정성을 기울이십니다. 다만 친절함이 묻어나는 스타일은 아니라 정성 대비 학생들이 느끼는 따뜻함이 적은 것 같습니다. 수업시간도 짧고(매일 30분정도만 수업) 시험도 쉬워서 좋았습니다. 초중 픽 빡센데 정진선 교수님 수업은 픽도 널널하고 좋습니다. 안심하고 들으세요.
초급중국어 2,정진선,19,Spring,4.0,"인원이 6명 뿐이라 책상을 원형으로 모아서 학원처럼 수업했던 점이 너무 좋았습니다.  새 과를 나가기 전 구글 음성녹음, 본문 한자/병음/해석 적어오기, (학기 후반부에) 챕터 하나 맡아서 문법 또는 본문 설명 발표하기 등등 로드는 은근히 빡셉니다. 선생님께서 문형이나 주제를 가지고 모든 학생들에게 말하기 연습을 체계적으로 시켜주셔서 실력 향상에 큰 도움이 돠었습니다.  절대평가라서 정말 노력한만큼 가져가는 수업입니다. 저는 다행히  에이쁠 받았네요 ㅜㅜ 이번 한 학기의 힐링 강의였습니다. 선생님 감사했어요👍"
초급중국어 2,정세진,20,Fall,4.0,"학점을 좀 짜게주시는 것 같지만
너무 좋으시고 학생들을 엄청 잘 챙겨주시는 교수님이에요
교수님 너무너무 좋으세요🥰"
초급중국어 2,정세진,20,Fall,5.0,"선생님 너무 친절하시고 녹강1회, 실시간 1회 + 실시간 랩으로 진행했는데 설명 잘 하시면서도 진도 끝까지 뽑으심. 중간중간 퀴즈 안봐서 로드는 별로 없었고(그치만 랩수업 따라가려면 제때 어느정도 복습해야함) 시험은 다들 잘 봐서 A안에서 나눠주신듯. 샘이 중간에 중국 노래도 들려주시고 그래서 재밌었다 완전 만족!!!"
초급중국어 2,정세진,20,Fall,5.0,"교수님께서 정말 친절하십니다! 수업도 정말 열정적으로 해주시구요! 늘 학생들을 위해 열심히 노력해주시는 것이 느껴집니다 정말 좋았어요! 시험은 중간, 기말 2번 봅니다. 랩시간에는 주로 말하기 연습을 합니다!"
초급중국어 2,정세진,20,Fall,4.0,"중간기말, 랩시험 2번 있어요! 단어 다 외웠는데 실수 좀 하면 A0 나오고, 거의 다 만점에 가까워야 A+나오는 것 같아요.... 교수님 친절하셔서 좋았습니다. 랩수업도 재밌었고요. 그런데 언어수업이라 확실히 신경쓸 것도 많고 단어 외우기도 빡세긴 한 것 같아요. 그래도 외우다보면 늡니다"
초급중국어 2,정세진,20,Spring,5.0,학점은 잘 주시는 것 같습니다! 저는 초중1 끝나고 바로 들은건데 워크북이랑 복습 꾸준히 해야 따라갈 수 있었어요. 책 내용 자체가 초중1보다는 꽤 어렵기때문에 공부를 더 꼼꼼히 해야합니다! 교수님은 열정적으로 가르치셔서 만족했습니다. 랩수업도 큰 도움이 되었어요!! 다만 비대면 언어 수업이라 대면보다 집중도 떨어지는 건 어쩔 수 없는 것 같습니다 ㅠㅠ
초급중국어 2,정세진,20,Spring,5.0,"시험 유형: 받아쓰기, 빈칸 채우기, 중작과 병음표기. 교재 외 수업자료 중 외우라고 한 것은 필히 숙지해야 합니다. 학점 정말 잘 주십니다❤️"
