프랑스어 말하기,BORDEZ Cécile,23,Fall,5.0,"교수님의 밝은 에너지와 미소, 유익한 강의 내용과 좋은 학점까지, 힐링하고 갑니다!! 1시간 15분 동안 프랑스어로만 말씀하신다길래 조금 걱정했는데 아주 천천히 말씀하시고 모르는 게 있으면 좀 더 쉬운 프랑스어로 설명해주셔서 프랑스어 회화 실력이 많이 늘은 것 같아요. 특히 실생활에 쓰일 법한 내용이라 더 좋았어요 (길 물어보기, 등등). 과제는 50단어 정도 되는 글쓰기가 있는데, 선택이라 필수는 아니에요! 그냥 피드백 원하는 사람만 하면 되는 것 같아요. 조모임이 따로 있지는 않지만 수업 시간 때 계속 다른 수강생들과 프랑스어로 대화를 나눠야해요. 시험은 강의명과 달리 말하기 빼고 다 나왔네요 ㅋㅋㅋㅋㅋ 한 가지 단점이라면 가끔 늦게 끝내주실 때가 있어서 만약 연강이라면 건물간 거리 잘 확인하세요!"
프랑스어 말하기,BORDEZ Cécile,23,Fall,5.0,"선생님께서 너무 밝으셔서 수업 시간 내내 즐겁습니다. 수업시간 내내 프랑스어로 말씀하시기 때문에 프랑스어 듣기나 말하기 실력이 많이 늡니다. 다만, A1-A2반은 기초표현(길찾기, 사람 묘사하기, 인사하기 등)이랑 문법들 위주로 수업해서 조금 지루할 수는 있어요! 과제는 없고 조별로 수업 중에 프랑스어로 이야기하는 시간이 많습니다. 과목 선택할 때 성적 고민이 제일 많이 되었는데, 시험이 듣기랑 읽기, 쓰기로 이루어져 있어서 수업 시간에 배운 내용을 아는 게 중요하다기 보다는 기본적인 프랑스어 실력이 조금 있어야할 것 같아요. (물론 수업 시간에 배운 내용을 알면 시험에 도움이 되긴 합니다.) 저도 그래서 시험 때 듣기 20문제 중에서 한.. 5문제? 정도는 그냥 못 들은 거 같은데 그래도 다행히 A+은 나왔네요. 성적을 매우 너그럽게 주시는 거 같습니다."
프랑스어 말하기,BORDEZ Cécile,22,Fall,5.0,"일단 교수님이 진짜 스윗하시고 프랑스어도 일부러 천천히 말씀하시려는게 보여서 알아듣기도 편했음! 
매 강의마다 둘씩 아니면 셋이서 프랑스어로 토론해야 하는게 많음 어려운 주제는 아닌데 꾸준히 자잘하게 말을 많이 해야 함. 
질문하면 꼼꼼히 설명하시는게 좋았고 시험은 A2-B1 레벨 중간 기말 총 2번, 과제는 짧은 글 총 4개라 (기한도 널널하게 주심) 강의에 대한 부담은 거의 없음! 교수님 최고"
프랑스어 말하기,BORDEZ Cécile,21,Fall,5.0,불어로 말할 수 있는 시간도 많아서 실력 향상에 도움이 크게 되는 거 같아요
프랑스어 말하기,BORDEZ Cécile,20,Spring,4.0,프랑스어 실력이 최소 B1 이상인 사람만 수강할 것. 고인물 파티 + 한 시간 15분 내내 프랑스어로 말씀하시는 교수님 = 드랍률 70%
