고고학개론,이희경,23,Spring,5.0,"역사에 관심 있어서 수강했는데 덕분에 고고학에 대해 조금 더 잘 알게 되었습니다.
시험은 암기 위주이고 피피티의 좀 지엽적인 부분까지 나옵니다. 그리고 서술형의 경우 수업때 다룬 핵심 내용이 나오는 경우가 있어서 속기까지 미친 듯이 칠 필요는 없지만 교수님이 시간을 좀 오래 할당해서 설명하시는 부분은 필기 해두는 것이 좋습니다. 그렇지만 성적을 잘 주셔서 모든 것을 외우겠다는 압박은 가지실 필요가 없습니다."
고고학개론,이희경,23,Spring,5.0,"진짜 이건 5점짜리 강의입니다!
교수님도 친절하시고 로드도 레포트 1번, 중간, 기말이라 거의 없습니다
그리고 서울대 박물관, 고고학 실험실, 몽촌토성 발굴 현장을 가보는 등 색다른 경험을 할 수 있는 수업입니다
그러나 시험이 PPT 800장으로 은근히 많은 편인데, 다른 교양도 그렇겠지만 짜잘한 부분도 봐야 시험에서 고득점을 얻을 수 있습니다
무엇보다 성적 평가가 매우 혜자롭습니다. 드랍자 포함 70% 안에만 들면 A입니다!
성적도 잘 주시고 무엇보다 평소에 해볼 수 없는 경험을 할 수 있으며, 배우는 내용도 유익하기 때문에 강력 추천합니다!"
고고학개론,이희경,23,Spring,4.0,"고고학에 대해서 관심이 크지 않은 편인데도 교수님이 친절하신 분이라 드랍 안하고  끝까지 수강할 수 있었습니다! 성적도 잘 주시고  로드도 많은 편은 아닙니다 ! 
다만 조금 힘들었던 점은 ppt 장수가 많아서 암기할 양이 많았던 것입니다! 원래 교양 수업이 다 암기이지만 이 수업은 조금 소화하기 힘들 수도 있어요! 
수강생들이 드랍도 많이 하지만 열심히 하는 분들도 꽤 많아요 적당히 공부해서 에이쁠 따기 위해 수강하고자 하시는 분들은 좀 고민해보시길 권합니다 :)"
고고학개론,이희경,23,Spring,5.0,"이번 학기 살아갈 힘을 준 강의였습니다. 

저는 역사적인 지식은 부족한 편이나, 박물관이나 유적지 구경 가는 것이 취미라서 수강하였습니다. 역사 지식이 부족해서 강의를 완전히 받아내지 못하는 것 같아 아쉽긴 했지만, 내용을 따라가거나 시험을 보는 데 있어서 어려움은 전혀 없었습니다. 오히려 굉장히 과학적이고 융합적인 학문임을 느꼈습니다.

주전공 분야만큼 즐거움을 느낀 분야는 처음이었습니다. 학교 박물관이나 연구실 답사도 진행하였기 때문에, 관심 있으신 분은 정말 추천드리고 싶습니다. (저는 개인 사정으로 참여하지 못하였지만, 몽촌토성 유적 답사도 있었습니다.)
교수님께서 유적들과 관련된 재미있는 이야기도 많이 해주시고, 최신 이론이나 발견에 대한 얘기도 많이 해주셔서 개인적으로 흥미롭게 들었습니다. 

궁금하거나 관심 있으시다면 정말 꼭 수강해보시길 추천드립니다! 과제는 자유주제로 기말 레포트 하나 정도로, 평소 관심 분야가 있다면 어렵진 않습니다(저는 저의 전공 분야 지식을 활용해 작성했습니다). 교양 수업이니 상식을 넓히는 면에서도 좋다고 생각합니다."
고고학개론,이희경,23,Spring,5.0,"실험실 박물관 그리고 고고학 현장까지 가 볼 수 있는 진짜 의미 있는 강의임

개론이라서 분명 깊은 부분까지 갈 거라고 교수님이 강조하셔서 시험 때 힘들긴 한데 고고학에 대해 피상적으로 생각하지 않고 깊이 들어갈 수 있는 정말 좋은 강의라고 생각함

교수님도 정말 친절하고 선사인을 '인간'으로 마주할 수 있는 기회임. 단순히 가르치는 것뿐 아니라 역사에 대한 상상력도 키워주심

출석도, 출석 아님 결석밖에 없어서 굳. 아침 강의라고 다 이해해주심.

보고서도 채점 기준이 주관적이기 때문에  웬만하면 8,9점이라고 했음. 잘 쓰면 10점.(이건 따로 문의함!)

성적 잘 주시긴 하지만 시험이 어려워서 꼭 사례들까지 놓치지 말고 외울 것!!!!

본인은 중간 등수는 일의자리 후반대였음! 에쁠 받았고 보고서는 어쩌다보니 10장 썼는데 이 정도 안해도 된다고 봄..
기말은 안알려줘서 모릅니다"
고고학개론,이희경,23,Spring,5.0,중간 기말 시험범위 내용이 많기는 성적은 엄청 잘 주십니다. 수업 내용도 재밌어요!
고고학개론,이희경,23,Spring,5.0,"고고학이라는 학문에 대해 전반적으로 살펴보는 강의입니다. 흥미로운 내용을 배우며, 로드도 많지 않습니다. 박물관 내 연구실, 고고학 연구실, 발굴 현장을 방문하는 흔치 않은 경험도 쌓을 수 있습니다. 새로운 학문에 접근하기에 좋은 강의입니다."
고고학개론,이희경,22,Fall,5.0,"교수님이 친절하고 좋으시다.
로드가 거의 없다. 중간 기말+마지막 레포트 하나(매우매우 쉬움. 제출에 의의를 두심)
성적 평가가 혜자스럽다. 70%내에만 들면 A확정인듯 함. 교수님이 우리 전공 교수님이셨으면 좋겠다.ㅜㅜ
현장 실습과 실험실 수업이 매우 흥미롭고 이때문에라도 들을 가치가 충분하다.
서울대가 아니면 이런 수업 못 들어보지 않을까?
꿀강이고 관심있으면 재미까지 얻을 수 있음"
