한국문학과 세계문학,손유경,20,Spring,5.0,꿀강은 아님. 하지만 개인적으로 정말 너무 좋은 명강이었음. 교수님 귀여우시고 유머 감각 있으시고 수업 내용 너무 좋음. 중간 전까지 한국문학과 세계문학에 관한 사유들? 관련 사상들? 보고 정리하고 중간 이후부터 강계에 나온 책 읽음. 책들도 다 재밌고 발췌독도 재밌고(번호 몇 번 안 불린 게 아쉬움ㅠㅜ 연기하고 싶었는데) 발췌만 하다 수업 끝나는 게 아니라 교수님이 계속 코멘트+마지막에 총체적으로 정리해 주셔서 공부하기도 편함. 책 읽기랑 중간기말 말고는 로드X. 시험은 지엽적인 거 안 중요하고 그냥 수업에서 중요하게 다루신 거에서만 나옴. 중간 비대면 기말 대면으로 진행했음. 중간은 그 사상? 사유?들 잘 정리해놓으면 되고 기말은 정말 책 읽어 보고 수업 마지막마다 정리해 주시는 거 생각만 해봐도 됨. 상평이라 하셔서 성적도 기대 안 했는데 열심히 썼더니 A+ 나옴ㅠㅜ(글 못 쓰는 편임!!!) 교수님 감사합니다S2
한국문학과 세계문학,손유경,19,Fall,5.0,이런 식의 문과 수업은 처음 들어봐서 처음에는 당황했었지만 교수님도 너무 좋고 귀여우시고 내용도 재미있어서 정말 좋았습니다. 초반부에는 교수님의 강의로 세계문학에 대한 내용을 짚어 가는데 그 흐름 방식이 독특해서 재미있었습니다. 다만 저는 PPT등의 강의 자료에 익숙해져 있었는데 교수님의 말씀으로만 수업이 진행되다 보니 처음에는 좀 적응하기 힘들었던 것 같습니다ㅠㅠ 후반부에는 일주일에 한권 또는 두권씩 책을 읽어가야 되는데 이게 은근 빡셉니다.... 총 8권이었는데 다 사기에는 부담스럽고 도서관에는 부족해서 책을 구하는 게 좀 힘들었습니다.  다른 분들 보니까 그냥 책을 사거나 ebook으로 보시기도 합니다. 수업시간에 발췌독을 시키시는데 내가 인상깊었던 부분을 얘기하면 됩니다. 한4-50분 동안 발췌독하고 그 다음에는 전체적인 내용을 훑는 방식으로 진행됩니다. 시험은 중간 기말 각각 서술형 세 문제씩이었고 수업시간에 교수님이 강조해서 말씀하신 부분에서만 나옵니다. 모든 내용을 세세히 볼 필요는 없고 큰 줄기 위주로 서사를 그리면서 공부하시면 됩니다. 둘 다 시험 전날 5시간 공부했고 그정도 할 필요도 없지 않았나 싶을 만큼 답을 허술하게 썼는데 에제 나왔습니다. 지각한 분들이 많아서 아마 출석도 큰 요인으로 들어가지 않았나 싶습니다. 저는 제가 로망을 갖고 있던 문학 수업이라 재미있었습니다.
한국문학과 세계문학,손유경,19,Fall,5.0,"강의퀄리티가 기술적인 부분뿐 아니라 내용적으로도 훌륭하다고 생각합니다.
수업시간에 읽는 책도 마음에 듭니다.
유정, 나목, 척하는 삶, 이것이 인긴인가 등이 있습니다.
학점과 무관하게 수강하실 것을 추천합니다."
한국문학과 세계문학,손유경,19,Fall,5.0,"수업 퀄리티 매우 좋음 유머감각 지난학기보가 느신듯ㅋㅋㅋ
갓유경 관악여신 갓유경 찬양합니다"
한국문학과 세계문학,손유경,19,Spring,5.0,"시험은 두번! 시험문제는 3~4문제로  전부 서술형으로 나옵니다
시험문제는 평소 수업시간에  강의듣다보면 중요한것들이 몇개 있는데 거기에서 거의 다 나오며 과제의 경우 책읽기 외엔 없습니다..
시험 전날 2시간씩 공부한게 다인데 A0나왔네요 ㅜㅜㅜ
감사합니다 교수님!"
