삶과 교육,김지현,23,Spring,5.0,"최근 강의평이 없는 거 같아 몇 자 써봅니다.
일단 로드가 많은 게 싫다 하시는 분들은 뒤도 돌아보지 말고 도망치십시오.

로드
- 매주 학문과 교육(장상호)을 읽고 a4 1매 정도의 질문(다른 과제 있을 경우 해당 주차는 없음)
- 수시과제 3개(학기초에 교육관 작성 a4 1매 정도, 기말보고서 계획서, 학기말에 교육혁신을 위한 방안 작성 a4 1매 정도)
- 기말 보고서(1부: 초기에 작성한 교육관에서 변화한 점 a4 4매. 2부: 자유 주제 연구 a4 7~8매)
- 학기 중간 즈음에 교육공간 탐색 팀플

교수님이 정말 열정이 넘치십니다. 매주 질문 과제 가운데 2~3명 정도의 질문을 수업 1부에 다룹니다. 프린트해서 수강생 모두에게 제공해주시는데, 교수님께서 미리 다 읽어보시고, 어떤 말씀을 하실지 적어서 오십니다. 계획서 작성 후에도 1:1 튜토리얼을 필수 1회(2회까지) 진행해주십니다.

수업내용
- 1부에는 질문을 다루고, 2부에는 해당 주차에 읽은 학문과 교육의 내용을 설명하십니다. 수업 분위기 자체가 딱딱하지 않아서 질문도 많이 이루어집니다.

로드가 많기 때문에, 당연히 힘듭니다. 하지만 힘든 만큼 얻어가는 게 많습니다. 드랍 기간 끝나고 이번 학기에 15분 정도 남으신 거 같은데, 수강생분들도 진짜 열정이 있으시고, 학문적으로 뛰어난 시각을 가지신 분들이 남습니다. 저는 개인적으로 다른 분들의 질문을 통해서도 많이 배웠습니다.

힘든 만큼 교육학적인 인사이트를 많이 배웠고, 제2기 교육학(교육본위론)에 대해 많이 얻어 갈 수 있습니다. 개인적인 의견이지만, 교육학에 대해 관심이 있으신 분들은 꼭 한 번씩 들어보셨으면 좋겠습니다.

(성적은 아직 안 나왔는데, 이전 강의평에서 너그럽게 주신다고 하니 그러려니 하고 기다리렵니다.)

+ 이번 학기 같이 수강하신 분들 덕분에 많이 배웠습니다. 감사합니다."
삶과 교육,김지현,14,Spring,3.0,"신입생 때 죽는 줄 알았다 ㅠㅠ
금요일 아침 수업인 게 크리티컬이라 시키는 것만 하면 점수는 나오긴 하더라
근데 그 시키시는 게 좀 많다"
삶과 교육,김지현,20,Spring,4.0,"교육이 무엇인지에 대해 생각해 볼 수 있는 기회에요.
하지만 로드는 빡셉니다. 매주 100페이지 정도의 교육학 책을 읽고 A4한바닥 질문을 제출하거나 다른 주제에 대한 글을 쓰는 과제가 있고 기말 과제로 연구보고서 15바닥이 있어요. 매주 강의와 조별 토론으로 이루어지는데 중간에 조별 연구 발표도 한 번 있어요. (이거는 이번 학기가 비대면이어서 다른 활동 대체인 걸로 알고있어요) 대부분 이야기 하듯이 정말 의미있는 강의는 맞지만 힘든 것도 사실입니다. 하지만 성적은 조금만 열심히 참여하면 잘 주시는 것 같아요!!"
삶과 교육,김지현,20,Spring,3.0,"많이 배워갈 수 있는 수업입니다
다만 과제는 정말 많습니다"
삶과 교육,김지현,20,Spring,5.0,음... 전 좋았어요 배울 게 많았고요 성적 되게 빨리 나왔어요!! A쁠 나왔는데 학점도 되게 후하게 주시는거 같아요
삶과 교육,김지현,20,Spring,2.0,"존나 Stay하세요....;;;
사실 강의 듣기전에
""배울 것 많다는데~ 기껏 과제 많은 거 견디지 뭐!"" 이 생각했는데
그 때의 저를 두들겨 패고 싶습니다...
드랍기간 때 드랍안한 저를 저주하고 싶습니다....

그런데 수업 구성원 분들 진짜 똑똑하신 분들도 많고 그래서 토론하면서 배울 점은 많은 것 같네요^^"
삶과 교육,김지현,20,Spring,1.0,"절대 듣지마세여... 과제 열라 많고 어려워요 
제발 드랍하거나 수신변경때 변경하세여..."
삶과 교육,김지현,19,Spring,5.0,"중간고사(오픈북), 기말에는 조별발표와 배운 내용을 토대로 한 연구보고서가 있습니다. 매주 책을 읽고 etL에 질문을 한 가지 올리면 되고요. 중간에 영화도 봅니다. 강의계획서에 있는 그대로라고 보시면 됩니다. 교육이란 무엇인지 곰곰 생각하게된 강의였고요, 처음엔 책 두께를 보고 드랍각을 쟀지만 어느 순간 수업에 진심으로 재미를 느끼기 시작해서 괜찮아지더라고요. 수업 시간에 질문이나 발언할 수 있는 자유로운 분위기가 있어서 재미있었습니다."
