인간과 우주,Sascha Trippe,21,Fall,4.0,"영어가 편하고 천문학을 미리 배운 사람들한테는 정말 꿀강이다. 그렇지만 천문학을 처음 접해본 나로썬 너무 많은 양이었다.. 그리고 과제가 거의 매주 나오는데 은근히 시간 많이 투자해야된다. (영어로 된 잡지나 논문을 주로 읽고 요약함). 중간은 매우 무난했으나 기말은 영어 서적들 내용을 기반으로 한 문제들이 몇 개 출제돼서 점수 많이 깎였다. (책은 참고로 코스모스와 intestellar age를 읽어야한다). 수업이 절평이다 보니 정말 열심히, 시간을 많이 투자해야지만 A를 받을 수 있을거다. 난 결국 중간에서 41/50, 기말에서 39/50 받고 최종적으로 B쁠 받았다. 굳이 천문학에 관심이 없다면 듣지 말자..."
인간과 우주,Sascha Trippe,21,Fall,1.0,"다른 교수님들은 모르겠지만 우주 전반 지식을 교양 수준으로 다루는데 지나치게 세세하고 지루한 내용들이 많았음. pdf가 외우기 좋은 깔끔한 문자 위주가 아니라 사진자료 위주라 어떻게 시험 공부를 해야 할지 막막함.매주 새로운 과제를 내주는데 계산 과제 말고는 딱히 배움을 얻을 만 한 게 없었음. 교양인데 매주 과제 내서 귀찮게 하는데 과제 비율은 ㅈㄴ 낮은게 빡침 포인트. 안 그래도 pdf 분량 많고 다 외워야 하는데 책 두 권(칼 세이건 코스모스, Interstellar Age)을 따로 읽어야 하고 그게 기말 시험에 나옴. 그것도 지엽적인 문제로 냄.코로나지만 오픈북 그딴거 없음. 이번 학기에 나를 가장 귀찮게 한 강의였는데 학점은 씨쁠받음. 결론은 듣지마."
인간과 우주,이형목,17,Fall,4.0,학생들을 이해시키시려고 많은 노력을 하십니다. 시험 문제도 외워가면 되는데 배운 내용을 응용한 계산 문제 같은 게 나와요 조별 발표는 한 번 있습니다
인간과 우주,이형목,17,Spring,5.0,"중간 기말 시험으로 학점 주심.
로드는 없고 조별발표 1회 있으나 부담 없음.
수업 내용은 교양 수준.
인문계열 학생들이 많이 듣다 보니 교수님께서 여러 번 설명하고 이해시키려고 노력하심."
