명상과 수행,김지현,18,Spring,4.0,"명상과 수행. 뭔가 이름부터 편안한 냄새가 솔솔 풍기길래 수강신청했는데, 종교강의였음.
교수님 강의력 괜찮으시고 커리도 할만함. 시험 분량이 어마어마 한게 좀 흠이긴 함. 
암기과목임에도 불구하고 자료가 줄글로 되어있어 공부할 때 요점 정리하기가 쉽지 않음.

대체로 강의 자체는 좋은 평을 남기고 싶은데
종교과목임을 모르고 듣는다면 상당히 골치아플 수 있음...."
명상과 수행,김지현,20,Spring,5.0,수업은 명상 이외에 종교 수업이라 관심 없으면 듣기 어려움. 첫수업부터 한 번도 제대로 집중해본 적이 없음. 명상 시간은 나름 개인적으로 괜찮았음. 명상 일지 귀찮긴한데 검사 직전에 몰아쓸 수 있는 양임. 시험 비대면으로 봐서 서술형이었는데 자료 조금씩 참고하면 쓸 수 있는 수준이었음. 공부 하나도 안하고 시험봤는데 학점 잘 주심. 교수님 친절하시고 융통성 있으심.
명상과 수행,김지현,20,Spring,5.0,힐링강의입니다! 아침에 라디오 듣는 느낌으로 수강했습니다! 교수님께서 좋은 강의를 해주시기 위해서 강사분들도 초청해주시고 감사했습니다!
명상과 수행,김지현,20,Spring,4.0,"힐링하고 쉬고싶다 할때 듣기 좋음 교재 다배우고 후반부에 수업할꺼없을때 강사분들 초청해서 명상하고 하는데 그게 진짜 심적으로 뭔가 도움이 죅금 되는 느낌? 아침수업이라 정신이 혼미해서 그렇지.. 기말도 종교학쪽이라 어려워서 전날 밤에 3시간 벼락치기하고 장황하게
아무말 썼는데 성적 잘주심"
명상과 수행,김지현,20,Spring,5.0,무슨 자기 에제맞았다고 1점을 주냐 ㅡㅡ 절대 1점 짜리 수업은 아니고 교수님도 많이 노력해주십니다. 이번학기 힐링 수업이었어요~
명상과 수행,김지현,20,Spring,1.0,시함 30점 만점에 29점 받고 과제 출결 다했는데 에제 ;; 성적 주는 기준을 모르겠음 열과 성을 다해 명상하고 일지 쓸 자신 없으면 듣지마셈
명상과 수행,김지현,20,Spring,4.0,솔직히 좀 지루하지만 명상시간 동안 힐링할 수 있었어요!!
명상과 수행,김지현,20,Spring,5.0,"수업 내용이 다소 난해하나 교재 읽으면 이해가 됩니다. 하지만 이 교재 마저도 굳이 모두 읽지 않아도 됩니다ㅋㅋ 그냥 본인이 명상 연습을 꾸준히 하면서 깨달은 바, 느낀 바를 나름대로 잘 숙지하고 있다가 적당히 시험 답안에 가미하시면 무리 없이 고득점을 받으실 수 있어요. 이 수업에서의 테마가 ""명상""이니만큼 이론보다는 연습이 중요합니다. 교수님께서도 이론 수업은 간략하게 피피티 읽으시면서 진행하시고 오히려 전문가 강연과 명상 연습을 통해 수강생들이 무엇을 느꼈는지에 대해 더 중요하게 다루십니다. 로드는 쪽페이퍼 두 개, 명상일지 쓰기였는데 모두 부담이 적습니다. 다만 명상일지는 한꺼번에 몰아서 쓰려면 좀 많이 힘드니까 미리 써두세요. 개인적으로 코로나 사태에 힐링이 되는 수업이었습니다. 교수님도 ㄹㅇ 보살이세요. 추천추천!"
명상과 수행,김지현,20,Spring,3.0,종교에 관심이 많지않아서 수업이 지루했음ㅜㅜ  교재가 양이 많아서 1회독도 제대로 못했지만 기말 끄적거릴수만 있다면 성적은 적당히 잘 주시는듯!
명상과 수행,김지현,20,Spring,5.0,"수업은 좀 지루했지만..명상할때만큼은 너무 좋았어요 교수님 말씀도 너무 힐링되었고요! 글구 학점 정말 잘 주십니다! 하라는 과제(일기 비슷하게 반페이지 20개랑 이 수업을 듣게 된 계기 a4용지 1장, 수업을 듣고 배우고 느낀점 a4용지 3장) 다하고 전날 교재 한번 읽고 시험 봐서 에쁠 받았어요! 괜찮은 수업었어요 추천합니다"
명상과 수행,김지현,20,Spring,3.0,명상하는 시간은 좋음 수업시간은 종교에 관심이 없다면 조금 지루할수도 있음 시험칠때는 리딩 2회독하면 될듯?
명상과 수행,김지현,18,Spring,5.0,종교개론 느낌이라 수업이 재밌거나 제 흥미에 맞지는 않았지만 수업 시작하고 30분 명상하고 중간에 쉬는시간있고 수업 일찍 끝내주셔서 실제 수업시간 1시간 반 정도입니다. 그리고 퀴즈 없고 중간고사 한번인데 사실 수업 안들어도 되고 교재 두번정도만 읽어가시면 될듯해요. 명상일지라고 있는데 저는 2일 정도에 방학숙제하듯 몰아썼고 기말레포트도  막날 썼는데 에쁠 주셨습니다. 꿀강인듯.
명상과 수행,김지현,17,Spring,4.0,수업내용이 재밋진않지만 열심히 공부해서 쪽지시험에서 좋은 성적거두고 명상일지 적어나가면 좋은 학점 받을 수는 있습니다
명상과 수행,김지현,17,Spring,3.0,"출석은 작은 종이같은걸 조교님이 나눠주시면 끝날때 내고가는 형식으로 합니다.
그리고 퀴즈는 중간중간 계획이 몇번 수정되긴 했지만 총 4번? 정도 봤던것 같아요.
퀴즈는 정말 부담없이 나왔습니다.
근데 봐야할 텍스트가 은근 양도 많고 생소한 내용이라, 나중에 가선 퀴즈 준비도 잘못하고 그냥 될대로되라 식으로 봤던것 같네요...
기말레포트는 자신만의 명상법 만들기 였습니다.
종강할 때까지 학점이 뭐가 나올까 1도 예상할 수 없었다는게 흠이었지만, 결과적으롬 생각보다 정말 잘받아서 만족했습니다.
각 종교별 명상법관련 이론을 배우고 명상을 직접 해봅니다.
강의 시간에 뒤에서 보면, 노트북으로 다른거하는 분들 정말 많습니다."
