명상과 수행,성해영,23,Fall,5.0,수업 중 명상시간이 있었고 수업 자체가 편안한 분위기라서 좋습니다. 명상일지는 밀리지만 않으면 분량도 내용도 자유라서 부담 없는 과제임. 잘 듣고 갑니다
명상과 수행,성해영,23,Fall,3.0,"명상에 대한 흥미가 있다면 괜찮을 수업이고, 로드는 적습니다. 피뎁내용만 외워서 시험치면 성적이 잘 나오진 않는듯하고, 수업 좀 들어야 할듯 합니다. 전자 출결이며, 수업끝나고 인증번호 치는 식으로 이차 출결 하십니다."
명상과 수행,성해영,23,Fall,5.0,강좌명은 명상과 수행이지만 15주 중 절반 정도는 종교에 대해서 가르치심. 수업 중간중간 인생사에 대한 조언도 해주셔서 명강이라 생각. 시험도 한번 보고 과제도 많은 편은 아니라 꿀강이지만 수업 중간중간 직접호명을 통해 코멘트를 요구하심. 그렇기에 수업을 열심히 듣는 것을 추천.
명상과 수행,성해영,23,Fall,5.0,"수업에서 얻은 것은 그리 많지는 않지만, 명상을 하며 배운 것이 많아서 매우 만족스러운 강의입니다. 하루이틀 전에 벼락치기 하고 시험 쳤고, 명상일지는 최소 횟수로 써서 냈고, 기말보고서를 좀 열심히 써서 냈더니 A+ 받았습니다. 수업도 기존 시간보다 20분 늦춰주시고, 수업 중에 명상할 수 있는 시간도 주셔서 실질적으로 수업하는 시간은 1시간 ~ 1시간 30분 밖에 안됩니다."
명상과 수행,성해영,23,Fall,3.0,"이론적 내용이나 깊은 통찰을 얻기에는 부족한 수업입니다. 로드와 부담은 적지만 교수님이 같은 설명을 반복하시고 수업 시간에 설명이 다른 길로 새는 경우가 많습니다. 
시험은 족보와 동일하게 나왔습니다!"
명상과 수행,성해영,23,Fall,4.0,"조금 과장해서 첫 수업부터 마지막 수업까지 같은 말씀만 반복하시는 느낌입니다. 따라서 대단한 통찰을 얻기를 기대하시면 실망하실 수도 있습니다. 그러나 그와 별개로 교수님 성품이 훌륭하시고, 참여를 적극적으로 유도하시는데 학우들에게서도 배운 점이 많습니다. 학생들 많이 배려해 주시고, 시험도 딱 나올 부분에서 나오니 에타 족보 참고하시면 도움이 될 듯합니다.  
처음엔 말씀이 상당히 추상적으로 들릴 수 있는데, 열심히 듣다 보면 교수님께서 어떤 맥락에서 말씀을 하시는지 대충 알 수 있습니다. 지엽적이거나 지나치게 자세한 설명 보다는 강조, 반복하시는 부분 위주로 공부하시면 시험도 충분히 대비하실 수 있을 것으로 생각됩니다. 
다른 학우들 보니 성적은 잘라 주시는 것 같은데, 개인적으로는 명상일지 2-4개씩 몰아쓰고, 쪽페이퍼, 기말리포트 다 하루 컷 했는데 성적 잘 나온 걸 보니 기말고사 한 방이 중요한 것 같습니다. 시험에서 알차게 서술하려면 속기가 어느 정도는 필요해 보이나, 범위가 많지 않아 속기만 잘 정리해서 하루이틀 열심히 보면 될 것 같습니다. 복습해주시는 내용만 잘 정리하셔도 웬만큼 쓰실 수 있을 겁니다.
—> 한 줄 요약: 매 수업 잘 듣고 과제 밀리지 않은 사람에게는 이보다 부담없고 편한 꿀교양이 없을 것 같지만, 그렇지 않은 사람에게는 편하지만 학점은 보장이 안 됩니다."
명상과 수행,성해영,23,Fall,3.0,"명상 시간 좋았고 교수님 인품도 훌륭하시지만
학점을 주시는 기준? 은 모르겠습니다. 
학점 중요하시면 듣지 마세요"
명상과 수행,성해영,23,Fall,5.0,복습하고 명상하는 시간 빼면 실제 수업 시간은 한시간 정도 밖에 안됩니다. 여러 자잘한 과제들이 많지만 크게 부담되는 수준은 아닌것 같습니다. 학점도 잘 주시는 것 같아 꿀강이라고 생각합니다
명상과 수행,성해영,23,Fall,4.0,"성적을 주시는 기준을 잘 모르겠습니다… 
별개로 교수님 인품은 훌륭하시며 학생 편의 잘 봐주셨습니다."
명상과 수행,성해영,23,Fall,5.0,"얻어가는 게 많았습니다. 교수님 성품이 훌륭하신 게 많이 느껴졌고, 저는 1학년이었지만 제 스트레스를 관리하는 방법에 대해 배울 수 있어서 좋았어요. 강의 들으면서 수강생한테 질문도 많이 하시고 말도 많이 거시는데 다른 수강생분들한테도 배울 수 있는 점이 많았습니다! 
과제는 의식탐구일지나 레포트가 몰아서 하면 번거로울 수 있지만 저는 의식탐구일지도 1주일에 하나 정도 썼고 성적은 에쁠 받고 갑니다! 기말도 강조하신 부분에서만 나와서 정당한 시험이었다고 생각합니다.
저를 포함해서 수강생 대부분이 무교였는데 종교에 대한 이론 부분도 지루하지 않고 재미있었어요. 꿀강이자 명강이라고 생각해서 꼭 추천드리고 싶습니다!"
명상과 수행,성해영,23,Fall,5.0,"진심 부담 1도 없는 수업 
수업 시작 시간 늘려주시고 끝나는 시간 줄여주시고 여러모로 꿀인듯요 아직 성적 나오기 전이지만 꿀강 찾는다면 들으셈요"
명상과 수행,성해영,23,Fall,5.0,수업 시작 시간 9시 50분으로 늦춰주셨고 매 수업시간 쉬는 시간 느낌으로 명상할 수 있어서 좋아요
명상과 수행,성해영,23,Fall,5.0,"강의력이 좋으셔서 기본적으로 집중이 잘 됩니다
과제가 좀 있지만 크게 부담스럽진 않습니다
명상 시간이 있어서 수업 시간은 잘 갑니다"
명상과 수행,성해영,23,Spring,5.0,"강사님 강의력도 좋으시고, 성적도 잘 주십니다"
명상과 수행,성해영,23,Fall,5.0,명상에 대해 관심만 있으면 이론적인 내용 잘 몰라도 따라갈수 있어요
명상과 수행,성해영,23,Fall,5.0,인생의 강의입니다. 자신이 시험을 준비하고 있거나 인생의 어려움을 겪고 있다면 한번쯤 들어봐도 좋을듯
명상과 수행,성해영,23,Fall,5.0,로드도 적고 많은걸 배워가고 있어요. 자신의 마음가짐 등 우리가 살아가면서 좀 더 행복할 수 있는 방법들에 대해 많이 알려주십니다.
명상과 수행,성해영,23,Fall,5.0,아직 종강전이지만 배워가는게 많습니다!! 시험 부담 많이 느끼신다면 완전추천
명상과 수행,성해영,23,Fall,5.0,아직 종강은 안했지만 부담이 이렇게 적은 강의는 첨임;
명상과 수행,성해영,22,Fall,5.0,강의도 매번 시작할 때 명상 30분으로 시작해서 자거나 쉬면서 시작할 수 있어서 좋았음. 명상일지를 매주 쓰는 게 귀찮지만 몇번 몰아서 쓰면 괜찮았음. 시험도 어려운건 1문제 정도고 성적도 잘 주셔서 전반적으로 좋았음.
명상과 수행,성해영,22,Fall,5.0,과제들은 거의 다 하루컷했구 시험도 꽤 망했다고 생각하고있었는데 명상일지를 열심히 써서 그런지 에제 나왔습니다 만족만족!!! 수업 넘 좋아요
명상과 수행,성해영,22,Fall,5.0,"교수님의 입담이 좋으시고 직접 명상하는 시간도 포함되어 있어 신기한 수업이었습니다. 내용이 많지 않아서 시험 공부하기는 편했고, 다만 과제가 어렵지는 않지만 조금 귀찮습니다."
명상과 수행,성해영,22,Fall,5.0,"명상음원이 정말 꿀잠잘때 유용함
학점 잘줌
수업 편함"
명상과 수행,성해영,22,Fall,5.0,아침에 잘 수 있는게 제일 좋은 것 같은 교양이에요. 내용도 어려울 것 없고 강의안도 부담없고 과제두요 양은 많지만?
명상과 수행,성해영,22,Fall,5.0,"교수님 감사합니다...ㅠ 명상일지 최소분량으로 하루컷, 기말페이퍼 하루컷, 올출석, 기말은 전날 3시간 정도했는데 A+ 나왔습니다...! 얻어가는 것도 많고 힐링되는 이 시대 최고의 교양..!!!"
명상과 수행,성해영,22,Fall,5.0,교수님 짱짱.. 수업도 30분씩 일찍 끝내주시고 중간중간에 특강도 있고 아침 수업인데 30분 합법적 단잠을 잘 수 있다는 점이 너무 좋았습니다. (교수님께서 명상 시간에 잘 잠드는 것도 이완을 잘한 거라며 칭찬해주십니다!) 명상일지랑 기말레포트 다 밀려서 하루만에 얼렁뚱땅 다 쓰고 시험 공부 하루 정도 투자했는데 에쁠 주셨네요!! 교수님께서 학생들에 대한 애정도 깊으십니다. 깊이 있는 내용을 배우는 건 아니지만 힐링용으로 추천해요!!
명상과 수행,성해영,22,Fall,5.0,드르렁 낮잠 개꿀 ㅋㅋㅋ 그리고 살아가면서 유용할 명상이라는 도구도 하나 얻어갈 수 있음. 빛나는 통찰을 주시진 않음. 그냥 적당히 편하고 재밌는거 얻어간다 생각하시면 됩니다~ 기말고사 요가문제 아예 안 썼는데도 에제받았어요 셤도 별로 안 어려움 웰빙교양 하나 넣겠다면 추천! 그리고 뜻밖의 편안함도 얻을수도있음
명상과 수행,성해영,22,Fall,5.0,"교수님 짱짱❤️ 명상일지 쓰는 건 귀찮지만 기말 보고서도 3페이만 쓰면 되고 기말 시험도 전혀 안 어려워요 한 문제 정도 지엽적이깅 한데 전 4시간 정도 시험 공부 하고 에제 받았어요 매우 만족합니다
명상과 자아성찰 자체에 흥미가 없는 분들은 지루하실 수 있지만 인문학도로서 정말 의미있는 수업이었습니다 추천해요!"
명상과 수행,성해영,21,Fall,4.0,명상일지 쓰는게 굉장히 귀찮음... 내용도 그렇게 와닿는게 아니라 시험 공부하는데 좀 힘들었음.. 그래도 잘 따라오면 점수는 잘 주시는 듯.
명상과 수행,성해영,21,Fall,4.0,수업 시간 중에 명상 시간이 있어서  직접 체험하고 배울수 있어서 좋았음. 근데 명상일지는 직접 손으로 작성해야하고 생각보다 많이 써야해서 과제가 적다는 느낌은 안들었음. 출결 제대로하고 시험도 괜찮게 본 것 같은데 생각보다는 성적이 잘 안나왔음.
명상과 수행,성해영,21,Fall,4.0,자잘한 과제들이 많고 명상일지는 손으로 직접 써야해서 더 귀찮음. 수업 내용 자체가 종교쪽을 다루다보니 내용을 직관적으로 이해하는 게 어려웠음. 그래도 시험 문제 같은 경우는 나름 명확하게 나옴. 다만 명상법 개발 보고서 같은 거는 어떤 기준으로 채점하는지는 잘 모르겠음.
명상과 수행,성해영,21,Fall,5.0,"과제는 1차 쪽페이퍼(자기소개), 의식탐구일지 중간 제출, 2차 쪽페이퍼(소감문), 의식탐구일지 최종 제출, 나만의 명상법 보고서로 많은 편이기는 함.
기말고사 한 번이었고 줌으로 봤음.
교수님께서 학생과의 상호작용을 좋아하셔서 매 수업시간마다 학생을 지목해서 발표를 시키거나 질문을 하심. 매 수업시간마다 30분가량 명상 시간을 주셔서 누워 잘 수 있음.
학점을 잘 주셨는지는 모르겠으나 나는 잘 받음"
명상과 수행,성해영,21,Fall,3.0,"널널한 꿀교양 강의라고 생각하지 말 것
교수님 인품 훌륭하셔서 믿고있었는데
학점 잘라서 주심
그리고 과제도 은근 있음"
명상과 수행,성해영,21,Fall,3.0,과제가 많음ㅠㅠ 성적도 잘주시는지 잘 모르겠음 하지만 수업시간에 명상하는거 신선하고 재밌음
명상과 수행,성해영,21,Fall,5.0,명상도 배울 수 있고 시험 부담도 적습니다. 과제 로드가 좀 있지만 명상 착실하게 하면 어렵지 않은 과제입니다. 대신 출결은 조금 빡빡하게 하십니다. 그래도 강의 내용도 흥미롭고 해서 힘들진 않았습니다.
명상과 수행,성해영,21,Fall,5.0,"명상을  하면서 직접 체험할 수 있고
명상에 대해 배울 수 있어 좋습니다!!"
명상과 수행,성해영,20,Fall,3.0,"기대는 많았지만 남은 것은 별로 없었음.
수업의 밀도가 매우 낮고 교수님의 통찰도 내 입장에서는 그닥 인상적이지 않았다.
명상을 체험하는 의미로는 좋은 수업이지만, 그 이상의 내용을 기대하긴 어렵다."
명상과 수행,성해영,20,Fall,5.0,"학점은 에제 받았는데 학점과 무관하게 좋았던 수업이였습니다.

로드는 의식탐구일지(분량 자유 주 1회) 쪽페이퍼(1p정도 처음, 학기말 2회) 나만의 명상법(3p이상), 기말고사인데 크게 부담되는 것도 없고 수업도 30분~1시간 가량 일찍 끝내주셨습니다. 배워가는 것도 많고 힐링할 수 있는 수업이었습니다."
명상과 수행,성해영,19,Fall,3.0,"흥미로운 주제에 유익한 강의였습니다!
교수님께서 굉장히 달변가셔서 학생들 수업 태도도 전반적으로 좋았어요.
다만 저는 수업 초반 하는 30분 짜리 명상 때 항상 잠에 들어서.... 수업때까지 쭉 자게 되더라구요ㅠㅠㅠ
그치만 매 수업 한 쪽 짜리 페이퍼로 수업 내용을 다 정리해서 나눠 주시고, 못 받아도 이티엘에 다 올려주셔서 공부하기에는 굉장히 편해요.
그치만 저는 인문대식 시험에 익숙하지 않았던 이과생이라,,, 전공 시험 보듯이 답안지 작성했더니 답은 다 맞았던 것 같은데 비를 받았어요 흑
출석은 가끔 출석표 나눠주시면 거기에 학번 이름과 문답을 적으면 돼요"
명상과 수행,성해영,19,Fall,5.0,과제 정말 대충하고 시험공부 하루 밤 새니 에이쁠 나왔습니다. 딱 나올 것만 내시더라구요. 개인적으로 가장 많이 배울 수 있던 강의였습니다
명상과 수행,성해영,19,Fall,5.0,교수님이 진짜 좋으세요. 씨쁠인데도 추천하고싶을만큼? 학점은 꿀강이 아니지만ㅋㅋ 수업 자체로 스트레스받는건 없어요. 과제 시험 출석 모두 널널했던. 좋았어요.
명상과 수행,성해영,19,Fall,5.0,"무엇보다도 교수님이 정말 좋으십니다.
항상 학생들을 존중해주시고 학생을 먼저 생각하시는 모습이 정말 감동입니다.
성적 문의 메일에도 정말 길고 자세하고 친절하게 답장해주시고 질문도 항상 잘 받아주십니다. 정말 니르바나의 경지에 이르신 교수님이신 것 같아요! 최고의 수업입니다. 성적은 조금 아쉬워도 들은 걸 후회하지는 않아요!"
명상과 수행,성해영,19,Fall,5.0,"명상 일지+ 자잘한 레포트 3개(1-3페이지짜리) + 기말고사 정도로 매우 널널한 수업인데, 무엇보다 교수님께서 강의를 매우 잘하십니다. 질문 받는것도 좋아하셔서 조금이라도 헷갈리는 거 있으시면 물어보시길. 명상이 가지는 힘이 생각보다 크다는 것을 느끼게 해준 명강이라고 생각해요. 매 수업시간마다 20분씩 명상하는 힐링도 좋았고, 매 수업 15분 정도 일찍 끝내주시는 것도 행복했고, 두번의 특강도 만족스러웠습니다. 학점은 에제 받았는데, 많은 사람들이 헷갈려서 틀린듯한 기말고사 2번을 같이 틀렸던지라 학점까지 만족스럽네요. 전체적으로 학교 다니면서 생각이 복잡해지는 시점에 들으면 힐링할 수 있는 명강!! 강추강추"
명상과 수행,성해영,19,Fall,5.0,여러 매력과 장점이 있는 수업이지만 무엇보다도 교수님 강의력이 매우 좋으십니다.  재미있게 들을 수 있어서  이 분야에 큰 관심이 없는 분께도 추천하고 싶습니다.
명상과 수행,성해영,19,Spring,5.0,"개인적인 평가로는 삶에서 많은 부분들을 바꾸어 놓은 강의라고 생각함
출결 한학기 총 8번 부르심/ 과제는 쪽 페이퍼 2회, 명상 일기쓰기, 명상 보고서 1회
명상이 가진 힘이 생각보다 크더라구요 정말 많은 것들을 배워갔어요"
명상과 수행,성해영,19,Spring,4.0,"과제형식이 엄청 자유로움
과제내용이 부담없음
시험 적당
교수님 좋으세요"
명상과 수행,성해영,19,Spring,3.0,"지각결석민감반응..??? 딱히 모르겠네요 전 올출석, 과제 다하고 시험전날 밤샘 이렇게 했는데 비쁠받았어요~"
명상과 수행,성해영,19,Spring,5.0,일단 교수님이 넘 친절하시고 학생들 편의를 많이 봐주세요 수업때 명상을 실제로 하는데 좋았음 명상 일기 쓰는게 과제인데 밀려서 몰아썼음... 지각결석 반영이 큼+오전 강의+출석체크 랜덤이니까 늦잠 자주자면 비추 저어는 택시 n번 탔음
명상과 수행,성해영,19,Spring,5.0,"각 종교의 수행법에 대해서 배울 수 있는 좋은 강의. 교수님 강의력 좋아요ㅠㅠㅠㅠ 수업 열심히 듣고 필기 열심히하면 에쁠떠욤 출결 학기에 8번 체크하시는데, 지각이랑 결석 민감하게 반영하신듯!"
명상과 수행,성해영,19,Spring,4.0,"강의 내용이 신선하고 한 학기동안 다루기엔 지나치게 라이트한 감이 없지않아 있음. 과제에 대한 평가방식이 모호하고, (좋게 얘기하면 관악의 강의중 가장 자유로운 방식의 과제가 아닐까 싶음) 
출결 잘 하고 과제 하라는거 다 하고 시험 하루 벼락치기하면 최소 에마는 나오는? 강의. 본인은 지각 한번 과제 다 내고 시험 다 적고나왔는데 에제받음"
명상과 수행,김지현,23,Spring,4.0,"개인적으로 수업 때 명상 시간 가지는 건 좋았는데 명상일지 과제가 좀 많이 귀찮았습니다. 시험공부는 핵심적인 내용 위주로 내시고, 그래서 분량은 많아 보여도 공부량이 막 엄청나지는 않아요. 무난하게 들을 만합니다."
명상과 수행,김지현,23,Spring,3.0,"교수님 목소리가 너무 작으시고 졸려요 종교학에 대해 큰 관심이 없으면 그렇게 유익한 수업 같진 않고 명상일지 20개이상 제출, 레포트 ,기말 있는데 기말 공부를 조금 하긴했어도 나머지 과제 성실히 해갔는데 성적이 그리 너그러운 편은 아닌 것 같음"
명상과 수행,김지현,23,Spring,4.0,"수업 초반 30분 정도는 명상을 하고 강의도 일찍 끝내주시는 경우가 많았던 기억이 있습니다.
명상일지를 일주일에 두 세번 작성해야 하는 것이 귀찮다고 느껴지실 수 있을 것 같습니다. 따로 주시는 읽기 자료는 수업용 피피티를 이해하는데 도움이 되기 때문에 시험 보기 전에 한번 읽어보시면 좋을 듯 합니다."
명상과 수행,김지현,23,Spring,4.0,수업 하나도 안 듣고 시험지에 헛소리만 써서 냄. B대의 성적을 받음. 미친 수업이다. 과제는 다 냈다. 매 수업마다 명상을 하는데 이 시간이 의외로 좀 견디기 어려웠다. 자고 싶었다 그냥..
명상과 수행,김지현,23,Spring,5.0,출석은 매번 쪽지에 이름 써서 나가기 전에 제출하는 식으로 이루어지고 명상 30분 정도 한 후에 진도 나갑니다. 수업 처음 몇 번만 듣고 아예 안 들었는데 시험 보는 데 큰 지장은 없었던 것 같아요. 근데 범위가 너무 많고 참고자료가 책이라서 1회독하기도 힘들었습니다..ㅠ 명상 일지는 하루 전에 몰아서 썼고 시험도 하루 전에 자료 읽고 봤는데 성적은 나쁘지 않았어요! 저는 서술형 문제 쓸 때 최대한 책에서 본 단어들을 많이 활용해서 썼던 거 같습니당
명상과 수행,김지현,23,Spring,5.0,"장점: 수업을 안들어도 됨
단점: 수업을 들어도 의미가 거의 없음(시험 공부의 관점에서)

아무래도 한학기 내내 한개 종교만 해도 온전히 다루기 힘든 '종교'라고 하는 거대한 축을 힌두, 불, 이슬람, 기독(가톨릭, 개신교, 동방정교 따로따로), 유, 도까지 다 다루려고 하다보니, 수업이 피상적으로 정보 나열식으로 흘러가버리고, 그렇기에 시험준비를 할때 막막하였던 과목이었던 것 같습니다. 더불어, 실제 시험에서는 제공되는 별도의 책을 시험 범위로 삼으시기에(은근 분량이 많았던 기억이.) 해당 책을 읽고 시험에 들어가는 정도면 성적에 큰 지장은 없기에, 수업이 시험에 엄청난 영향을 주지 못한다는 인상을 받았습니다. (수업을 안들었어도 책만 읽으면 성적을 잘 받을 수 있었겠다는 느낌이었습니다.-책은 미리미리 읽어두는거 추천드립니다. 시험 직전에 이거만 잡고 있던 기억이..)

수업 자체는 초반 30분은 명상이고, 마치는 것도 2,30분 일찍 끝내주시다보니, 편하게 들을 수 있었습니다. 저는 모든 종교는 아니어도, 일부 종교들의 경우 관심이 있는 편이었어서 상대적으로 재밋게 들었던 것 같습니다. 그리고 명상일지가 귀찮긴 했는데, 방학때 일기 몰아쓰는 감성으로 적으니 문제는 없었습니다. 그러나 이 부분에 관심이 없으신 분이면 STAY...굳이 이걸 들을 이유가...? 다른 꿀강 많으니 다른거 들으시길. 

학점은 너그러운거 같긴 합니다. 시험도 굵직한 부분에서만 나와서 전체적인 윤곽만 알고 있다면 충분히 서술 가능한 정도. 사실 수업때 다른 과제때문에 거의 못들었던거 감안하면 학점도 만족스럽게 나온거 같네요. 굳이 정리하자면, 이 분야 관심 없으면 STAY, 관심 있으면 ㄱㄱ"
명상과 수행,김지현,23,Spring,5.0,"종교에 관심있으시면 괜찮은 수업이에요
사실 수업 중간부터는 다른 수업 과제때문에 안들었는데
그냥 핵심 중 핵심 내용에서만 출제하셔서 부담이 없어요
그리고 명상시간이 개인적으로 정말 좋았습니다"
명상과 수행,김지현,23,Spring,5.0,"수업 잘 안들어도 되고 명상일지만 꼬박꼬박 잘 쓰시고
텍스트 미리 조금씩 읽어두면 기말 때 편합니다
구체적으로 다 외울 필요도 없어요 
휴강도 두어번 해서 좋았습니다 
A+ 받아가요 감사합니다 교수님!"
명상과 수행,김지현,23,Spring,5.0,과제와 기말고사 모두 당일에 시작했는데 에제 받아갑니다. 명상이랑 종교에 흥미 없으면 안 듣는 걸 추천
명상과 수행,김지현,23,Spring,1.0,"이 강의를 만족스럽게 수강하기 위해서는

뭐든 시키면 열심히 하는 성실한 서울대생일 것
""AND""
명상과 종교학에 흥미가 있을 것

둘 모두를 만족해야 합니다.

저는 후자만 가지고 있는 사람인데, 과제 부족하게나마 모두 제출하고, 시험 백지 안 내고 D 받아갑니다."
명상과 수행,김지현,23,Spring,1.0,개인적으로 정말 안맞았던 수업.. 수업과 시험이 따로놀고 과제는 많은 성의를 요구하시며 학점이 매우 깐깐하십니다..
명상과 수행,김지현,23,Spring,3.0,저는 시키는거 다하고 기말고사도 공부해서 그럭저럭 봤는데 A-입니다 A+ 폭격기까지는 아닌것같지만 종교학 좋아하시면 재밌게들을수 있겠죠
명상과 수행,김지현,23,Spring,5.0,"수업 내용 특성상 머리에 잘 안 들어오는 것은 맞는 것 같습니다. 저는 추상적이고 신비적인 것들에 거부감 별로 없는데도 교수님 특유의 나긋나긋한 말투를 따라가다 보면 정신이 다른 곳에 가 있곤 했습니다. 그래도 너무 걱정 안 하셔도 되는 게 이 수업은 이론보다는 실습 위주입니다. 평상시 성실하게 출석하고 명상일지 쓰시고 느낀 점 몇 가지만 잘 정리해두면 문제 없이 성적 받으실 수 있을 것 같습니다. 기말시험도 텍스트 범위가 많고 난해해서 준비할 때는 괴로워도 막상 시험문제는 간단한 키워드 5개 중 3개 골라 쓰기, 여러가지 명상전통 비교, 수업 동안 깨달은 점서술 정도라서 부담스럽지 않습니다.
그리고 두 번 정도 명상특강이라고 해서 외부에서 강사 분께서 오셔서 실습도 하는데, 저는 이게 색다르고 좋은 경험이었습니다. 그 밖에도 휴강을 많이 주셔서 부담이 적었습니다.
마지막으로 이 수업은 교수님께서 매우 인자하고 인품이 훌륭하셔서 추천 드립니다. 한 학기 동안 힐링하실 수 있습니다."
명상과 수행,김지현,23,Spring,5.0,"교수님께서는 A+ 폭격기가 아닐까요?
명상일지만 잘 버텨낸다면 당신도 A+"
명상과 수행,김지현,23,Spring,5.0,"??? 제가 왜 A+?
진자 사랑합니다 교수님…

(명상은 너무 좋았지만
극 S인 저에게 종교학 수업 내용은 너무 벅차고 시험공부 내내 힘들었습니다… 다만 모든걸 잊게해주는 혜자 학점.. 사랑합니다)"
명상과 수행,김지현,23,Spring,3.0,솔직히 명상에 대해 흥미가 없는 사람은 너무 듣기 어려운 수업이었다..
명상과 수행,김지현,21,Summer,5.0,"힐링 수업이었음. 명상 일지를 써야 하지만 어렵지 않게, 자신의 이야기를 쓰면 돼서 괜찮았음."
