현대문화와 기독교,이유나,20,Fall,5.0,"20겨울 수강했습니다.

시간은 3시간 배정되어 있지만 보통 1시간 남짓한 수업 동영상과 비슷한 시간의 참고동영상을 보면 되는 사실상 회차당 2시간 정도의 수업입니다. 가끔씩 참고동영상도 없어서 1시간이면 땡인 날도 있습니다. 출석을 따지시기 때문에 수업을 안듣더라도 동영상은 켜놓으셔야 돼요.
기말고사는 돌아다니는 족보랑 비슷합니다. 다만 수업은 기본적으로 들으셔야 점수를 잘 받을 수 있을 것 같습니다.
중간고사 대체과제로 주제 하나를 잡고 15분 정도 길이의 ppt를 만들고 그걸 mp4로 변환해서 둘 다 제출했는데, 저는 이걸 태어나서 처음 써보는 탓에 변환하는 데에 시간도 많이 걸리고(한 번 할 때마다 20분이 넘어갔습니다 -_-;;;) 음성녹음 오류뜨고 하느라 제출 하루가 딜레이가 걸려버렸습니다 ㅠ 이후에도 이렇게 과제가 나온다면 이런 불상사가 생기지 않도록 미리미리 주제 잡고 과제를 해놓으시는 걸 추천드립니다. ppt 동영상 변환도 익숙하지 않다면 먼저 시험용으로 몇 번 해보시는 것도....ㅎ

아무튼 이러저러해서 저는 드포 29명 중 18등이라는 처참한 성적을 거뒀는데 B+을 주셨습니다. 학점도 한 것에 비해 잘 주시고, 기독교에 관해서 여러가지로 배워갈 수 있는 게 많습니다. 저도 신앙은 1도 없지만 기독교 역사와 각 교파의 문화 등에 대해서 재미있게 알아갈 수 있었습니다 ㅎㅎ"
현대문화와 기독교,이유나,20,Fall,5.0,"개꿀따리개꿀따~
중간대체 쓰기 매우 귀찮지만 그것만 버텨내면 괜찮습니다.
기말은 기출이랑 매우 비슷하게 나와요ㅎㅎ"
현대문화와 기독교,이유나,20,Fall,5.0,"2020 겨울학기 들었습니다. 교수님 말씀하시는 톤이 통계학 정상아 교수님과 매우 비슷합니다. (그만큼 귀에 쏙쏙 박힙니다.) 100% 녹강으로 진행되었고, 영상에 보여지는 PPT는 참고자료를 띄우는 용도 정도이므로 정말 '배우러' 오신 분이면 필기 노트 준비하세요. 그냥 좋은 학점 받는 것으로 충분하신 분들은, 개강 전에 미리 스랖에서 기출을 다 다운받으시면 문제가 나오는 파트랑 방식이 다 눈에 보이는데 수업을 들으면서 그때그때 답안을 미리 작성해두시면 좋을 것 같아요. 시험 끝나자마자 이랬으면 좋았을걸 하는 생각이 들었습니다. 천상 이과로서 서술형 시험인 기말을 다소 망쳤는데, 그나마 개신교인으로서 가지고 있는 기초 지식이 중간 레포트에 생명을 불어넣었나 모르겠습니다. 드랍자 포함, 상위 50%에도 못 들었는데 A0 받았습니다."
현대문화와 기독교,이유나,20,Fall,5.0,"겨울학기수강
수업내용도 재밌고 중간대체발표하나랑 서술형기말하나 보면 로드끝!"
현대문화와 기독교,이유나,20,Fall,5.0,"과제는 교수님께 질문하는 과제 1회+다큐...? 보고 감상문 적기 2회+5p 보고서 과제인데,, 질문 과제와 감상문 과제는 정말 부담 없이 할 수 있습니다. 그리고 보고서 과제는 교수님께서 그 중요성을 굉장히 강조하시는데, 조교님과 교수님께서 주제 선정이나 모르는 부분에 대해서 친절하게 피드백을 주시기 때문에 어렵지 않게 할 수 있습니다. 시험도 스랖에 있는 족보에서 많이 나와서 과제와 시험 모두 부담 없이 편하게 준비할 수 있습니다. 그리고 무엇보다 교수님이 정말 좋으신 분입니다!!!"
현대문화와 기독교,이유나,20,Fall,5.0,인풋 대비 아웃풋이 아주 좋은 강의입니다 학점을 잘주십니다
현대문화와 기독교,이유나,20,Fall,5.0,교수님 너무 친절하고 좋으세요! 관심있는 분야라 그런지 강의도 나름 주제가 흥미로웠고 성적도 잘 주십니다 추천해요ㅎㅎ
현대문화와 기독교,이유나,20,Fall,5.0,"교수님 너무 귀여우시고 좋으신데, 처음에는 도대체 수업을 들어도 뭘 어떻게 어느 정도로 정리해야 하는지 갈피를 못잡아서 혼란스러웠습니다. 서너 번 정도 감상문 과제 있고, 크게 부담은 없지만 만점은 드문 것 같아요. 그리고 중간대체보고서가 꽤나 비중이 크고 또 부담도 많이 됩니다. 주제도 워낙 광범위해서 본인이 구상하기 나름이고, 평가기준도 꽤나 깐깐한 것 같습니다. 기말은 오픈북 비대면 서술형이고 수업만 잘 들었다면 어려움없이 서술가능한 것 같습니다. 감상문과제 그럭저럭 잘 써서 냈고, 기말도 무난하게 서술했는데, 제 기준 보고서를 잘써서 A+ 주신 것 같아요."
현대문화와 기독교,이유나,20,Fall,5.0,교수님 너무 좋으시고 수업내용도 진짜 재밋고 부담스러운거 하나도 업서요 ㅎㅎ 교수님 진짜 완전 좋으심ㅎㅎㅎㅎㅎㅎㅎㅎ중간보고서는 꽤 열심히 쓰고 과제랑 기말고사 좀 망햇는데도 에제 뜬거보면 진짜진짜진짜 성적도 잘주셔요 ㅎㅎㅎ꼭들으세용ㅇ
현대문화와 기독교,이유나,20,Spring,5.0,"여름계절 수강했고 드랍자는 9명 정도였어요 드포라서 성적받기가 더 수월했던거 같아요
과제는 그냥 10줄 안밖의 짧은 감상평쓰기가 3개 정도였고 올려주시는 영상자료는 시험에는 포함되지 않았습니다
시험은 족보에서 많이 나온다고 들었는데 (제가 못찾은 걸수도 있지만) 3문제중 한문제만 족보랑 같았던거 같아요 그래도 어렵진 않아서 금방 적을 수 있었습니다
레포트도 정성들여 쓴건 아닌데 A0나온거 보면 학점은 널널하게 잘 주시는거 같아요!"
현대문화와 기독교,이유나,20,Spring,5.0,"여름 계절 수강 
이 수업은 계절로 들으세요... 계절이라고 진도도 조금씩 나가고 드랍자도 많아서 학점 잘 받을 수 있어요!! 시험은 족보 그대로에 오픈북이라 사실상 변별이 거의 안 되고 리포트 비중이 크다고는 하는데 리포트 발로 쓴 제가 잘받은걸로 봐서는 이번에 학점 그냥 뿌리신 것 같아요. (마감 당일부터 쓰기 시작해서 30초 남기고 제출해 검토도 못한채 냈는데 예상보다 너무 잘 받았어요ㅠㅠ) 기독교 신자인데 객관적으로 종교를 볼 수 있어서 그것도 새로웠어요!"
현대문화와 기독교,이유나,20,Spring,5.0,"시험은 족보 그대로, 대체 레포트의 비중이 커요!
일단 학점은 비율을 채워준다는 건 유의하였으면 좋겠어요. (저는 잘 나와서 강평을 쓰고 있기는 한데) 학점을 막 퍼서 주시는 것이 아니라 B0, B+도 상당수 주시는 수업입니다.
로드가 워낙 적어서 드랍하시는 분이 없고, 그래서 40%는 B를 받는 수업이에요.

중간 대체 레포트는 독창성? 신선함을 많이 보는 것 같아요.
엄청 새로운 주제를 잡아서 교수님이 전혀 도와주실수 없겠다~ 이런 평을 하셨는데도 잘 나온 것을 보면요"
현대문화와 기독교,이유나,20,Spring,5.0,"시험은 스랖에 있는 족보 그대로 나옵니다. 수업내용도 흥미롭고, 로드는 적당합니다. 꿀강으로 추천합니다 ㅎㅎ"
현대문화와 기독교,이유나,20,Spring,4.0,기독교와 관련해서 아주 기초적인 지식을 배울 수 있는 강의. 독실한 신자의 입장에서 들으면 불편할만한 내용 존재. 그냥 딱 교양 정도의 수준. 중간 대체 레포트 비중 큼. 기말은 스랖 족보 거의 그대로
현대문화와 기독교,이유나,19,Fall,5.0,중간 없고 기말이랑 중간 대체 페이퍼만 내면 됨. 수업 되게 재밌게 하시고 목소리도 또랑또랑 안 졸리고 수업 내용 효과적으로 잘 전달되는 듯한 느낌을 받았음. 개신교 천주교 위주로 수업 진행하시는데 무교여도 잘 알아듣게끔 설명해주심. 종교에 대해 잘 알고 싶으면 듣길 강력추천.
현대문화와 기독교,이유나,19,Fall,5.0,중간고사도 안보고 정말 널널했던 수업! 시험도 피피티 달달 외워서 가는 것이 아니라 큰 흐름만 잡고 가면 괜찮은 성적을 받을 수 있는 수업입니다 중간고사 대신에 중간 대체 레포트 과제를 내주셔서 기말 고사 보는 날에 제출하는 방식인데 시험보다 레포트가 중요하다고 하셔서 레포트에 신경을 좀 더 써주시면 좋은 성적을 받을 수 있을 것 같습니다
현대문화와 기독교,이유나,19,Spring,5.0,"암기랑 안맞는 사람에게 정말 추천! 무언가를 달달 외워야하는 그런 종류의 부담 전혀 없이, 편하게 이야기 듣는것처럼 들을 수 있는 강의입니다. 중간 대신 에세이 하나 있고 기말 시험 있는데, 시험은 거의 본인의 생각을 쓰는 느낌! 학점도 최대한 잘주시는듯합니다♥"
현대문화와 기독교,이유나,18,Fall,5.0,"기독교 중에도 개신교에 조금 더 초점을 맞추어서 내용을 다루는데, 상당히 흥미로운 것들을 알아갈 수 있었습니다. 무신론자라 종교적 개념들에 대해 문외한이었는데, 교수님께서 그 부분까지 감안하시고 수업을 진행하십니다. 모르면 모른다고 말씀드리면 친절히 지도해주십니다.

로드는 중간은 안 보고 기말 시험 하나를 봅니다. 그리고 중간고사 대체 레포트가 있는데, 이건 주제의 참신성과 주장을 어떻게 뒷받침하는지, 그리고 교수님께 얼마나 도움을 받는지(자신을 이용(?)하라고 적극 권장하셨어요)에 점수가 달린 것 같습니다. 성실히 임하는 모습을 보고 학점을 주시는 듯해요."
현대문화와 기독교,이유나,17,Fall,5.0,"개인적으로 만족도가 매우 높았던 수업입니다.
교수님께서 기독교 관련 다양한 주제를 체계적으로 설명해주시고, 최대한 객관적 관점에서 종교적 현상들에 관한 논의를 이끌어 주셔서 좋았습니다. 기독교, 또는 종교에 관심이 있는 분들이라면 충분히 즐겁게 수업을 들으실 수 있을 것 같습니다!
 레포트 하나+기말고사로 성적이 결정되는 듯한데, 교수님께서도 기말고사보다는 레포트가 중요하다고 말씀하셨을 정도로 레포트가 중요한 것 같습니다. 교수님께 레포트 주제에 관해 미리미리 조언을 구하고, 내용의 방향을 잡아가신다면 큰 부담없이 레포트 작성을 하실 수 있을 것입니다. 기말고사는 시험 범위의 내용을 잘 외웠다면, 어렵지 않게 풀 수 있는 내용들 위주로 나왔습니다. 시험 보시기 전에 기출 문제 한 번 보고 가시면 큰 도움이 될 듯 합니다."
