도덕적 추론,이현우,23,Spring,4.0,"시험을 치르지 않고 과제로만 평가된 수업이었습니다.
한페이지 분량의 작은 과제, 중간과제는 제출만 하면 감점하지 않아 부담이 크게 없었는데 기말과제는 작품 선정부터 다소 막막하긴 했습니다. 개인적으로는 어렵고 복잡한 작품보다 차라리 쉽고 뻔해보이는 작품을 골라서 정확하고 자세하게 쓰는게 나을 것 같습니다.
수업시간에 자잘한 과제들에 대해 모범 답안을 알려주시고, 글쓰기 형식 등에 있어서 전체 피드백을 해주시는데, 이때 교수님이 원하시는 스타일과 내용을 파악하셔서 기말과제에 반영하면 됩니다. 특히 글쓰기 형식을 중시하시니 교수님이 알려주시는 가이드라인을 잘 따르는게 중요합니다."
도덕적 추론,이현우,23,Spring,5.0,기말 보고서 하나만 평가에 들어갔고 나머지 과제는 제출만 하면 만점 주셨습니다. 보고서 하나로만 평가하니까 위험 부담이 조금 있어서 보고서 작성에 자신있으시면 추천드려요. 중간에 자잘한 과제들 하면서 교수님께서 원하시는 형식들을 파악하면 기말보고서에서 좋은 성적 받을 수 있습니다.
도덕적 추론,이현우,23,Spring,5.0,"전반적으로 수업은 재미있고 부담이 없었음. 팁을 주자면 4번 정도 과제를 성적 포함 아니고 제출 여부만 판단하는 것인데 이 과정을 하다보면 교수님이 원하시는 보고서의 체계가 보임. 그 조건들을 다 모아서 기말 보고서에 잘 반영해야함. 윤리 베이스 하나도 없었는데 재미있는 부분만 들었는데 보고서 쓰기 어렵지는 않았음. 마지막 기말 과제는 주제, 개요 검토는 한 번 부탁드리는 거 추천 개인적으로 할꺼 다하면 잘 주시는 듯?"
도덕적 추론,이현우,23,Spring,1.0,"성적이 사실상 기말보고서 하나로만 부여되는데 요구사항이 되게 모호함. 기말보고서에는 크게 작품의 줄거리, 갈등 상황, 인물의 행위와 그 이유, 그리고 작가/감독이 내포하는 의미가 들어가야함. 그런데 한 번도 언급된 적이 없었던 글쓴이 자신이 지지하는 입장에 대한 내용이 명확하지 않다고 감점됐음. 감점할 것이면 채점기준에 미리 포함시켜서 설명해주셨으면 좋았을 것 같은데 없던 채점기준 하나가 갑자기 생겨버린 꼴.
이외에도, 수업시간에 등장한 이론을 적절히 들고 와 서술하라고 요구하셔서 어떻게든 엮으려고 노력했지만, 막상 교수님은 수업에서 배우지도 않은 부분을 끌고 와서는 이러한 상황에서 적절하지 않다고 감점하는 식. 철학 전공 수업도 아니고, 초심자들이 그러면 논문이나 저서를 싹 뒤져보면서 하나하나 검토해가며 글 쓰기를 원한 것인지.
수업 시간에는 도덕을 가볍게 접근해보자고 언급하셨으면서 채점은 그 어느누구보다 더 엄격하게 하시는 느낌.
애초에 수업시간에 배운 한정적인 내용을 가지고 세세하게 따져가며 평가하는 방식의 한계라고 생각함.
글쓰는 윤리 교양들 많이 들어봤지만 이런 식의 채점을 받으니 참 황당하고 어이가 없음.
전반적으로 교수님의 수업 진행이나 과제 설명 및 공지가 미숙하다고 느껴지는 수업. 한 학기 흐름이 체계적이지 못하다는 인상을 자주 받음. 

추가로, 판서를 하시는데 글씨가 작아 뒤에 앉으면 보이지도 않고 필체도 좋지 못한 편이심.

만약에 이 수업을 듣게 된다면 괜히 특이한 작품 고르지 말고, 무난무난한 작품 혹은 선과 악이 분명하게 그려지는 작품 선정하는 것이 좋을 듯. 괜히 어쭙잖은 분석해보겠다고 나서는 것보다 평범한 방식을 택하는 것이 이로움."
도덕적 추론,이현우,23,Spring,5.0,"교수님이 은근한 개그력을 가지고 계세요.. 말하시는 톤 자체가 워낙 소소한 재미를 주십니다.. 기말과제 1개를 제외하고는 성적에 영향을 끼치는 요인이 거의 없습니다 ! 그래서 학점 받을때 꽤 긴장이 되더라고요.. 여하튼 학점은 드포해서 a를 40프로 정도 주시는 것 같습니다 ! 유의할 점이 있다면, 윤리학을 접해보지 못한 학생들은 수업 시간에 다소 이해하기 어려울 수 있을 것 같습니다 !"
도덕적 추론,이현우,23,Spring,4.0,교수님이 젊으셔서 그런지 얘기를 되게 위트있고 재미있게 하시고 예시 같은거 들어주시면서 굉장히 이해가 쉽게 설명 잘해주십니다. 과제가 좀 있긴 한데 부담이 있는게 아니라 하면서 성찰할 수 있는 기회를 주는 느낌이라 오히려 좋았어요
도덕적 추론,이현우,22,Fall,5.0,"이전 강의평에서 자세히 써주셔서 개인적인 느낌만 남기자면, 젊은 교수님이셔서 그런지 학생들의 상황과 입장을 매우 잘 고려해주신다는 점이 수업의 가장 큰 장점인 것 같습니다. 토론 위주의 수업은 아니고 이론 중심입니다. 교양 치고는 꽤 깊게 다루시는데,저는 개인적으로 어디 가서 들을 수 없는 희소 가치가 있는 내용인 것 같아 좋았습니다. 그리고 이런 저런 재미있는 썰도 많이 풀어주십니다. 이건 아마도 이번 학기가 매우 소수 인원 강의였기 때문에 편안한 분위기에서 진행되어서 더욱 그런 듯 합니다. 영화 보고 인물의 도덕적 추론을 분석하는 과제 역시 부담 없으면서도 다른 수업에서 할 수 없는 좋은 경험이었습니다. 전반적으로 알차고 추천할 만한 강의라고 생각합니다. 도덕철학에 관심 있는 분들은 들어보세요."
도덕적 추론,이현우,22,Fall,5.0,"1. 강의내용 
강의내용은 윤리학 전반에 대해 다뤄주십니다. 개인적 측면, 사회적 측면으로 나눠서 수업이 이뤄집니다. 개인적 측면은 아리스토텔레스, 칸트, 공리주의에 대해 배웁니다. 내용은 각각의 철학자들이 생각한 인간이라면 따라야 할 것들을 위주로 배웁니다. 다만 나열식으로 배우는 것은 아니고 철학자들 나름의 증명, 고심했던 부분들, 지금 현대인들이 생각하기에 아쉬웠던 부분들, 얼탱이 없는 부분들도 함께 배웁니다. 특히 칸트 부분은 제가 철학과 수업을 논리학이랑 논비사만 들어서 잘 몰라서 그런 것일수도 있는데 유명한 칸트책뿐만 아니라 말년에 칸트가 써서 잘 알려지지 않은 부분들, 최근 논의되는 부분들도 함께 가르쳐주십니다. 철학자들의 논의를 배운 이후 도덕적 추론을 하는 방법을 배웁니다. 여기서는 현대적 철학자들이 했던 논의들도 폭넓게 다뤄주십니다. 사회적 측면은 사회계약론과 관련된 고전적, 현대적 논의를 배우고 롤스의 정의론에 대해서 배웁니다. 교수님이 롤스 전공자라 그런지는 몰라도 우리가 잘 못 알았던 롤스의 내용들도 배웁니다. 마지막으로 기타 주제들 투표, 민주주의 관련 철학적 논의를 배우는데 종강날 수업은 이상은 높지만 현실은 시궁창임에도 불구하고 우리가 도덕을 배워야 하는 이유를 알려주시면서 훈훈하게 끝내주십니다.

2. 과제 및 시험 
중간고사는 3p 영화를 보고 도덕적 추론을 분석하는 것이었거 기말은 원래는 기말시험이 예정되어 있었는데 교수님이 학생들 배려해주셔서 간단한 3P짜리 영화 분석 리포트로 대체했습니다. 과제는 교수님이 선정한 영화 일부분을 보면서 나타난 도덕적 갈등 상황에 대한 분석이고 3번 있었습니다. 1p 내외라 큰 부담이 없고 성적 평가에 들어가지는 않습니다.  영화 간단하게 보고 나름의 생각을 적으면 되서 재미있습니다. 

3. 수업의 재미 
수업은 도덕 전반에 관해서 배우는 것이라 관심이 없으면 솔직히 지루할 때도 있습니다. 그렇지만 일단 배워두면 다른 수업 리포트나 토론 수업에서 요긴하게 써먹을데가 많아서 좋습니다. 특히 psat이나 leet에서 언어이해나 언어추론 부분에서 나오는 철학 파트들 소재를 많이 다뤄주셔서 내적 친밀감을 쌓으려는 분들에게는 좋을 것 같습니다. 
한편 교수님이 06학번 선배님으로 살아있는 역사책이셔서 재미있는 이야기들도 해주십니다. 학부생 시절 에피소드, 대학원생 시절 에피소드, 학교 행정 처리와 관련한 야사 등등.. 낭만이 있던 시절이 무엇인지를 간접체험합니다. 그래서 그런 것인지
학생들 어려운 점을 잘 알고 배려해주십니다. 마지막으로 교수님이 마스크 벗으면 귀여우십니다. 

4. 성적 
성적은 최대한 잘 주십니다. 학생들 요즘 살림살이 각박한 것 아시고 교수님의 재량 범위 내에서  최대한 잘 주시겠다고 공언하셨습니다. 실제로 크리스마스 이브날에 선물을 주셨습니다. 

5. 종합 
고학번이라면 예전 1학년 응애시절 회상하면서 부담없이 들을 수 있고 저학번이라면 앞으로 있을 글쓰기 과제에서 쓸 수 있는 토픽들도 배우고 다양한 도덕 주제를 배울 수 있기에 추천합니다."
도덕적 추론,정진범,20,Spring,5.0,"숨겨진 꿀강.. 일단은 비대면이라 교수님께서 녹강을 올려주시는데 길이가 짧아요!! 이 강의는 공리주의나 칸트, 평등 등에 대해서 다루는데 이런 주제에 관심있는 분들에게 특히 꿀강일듯 해요. 내용은 별로 안어려운 것 같습니다 그리고 ppt에 내용이 잘 정리되어 있어요.  강의력이 엄청 좋으신 지는 잘 모르겠어요...."
도덕적 추론,정진범,20,Spring,4.0,"수업 들으면서 교수님이 참 멋진 분이시다 하는 생각을 가짐.  학생들 배려하시는 게 잘 느껴지고 녹강 양도 많지 않고 과제도 어렵지 않게 할 수 있음. 과제는 책 3권 중 2권 골라 서평작성. 그리고 중간 없고 기말만 봤음. 기말 시험은 오픈북인데, 솔직히 풀 때 시간 부족해서 오픈해보지도 못하고 허겁지겁 쓰느라 바쁨. 교수님 제발 점수 잘주세요ㅠㅠㅠ
전반적으로 강의력이 엄청 뛰어나신 편은 아닌듯. 철학이라 더욱 그럴수도 있겠지만 강의 중간중간 멈추고 생각해보거나,  몇번을 다시 되돌아가서  들은 적이 제법 많았음. 그래도 목소리가 정말 깔끔하시고 정리가 잘 되어있어서 속기록 다시 보면 또 이해가고, 한번 더 생각해보면 더 좋구 그런 강의. 그리고 진짜 목소리 너무 좋으심.."
도덕적 추론,김현섭,22,Spring,2.0,"강의력은 괜찮은데 수업 진행방식에 의문이 많았습니다. 비대면이면서 질의응답을 받는 시간이 매우 길고, 그 답변 또한 길다보니 점점 집중을 하기 어려웠습니다. 이런 부분이 저와는 맞지 않다고 판단해 저는 드랍하였지만 토론 좋아하시는 분들이먼 재미있게 들을 수도 있을 것 같습니다."
도덕적 추론,김현섭,22,Spring,4.0,"생각해볼거리를 풍부하게 제공해준 교양수업이었습니다
솔직히 힘들기는 무진장 힘들었습니다만.. 결과적으로 성적받고 나니 쑥 내려간 강의였습니다😆
토론이 거의 매주 있고 과제도 매주에 가깝게 에이포 한장 분량 써내야했었어요. 매주 읽을 분량도 상당했고..(저는 읽다 안읽다 했습니다)  교수님의 강의도 사실 집중력을 좀 요하긴 했지만 교수님께서 토론 중엔 어떤 의견이든 적극적으로 경청하고 정리해주셔서 좋았습니다.
결론적으로 교양을 정말 스스로의 교양수준을 높이는 시간으로 삼고 싶다면 추천드립니다. 대신 여러 윤리적 이슈를 다루다보니 토론 참여상대와의 사고관 차이에 약간 스트레스 받는건 감당하셔야 합니다^^;;"
도덕적 추론,김현섭,22,Spring,4.0,과제가 매주 있습니다. 읽을거리(좀 많음)을 주시고 읽을거리와 관련된 쟁점에 대해 자신의 생각을 쓰는겁니다. 저는 그게 잘 맞지 않았지만 생각할 거리가 많다는 점은 확실히 좋았습니다. 수업은 교수님이 읽을거리에 대해 간략히 소개하시고 학생들끼리 토론하는 형식이 많았습니다. 전부 비대면이라 컴퓨터에서 말하는게 어색해서 잘 못했지만.. 다른 학우들이랑 토론하는 기회가 많은 것이 좋은 분들에게 추천합니다.
도덕적 추론,김현섭,22,Spring,5.0,"교수님이 아주 친절하시고 강의에 있어서도 신경을 많이 써서 준비해주시는 것 같습니다. 윤리학, 정치철학적으로 논쟁거리가 되는 주제에 대해서 읽어올 자료를 주시고, 그 주제에 대해 논쟁의 핵심을 설명해주신 다음에 학생들이 자유롭게 토론하는 방식인데, 관련 주제에 관심이 있다면 매우 즐겁게 참여할 수 있는 강의였습니다. 추천할만한 명강이라고 생각합니다."
도덕적 추론,김현섭,22,Spring,5.0,사회문제에 확고한 주관을 가진 분들이 몇몇 보이셔서 따라가기만 해도 즐거운 수업이었습니다. 에세이 열심히 쓰고 시험 잘 보면 성적은 걱정 없어요!
도덕적 추론,김현섭,22,Spring,5.0,"진짜 갓갓갓..
출석 열심히 하고 시험 잘보면 에쁠~"
도덕적 추론,김현섭,22,Spring,5.0,"좋은 주제로 토론을 많이 해요
성적은 드랍이 많아서 괜찮아요"
도덕적 추론,김현섭,18,Spring,5.0,"음...도덕적으로 찬반이 갈릴 수 있는 주제들을 일주일에 한 가지씩 다룹니다.  주2회수업이라 수요일 수업은 대부분 안 갔구 발표도 거의 안했습니다. 에세이 5번도 거의 대충 써서 냈고... 시험은 공부한다고 메리트가 있는 시험이 아니라구 하셔서 공부 안 해갔는데 에이쁠 나왔습니다. 시험을 몹시 열심히 썼는데 그게 유효했던건지 원래 성적을 잘 주시는지는 모르겠네요. 
수업 자체는 아주 흥미로웠습니다. 선생님이 엄청 똑똑하셔서 어떤 말을 하든 적절한 반박으로 수업을 이끌어가주세요. 
부담없이 윤리학 맛보기 하고싶은 분들 들으시면 좋을 거 같아요!"
도덕적 추론,강상진,22,Spring,4.0,"기본적인 철학에 대해 설명해주고, 그 잣대로 현재 논란이 되고 있는 문제들을 어떻게 바라볼 수 있는 가를 설명해주는 수업 ! 시험은 없지만 글쓰기 과제에 몰빵이라 글을 잘 못쓰면 학점이 낮을 수 있다.."
도덕적 추론,강상진,21,Fall,4.0,"시험은 안보고 글쓰기 수업이 주를 이룸
글쓰기 평가 기준은 잘 모르겠지만, 교수님께서 인품이 좋으신건 사실임.
그런데 다음학기부터 강의 안할 예정이라는 식으로 말씀하셔서 어떻게 될지는 모르겠음"
도덕적 추론,강상진,20,Fall,5.0,"이번 학기 들었던 강의 중 최고가 아닐까 생각해봅니다.
교수님께서 제 글을 직접 피드백해주시는 것이 정말 좋았고, 실제로 글을 쓸 때 논지를 명료하게 다듬는 데 있어서 큰 도움을 받았습니다. 수업의 내용 역시 흥미로웠습니다. 그리고 중간, 기말고사가 없다는 점도 좋습니다.
로드는 1주일에 한번씩 수업하기 전에 약 30~40페이지 분량의 책 읽어오는 것과 더불어, 학기 중에 짧은 글쓰기 과제가 9번 진행되는데, 그 중에 3번만 골라서 글을 작성하면 되었습니다. 중간중간 책을 잘 읽었는지 확인하는 출석 퀴즈도 있었지만 잘 못 봤음에도 성적은 그럭저럭 나온 것으로 보아 출석 퀴즈보다는 짧은 글쓰기 과제의 점수가 더 큰 비중을 차지하는 것 같습니다. 마지막으로 10페이지 조금 안되는 분량의 기말 보고서를 작성하는 과제가 있습니다. 그 보고서 점수와, 다른 학우들의 보고서를 읽고 논평을 성실하게 작성하는 것이 중요한 것 같습니다."
도덕적 추론,강상진,20,Fall,4.0,"로드는 좀 있지만 교수님이 정말 이 시대의 참스승님이십니다.
수업을 들으면서 교수님에 대한 존경심이 부글부글 끓어오름"
도덕적 추론,강상진,20,Fall,5.0,"관악 최고의 명강입니다. 단순히 윤리 사상을 배우는 게 아니라 철학자들의 주장을 제대로 이해하고 이를 바탕으로 자신의 논변을 펼치는 과정을 훈련하는 수업으로 본인이 얼마나 수업에 참여하는지에 따라 배우는 정도가 꽤 다를 것으로 생각됩니다. 한 학기 내내 열심히 참여한다면 정말 많은 것을 얻어갈 수 있습니다. 
교수님은 정말 인자하시고 학생들을 위하는 마음이 느껴지는 따뜻하신 분입니다. 저는 교수님께서 매주 학생들의 글을 직접 피드백해주시는 것(대학글쓰기 수업도 주로 조교님들이 글을 피드백해주시던데 이 수업은 짧은 글쓰기+주제보고서+논평문+수정보고서까지 모두 교수님께서 피드백해주십니다..! 갓상진ㄷㄷ)을 보고 큰 감동 받았습니다. 개인적으로 수업이 끝나 더 이상 교수님께 저의 글에 대한 직접적인 조언을 구할 수 없다는 것이 많이 아쉽네요. (교수님은 진정한 참스승이십니다!!)
아울러 이 수업에서는 글을 잘 읽는 법도 배울 수 있는데 아랫분이 출석퀴즈가 난해했다고 하지만 저는 학생들이 리딩자료를 정확히 이해했는지를 분별하는 유익한 퀴즈였다고 생각합니다. 생각보다 리딩자료를 오독하는 경우가 저를 포함한 많은 분들에게 종종 발생하더군요. 이를 의식적으로 경계하기 위해서라도 출석확인용 퀴즈가 필요하다고 생각합니다. 
학점은 잘 주시는 것 같습니다. 다만 주변의 이야기를 들었을 때 글쓰기 평가는 아주 정확하게 해주시는 것 같습니다. 이 명강을 한학기동안 비대면으로 듣게 된 것도 아쉬운데 코로나로 종강파티까지 취소되어 더더욱 아쉽네요..ㅠㅠ (교수님 꼭 대면으로 뵙고 싶습니다ㅠㅠ )
한줄평: 대학 와서 참된 배움을 얻고자 하는 분들께 꼭 추천드리고 싶은 명강입니다!"
도덕적 추론,강상진,20,Fall,2.0,이번 학기 최악의 강의 퀴즈는 난해하고 글쓰기는 채점 기준을 모르겠음
도덕적 추론,강상진,19,Spring,4.0,"정의란 무엇인가 느낌. 내용이 그렇다는 게 아니고, 답을 주기보다 스스로 질문을 던지게 하는. 학점을 잘 주시는지는 모르겠지만 시험이 없는 것도 편함"
도덕적 추론,강상진,19,Spring,5.0,"내용: 몇 가지 이슈에 대한 도덕적인 입장을 세우고, 그에 관한 근거들을 차근차근 생각해볼 수 있는 수업입니다. 저는 항상 어떤 소재에 대해 찬성하는 입장, 반대하는 입장을 들으면 명확하게 주관을 갖기보다 '이 또한 맞고 저것 또한 맞다'라는 우유부단한 생각을 지녀와서 불만이었습니다. 그래서 이 수업을 듣게 되었는데, 제가 가지고 있는 주관을 발견하고, 그에 대해 세세한 생각을 정리해볼 수 있었던  수업이었습니다. 매우만족
과제: 짧은 글쓰기 5번 중 1번 이상+논평문+주제보고서입니다. 다른 학기에는 개인 주제보고서 또는 조를 이뤄서 발표를 택했는데 이번에는 자원자가 별로 없어서ㅠㅠ 개인 주제보고서 작성 후 서로의 글에 대해 논평문을 냈습니다. 교재는 주로 정의랴 무엇인가, 돈으로 살 수 없는 것들, 완벽에 대한 반론 등을 다뤘습니다. 교수님께서 과제 주실 때 학생들을 많이 배려해주시는 것 같습니다. 기간도 넉넉하고 여러 선택지가 있다보니 바쁜 학기였음에도 불구하고 뒤쳐지지 않았던 것 같습니다. 주제보고서는 교수님 피드백을 받아서 수정할 수 있습니다.
성적: 후하게 주시는 듯 합니다.. 개인의 실력 향상을 위주로 성적을 매긴다고 말씀하셨습니다"
도덕적 추론,강상진,18,Fall,3.0,"시험이 없어서 강의는 안 들어도 됨. 하지만 흥미롭긴함.  한번 깜짝 퀴즈가 있었는데 해당 주의 자료만 읽으면 됨. 

과제랑 조별 발표가 있는데 발표하고 싶은 사람이 없어서 주제보고서로 대체됨.  과제는 여섯개 있는데 하나 해서 성적 잘 나오면 더 안 해도 됨.   마지막 주제 보고서 주제는 지정 혹은 자유.  다른 사람 보고서에 한번 이상 논평 해야함.  

적다가도 많아 보이는 과제.  


교수님이 마이크를 입 앞에 안 둬요.  잘 안 들리니까 듣고 싶은 사람들은 앞에 앉으세요.  그럼 화이팅"
도덕적 추론,강상진,18,Fall,4.0,"학점비율은 잘 모르겠음
일단 출석은 2결 하고 지각 겁나많이함
그리고 매번 수업 갈때마다 강의실이 따뜻하고 오전수업이라 맨날 잤음ㅠㅠ 교수님 죄송해요ㅠ
근데 교수님이 학생들 이름 다 외우심..ㅎㄷㄷ
그래서 겁나 망한줄 알았는데 기말레포트 열심히 써서 에이마 받음"
