러시아인의 삶과 문화,백승무,20,Fall,5.0,"외쳐 갓-승무
일단 강의 내용 아주 유익함 + 교수님의 열정(녹강이지만)이 더해져서 좋음. 나도 러시아 뽕 차오름 코로나 끝나면 성 바실리 흐람에 갈 것..
녹강 시간이 길긴한데 수강기간 널널하고 나중에 기말기간까지 연장해주시기도 함
겹강인 사람들이랑 얘기해보니 공연감상문에 대한 부담이 다들 컸던 것 같은데, 다들 발레에 대해 아는 게 없으니 수준은 거기서 거기일 것 같음ㅋㅋㅋ 소설 읽다가 포기하고 청소년용 만화로 된 카라마조프가의 형제들 봤음.. 그래도 이해하는 데에는 문제가 없었다! 발레는 이해를 못 했지만 내 나름대로 해석했음 ㅎ.ㅎ 나중에 발레 해설? 나름 피드백같은 영상도 올려주셔서 좋았음

이번 시험은 다 객관식이었고 음악 듣고 작곡가 고르기 + 다른파트들 문제였음. 러시아 미술이나 다른 파트에 나온 그림들을 주고 작가나 제목 맞추라는 문제는 없었음."
러시아인의 삶과 문화,백승무,20,Fall,5.0,"이번 학기에 수강 신청하려고 했을 때 강의평이 2개밖에 없었는데 다 꿀강이라고 극찬을 하길래 수강 신청을 했습니다. 수업을 듣는 중에는 꿀강이 아니라고 생각했는데 성적 받고 나서 결론부터 말하자면 꿀강이 맞습니다. 
사실 수업을 듣는 학기 중에는 꿀강이라고 안 느껴졌어요. 왜냐하면 1) 정규 수업 시간을 초과하는 동영상 강의 2) 강의 자료를 제공해주지 않음 3) 생각보다 부담이 되었던 중간과제 때문이었습니다. 교수님께서 ppt 자료를 올려주지 않으시고 동영상만 올려주십니다. 초반에는 손으로 직접 다 필기를 하다보니 강의를 듣는 시간의 두 배 넘은 시간이 소요되어서 너무 힘들었어요. 그래서 나중에는 동영상 강의에 나오는 ppt를 먼저 캡처하고 수업을 들으니까 훨씬 더 수월했어요. 중간 과제는 카라마조프가의 형제들 책을 읽고, 발레 작품을 본 후(동영상으로) 발레에 대한 감상문을 쓰는 것이었습니다. 과제를 할 당시에는 발레에 대한 배경 지식이 없어서 감상문을 쓰는데 스트레스를 받고 힘들어 했습니다. 
이번 학기에는 비대면 방식으로 기말고사가 변경되어서 객관식 퀴즈 형태로 기말고사를 봤습니다. 객관식이다 보니 문제가 어려운 편은 아니었습니다. 그리고 시험이 끝나고 몇 시간 후에 바로 교수님이 성적을 공개하셨는데 성적은 정말로 후하게 주셨어요. 그리고 강의를 들으며 러시아 역사, 미술, 음악, 도시 등 러시아에 관해 전반적으로 배울 수 있었고 강의도 재미있어서 수업을 정말로 즐겁게 들었습니다. 강의 시간이 정해진 시간을 초과하지만 교수님이 워낙 강의를 잘 하셔서 재미있게 들을 수 있었어요."
러시아인의 삶과 문화,백승무,20,Fall,5.0,"이거 외않들어요..? 양이 적은 편은 아니지만(중간 보고서 대체되면서 기말때 한학기양으로 한번에 시험봤음..ㅠㅠ) 시험문제가 어려운편도 아니고 무엇보다도 학점을 진짜 뿌립니다..,, 생각보다 러시아 A to Z까지 배우는 느낌이에요. 그리고 제일 좋은건 교수님이 너무 재밌으십니다.. 녹강인데도 느껴지는 그의 에너지... 직접 대면으로 수업안한게 아쉬울정도에요. 다들..들으세요.."
러시아인의 삶과 문화,백승무,20,Fall,5.0,배우는 내용이 적은 건 아닌것 같은데 학점이 모든 걸 커버칩니다. 교수님이 참 귀여우세요
러시아인의 삶과 문화,백승무,20,Fall,5.0,"저 강의평 처음 써봐요,,, 갓승무교수님 덕분에 한학기가 행복했습니다ㅠㅠㅜㅠ 시험본지 4시간만에 성적떠서 1차놀랐는데 은혜로운 학점에 2차놀라서 강평쓰러왔네요 모두 귀여우신 교수님의 러삶문 수업 들어주세요"
러시아인의 삶과 문화,백승무,20,Fall,5.0,백교수님을 뵐 수 있어.... 행복했습니다.... 너무 달콤한 한 학기였어요
러시아인의 삶과 문화,백승무,20,Spring,5.0,학점을 정말 잘 주시는 것 같아요. 그리고 줌이 아닌 녹강이어서 듣고 싶을때 수업을 들을 수 있아요. 다만 강의자료를 안올려주셔서 수업을 꼭 들어야합니다 ㅎㅎ 교수님이 수업을 굉장히 열정적으로 하시는 것 같아서 좋았고 러시아에 대해서 전혀 몰랐는데 이 강의를 통해서 러시아라는 나라에 대한 흥미를 가지게 되었습니다! 저는 공연감상문에  대한 부담이컸는데 그게 아니라면 로드는 시험 한번으로 널널합니다. 시험은 조금 디테일하게 나오는 느낌입니다!
러시아인의 삶과 문화,백승무,20,Spring,5.0,녹화한 강의 올려주시고 출석 인정 기한 넉넉하게 주십니다. (거의 학기말까지ㅋ) 중간은 공연 감상문으로 대체하여 감상문 한 편과 기말이 다인 정말 로드가 널널한 강의입니다. 기말 한방이라 객관식에다 짧은 서술형이라 부담도 없습니다. 거기다 학점도 정말 잘 주시고요! 꿀강의입니다ㅎ
러시아인의 삶과 문화,서광진,18,Fall,3.0,시험 지엽적인거 맞습니다. 문과생들한테 털리는 과목이니 외우는 거 못하는 공대생은 비추. 로드도 빡세서 힘들어졌습니다.
러시아인의 삶과 문화,서광진,18,Fall,5.0,"먼저 써주신 분 말대로 글쓰기 역량강화 수업으로 채택돼서 5페이지짜리 레포트를 3번 써야했습니다. 다음번에도 유지가 될 지는 모르겠지만 도움이 될까 싶어 써보자면,
1. 러시아 문학작품 읽고 감상문 5페이지
2. 러시아 공연예술(발레, 영화, 연극 등)을 보고 5페이지
3. 위 둘과 수업내용 참고해 '러시아, 러시아인 그리고 우리'라는 주제로 에세이 5페이지
였습니다.
제출은 대략 중간고사 전, 중간-기말 사이, 기말고사 전 정도로 생각하시면 될 것 같습니다. 주제 선택은 완전히 개개인의 자유이고, 제출 후 약 3~4주 뒤에 코멘트를 달아서 돌려주십니다.
시험 중에 서술형은 평소 수업만 열심히 들었다면 누구든 쓸 수 있는 내용으로 나오고, 단답형은 지엽적으로 인물 이름, 연도, 작품명 등도 출제가 돼서 꼼꼼히 외울 필요가 있습니다. 시험성적을 알려주시지는 않습니다.
다들 꿀강을 생각하고 오셔서인지 첫번째 과제가 마감될무렵에 드랍자가 대규모로 나와서 교수님께서 학점을 잘주시겠다고 언급을 해주셨고, 실제로도 성적을 후하게 주셨습니다."
러시아인의 삶과 문화,서광진,18,Fall,4.0,"일단 올해 글쓰기 역량 강화 수업에 선정되어서 과제가 정말 많았구요... 5장짜리 레포트를 3개 써야 했습니다.  시험은 중간 기말 두 번이고, 난이도는 적당한 것 같아요. 단답형 14-6개와 약술형 5문제를 내시는데 수업시간에 강조하신 부분에서 나옵니다. 강조하는 부분은 설명을 길게 하세요. 전 중간 이후로 수업 안들어서 그냥 공부하느라 조금 힘들었지만, 자료를 올려주시고 자료에 있는 내용으로 수업을 하시기 때문에 사실 강의는 안들어도 됩니다. 근데 교수님이 재밌기도 하시고, 들으면 유익한 내용이고 강의력도 뛰어나니 들으시는걸 추천합니다. 
아래아래분이 성적에 대해 언급한 부분은 거짓말 같네요. 성적은 아직 나오지 않았지만 교수님이 최대한 잘 준다 하셨고, 교수님 성격상 그럴 것 같습니다. 
정리하자면 이번 학기부터 과제가 많아져서 문제이지먼 그 전 학기까지는 분명 꿀강명강이 맞았던 것 같습니다. 지금은 꿀강은 아닌 것 같습니다. 과제를 착실히 하실 수 있는 분이면 들으셔도 좋을 것 같아요."
러시아인의 삶과 문화,서광진,17,Fall,5.0,"뭔가 상당히 아래  글이 수강신청 기간을 맞아 급하게 작성된 것 같군요.
수강평을 남기는 성격은 아닌데 틀린 것은 정정할 필요가 있다고 생각합니다.
글쓴님 말대로 b-나 d가 나왔을 수도 있겠지만, 적어도 교수님과 성적 문의를 하면서,
학점을 박하게 주신다는 느낌은 전혀 못받았습니다. 중간 살짝 아래를 한 것 같은데 b+를 주셨고요.
게다가 지엽적이라뇨. 시험 보신 분이 맞나 궁금하네요. 수업시간에 강조하신 부분에서 내셨습니다.
러삶문 강좌가 이번 학기 부터 갑자기 수강신청도 빡세지고 그러고 있다고 들었는데,
그럼에도 올바른 정보를 제공하는 게 맞다고 생각합니다."
러시아인의 삶과 문화,서광진,18,Spring,1.0,"쁠몰아니고 시험 지엽적, 연도 지명 인물 다 외워야함. b-까지 채워주고 d도 줌..;;;;"
러시아인의 삶과 문화,서광진,17,Spring,5.0,"관악의 '숨은' 명강의

교수자 : 서광진 교수님은 학생들에게 편하게 잘 대해주십니다. 강의력도 좋으시고 내용을 재미있게 잘 가르쳐 주십니다. 굉장히 열려있으십니다. 

강의내용 : 교수님께서 주시는 자료를 통해 진행됐습니다. 자료는 각각의 키워드(도시,술,종교,미술,시베리아 등등)로 나눠져 있고 각각의 설명이 되어있습니다. 내용은 지루하지 않고 재밌습니다. 교수님께서 시각자료도 준비하셔서 보여주시며 강의 진행하십니다.

과제 : 원래 서광진 교수님은 과제를 많이 내주시는 편이라고 합니다. 하지만 저희 때는 교수님께서 과제를 까먹으셔서 서평 딱 한편만 제출하고 끝났습니다. 서평은 정해진 책은 아니였으며 러시아와 관련된 책(본인 전공과 관련있는 책이면 좋음)을 읽고 5페이지 정도의 서평을 제출하시면 됩니다. 과제는 학점에 큰 영향을 미치지는 않는 것으로 보입니다.

시험 : 중간,기말고사가 있었습니다. 원래는 중간고시가 없었으나 갑자기 생겼습니다. 문제는 납득할 수 있는 수준에서 나옵니다. 주요 키워드들과 중요사건 연도를 주관식으로, 각 키워드에 대한 내용과 흐름을 서술형으로 내십니다. 외우는 것이 아니라 내용을 이해하고 중요한 부분만 암기해두시면 충분히 풀 수 있습니다. 난이도 자체는 중하 정도였다고 생각합니다.

학점 : 쁠몰 주십니다. 출석 과제 어느정도 안좋아도 시험만 잘 보시면 a나올 수 있다고 생각합니다. 학점따기 정말 좋은 강의입니다.

총평 : 사람들이 왜 안듣는지 정말 이해가 안될정도로 명강의이자 꿀강의. 아마 러시아가 생소해서 안들으시는 것 같은데 시도해서 나쁠건 없다고 생각합니다. 교수님, 강의내용 모두 좋았다.

추천 : 강력 추천"
러시아인의 삶과 문화,변현태,19,Spring,5.0,포기하고 싶어도 드랍하지 않고 과제를 내기만한다면 행복한결말을 볼것...
