음악의 원리,전상직,23,Fall,5.0,"강의를 듣고 음악을 대하는 태도와 생각을 바꿀 수 있었습니다.
내용이 다소 어려워서 드랍기간이 끝나면 강의실에 빈자리가 꽤 생깁니다.
어렵긴 하지만 개인적으론 영양가 풍부한 수업이었다고 느꼈습니다.
스누온에 옛날에 녹화된 강의가 있으니 복습이 필요하거나 맛보기로 들어보고 싶으시면 스누온 찾아보시면 좋을 거 같습니다.

(제가 수강했을 땐 중간고사 없이 기말고사만 있었는데 24년 1학기에 수강하는 친구는 중간고사를 봤다고 합니다)"
음악의 원리,전상직,22,Fall,5.0,"군e러닝 수강

클래식에 대한 귀를 뚫어주는 수업입니다. 내용은 솔직히 쉽지 않지만 이정도 강의력이면 진지하게 들어볼만하다고 생각됩니다. 한학기를 듣고 나면 이전에는 들리지 않던 것들이 조금씩 들리기 시작합니다. 관심있다면 적극 추천하는 강의입니다"
음악의 원리,전상직,23,Fall,5.0,음악을 진심으로 사랑하는 사람이라면 졸업 전 꼭 들어보아야 할 띵강의입니다 솔직히 내용 꽤 어렵고 수업 따라가기가 마냥 쉽지는 않지만 열심히 듣고 공부해보면 정말 정말 그 어디에서도 배울 수 없는 것들을 얻어갈 수 있습니다 중간 없고 기말 한 방에 교향곡 분석 과제 하나라서 로드가 그리 빡빡한 건 아닙니다 한 학기 동안 내가 교수님의 화법과 음악적 시각을 내면화한다 생각하고 수업 들으면 학기말 가서 교수님의 뉘앙스를 얼추 따라는 할 수 있을 겁니다 기타든 피아노든 악기 뭐 하나라도 5년 이상 제대로 다뤄보신 분들이 듣기에 적절할 듯합니다
음악의 원리,전상직,23,Fall,3.0,"개인적으로 강의는 너무 지루했다. 첫째주 빼고 제대로 들은 적이 없다..ppt가 자유로운 구성이고 악보와 키워드가 흩뿌려져 있으며 설명이 잘 안되어있다. 교재를 보거나 필기를 해놓아야 어떤 맥락인지 알 수 있다. 기말고사 한방이고 논술형이다. 개념을 보고 대충 설명할 수 있을 정도여야 적을 수 있다. 과제의 비중이 상당하니 성의껏 하시길. 그나마 과제에 투자를 많이 했는데 그빨인지? 학점은 괜찮게 받았다
 +과제, 기말고사 점수는 따로 안알려준다."
음악의 원리,전상직,23,Fall,5.0,"클래식과 같은 순수예술로써의 음악을 말 그대로 '학문적인' 차원에서 다루는 강좌입니다. 
아무래도 저와 같이 음악 이론에 대해 정식으로 배워본 적이 없는 비전공생에겐 처음엔 어렵게 느껴질 수 있으나... 수업을 계속 듣다 보면 점점 어느정도 이해가 됩니다. 다만 아주 기본적인 것들 (조표 붙는 순서, 온음/반음 관계 등) 은 미리 알고 있으셔야 하는 것 같습니다.

개인적으로 수업 초반엔 무슨 내용인지도 잘 이해가 안되고 막막했는데, 평소 짬짬히 교재를 읽어 둔 덕에 중반부터는 별 어려움 없이 따라갈 수 있었습니다. 애초에 교재 자체가 수업 내용이 그대로 담겨 있고 이를 좀 더 이해하기 쉽게 설명하는지라... 평소 수업 전후로 교재를 읽어보시는걸 적극 추천드립니다. 교재는 음악대학 도서관에서 장기 대출이 가능해서, 따로 사실 필요도 없습니다.

시험은 기말에 한 번 보는데, 강의때 다룬 내용보다는 한층 쉽게 나오므로 크게 걱정하실 필요는 없습니다. 수업 중간중간에 교수님께서 조금 과할 정도로 지엽적이고 깊게 들어가시는 부분들이 있는데, 어짜피 시험에선 안 나오는 부분들이니 크게 스트레스 받으실 필요는 없고.. 전체적인 흐름을 중심으로 대비하시면 될 것 같습니다. 보통 다들 어려워하시는 부분인 조율법이나 화성 단원도 (최소한 이번 시험에서만큼은) 예상외로 시험문제가 딱히 지엽적으로 나오진 않았습니다.

과제의 경우 기말시험 이후 일주일 뒤가 마감 기한인 레포트가 한 개 있는데, 교향곡 한 곡을 선택한 뒤 수업 때 배운 내용을 적용하여 작성하는 과제입니다. 교향곡 전 악장을 모두 분석해야 하지만 이 역시 일일히 지엽적으로 다룰 필요는 없고, 곡의 전체적인 흐름 및 핵심적인 부분들만 설명하셔도 충분합니다. 다만 이것만으로도 시간이 꽤 걸리는지라 (예상외로 배운 내용들을 곡에 적용하기가 꽤 어렵습니다), 기말 전에 미리미리 작성하시는 걸 적극 추천드립니다. 저는 베토벤 교향곡 9번 [합창]을 대상으로 기말 이후 벼락치기로 작성했는데, 정말 피 볼 뻔했습니다...

정리하자면, 비전공생이 처음 듣기엔 진입장벽이 좀 있고, 어느 정도의 시간 투자가 필요한 강의이기도 하지만, 확실히 그만큼 음악에 대해 배워가는 게 많은 강의이기도 합니다. 개인적으로는 본 강의를 수강한 뒤 음악적 지식이 한층 더 풍부해짐을 느꼈고, 평소에 (꼭 클래식뿐 아니라 대중음악을) 음악을 들을 때도 단순한 느낌을 넘어 엄밀한 구성 방식 (리듬의 변화, 화성 진행 등) 에 집중해서 들을 수 있게 된 것 같습니다. 음악을 조금 더 진지하게 배워보고 싶으신 분들께 적극 추천하는 강좌입니다!"
음악의 원리,전상직,23,Fall,4.0,"강의내용은 음악에 대한 기초지식이 없으면 매우 어려움. 다만, 시험은 강의 난이도에 비해 쉬운듯. 과제는 기말 레포트 하난데 전악장 분석이라 양이 꽤나 많음."
음악의 원리,전상직,23,Fall,4.0,"기말고사 1번, 기말레포트 1개가 끝.
내용은 어려웠지만 재밌었습니다."
음악의 원리,전상직,23,Fall,5.0,클래식을 좋아하는 사람으로서 너무너무 만족스러운 강의였습니다 2시간 반 통강이라 체력적으로 힘들긴 한데 아는 음악 들으면서 설명 들으니까 재밌더라고요! 클래식 안 좋아하시면 재미없겠지만..개인적으로 왕추
음악의 원리,전상직,23,Fall,5.0,"대중음악이 아닌 클래식에 기반한 순수음악을 다루는 수업입니다
어렸을때 피아노같은 악기를 배워본 경험이 있다면 수업 내용을 무리없이 따라갈 수 있을거같습니다
교수님이 위트있으면서도 음악에 대한 곤조가 있으셔서 개인적으로 멋있었습니다 
음악에 관심있으시다면 들어볼만한 명강이라고 생각합니다"
음악의 원리,전상직,23,Fall,4.0,정말 음악의 원리에 대해 배우는 수업입니다... 교수님께서도 어느정도 기본이 되어있다는 전제하에 수업하시는 것 같고 휙휙 넘어가시는 부분도 좀 있습니다. 그래도 공부하다보면 재미있고 항상 수업도 30분 일찍 끝내주셔서 나름 만족스러웠던 강의입니다.
음악의 원리,전상직,22,Fall,3.0,군원격으로 평점 상관 없이 듣기엔 나쁘지 않아요
음악의 원리,전상직,22,Fall,5.0,"22-2 군원격 강좌로 수강했습니다.
기말기험은 1번 보고 로드는 레포트 1번이 전부였습니다. 레포트는 자신이 직접 고전음악 중 하나를 골라 그에 대한 분석을 하는 것이었습니다. 기말시험은 기출문제와는 달리 수업 때 배운 매우 기초적인 내용이 나와 좋은 성적을 받을 수 있었습니다. 시험이 앞으로도 이렇게 출제될지는 모르겠지만 군원격 강좌라 그런지 성적은 후하게 주는 것 같았습니다."
음악의 원리,전상직,23,Spring,5.0,"말 그대로 음악의 원리에 대해 배울 수 있습니다. 소리(음파)의 성질부터 시작해서 음색, 리듬, 화성, 구성 등등을 거쳐 악곡의 구조까지입니다. 서양음악에만 해당되는 건 아니라고 하시긴 했지만 대체로 서양음악 내용입니다. 저는 음대생은 아니지만 이쪽 지식이 있었는데 알고 있던 내용을 되돌아보기도 하고 새로운 내용을 심도 있게 배우기도 한 느낌이라 수업도 재밌게 들을 수 있었고 만족스러웠습니다. 수업할 때 교수님께서 설명을 위해 약간의 청음 능력이나 악보 읽는 능력을 필요로 하는 경우가 있기 때문에 음감이 없거나 악보를 잘 못 보시는 분들에겐 어려울 수 있습니다. 음악도서관에서 교재 빌려 보면 수업 시간에 사용하신 예시 음악과 악보도 다 나와 있어서 참고하시면 좋을 것 같습니다. 화성 파트 어렵다는 평이 많은데 수업 중에 들어주시는 세세한 예시는 외울 필요 없고(그렇게 자세하게 하시지도 않으심) 교재 읽어보시면 쉽게 이해할 수 있습니다. 

시험은 기말 한 번이고 교재랑 에타 족보 한 개정도 참고하면 무난하게 풀 수 있습니다. 과제는 악곡 하나를 배운 내용 적용해서 분석하는 보고서인데, 중간고사 대신 이 보고서를 두 번 중간제출합니다. 저는 베토벤 현악 사중주 하나 골라서 24쪽 정도 분석하고 결석 한 번 했는데도 A+ 받았습니다. 클래식 음악의 사회적 철학적 역사적 면 등등 외적 측면보다 음악 내적 측면, 그러니까 음악 그 자체를 이루는 것들과 그 구성 원리에 관심이 있으신 분들에겐 꼭 추천하고 싶은 교양입니다."
음악의 원리,전상직,23,Spring,5.0,국내 최고 수준의 비전공자를 위한 음악 강의입니다.
음악의 원리,전상직,22,Fall,4.0,대학에 와서 들은 교양수업 중 가장 기다려지고 흥미있게 들은 수업이었습니다! 저는 시험을 준비하며 책을 구매했는데 미리 구매해두어 수업 듣다가 이해가 잘 되지 않는 부분이 있을 때 참고하면 좋을 것 같습니다:) 책에 상당히 친절하게 설명이 되어있더라구요
음악의 원리,전상직,22,Fall,4.0,"22-2 군원격

이번 학기 시험은 들려주는 문제 없이 썰푸는 문제 위주로 나왔음. 완전 노베이스라 걱정했는데 수업때 교수님이 강조하시는 내용 잘 녹여서 쓰니 a+ 나옴."
음악의 원리,전상직,22,Spring,5.0,"22년 1학기 군 원격강좌로 들었습니다.
원래 클래식 듣지도 않는 음알못이었는데
군대에서 교양 수업 하나 듣고
제 삶이 이렇게 바뀔 줄은 몰았습니다.
음악의 다양한 구성요소와 원리 등을 통해서
궁극적으로는 ""음악을 어떻게 듣는가?""
에 대해서 통찰하고 있는 수업입니다.

수업 초반에 교수님께서 이 교양강의를 통해
여러분이 향유할 수 있는 문화가 하나 더 늘었으면 좋겠다고 하셨는데
정말로 그렇습니다
이제는 음악회 다니면서 즐길 줄도 알고
각 연주자들의 차이점도 느낄 수 있고
단순히 음악을 hear 하는 게 아닌 listen 할 수 있게 되었습니다
군 원격강좌 4개 중에 고민이라면 무조건 이거 추천합니다"
음악의 원리,전상직,21,Spring,5.0,"클래식을 원래 좋아해서 정말 재밌게 들을 수 있었습니다.
몰랐더 음악 원리에 대해서 자세히 알게돼서
의미 있는 시간이었네요.

생각보다 처음에 내용이 낯설긴 했습니다."
음악의 원리,전상직,22,Fall,5.0,"22년 2학기 군원격강좌 수강생입니다.

교양수업이라는 이름이 잘 어울리는 강의입니다.

클래식에 관심이 있는 사람이라면 들었을 때 얻어갈게 참 많은 강의입니다. 교수님의 음악에 대한 시각도 공감이 많이 됐고, 학생들을 가르치시는 마인드가 참 건전하신 분이십니다. 위트도 있으시고요.

난이도는 너무 쉬워서 얻어가는게 없지도 않고, 너무 어려워서 듣는 것 자체가 힘든 수준도 아닌 정도입니다. 개인적으로는 재미있게 들어서 여러번 돌려보면서 공부해서 그런지 어느정도 이해가 잘 됐고요.

시험은 대면 기말고사 1번, 레포트 1개가 있는데 기말고사 참석이 불가능하면 대신 레포트 1개를 더 쓰는거로 대체 가능합니다. 레포트는 부대 안에선 쓸 환경이 안돼서 휴가나가서 썼는데 개인적으로 욕심 좀 부리긴 해서 그런지 사흘 정도 꼬박 썼고, 기말고사는 수업을 성의껏 듣기만 해도 맞출 수준으로 나왔습니다."
음악의 원리,전상직,22,Fall,5.0,"대면 강좌로 수강함(군원격 X)
강의 내용은 처음 마주했을 때는 막막한 느낌이 듭니다. 그렇지만 시험에는 세세하고 어려운 내용보다는 교수님께서 수업에서 강조하신 내용(약간 추상적인 내용)이 많이 나오니 겁먹지 않으셔도 됩니다.
또한 에타와 스랖에 기출이 있는데 겹치는 문제가 많이 있으니 도움이 될 것입니다.

과제는 베토벤 교향곡 9번을 주제로 작성했는데 4악장을 중심으로 분석을 했고, 나머지 악장은 다른 악장과의 관계에 집중하여 나머지는 단순 소개를 했습니다.
과제는 한 번에 몰아서 하려면 막막하니 미리 곡을 정하고 조교님 피드백을 받으면 수월할 것입니다.

수업 때 많이 졸았고 시험도 그렇게 잘 보진 않았다고 생각했는데 A0를 받았습니다. 기출 문제랑 교재, PPT를 잘 보면 성적은 어느 정도 나오는 듯합니다.
그렇지만 PPT랑 교재에 자세히 설명하지 않는 부분이 있어서 교수님 설명을 집중해서 듣는 것이 좋을 듯합니다.

수업의 유일한 단점은 수업 시간에 교수님 목소리가 잘 안 들린다는 점이랑 PPT가 너무 막연하게 나와있다는 점입니다. 그렇지만 집중해서 들으면 큰 문제는 없을 것 같습니다.

참고로 출석은 지정좌석제이고 조교님께서 수업 시작 전에 한 번 수업 끝날 때 한 번 사진을 찍어서 확인합니다."
음악의 원리,전상직,22,Fall,5.0,"평가에 앞서 저는 군원격 강좌가 아니라 실강좌로 들었습니다.
일단 어려운 수업입니다. 화성 관련해서 잘 모르시면 교양이 아니라 전공 수업 하나 더 듣는다는 느낌으로 임하셔야 합니다. 클래식 음악에 정말 흥미가 있으신 거 아니면 힘드실 거예요. 하지만 관심이 있으시다면 노베이스도 충분히 노력해서 따라갈 수 있습니다. (제가 그랬으니까요)
그리고 수업 시간에 배우는 내용과 책 내용이 거의 비슷하기 때문에 (ppt 내용을 풀어쓴 게 책 내용) 수업 열심히 들으실 거면 책을 살 필요는 굳이 없는 것 같습니다. 반대로 수업 1도 안 듣고 책만으로도 공부할 수는 있겠지만 생각보다 쉽게 읽히는 책이 아니기 때문에 저는 비추합니다...
그리고 과제 관련해서 절대로!! 교향곡 전 악장을 완전히 분석할 필요 없습니다. 수업 시간에 교수님이 악보에 한 부분을 떼와서 막 형광색으로 칠하시고 화살표 그어가고 숫자 1234 적으시면서 악보 분석하시는데, 저희도 선택한 곡에서 일부분을 떼오고 교수님이 하신 거 비슷하게 흉내 내려고 하면 됩니다. 제가 선택한 곡은 악보가 105페이지나 되는데 저는 그중에서 7페이지 정도만 분석한 것 같네요. 그래도 쓰는 데 시간 꽤 많이 걸렸습니다... 하지만 보고서 쓰면서 자동으로 시험공부가 되기 때문에 이건 좋았어요.
시험은 스랖이나 에타에 있는 족보보다 훨씬 쉽게 나왔습니다. 특이하게도 이번 시험에서 지엽적인 문제는 주로 첫 번째 ppt에서 대부분 나왔던 것 같네요. 어쨌든 수업 재밌게 듣기만 하면 풀 수 있는 문제가 60%, 적당히 암기하면 풀 수 있는 문제가 30%, 진짜 지엽적인 문제 10% 요런 느낌으로 나왔습니다.
저는 보고서 10페이지 정도 쓰고 시험은 지엽적인 문제 한두 개 제대로 못 적은 거 빼고는 다 맞춘 것 같아요. 보고서나 시험 점수를 알려주지 않으셔서 정확한 점수가 어떻게 되는지는 모르겠네요. 결론적으로 A+ 받았습니다. 들었던 음악 관련 교양 중에서 가장 유익했던 수업이었어요!"
음악의 원리,전상직,22,Fall,5.0,돌이켜 봤을때 내용이 아래에서 얘기하는것처럼 그렇게 어렵지 않았던것 같아요. 어렵다는 이야기가 많아서 이번학기는 수업내용이랑 시험을 엄청 쉽게 조정하신것 같습니다 (특히 이번학기 시험은 족보문제들보다 훨씬쉽게나왔음) 다만 악보읽기나 온음반음같은 배경지식이 꼭필요한건 맞습니다 .
음악의 원리,전상직,22,Fall,4.0,"이 강의를 들으면 음악에 대한 이해의 폭이 넓어질 수 있다. 순정음, 자연음 이야기를 듣고 오케스트라의 고유한 아름다운 음 조합을 알게된 점이 좋았고, 다른 내용은 규칙과 일탈이 음악의 본질이다..가 전부인 듯하다. 
학점은 군원격 강의라 약간 퍼주지 않을까 생각했는데 아닌 듯하다. 과제 시험 웬만큼 했는데 에이마. 사실 총 평점 안들어가서 노상관이긴하니 듣는게 이득인듯."
음악의 원리,전상직,22,Fall,5.0,"성적이 아직 안 나왔지만 별개로 재밌게 들어서 5점 남기고 갑니다. 교수님도 좋았지만, 조교님께서 지도를 잘해주셔서 강의를 잘 들을 수 있었어요. 음원리 수업에서 가장 고민거리가 되는 건 이걸 과연 내가 할 수 있을까? 같은데, 솔직히 음악에 대한 배경지식이 부족하면 일부 부분이 과하게 어렵게 느껴질 수 있습니다. 저의 경우 기본적인 화성학 조금 (음대생은 아닙니다)와 악기 연주 경험이 있었어서 딱 괜찮은 난이도로 느껴졌어요. 본인이 악보를 모른다면 다시 생각해보시는 편이 좋을 것 같습니다."
음악의 원리,전상직,22,Fall,1.0,걍 진짜 좀 투머치하게 어렵다. 밑에 분들은 많이 똑똑하신거 같다…
음악의 원리,전상직,22,Spring,4.0,"22-1 군원격 강좌로 들었습니다. 클래식에 관심이 많으시면 들어볼 만한 강좌이고, 군 원격 강좌중에 로드도 적은 편입니다. 시험은 기말고사만 대면에, 불참자는 대체과제을 내는 형식이었습니다."
음악의 원리,전상직,21,Spring,4.0,"군 원격강좌로 수강했습니다. 음악, 특히 클래식에 대한 관심이 전혀 없으신 분들에게는 상당히 버거운 강의일 것 같습니다. 수업이 조금 어려운 편입니다. 하지만 클래식을 좋아하고 조금 더 깊이 있게 배워보고 싶으신 분들에게는 좋은 강의인 것 같습니다.
클래식을 즐겨 듣고, 시간이 많으신 분들에게 추천합니다."
음악의 원리,전상직,22,Spring,4.0,"군 원격으로 수강했습니다. 몇 년 전에 촬영한 영상을 계속 우려먹는 것이 조금 불편하긴 했지만, 그것과 별개로 수업의 내용과 질은 좋았습니다. 저는 음대생이라 크게 어려운 부분은 없었지만, 비전공자 분들은 클래식에 관심 있고 음악 배경지식이 없다면 힘드실 수 있겠단 생각이 들었습니다. 그동안 음악을 하며 간과했던 부분이나 잘 생각해보지 않았던 부분에서의 지식을 얻어갈 수 있어서 좋았네요. 음악 전공생들에게도 추천하는 교양 수업입니다."
음악의 원리,전상직,22,Spring,5.0,문외한인 저에게 수업 내용은 전혀 쉽지 않았습니다. 다만 수업도 매우 재밌고 얻어가는 것도 많으니 음악을 좋아하신다면 추천합니다.
음악의 원리,전상직,22,Spring,4.0,존나 어렵습니다. 하지만 그만큼 남는 게 많습니다.
음악의 원리,전상직,22,Spring,5.0,"군원격으로 들었습니다.
신경쓸 게 시험 한 번 레포트 한 번뿐이라 부담은 없는데 좀 어려워서 관심이 없다면 듣기 힘들어요.. 그래도 학점은 잘 주시는 듯 a0 받고 갑니다"
음악의 원리,전상직,22,Spring,5.0,군 원격강좌로 들었습니다. 강의는 어렵습니다. 그래도 여러번 보면서 이해할 난이도는 아닙니다. 음악에 관심이 있어 계이름 정도만 안다면  이해가 그리 어렵지도 않습니다. 무엇보다도 다른 학점용의 물강의들 보다 무언가 남는 강의라고 생각되기에 강추합니다. 특히 원격강좌로는 시간이 남아나는 군대 특성상 심심하지 않게 5개월을 녹일 수 있어 최고의 강의입니다.
음악의 원리,전상직,22,Spring,5.0,"소문대로 수업이 쉽지만은 않았습니다. 그럼에도 정말 재미있게 들었습니다. 근데 기본적으로 클래식 음악에 대한 흥미가 좀 있어야 포기하지 않고 재미 붙여 공부할 수 있을 것 같습니다. 
교수님께서 쓰신 교재만 잘 보고 수업 잘 듣는다면 시험은 문제 없을 것 같습니다. 저는 교재비 아끼려고 피피티만 보려고 했지만 결국 시험 앞두고 샀습니다. 그냥 개강 직후 바로 사시길 추천해요. 여러모로 좀 더 일찍 사지 않은 게 후회되는데, 일단 교수님의 목소리가 잘 안 들릴 때가 있었고, 들어도 이해 안 되는 내용이 나올 때가 있었는데, 그럴 때 교재 읽으면 이해가 정말 잘 됩니다. 그리고 교재가 정말 이해하기 쉽게 쓰여졌습니다. 쉽지 않은 내용임에도 술술 읽혀서 시험공부에 도움이 많이 되었습니다. 아무튼 정말 교양이 쌓이는 게 느껴지는 명강입니다."
음악의 원리,전상직,21,Fall,5.0,"군원격강좌로 수강했습니다. 
주마다 끝마쳐야하는 영상이 있지만 미리 들을수도 있고 따로 주마다의 과제는 없습니다. 배경지식이 없어서 시험은 조금 어려웠고 과제는 최대한으로 작성해서 a0 받았습니다."
음악의 원리,전상직,21,Fall,5.0,"A0

교양다운 수업이긴 한데 스누온 배속으로 듣고 교과서 보면 시험은 날로 먹을 수 있음ㅋㅋ"
음악의 원리,전상직,21,Fall,4.0,"군원격강좌로 수강했습니다. 일단 내용은 엄청 어렵습니다. 제가 비전공자라 그런줄 알았는데 주위 음악전공자들에게도 꽤나 난도 있는 내용이라 합니다. 음악에 대해 아예 노베이스면 듣기 어려울거 같고, 화성이나 계이름 등 음악의 기본기가 있다면 배워가는게 많은 강의일겁니다. 과제는 레포트 1번에 기말고사1번입니다. 군복무중 강의만 챙겨듣고 과제랑 시험 둘다 제대로 못챙겼는데 B+준걸보니 성적은 잘 주시는 듯 합니다. 가볍게 들을 강의는 아니니 참고하시면 될것 같습니다."
음악의 원리,전상직,21,Fall,5.0,"악보만 보고 (전조된) 조성이나 화성을 파악하는 감을 기르셔야하는 것 같습니다. 시험 문제를 풀거나 분석 레포트를 쓸 때 필요한 부분인 것 같습니다.
코로나 시대라서 비대면 객관식 문항으로 시험을 치뤘습니다. 다소 지엽적이라고 느껴졌던 문항들은 ""악기와 발성법이 올바르지 않게 짝지어진 것은?"" 이나 ""각 화성음 사이의 간격(cent)나 피타고라스 조율법에서 늑대 5도음은 몇 센트 간격인가?""정도가 기억에 남네요. 나머지는 주차별로 배웠던 굵직굵직한 내용들이 주를 이루었던 것 같습니다.
레포트는 베토벤 교향곡 하나를 잡고 30장 조금 안 되게 썼습니다. 악보 그림의 비율이 상당히 많아서 내용은 그리 길지 않았어요. 전 악장을 다 살펴보았지만, 주차별로 배우는 내용인 ""리듬"", ""화성"", ""선율 및 텍스처"", ""형식과 구조""를 큰 장으로 두고 해당하는 내용(e.x., 비화성음이 쓰이는 부분, 싱코페이션으로 리듬적 일탈을 이끌어내는 부분)의 악보를 잘라서 넣고 분석하는 방식으로 썼어요.
시험과 레포트 모두 개별 점수는 알려주지 않았지만 A+ 학점을 받았습니다. 비전공자로서 많이 어려웠고 그만큼 시간 투자도 많이했지만.. 덕분에 평생 남을 교양 지식을 익힌 것 같고 학점도 잘 나와서 너무 좋았습니다.
다만 녹강은 조금 오래된 것 같고 학생들이 질문에 대답하는 소리가 잘 안 들려서.. 추후 개선이 되면 좋겠습니다."
음악의 원리,전상직,21,Fall,5.0,음악 이론을 교양 수준에서 깊이 있게 배우고 싶다면 적극 추천합니다. 어렵긴 해요 ㅠㅠ
음악의 원리,전상직,21,Fall,5.0,"이게 교양이다 희망편

시험도 어렵고 레포트 작성도 노베 입장에서 난해하지만, 강의의 본질적 목표엔 완벽히 부합해서 만족스러웠습니다. 

다만, 저 같이 계이름과 음이름의 차이도 모르던 사람이 듣기에는 상당히 어려울 수 있습니다. 

이론 이해하는 것까진 어느 정도 가능하나 악보에 적용하는 것은 또 다른 문제라..."
