미술명작의 이해,이은주,20,Fall,5.0,밑에서 교재 꼭 필요하다는데 난 교재가 뭐였는지도 모름.. 그냥 출석만 체크하고 방치뒀다가 시험 삼사일전에 다시 들으면서 필기했음. 근데 시험 비대면 아니었으면 개망했을듯..? 비대면오픈북이라서 타임어택은 어쩔수없음. 필기한 내용 거의 그대로 붙여넣는데도 아슬아슬하게 40초 남기고 겨우 제출함. 중간고사 대체로 전시회 감상문 제출해야했는데 분량도 적고 온라인전시보고 대강 써내면 돼서 편했음. 고생 안하고 에이쁠 받아가서 좋았던 수업.. 교수님도 귀여우심
미술명작의 이해,이은주,20,Fall,5.0,"미술에 관심 있고 서양 역사에 대해 전반적으로 알고 있으면 그렇게 어렵지 않습니다. 다만 주술구조가 잘 안맞는 말씀을 종종 하셔서 속기를 하다보면 화나는 순간이 올수도 있습니다. 기말고사가 전범위라 정말 힘들었는데, 시간도 부족해서 두장 정도 쓰고 과제 전부 제출하고 올출석하니 에이쁠받았습니다. 학기 내내 부담없이 들을 수 있지만 시험기간이 좀 빡세긴 합니다."
미술명작의 이해,이은주,20,Fall,3.0,"그냥 미술사에 대한 강의인데, 그저 대본을 읽는 느낌이 강해서 귀에 쏙쏙 들어오는 느낌은 아님. 처음에 손으로 필기했다가 중간부터 한글파일로 속기했는데 기말고사가 완전 타임어택이라 손필기했으면 진짜 힘들었을듯. 결석 한번 지각 한번인데 에마 받아서 나름 만족.."
미술명작의 이해,이은주,20,Fall,4.0,저는 수업 자체가 흥미롭고 재미있어서 딱히 공부한다는 생각이 안 들었어요(그냥 미술관 가서 이야기 듣는 느낌) 외우면서 공부한 것도 아닌데 1회독 하고 에이쁠 받았습니다.(수업 시간에 열심히 들었습니다) 다만 교재가 없어서 모든 걸 다 받아적어야 하는데 팔이 빠질 거 같습니다. 원래 강의 시간의 1.5배의 시간이 필요했던 거 같아요. 그래도 재밌게 들었던 강의라 후회는 없어용 성적도 잘 받았고!
미술명작의 이해,이은주,20,Fall,4.0,"각 미술사조를 기준으로 간략하게 역사적 맥락과 개념을 설명하시고, 그와 관련된 작품들을 다양하게 보여주며 수업하십니다.
교재가 무조건 필요합니다. 전 딱히 교수님께서 말씀 안하셔서 필요 없는 거 같아서 그냥 필사로 했다가....죽을 뻔 했어요. 하루를 이 수업 한 주차 정리로 날릴 정도....
양이 엄청나게 많구요. 이번 학기는 기말도 비대면으로 시행하였는데 고대부터 미래주의까지 였습니다....진짜 머리가 남아 돌지 않았습니다...꾸준히 공부하셔야 해요
과제는 처음 왜 미술에 관심이 생겼는지 한 반페이지 적으시면 되고, 이번엔 중간고사를 레포트와 합쳐서 진행하셔서, 전시회 보고 레포트 한 3~4장 또는 그 이상으로 적으면 되었습니다.
시험은 타임어택입니다. 진짜.
전 성적이 A0 나오긴 했는데 평가 기준은
잘 모르겠지만... A이상은 많이 주시는 거 같긴 해요. (근데 이번에는 주변에서 B도 많이 받았다고...)
수업은 녹강으로 진행하셨습니다."
미술명작의 이해,이은주,20,Fall,5.0,"교수님 말투랑 추임새가 귀여우셔서 수업 즐겁게 들었음!
로드는 온라인 전시 관련 보고서 4장+기말고사가 전부
코로나때매 중간 못봐서 기말 분량이 좀 많았고 피피티 안올려주셔서 벼락치기는 좀 무리였음
속기 미리 하고 시대별로 작품이랑 성격 요약해서 정리해두면 시험 답안 작성하기는 수월할듯
보고서랑 시험 둘다 그렇게 시간 투자 안하고 뚝딱뚝딱 으악 모르겠다~ 이렇게 했는데 에이쁠 나와서 기쁨의 눈물을 흘림 개꿀강인듯"
미술명작의 이해,이은주,20,Fall,4.0,내용 재밌으나 강의력은..... 하.... 교수님 얼굴이 나오지 않는 동영상 강의였지만 그대로 대본만 줄줄 읽으시는 느낌을 강하게 받았습니다. 과제 한 번이라 부담은 없었지만 시험 채점기준을 잘 모르겠습니다. 원래 미술을 좋아해서 즐거운 마음으로 듣긴했고 올출석에 에제 받았으나 성적 기준은 정말 모르겠네요..
미술명작의 이해,이은주,20,Fall,5.0,"정석적인 교양 강의! 미술에 대한 지식 전혀 없이도 차근차근 시대순으로 쌓아가는 강의라서 흥미롭게 들었어요 원래 대면 시험 2번 예정돼있었는데 중간은 대체과제로 변경, 기말은 비대면 오픈북으로 변경됐습니다 전체 녹강이라서 듣기는 편하지만 교수님과 소통이 좀 어렵다는 단점은 있었네요 기말 진짜 망쳤다고 생각했는데 생각보다 학점을 잘 주셔서 만족했습니당 수업들으실 때 미리미리 속기록 만들어놓으시길 추천..ㅠㅠ몰아서 공부하려면 양이 너무많아요"
미술명작의 이해,이은주,20,Fall,5.0,내용이 흥미롭고 과제 부담도 별로 없어서 재밌게 들었습니다! 다만 시험에 대한 공지가 조금 부족하다고 느껴졌습니다. 성적은 괜찮게 주시는 거 같습니다.
미술명작의 이해,이은주,20,Fall,3.0,"출석 감점 개커... 과제랑 시험 잘했는데도
출석 때문에 감점ㅠㅠ 하 슬프다
수업 자체 부담은 없지만 시험 좀 어려울 수 있음!"
미술명작의 이해,이은주,20,Fall,5.0,"출석다하고 과제 마감시간 지켜서 적당히 잘하고 오픈북시험도 핵심문장 지켜서 3-4페이지 적었더니 에플받았어요
몰아서 공부하면 시험기간에 매우 힘들수가 있습니다!"
미술명작의 이해,이은주,20,Spring,5.0,비대면이라 그런지 몰라도 학점 굉장히 잘 주셨습니다. 내용은 미술 사조에 해당 작품을 대입하여 보는 형식. 다만 내용이 굉장히 많았고 기말 한방이라 외우느라 힘들었음
미술명작의 이해,이은주,20,Spring,5.0,"코로나로 기말만 한번 봐서 시험범위 줄여주셔서 너무 감사했습니다..
미술교양을 좋아해서 다양한 강의를 많이 들었는데 다른 강의보다 미술 사조나 배경에 대한 이야기를 꽤 자세히 해주셔서 재밌게 들었습니다!! 
시험도 그다지 어렵지않았고 성적도 잘주시는듯해요"
미술명작의 이해,이은주,20,Spring,5.0,"여름계절학기로 일주일 3번 수업 들었습니다. 진짜 너무너무 추천하는 수업이에요! 일단 과제 부담 0에 수렴하는 꿀강이고요. 과제도 그냥 적당히 분량 채우면 점수 후하게 주시는 거 같아요. 그리고 저는 워낙에 예술이랑 미술 분야에 관심이 많았어서 수업도 너무 흥미롭게 잘 들었습니다. 교수님께서 전달력이 좋은건 아니지만 그림보면서 수업하는게 저는 너무 재미있었어요. 녹강이라서 밀리면 힘든건 있지만 어쨌든 저는 다 속기하면서 들을 정도로 흥미있게 들었어요. 외울거 많다고 하시는 분들도 있는데, 수업 열심히만 들으면 반은 이미 머리에 있어요 ㅎㅎ.. 그냥 이야기 듣는 것처럼 부담 없이 들을 수 있는 수업 같아요. 저는 그렇게 암기량이 많다고 느끼지는 않았습니다. 심지어 범위도 제한해주셔서 너무 좋았어요. 너무너무 추천하는 수업입니당!!"
미술명작의 이해,이은주,20,Spring,4.0,"여름학기 수강
로드가 엄청 없습니다...분량과 관계없이 글을 이렇게 부담없이 써본적이 없어요
시험도 적당히 바짝 하면 거의 다 쓸 수 있게 나옵니다"
미술명작의 이해,이은주,20,Fall,5.0,(여름계절수강) 와 올출석에 시험 좀 망하고 과제 하나 열심히 했더니 에제ㅜㅜㅜㅜ사랑해요 진짜 녹강 올려주시는데 교수님 목소리도 너무 발랄하고 기분 좋아지는 수업이고 내용도 정말 계절에 배우기 딱 좋은 미술 교양 느낌!! 꼭 들으세요😍
미술명작의 이해,이은주,20,Fall,4.0,"미술에 관심있으신 분이라면 얼마든지 내용은 흥미로우실겁니다!! 굵직굵직하게 중요한 예술작품들과 사조들을 배울수 있어서 제가 들었던 교양중에 가장 교양이라고 할만한 강좌였습니다ㅎ
다만 수업전달력이 뛰어나진 않으세요ㅠ 그래도 매 수업마다 좋은수엄하려고 노력하시는게 느껴지는 교수님이셨습니다! 
시험기간에 암기할게 많아서 조금 힘들긴 하지만 그래도 편의봐주세려고 시험에 나올 작품들 다 짚어주셨습니다! (그래도 암기양은 많습니당..ㅠ)"
미술명작의 이해,이은주,20,Spring,5.0,"No load,  Yes  'A'
이번 학기 수업 중 꿀보다 더 달았던 수업.
고등학교 때 미술을 못 들어봐서 그냥 신청해봤는데 수업 내용이 딱 교양 수준이라 좋았다. 근데 녹강만 해서 집중이 안되는 것은 별로였다."
미술명작의 이해,이은주,20,Spring,5.0,시험  부담 적고 과제는 하나 있는데 퀄보단 양만 잘 채우면 점수 잘 주는 듯
미술명작의 이해,이은주,20,Spring,2.0,"시험은 중간은 대체 과제 기말은 대면 시험으로
중간 외에 로드는 거의 없었고, 기말은 쉬운 편이라
과목에 대한 부담은 적었습니다.
첫 사이버 강의라 시행착오가 있을 수는 있지만,
수업이 강의 피피티에 음성만 입힌 영상인데,
전달력이 좋으신 편은 아니라서 수업이 정말 따분했어요.
그리고 수업 방식이나 시험에 대해서 학생들과 논의가 전혀 없어서
많이 아쉬웠습니다."
미술명작의 이해,이은주,20,Spring,5.0,많은 내용을 배우는 만큼 알아가는 것도 많음.  교수님 설명만 잘 따라가면 됨.
미술명작의 이해,이은주,20,Spring,5.0,"강의 굉장히 열심히 듣고 복습도 열심히 했는데
공부한 것에 비해 시험이 쉬워서 허탈했습니댱,,,
과제도 부담 없고 수업 자체도 부담스럽지 않아 좋습니다!!
교수님도 정말 친절하세요ㅠㅠㅠ
이번 학기 성적 정말 잘 주셨습니당!"
미술명작의 이해,이은주,20,Spring,5.0,"교수님 죄송합니다..
첫 강의만 듣고 나머지는 틀기만 하고 안 들었어요
시험도 타노스식 공부법으로 10개 주제 중
5개만 전날에 급하게 외웠습니다
A+ 감사합니다
데헷 >ㅁ<"
미술명작의 이해,이은주,19,Fall,5.0,"미술에 대해 아예 모르는 상황이었는데도 쉽고 재밌게 배웠습니다 수강생들이 다들 잘해서 학점 받기 수월하지 않았을 수도 있지만, 시험 자체의 난이도도 그리 높지는 않습니다"
미술명작의 이해,이은주,19,Fall,5.0,"시험 때 외우라는 거만 잘 외우고 가면 무난하게 성적 잘 받습니다!! 평점이 너무 낮아서 조금 슬프지만,,,, 교수님 되게 웃음이 많으시고, 질문 하면 친절하게 답변해주십니다!! 과제는 미술전 가서 수업 때 배운 내용이랑 엮어서 쓰면 됩니다!! 시험이 버겁게 느껴질 수도 있지만 암기+서술형 수업 때 한 거 미술사조랑 연관시켜서 잘 쓰면 점수 잘 주십니다!!"
미술명작의 이해,이은주,19,Fall,2.0,"미술사에서 중요한 작품들을 꼼꼼하게 분석하고 작품들을 보는 눈을 키우는 수업이라기보다는 미술사조별로 나타나는 특징에 작품들을 대응시키는 수업입니다. 그래서 작품을 깊이 있게 감상하는 수업을 원하시는  분들보다는 전체 미술사 흐름을 간략하게 알고 싶은 분들한테 추천합니다. 전반적으로 상식을 배우는 느낌이었어요.
중간기말 시험 두번이고 과제 중간에 한번 있는데 가볍습니다.
시험은 어렵지 않아요."
미술명작의 이해,허수정,19,Spring,2.0,내가 수업에서 얻으려고 했던 교양을 채워준수업이다. 들어보면 재밌고 흥미로운 얘기들이 많았다. 미술관 다니면 대충 주요 요소들이 눈에 보인다. 수업으로 얻은것이 많다. 하지만 3시간을 버티기 힘들긴하다. 가끔 노트북으로 딴짓하면서 버텼다. 학점은 하는 만큼 주시는듯.에제받음
미술명작의 이해,손영옥,18,Fall,3.0,...  에제 받긴했지만 시험기간에 죽는 줄 알았습니다....  드랍자 진찐 많아서 에쁠 기대했는데....ㅜ 학점을 후하게  주시는 편은 아닌 것 같네요. 뭐 그래도 그 시험범위 다 공부하면 양이 많은만큼 전체적인 미술사는 외워집니다. 그치만 다른 교수님거 듣길 추천해요.
미술명작의 이해,손영옥,18,Fall,1.0,절대 듣지 마십시오. 드랍자 미포함하는 건 거의 확실하고 시험 범위도 더럽게 많습니다. 미술교양 이번학기에 두개 들었는데 어쩜 두개 다 쓰레기같은 것만 골랐을까..덕분에 학점은 바닥 찍었습니다^-^
미술명작의 이해,손영옥,18,Fall,1.0,"에타에 미명이만 검색해봐도 시험범위 한탄하는 글이 주르륵 나옴. 정말 미술을 공부하고 싶어 미치겠다 이런 거 아니면 듣지 마세요. 정 듣고 싶으면 차라리 다른 교수님이라도 찾아보세요. 한 주마다 PPT가 최소 80페이지에서 130페이지까지도 가는데, 이렇다보니 당연히 시험범위는 극악이고 수업시간에 교수님은 랩을 함. 잠깐 정신 놓으면 어디 가있는지 모르고, 수업 때는 그냥 훅훅 넘어가는 부분들도 많은데 시험범위에는 전부 들어감. (500페이지짜리 참고도서도 시험범위) 과제는 조별발표 하나와 전시회 감상문 하나가 있는데, 감상문은 거의 제출만 하면 되는 거 같고 조별과제는 꽤 비중 있는 듯함. 로드는 적지만 그 장점을 전부 상쇄시키는 게 시험범위임. 다른 미술사 강의도 많으니까 그거 들으세요..."
