우리 몸의 이해,김성준,20,Fall,5.0,"엔젤이자 갓
졸업학기에 이과 시수 채워야 해서 들었는데 그저 갓 빛"
우리 몸의 이해,김성준,20,Fall,5.0,교수님 너무 좋으시고 수업도 잘 가르쳐주세요 영상 퀄리티도 매우 좋습니당
우리 몸의 이해,김성준,19,Fall,4.0,"전출+에세이 5개=A
발표하고 싶으면 해도 될듯. 그렇게 깊은 내용을 요구하시진 않음
적극적인 참여태도를 좋아하심.

수업은 특강오신 교수님마다 다른데 건강 프로그램 보듯이 실용적인 내용 위주로 가볍고 재밌게 들을 수 있는 것도 꽤 있었지만 그래도 기본적으로 생리학 내용이 좀 있음.
근데 이런걸 깊이 배우는건 아닌고 걍 범위가 넓다보니 언급만 해도 시간이 다 가버려서 좀더 다양한 내용을 들을 수 있으면 좋겠다 싶었음

어짜피 시험 안 보니 부담 갖지 않고 인체에 대한 내용을 공부해보고 싶다하면 큰 걱정이나 부담없이 들을 수 있는 강의라 생각"
우리 몸의 이해,김성준,19,Fall,5.0,그냥 개꿀강의 입니다!!! 출석만 잘하시구 발표 하고 레포트 5개만 쓰면 무조건 A!!
우리 몸의 이해,김상정,23,Spring,4.0,주차마다 다른 교수님께서 오셔서 수업해주셨어요. 문과지만 나름 두근두근하면서 들으러 갔는데 막 생각만큼 흥미진진~하진 않았고 강의마더 조금씩 달랐어요. 그리고 교수님들끼리 각 수업이 어디어디 진행되었고 시험은 어떻게 내시는지 잘 모르셔서 애매하게 흘러가는 부분도 많았습니다. 그래도 기본적인 지식 많이 배워갑니다! 조교님이 엄청 카리스마.. 아 그리고 조별과제 뭐 나쁘지 않았어요
우리 몸의 이해,김상정,23,Spring,4.0,"내용은 생각보다 쉽습니다.
조별과제와 독서과제가 있어 과제가 많은편이긴 하나 부담은 적습니다.
성적이 너그러운 편은 아닌 듯 합니다."
우리 몸의 이해,김상정,22,Spring,4.0,"이과 교양을 치우기에 나쁘지 않습니다 수업을 기본 1시간 정도는 일찍 끝내주셨고 새로운 내용이 어렵기는 하나 사실상의 암기 시험이라 달달 외우면 됩니다. 다만, 어느 정도까지 외워야할지가 불분명한 측면이 있으며(복잡한 의학 명칭 등의 제외가 불분명해요) 시험지를 걷어가기에 족보도 없고 이전 학기와는 다른 주제인 경우에도 당연히 족보가 없습니다. 중간이 너무 쉬웠어서 거의 절반이 90점을 넘겼고 이에 기말 점수는 모르지만 에제 받았습니다. 전반적으로 서평 하나 있고 시험 난도 측면의 문제 때문에 4점 드립니당"
우리 몸의 이해,김상정,22,Spring,4.0,다 객관식이라 공부하긴 편합니다! 강의만 잘 들어도 시험 잘 볼 수 있어요
우리 몸의 이해,김상정,21,Spring,5.0,개꿀강 이틀공부 에쁠 과학교양 픽 빡센거 피해 했는데 이게웬떡?
우리 몸의 이해,김상정,21,Spring,4.0,"그냥 무난무난하게 들을만 함!
교수님들이랑 조교님 모두 착하세요"
우리 몸의 이해,김상정,21,Spring,5.0,악평 많아서 고민했는데 듣길 정말 잘했네요. 문과인데 이해하는데 지장도 없었고 교수님들도 열정적으로 수업해 주시고 내용도 흥미로웠습니다. 성적 잘뜨긴 했는데 시험 너무 쉬워서 변별이 잘 됐을지는 모르겠네요..
우리 몸의 이해,김상정,20,Spring,4.0,"무우우우우난한 강의
문과도 상관없다 그냥 북개처럼 외우고 시험보면 끝
출석만 잘 챙기시길"
우리 몸의 이해,김상정,19,Spring,2.0,외울 게 너무 너무 많아요... 인체의 작동 원리를 가르쳐주실 줄 알았는데 그냥 외울 걸 던져주시는 느낌이었어요. 팀플 실험도 무슨 의미인지 잘 모르겠어요.
우리 몸의 이해,김상정,19,Spring,3.0,"시험 문제가 쉬워서 실수 한번 하면 학점 나락,,
생각보다 빡센 수업"
우리 몸의 이해,김상정,19,Spring,4.0,"학점도 떴겠다, 강의평 하나 남겨봅니다.

일단 이 강의는 1학기 내용이랑 2학기 내용이 다릅니다. 이번학기는 신경계 위주였고 (배설계와 순환계를 아주 살짝 다룹니다) 담학기는 .. 뭐 한다 했는데 까먹었네요 ㅎㅎ

80명 수업에 문과분들이 5,60명 되셨던것 같습니다. 전 이과고 생물학 수업을 1학년때 들었기에 꿀빨수 있을줄 알았는데 오만과 편견이었습니다. 중간고사 시험이 객관식 26개였는데, 그렇게 쉬운 난이도가 아니었음에도 만점 10명 1개 20명이었습니다. 절망.

그리고 로드도 빡셉니다. 매주 프린트로 수업나가는데, 수업양이 만만치 않고요, 의학강의다 보니 외워야할 것도 많습니다. 서평 하나 써야하고, 팀플로 실험하나 해서 보고서 쓰고 발표 해야하는데, 중고등학교 수준의 실험과 발표를 대학교에서 하자니 자괴감도 들었습니다.(개인적으로 팀플 없으면 좋겠네요)

결론적으로 로드 빡세고 공부량도 만만치 않지만, 사람의 몸의 작동원리와 현대의학의 최전선을 아주살짝 맛볼수 있는 유익한 강의라고 생각합니다. 수업도 전 재밌게 들었구요. 꿀빨러온다는 마음가짐보다는 이 분야에 흥미가 있으셔야 후회 안하실것 같네요. 학점은 일단 쁠몰은 아닙니다.

교수님, 많은 학생들이 이 강의를 듣길 원하시던데.. 이상한 팀플 없애고 학점 쁠몰하시면 80명은 물론, 120명도 채울수 있을겁니다."
우리 몸의 이해,김상정,18,Fall,3.0,"김전 교수님한테 들었는데 김전교수님 페이지로 들어가니 수강학기가 최근거 선택이 안돼서 어쩔수 없이 여기 적어요.
교수님이 말을 장황하게 하는 면이 있으셔서 듣다가 빡치는 게 한두번이 아니었으나 강의록이 엄청 잘되어있어서 저는 필기 꼼꼼히 안하거나 제대로 못들은 부분 강의록으로 공부했어요. 시험문제는 쉽게 나오는 편입니다. 강의록에 피피티 이상의 심화된 내용이 추가설명 되어있을때가 많았는데 그거는 공부 안하셔도 돼요. 교수님이 수업시간에 언급한거+피피티에 있는 내용에서만 시험에 나옵니다. (중간 때 괜히 꼼꼼히 공부했다가 시험문제보고 약간 현타옴) 서평2개는 귀찮긴하지만  하루에 한파트씩 천천히 읽고 요약해서 썼더니 할만 했어요. 그리고 저는조별과제가 좀 극혐이었습니다. 간단한 실험을 설계하라는데 말이 간단한 실험이지 문과분들은 되게 당황스러우실것이라 생각해요. 그리고 발표 때 보니까 다들 주제라던가 발표 엄청 훌륭하게 잘 해오시더라구요. 간단한 실험이라고 대충해선 안될것같습니다. 성적은 잘 주셨기 때문에 들은거에 후회는 없어용. 아 스누라이프에 중간기말족보 올라와있으니 참고해서 공부하심 좋을것같네요"
우리 몸의 이해,김상정,18,Spring,3.0,"책 두권 읽고 각각 중간 기말시험 보고 제출해요

중간 기말은 객관식시험으로 OMR카드 사용해서 채점합니다.

교양이라기엔 생물학에대해 깊히 들어갑니다.. 이과생인데도 당황했네요 분자수준의 기작까지 가르치셔서 근데 막상 시험에는 간단한거 물어봅니다.( 대장의 길이? 그런거 ㅋㅋㅋ)

소스 가지고 있으면 70% 비슷하게 나오네요. 연락주시면 드릴게요~

간단한 주제를 가지고 실험하는 조별과제 있습니다. 달달 외워가면 됩니다. 중간 5개 기말 3개? 정도 틀린거 같은데 에제 받았어요"
우리 몸의 이해,김상정,17,Fall,3.0,"음..일단 수업 내용이 꽤 어려워요 ㅜㅜ 문과분들 이과교양으로 선택하지 마세요...저는 이과이고 이런 류의 수업(참살이,인생개) 을 좋아해서 꾸역꾸역 들었는데 힘들었어요 ㅜㅜ 따로 강의록을 올려주셔서 공부하기는 편했어요!  의의로 시험은 엄청 어렵게 나오지는 않았는데 기말에 수업을 열심히 들어야만 풀 수 있는 문제가 나와서 당황했어요 ㅎ... 과제는 독서감상문 2번,조별과제 1번 있어용 조별과제는 간단하고 독서과제는 지정해준 생물학 책 2권 골라서 3페이지..? 정도 쓰는 거였어요. 별 거 아닌 거 같지만 은근히 귀찮아요 ㅜㅜ"
