미술명작의 이해,민경소,24,Spring,1.0,"강의내용을 산발적으로 뱉어내시는데, PPT가 너무 불친절하여 내용들을 다 흡수하고 이해하기가 너무나도 힘듭니다. 속기가 필수적이며 교수님의 강의력도 좋지 않아 전공수업보다도 듣기힘든 강의입니다. 학점으로 미화되지 않도록 지금 강의평을 남깁니다."
미술명작의 이해,민경소,23,Fall,2.0,"솔직히 그럭저럭한 강의였습니다. 예술에 대한 관심이 있는 학생으로서 미학 이론, 다양한 예술 작품의 학습을 통해 예술 작품을 보는 안목을 기를 수 있는 강의를 바랬는데, 솔직히 예술 작품에 대한 그저그런 설명만 이어지는 느낌이었습니다. 개인적으로는 이것 보단 다른 예술 교양을 듣는 것이 좋을 것 같습니다."
미술명작의 이해,민경소,23,Fall,5.0,"친절한 교수님!!! 
시험 전에 문제 유형이랑 중간/기말고사에 나오는 그림 추려서 알려주신 덕분에 공부하기 편했어요! 다양한 서양 명작에 대한 이해를 쌓을 수 있어서 뜻깊었던 수업이었습니다."
미술명작의 이해,민경소,23,Fall,5.0,"미술 관련 지식이 부족하다 여겨 배경지식을 넓히고자 수강했습니다. 관련 지식 전혀 없이(인상주의 초현실주의 등등 이름만 들어본) 수강했는데, 교수님 강의력이 좋으시고 설명을 잘해주셔서 많이 배워가는 수업이었습니다.
'명작'에 대한 수업으로, 작품을 중심으로 수업이 진행됩니다. 미술사적 배경, 관련 에피소드, 감상 방법 등을 설명해주십니다. 미술사에 대해 다루나, 역사보다는 작품에 초점이 맞춰져있다고 생각하시면 될 듯합니다. 중간고사 이후 범위는 전부 현대미술을 다룹니다. (저는 전시회를 더 의미있게 감상하고 아는척(?) 하고 싶어서 수강한 거라, 만족스러웠습니다!)

중간, 기말, 과제(보고서, 책 또는 영상물 감상 후 '내가 생각하는 명작이란 무엇인가?'에 대해)로 구성되었고, 사전에 유형과 예시문항을 자세히 제시해주십니다. 서술형 문항의 경우 미리 알려주시구요.
공부할 분량은 정말 많습니다.. 25~30시간 가까이 공부하고 시험봤네요. 수업 내용 꼼꼼히 필기하시고 복습 많이 하시면 시험이 어렵진 않습니다. 교수님께서 신경써서 출제하신 것이 느껴집니다. 
중간 32/35 과제 15/15 기말 32/35 로 A+ 받았습니다. 미술명작에 대한 배경지식을 넓히고 싶은 분께 매우 추천드립니다! 정말 많이 배워갈 수 있는 수업이었습니다.
+ 출석은 종이 돌리고 서명합니다"
미술명작의 이해,민경소,23,Fall,5.0,"미술에 전혀 관심도 지식도 없는 상태로 들었으나 그래도 무난하게 들을 수 있는 수업이었습니다
수업 내용을 전부다 필기하고 들어야한다는 번거로움이 있으나 그래도 잘 외워가면 무난한 성적 얻을 수 있었습니다 과제도 귀찮은 분량은 아니었습니다
중간 과제 기말 세 번 다 평균 살짝 아래였는데 에마 받아갑니다"
미술명작의 이해,민경소,23,Fall,5.0,무난한 교양강의입니다. 필기를 잘 해놔야 시험 공부할 수 있다는 어려움이 있지만.. 시험 2~3일전부터 정리하면서 외우시면 크게 어렵지는 않을 것 같습니다.
미술명작의 이해,민경소,23,Fall,5.0,명작이 왜 명작이 되는가에 대해 고민해 볼 수 있는 강의. 수업 내내 속기를 쳐야 시험 문제를 맞힐 수 있다는게... 좀 힘들지만 미술사를 개괄적으로 배울 수 있어서 좋았음
미술명작의 이해,민경소,23,Summer,5.0,교수님이 현대 미술 전공이라서 기말 범위가 다 현대 미술이었어요. 르네상스 같은 고전 미술 듣고 싶으면 다른 수업 듣는게 나을 듯 해요. 그래도 수업은 무난했어요
미술명작의 이해,민경소,22,Fall,4.0,"그냥 그럭저럭한 강의였습니다
미술에 대한 지식을 쌓을수잇는 무난한 교양입니다"
미술명작의 이해,민경소,23,Spring,5.0,"평소에 많이 봤지만 이름 모르거나/왜 명작인지 모르겠는 작품들을 왜 명작인지에 대해 탐구하게 되어서 너무 좋았음 특히 예술적 교양이 막 있는 편은 아니라서 수업 이전까지는 현대 미술 몇몇 작품은 나도 그릴 수 있을 듯 했는데 수업 듣고나니 왜 명작인지 너무 이해가 잘 되었다

학점도 너무 잘 주시고 특히 과제인 명작이란 무엇인가는 살면서 꼭 한번 고민해보면 좋은 내용인것 같음"
미술명작의 이해,민경소,23,Summer,5.0,많이 얻어 갈 수 있고 학점도 상대적으로 후하게 줌. 짧은 시간에 고대 이집트 부터 대지미술 등…작품을 관람할 때 알아야 할 기초 미술사 지식 깔끔하게 설명해 주심. 교수님이 항상 밝고 친절해서 1교시 인데도 즐기면서 들었어요.
미술명작의 이해,민경소,23,Summer,5.0,"계절학기엔 컴팩트하게 중간,기말 두 개로만 평가하셨습니다. 다른 분들 말씀처럼 속기가 필수라는 점은 힘들지만, 속기 잘 해두면 시험때는 많이 수월합니다. 교수님도 귀여우시고, 수업 전반적으로 재밌어요"
미술명작의 이해,민경소,23,Spring,4.0,"추상적이고 매시간 교수님의 모든 말씀을 필기를 해야해서 쉽진 않았지만, 중간 과제 평균보다 살짝 아래, 기말 평균보다 많이 아래였음에도 b0가 나왔습니다. 드랍자가 많아서 열심히만 한다면 좋은 수업인것 같아요!"
미술명작의 이해,민경소,23,Spring,5.0,"미술사 전반에서 특히 유명한 작품들을 중점으로 미술사조를 파악하는 수업입니다. 제목 그대로 미술 명작에 관심이 있으시다면 꼭 수강하시기를 추천드립니다.

시험은 전반적으로 쉽게 나오는 듯 하고, 교수님께서 중간 평균이 높아서 기말에는 변별력을 주시겠다고 하셔서 기말이 체감상 조금 더 어려웠습니다. 과제는 ‘명작의 탄생’을 주제로 글을 작성하는 것인데, 교수님께서 정해주신 영화나 문학 리스트 중 한 편을 시청하거나 읽고 나서 주제에 대해 5페이지 가량 서술하시면 됩니다. 중간 35/35, 기말 30.5/35, 과제 15/15, 출결 15/15로 A+ 받았습니다!"
미술명작의 이해,민경소,23,Spring,5.0,"재미있는 미술 교양 강의
학점도 잘 주심
로드는 적고, 시험도 할만함"
미술명작의 이해,민경소,23,Spring,4.0,저는 서양 미술에 관심이 많아 수강했었는데 미술의 전반적인 사조와 특히 현대미술 쪽을 자세히 다뤄주신 점이 좋았어요. 대신 강의자료에 내용이 없기 때문에 모든 내용을 속기해야 한다는 단점이 있습니다.. 그리고 교수님이 나중에 작품 100개 정도로 줄여주시는데 그것만 공부하지 마시고 관련 미술사조와 리스트에 나온 예술가의 타 작품에 대해 설명한 부분도 같이 읽어가는 것을 추천드려요! 저는 시험을 잘 치른 편은 아니었지만 결과적으로 에제 받았습니다!
미술명작의 이해,민경소,23,Spring,5.0,"미술 입문하기 좋은 강의입니다. 교수님도 친절하시고 좋아요.

수업자료에는 그림만 올려주셔서 수업 열심히 들으면서 필기해야 성적 잘 나올 수 있을 것 같습니다. 중간이나 과제는 무난무난한데 기말이 좀 어려웠습니다. 출석 관련해서는 종이 돌리면서 이름 쓰는 건데 가끔씩 출튀도 잡으셨습니다.

저는 한 학기 동안 듣기 잘했다고 생각할 정도로 유익한 강의였습니다!"
미술명작의 이해,민경소,23,Spring,5.0,"미술에 관심 있으시면 재밌게 들으실 수 있어요. 서양 미술 입문 수업으로 딱 좋습니다.
속기 필수고, 시험은 객관식 약술형 서술형 혼합인데, 서술형은 미리 문제 알려주십니다.
출석 잘 하고, 시험 공부 웬만큼 하면 성적도 괜찮게 주시는 것 같아요!"
미술명작의 이해,민경소,23,Spring,4.0,시험 외울거 많고 문제 정답 정확하지 않으면 가차 없어으셔요..그래도 미술사 전반에 관심있으시면 들어보셔도 나쁘진 않아요
미술명작의 이해,민경소,23,Spring,5.0,"중간 과제 다 쉬웠음
기말에서 변별력 준듯 중간이랑 비슷하게 공부했는데 헷갈리는거 많았고 몇개 틀림
그래도 전반적으로 미술사 과목치고 암기없는편 매우 추천"
미술명작의 이해,민경소,23,Spring,4.0,시험 난이도는 평이하고 외울 것은 많지만 외우는게 자신 있다면 들어도 괜찮을 것 같습니다. 강의 내용은 무조건 필기해야하며 과제는 하나고 채점도 너그러우신 듯 하지만 전 잘 못받았어요
미술명작의 이해,민경소,23,Spring,5.0,"출석 체크를 아주 깐깐하게 하십니다. 수업 내용은 미술사 전반에 걸쳐 명작을 중심으로 살펴봅니다. 과제는 한 번, 제시된 리스트에서 영화나 책을 한 권 읽고 교수님께서 제시하시는 평가 기준에 맞게 글을 쓰면 됩니다. 과제 성적은 15점 만점에 13.5점이 평균인 것을 보면 너그러운 편인 것 같습니다. 시험은 ppt만 보면 안되고 평소에 교수님 말씀 속기해야합니다. 암기에 자신있으시면 무조건 A+받으실 수 있어요. 미술 좋아하고 암기에 자신있었어서 중간 과제 모두 만점받았네요."
미술명작의 이해,박혜연,22,Fall,5.0,"출석: 수강인원 자체가 적어서 수업 전에 매번 호명하세요! 

참여: 참여도가 굉장히 중요한 것 같아요 1시간 수업하고 쉬고 또 1시간 좀 안 되게 수업하고 쉬고 나서 그날 수업 주제와 관련된 조별 토론을 진행합니다 수강인원이 적어서 초반부엔 발표할 때 목소리  떨리고ㅜ 했지만 적응되고 나니까 다른 분들이랑 여러 생각 듣고 얘기하는 게 재밌어서 자발적으로 발표하기도 하고 했습니다 저도 어디 가서 발표하고 하는 성격 아닌데 이 수업이 너무 좋고 재밌어서 열심히 참여했습니다

과제: 2페이지짜리 전시평이 유일한 과제... 진짜 개꿀강 아닙니까..... 사진도 넣어야 해서 2페이지 정말 금방 채웠어요 저도 전시평 처음 써보고 평소에 전시 보러다니지도 않아서 막막했는데 전시평 작성 관련한 수업을 한 번 진행해주셔요! 그거 열심히 듣고 수업 때 인용된 책 도서관에서 찾아서 읽고 전시 보러 갔더니 도움이 많이 되었습니다 
진행 중인 전시를 리스트업해서 공유해주시는데 그 중에서 전공이랑 관련있어서 눈길이 가는 전시 골라서 2시간 정도 보고 왔습니다 전시 감상이 재밌다는 생각이 처음으로 들 정도로 되게 유의미한 시간이었어요 ㅠㅜ 사진 열심히 찍어두고 떠오르는 감상 메모 열심히 해두고 미술관 카페에 가만히 앉아서 전시평 방향도 잡아보고 했네요 그러고 집에 오니 전시평은 몇 시간만에 완성했습니다 
과제 자체도 부담스럽지고 않고 미술에 ㅁ자도 모르던 제가 전시평까지 써보니 진짜 뭔가 배워가는 느낌이 들어서 좋았습니다 다만 피드백이 없는 게 다소 아쉬운 것 같아요 ㅜㅜ 

중간/기말: 사조 흐름대로 진도가 나가는데, 작품명과 작가 그리고 사조는 반드시 외우셔야 해요 그리고 사조의 흐름과 내용을 정확히 이해하고 계셔야 합니다 작품과 연관지어서 사조에 대해 설명할 수 있어야 해요 모든 문제가 서술형이라 외우지 않으시면 쓸 수 있는 게 없습니다 그치만 평소에 수업 잘 들어놓으니까 공부하는 데 얼마 안 걸렸어요! 작품이랑 내용도 그렇게 많지도 않구요 
3-5일 정도 공부하고 최대한 풍부하게 서술하려고 노력했습니다 기말은 점수를 모르지만 중간은 100점 만점에 98점 받았네요 다만 피피티에 문제를 띄어주시고 일정 시간 지나야 다음 문제를 보여주시는 형식으로 진행돼서 시험 시간이 오래걸리고 ㅜㅠ 힘들었어요 중간 때는 너무 지쳐서 제일 먼저 제출하고 나왔던 것 같은데도 점수 잘 받은 거 보면 분량보다는 퀄리티가 중요한 것 같네용

진짜 미술에 대해 전혀 모르고 모나리자를 봐도 그냥저냥.. 왜 유명한지도 모르겠던 사람이었는데 이번 수업을 통해 미술 사조 흐름에 대해서 쉽게 이해하게 되었어요 전시 보러다니는 데에도 흥미가 생겼고, 정말 교양을 갖춘 느낌이 듭니다! 이런 게 진정 교양 수업이 아닐까하는 생각을 하며 한 학기 동안 힐링하는 기분으로 수업 들었습니다 

소규모로 진행되는 것도 오히려 좋았고 토론도 수업 내에 전부 이루어지는 거라 정말 한 학기 내내 부담 하나도 없이 수업 재밌게 들었습니다 학점도 비쁠로 점철된 이번 학기를 에이쁠로 정화해주시는.... 갓혜연 교수님.. 교수님도 엘레강스하시고 귀여우시고 이름도 외워주시고 진짜 좋아요 가끔 졸리긴 한데...ㅎ 교수님 바이브 자체가 제가 좋아하는 바이브라서 더 좋았어요 

요약: 미술 잘 몰라도 관심과 열정만 있으면 좋은 성적 받을 수 있는 명강이자 꿀강!! 꼭 들으세요"
미술명작의 이해,박혜연,22,Fall,5.0,"명강입니다. 현대미술 전반에 대한 지식을 방대하게 쌓을 수 있습니다. 내용이 아주 가볍지는 않지만 관심 있으신 분들은 한 번씩 들어보세요 저는 개인적으로 들으면서 꽤나 즐거웠어요.
학점은 비율 잘라 주시는 것 같습니다. 이번 학기 수강인원은 11명인가...?로 시작해서 애초에 에이대 인원이 얼마 없었어요 쁠마제도 딱 비율대로 주시는 듯합니다 이건 참고하세요!"
미술명작의 이해,이은주,22,Spring,5.0,"여름학기 수강생입니다. 9시부터 12시까지가 수업시간이었는데 항상 11시 즈음 끝내주셔서 좋았습니다. 빨리 끝날 때는 10시 반에 끝나기도 했어요. 속기록이 있지 않아서 직접 속기를 했는데 반복되는 말이 많아서 앞에서 내용을 놓쳐도 커버가 가능합니다. 시험을 볼 때에도 구체적인 설명보다 대략적인 키워드만 제시해도 후하게 채점해주셔서 부담스럽지 않았어요. 외워야 하는 작품이 정해져있어서 시험공부도 3시간 정도 밖에 걸리지 않았어요. 서양미술에 관심이 있는 입장에서 수업을 통해 유명한 작품들을 만나고 상세한 설명을 들을 수 있어서 너무 재미있는 수업이었습니다. 교수님께서 드라마나 예능, 음악 같은 자료들을 활용해서 설명해주셔서 덜 지루했던 것 같습니다. 교수님 자체도 착하시고 밝고 유쾌한 편이세요. 미술에 관심이 있다면 적극 추천."
미술명작의 이해,이은주,22,Spring,5.0,"미술에 관심있고 속기록 있다면 강추하는 강의! 내욜도 재밌고 속기록 구하기도 쉽습니다. 혹시 못 구한다 해도 강의 노타빌리티로 녹은해두었다 출제되는 작품 부분만 속기따면 돼서 안 힘들어요. 시험은 1부 2부 나누어져있습니다. 1부는 중간 기말 각각 작품 리스트 26개 정도 주시고 해당 작품 작가, 이름, 연도, 미술양식, 특징을 쓰면 됩니다. 전날 호로록 암기하면 충분합니다. 2부는 미술양식 비교분석하는 서술형 문제인데 1부 시험 준비하면 자연스레 각 미술양식 특징이 외워져 큰 부담이 없습니다. 2부에는 출제된 미술양식에 대한 작품과 그 작품의 작가, 연도, 특징을 포험해 3개정도 사례를 제시해야하는데 이건 1부 작품 리스트 외운거에서 가져다 쓰시면 됩니다. 과제는 진짜 30분 컷...제출만하면 감점안하시는 듯 합니다.
교양도 쌓을 수 있고 학점도 잘 주십니다!+교수님 완전 친절하심ㅜㅜ"
미술명작의 이해,이은주,21,Fall,4.0,전 흥미있는 분야라 재미있게 들었는데 관심없으면 진짜 재미없을거 같아요 과제는 전시회보고 레포트 쓰는거 하나고 그외는 전혀 없습니다 수업 안듣고 속기록만 달달 외워도 성적 잘 받을수 있어요 전 결석을 좀 했더니 약간 아쉬운 학점 받았네요ㅠ 그래도 미술교양 재미있게 들었어요
미술명작의 이해,이은주,21,Spring,5.0,가볍게 교양 수준으로 진행 시험도 족보에 맞게 나옴
미술명작의 이해,이은주,21,Spring,1.0,"3p 감상문 한 번 시험 중간기말 두 번 있어요.
속기록 있는 사람 없는 사람 차이 많이 남. 속기록 없이 듣기 매우 어려움.
학점 잘 주신다는데 잘 모르겠음. 열심히 했으나 이해 불가능한 학점 받았음. 드랍자도 꽤 있었음."
미술명작의 이해,이은주,21,Spring,5.0,"21년 여름 계절 수강했습니다. 속기록 있으면 참 편한 수업입니다. 에타에서 쉽게 구할 수 있으니 편하게 들으실 수 있을거에요.
서양 미술 사조를 차근차근 밟아가는 수업입니다.
고대 그리스 > 로마 > 중세 > 르네상스 > 바로크 > 로코코 > 신고전주의 > 낭만주의,사실주의,인상주의 > 모더니즘
으로 이어지는 큰 뿌리를 배우기 좋습니다.
수업 진행 방식은 진도 나가고있는 사조에 해당하는 미술 작품들을 소개하시고 설명해주십니다. 작품 하나하나도 중요하게 설명하시지만 미술사조와 엮어 이해하는 것이 가장 중요합니다.
과제는 전시회 보고 배운 미술 사조와 비교/대조하는 감상문 하나 쓰기 입니다 . 
시험은 두번 치고 주로 ㅇㅇ사조와 ㅇㅇ 사조를 작품 2개씩 들어 비교하시오. 이런식으로 나옵니다.
중간 기말 모두 세문제씩 나왔는데 세피이지씩 쓰고 A+ 받았습니다."
미술명작의 이해,이은주,21,Spring,3.0,이번학기 수강 다 끝나지 않았지만 속기하다가 화병나서 씁니다. 과제 없는 것도 좋고 녹강 시청 기한 널널한 것도 좋은데 정말 심각할 정도로 강의력이 안 좋으시네요... 이런 식으로 수업하실 거면 차라리 대본을 쓰고 그대로 읽으시는 게 나을 것 같습니다. 설명도 중언부언하시고 했던 말은 자꾸 하시고 문장 호응도 하나도 안 맞아서 녹강임에도 불구하고 당최 무슨 소린지 알아들을 수가 없네요. 발음도 정확하신 편이 아니라 자꾸 다시 들어야 해요. 그렇다고 딱히 얻어가는 것이나 생각할 만한 것이 있는 수업이냐 하면 그것도 아닙니다. 그냥 미술 사조에 대한 설명과 작품 해설을 쭉 읽으시는 건데... 참 학점이라도 잘 주시면 그나마 낫겠습니다만 혹시 학점 때문에 듣고 싶은 분들은 차라리 딴 거 들으세요... 학점도 잘 주시고 강의력도 좋은 다른 수업 많습니다.. 아님 속기록을 손에 넣으시던지.. 전 속기록 없어서 한 학기동안 진짜 스트레스 많이 받았습니다.
미술명작의 이해,이은주,20,Fall,4.0,강의력은 좋으신 편은 아닌데 녹강인데도 친절함이 느껴짐. 과제도 부담없이 보고 싶은 전시 보고 작품 하나랑 연관해서 자유롭게 쓰면됨  시험은 개인적으로 복습하면서 미술사조 특징이랑 개별 작품 특징 정리해놓으면 따로 시험공부는 안해도 될듯
미술명작의 이해,이은주,20,Fall,5.0,이거 비대면 한정 개꿀인데ㅎ 수업 한번도 안 듣고 요약본 구해서 하루 전에 타이핑하고 에이플~
미술명작의 이해,이은주,20,Fall,2.0,"강의 심각하게 노잼
난 개말았지만 성적은 잘준다고 함"
미술명작의 이해,이은주,20,Fall,4.0,"일단 속기록을 받아놓지않으면 시간을 매우 많이 투자해야 하는 강의 ㅠㅠ 어떻게든 전체 강의 속기록을 손에 넣으세요. 저는 속기록 있어서 편하게 강의들었습니다만 이걸 다 내가 했어야 했다면 ..? ㄴㄴ ㄹㅇ 힘들었을 것 같네요. 일단 전 서양 미술사 + 종교에 대해 1도 모르는 사람이었지만 교수님 설명들으면 쉽게 이해됩니다. 약간 중언부언 한 문장이 계속 길어져서 그게 좀 힘들기는 했어요. 속기본 봐도 ~한, ~이고, ~여서 ~한 특징임. 과 같은 문장이 많았습니다 ㅠㅠ 본인이 어디가 중요한 부분인지 이해를 하셔야 할 것 같습니다. 그럼에도 정말 좋은 건 과제가 ㄹㅇ 없습니다. 첫 시간에 본인이 가장 인상깊었던 미술작품 1페이지 적는 것(성적 안 들어가는 것 같음 출결용), 미술전시 관람 후 수업시간에 배운 작품과 비교감상문 3p 입니다. 큰 변별을 두시지 않은 것 같다는 생각이 들었어요. 
시험 하나가 크게 작용하는데 대부분 ~사조에 대해 작가와 작품을 중심으로 서술하시오. ~사조와 ~사조를 비교하여 서술하시오. 등과 같이 매우 거대한! 문제가 나와서 쓸게 정말 많습니다.. 꿀팁이라고 한다면 수강하시면 알겠지만 그리스 로마부터 마지막 입체주의 등등까지 각각의 사조에 대한 특징과 작품의 특징을 속기록 바탕으로 서술형으로 정리해두시고 복붙 하셔서 수정하세요. 이번 시험 ㄹㅇ 타임어택이었는데 저는 그나마 이렇게 정리해 둔 것 복붙해서 문제 나름대로 선방해서 풀었습니다. 그리고 수업에서 사조 간 비교해서 알려주는 작품들이 있는데 이건 눈여겨 보고 서술형으로 또 정리했습니다 ..! 

정리: 속기록 있으면 꿀강 맞고, 아니면 힘드실 것 같아요 .."
미술명작의 이해,이은주,20,Fall,1.0,"요약 : 강의력 심각(문장구조 심각하게 어색하여 엄청난 분노 일어날 수 있음). PPT 제공 안 함. 문장으로 속기 필수. 기독교 싫은 사람은 거를 것. 마이너스 학점 있음. 

저는 진짜 별로였는데 생각보다 평점이 너무 좋아서 당황스러웠던 강의... 일단 강의력이 최악입니다. 차라리 대본을 준비해서 줄줄 읽으시는 게 낫지, 키워드만 준비해서 강의 찍으면서 문장으로 읽으시는 것 같아요. 근데 그걸 자연스럽게 읽는 게 아니라 굉장히 어색하게 읽으시고 문장 연결이 하나도 안 됩니다. 전체적으로 문장구조가 제대로 연결되는 부분이 하나도, 정말 단 하나도 없습니다. 이건 과장이 아닙니다. 속기하다가 읽어보면 주술 연결이 어떻게 이렇지 싶어서 매 수업마다 화날 수 있습니다. 그리고 발음도 부정확한 부분이 종종 있어서 그대로 속기하는 거 좋아하시는 분들한테는 비추합니다. 무슨 소리인지 다시 듣느라 생각보다 시간 많이 잡아먹어요. 또 ‘굉장히’였는지, ‘특히’였는지 아님 둘 다였는지 똑같은 수식어가 밑도 끝도 없이 반복됩니다. 
저는 별생각 없었긴 한데 기독교 싫어하는 분들한테도 비추합니다. 그림에 대해 설명하시면서 갑자기 ㅇㅇ복음 몇 장 몇 절에 나오는 이야기인데 한 번 읽어드리겠습니다~~하고 성경 구절 그대로 읽으실 수 있습니다. 고갱의 그림에서 이국의 문화를 제국주의적 시선으로 그리는 부분이 나오는데(기독교적 요소였음) 이걸 실드 치려고 하신 건지? 갑자기 나라마다 기독교적 요소를 자신의 특성과 합쳐서 그린 게 많았다며 동양 그림까지 소개하는 걸 보면 확실히 기독교이신 거 같아요. 암튼 심하진 않은데 기독교를 싫어하시는 분은 패스하세요.
암튼 다른 사람들 의견으로는 공부하는 것보다는 성적 잘 나옵니다. 근데 출석 한 번이라도 빠진 사람은 놀라운 학점을 받을 수도 있습니다. 저는 에마 받았어요. 제가 강의 들으며 받은 고통에 비해 그다지 만족스러운 성적은 아닌 것 같습니다. 녹강에 PPT도 제공하지 않으셔서 속기에 엄청나게 많은 시간을 써야 했네요. 투자한 시간에 비해 남는 게 없는 강의입니다. 종이에 필기하신 분은 시험 칠 때 눈물을 흘리게 될 수 있으니 무조건 노트북으로 속기하세요."
미술명작의 이해,이은주,20,Fall,5.0,교수님 귀여워요 강의력이 엄청 좋으신 건 아닌데 살짝 말실수 하셨을때 머쓱해하시는게 귀여움 과제는 하나밖에 없는데 그냥 무난한 수준임. 이번에 코로나로 비대면으로 쳐서 앞 학기보다는 문제가 좀 어려워진 감이 있었음. 비대면으로 친다> 속기했던 것 말 예쁘게 정리해 두기만 한다면 시간 촉박해도 나름 할 만했다 에쁠 감사합니다♡
미술명작의 이해,이은주,20,Spring,5.0,일단 소개하는 작품이 많아서 속기하기 힘들긴 함. 팔 아프고. 그래도 미술교양에서 기대하는 요소들은 다 들어가 있는듯. 시험은 타임어택. 학점은 잘주심
