배구,김부석,23,Fall,3.0,강의평 보니 SU로 전환하길 잘했네... 수업 소감문에 시합을 더 일찍 많이 했으면 훨씬 재미있었을 것 같다고 적음 ㅋㅋㅋ 다음부터는 조금 더 많이 할까요
배구,김부석,23,Fall,5.0,"저도 완전 재밌었는데.. 교수님이 학생 이름 하나하나 다 외워주시고 성적은 다른 분들은 어떨지 모르겠지만 전 에이플 받음,,"
배구,김부석,23,Fall,5.0,"난 재밌었는데... 강의평이..ㅠㅠ
교수님 한 학기 정말 재밌었습니다!"
배구,김부석,23,Fall,1.0,"결석 0번, 과제 모두 기한 내에 제출, 마지막 평가 시 실수 없었습니다. C 비율이 정해져있으니 차라리 C면 이해가 가겠는데 왜 B를 받았는지 기준을 도저히 모르겠네요. 마지막까지 여러모로 아쉬운 수업입니다."
배구,김부석,23,Fall,1.0,"실제로 배구부 경력은 없지만 교수님께 간택당해 경기할때 스파이못치고 리시브와 토스 독박쓴 사람 중 한명입니다.

사정이 있어서 인정 결석 2번과 아침수업이라 룸메들과 씻는 시간이 겹쳐서 지각을 3번 정도 했기는 합니다. 수업에서 아팠어도 교수님이 하라는거 다했고 교수님께 간택당했는데도 B가 나왔습니다.

다른 체육교양 수업 많이 들었는데 무단 결석한번해도 A+이 떴는데 지각 3번이라서 할말이 없는데 B가 뜬 정도면 어떤 기준으로 성적 주는지 모르겠네요.

배구를 처음 접하는 사람이라도 크게 배우는 것이 없는 수업입니다. 강의평도 처음 쓰는건데 그냥 듣지 마세요."
배구,김부석,23,Fall,3.0,"수업은 되게 재밌었는데
학점이 많이 짜신거같아요..
분명 SU 돌린사람 많아서 성적 주기 쉬울거같다고 하셨는데
많이 아쉽네요"
배구,김부석,23,Fall,1.0,"여태껏 들었던 체육교양 중 최악임.

성적
체육 교양에서 비를 받은 건 처음. 본인 이 수업 제외하고 체육 교양 5개 들으면서 에이쁠 세 개 에제 두 개 받았음. 평가는 마지막 날 시험과 수강 소감문, 배구 경기 직관 보고서 각각 A4 한 장으로 이뤄지는데 마지막 날 시험은 반영되지 않는듯함. 말로는 서브, 언더토스, 오버토스, 스파이크를 각각 세 번씩 시도해서 평가한다고 하나, 누구는 실수하니 기회를 다섯 번 주고 누구는 그냥 한 번만 하고 넘어감. 기록도 안 하는 걸 보아하니 평가 요소로 안 쓰는 거 같음. 무슨 기준으로 평가하는지... 참고로 본인 지각 2번, 결석 0번 함.

수업 내용
본인이 배구를 해본 경험이 있거나 배구부 경력이 없다면 아주 지루한 수업이 될 수 있음. 우선 11월 중순까지 매일 바뀌는 거 하나 없이 언더토스, 오버토스, 스파이크 연습만 시킴. 게임 언제 하냐고 다들 물어봐도 늘 다다음 주부터. 결국 애들끼리 알아서 미니게임했었음. 
게임할 때도 대놓고 배구부 경력 있거나 배구 잘하는 몇몇 애들을 대놓고 편애함. 공 만질 일 많은 세터나 공격수는 고정해두고, 나머지 애들은 알아서 뒤에서 리시브만 받도록 포지션 지정해 줌. 고로 배구부 경력이 없거나 수업 중 간택 받지 못했다면 30분 경기하는 내내 리시브 세네번 하는게 전부가 되는 경우 허다했음. 공격수나 세터로 간택된 애들이 너무 자기들만 하는 거 같다고 리시브만 하던 애들도 공격수나 세터 하도록 포지션 바꾸면 강사가 왜 바꿨냐며 다시 원상복구시킴. 결국 수업 중에 누가 왜 매번 포지션 고정하냐고 한 소리 해서 마지막 몇 번의 수업 때만 한두 번 포시션 바꿔가면서 함.

살면서 강의평을 써본 적이 없는데, 체육 교양에 강의평을 써볼 줄이야..."
배구,김부석,23,Fall,5.0,한 학기동안 재밌게 배구 배울 수 있었습니다. 학점도 엄청 잘 주시는 것 같습니다
배구,김태우,23,Fall,5.0,"23년 2학기 수강생입니다. 교수님께서 서울대 배구부 출신이셔서, 배구부 활동 중인 선배님들께서 조교로 활동해주십니다. 많이 웃고 즐기고 배우고 갑니다."
배구,김태우,23,Fall,5.0,재밌다. 또 듣고 싶다. 배구부 지원을 생각하게 해주는 수업
배구,김태우,23,Spring,5.0,관악에서 들었던 강의 중 제일 재밌었습니다. 체육교양으로 배구 강추
배구,김태우,23,Spring,5.0,선생님들께서도 잘 가르쳐주시고 학생들도 잘 따라가서 한 학기 내내 너무 유익했어요 ㅠㅍ
배구,김태우,23,Spring,5.0,한 학기동안 정말 편하게 즐겜할 수 있는 수업입니다! 과제만 있고 시험도 없어서 출석만 잘 하면 성적도 A+ 주시는 것 같습니다.
배구,김태우,23,Spring,5.0,한 학기동안 너무나 재밌게 배구 수업 들었습니다. 기본적인 기술도 배우고 후반부에는 게임 시간도 많아서 체육 교양 중 최고인 것 같네요. 교수님께서도 친절하시고 편하게 수업 진행해주십니다!
배구,장남경,22,Spring,5.0,덕분에 힐링했습니다..같이 수업 듣는 사람들끼리도 친해지고 대회도 나갈 수 있어서 좋은 기회였어요
배구,장남경,22,Spring,5.0,수업 재미있고 과제는 쉬워요 감상문 자기소개서 쓰기
배구,장남경,22,Spring,5.0,"수업 재미있고 새로 친구 사귀기 좋고요

제일 좋은건 배구수업에서 여자친구 만들었습니다.

게임하면서 코트에다가만 스파이크 꽂은 줄 알았는데

사랑의 스파이크도 같이 꽂았네요

꼭들으세요"
배구,장남경,22,Spring,5.0,시험은 기말고사 때 언더/오버/서브 5개씩 하는 거고 평소에는 연습이랑 게임 반반 정도로 수업 하십니다. 교수님도 좋으시고 팀 스포츠여서 수강생들과도 친해질 수 있는 좋은 수업이었습니다!! 한 학기 동안 열심히 하면 배구 실력도 꽤 늘 수 있는 수업입니다.
배구,장남경,22,Spring,5.0,"교수님 완전 좋으심
서브 못하는 사람들 하나하나 봐줘서 저 한번도 성공 못하다가 마지막에 결국 성공했어요 ㅎㅎ"
배구,장남경,22,Spring,4.0,"너무 착하심... 학생들과 친해지려고 노력도 하시고, 장난도 잘 받아주신더"
배구,장남경,21,Fall,5.0,"교수님 인품도 좋으시고 수업도 즐거움
걍 최고"
배구,장남경,21,Fall,5.0,진짜 너무 재밌고 좋았어요. 이 수업 덕분에 배구팬이 되어버렸습니다. 학교 다니면서 가장 잘한 일이 이 수업을 들은게 아닐까 싶을 정도입니다. 처음엔 배구라는 운동이 익숙치 않아 조금 아프고 힘들 수도 있는데 두 세번 정도만 버티면  익숙해져서 정말 재미있는 운동 하실 수 있을 겁니다.
배구,장남경,21,Fall,5.0,쌤도 너무 좋으시고 학우분들도 다들 열정적이셔서 수업 분위기가 한 학기 내내 활기찼다!
배구,장남경,21,Fall,5.0,교수님 정말 좋으시지만 수업과 별개로 난 운동은 안된다는걸 느껴서 조금 슬펐다
배구,장남경,21,Fall,5.0,"내 인생 최고의 선택:
<체육교양 배구 수강>"
배구,장남경,21,Fall,5.0,교수님 ㄹㅇ 개착함 그냥 거의 다 에이쁠 준 듯 배구도 잘 알려주심
배구,장남경,21,Fall,5.0,덕분에 배구 재밌게 들었습니다~ 교수님 친절하세요! 배구 실력이 늘지는 않았지만 재밌는 수업이었어요.
배구,장남경,21,Fall,5.0,"저한테 에쁠을 주시다니... (지각 두 번, 중간고사 개못함) 교수님은 희대의 츤데레입니다"
배구,오승현,23,Spring,5.0,"너무 좋았어요 예전에 배구를 잠깐 배웠던 적이 있지만 팀스포츠라 혼자서는 연습하기 어려워서 늘 아쉬웠는데, 좋은 수업 분위기에서 열심히 배구할 수 있어서 매주 너무너무 즐거웠습니다! 시험 못봐도 성적도 잘주시는거 같아요ㅎㅎ
과제는 2번이고 분량 맞춰 제출만 하면 됩니다!"
배구,오승현,23,Spring,5.0,"과제 하이큐 감상문 1장 배구 소감문 1장
시험 오버-언더 연계 10번 반복, 서브

성적 잘 주시고 수업 매우 즐거움 졸업 전 무조건 수강하세요"
배구,오승현,23,Spring,5.0,그저 빛! 배구 좋아하면 ㄱㄱㄱㄱㄱ 즐겁게 배구하고 에이쁠 받아가세요
배구,오승현,23,Spring,5.0,이 수업을 안 들으면 뭘 듣습니까. 스포츠 좋아한다? 들으세요.
배구,오승현,23,Spring,5.0,"관악 최고의 강의
최고 빛 빛 빛 빛 빛 빛 빛
사랑합니다"
배구,오승현,23,Spring,5.0,유쾌하시면서도 되게 재밌게 많이 배울 수 있어서 좋았어요!
배구,오승현,22,Fall,5.0,Goat 이 한마디로 충분함 학점도 매우 잘주심
배구,오승현,21,Spring,5.0,"다른 분들도 많이 말씀해주신 것처럼, 빛 그 자체인 강의입니다. 제가 들었던 체육 교양 중에서 가장 좋았어요. 배구 수업 있는 날만 기다렸습니다. 아무래도 팀스포츠이다 보니, 사람들과도 친해질 수 있어요. 이거 듣고 하이큐(과제)에 입덕했습니다…. 보쿠토 코타로… 내 최애….

p.s. 과제해야 한다는 명목으로 하이큐 완주했습니다. 덕분에 다른 수업들 중간은 망했지만 후회는 없어요*^^*"
배구,오승현,22,Spring,5.0,교수님 엄청 유쾌하시고 좋으세요! 기초부터 잘 가르쳐주시고 학생들한테 신경도 많이 써주세요ㅎㅎ 성적도 규정 내에서 최대한 잘 주려고 하시는 편인 거 같아요. 체육 교양으로 추천합니다!
배구,오승현,22,Spring,5.0,재밌고 교수님도 좋으세요! 성적은 에쎈유라 잘 모르겠지만 체육교양이니 잘주시는것 같네요
배구,오승현,22,Spring,5.0,너무 좋습니다!! 교수님도 재밌으시고 다른 수강생들과도 친해지기 좋아요! 배구도 배우고 유익한 수업입니다
배구,오승현,22,Spring,5.0,관악 구기종목 교양 top 2~3 확신(표본 9개)
배구,오승현,22,Spring,5.0,이보다 더 재밌는 체육교양이 있을까… 매주 기다려지는 강의였습니다.
배구,오승현,22,Spring,5.0,"최고의 체육교양 강의.
교수님께서 인품이 너무 좋으시며 재밌으십니다. 배구 자체도 재밌고 다른 과 친구들도 사귈 수 있는데다가 1학점 A+까지 달달합니다."
배구,오승현,22,Spring,5.0,무조건 들으세요!!!! 삭막한 시간표에 한 줄기 빛이 되는 수업입니다!
배구,오승현,21,Fall,5.0,수업도 정말 재미있고 교수님도 친절하십니다! 성적도 대부분 잘 주시는 것 같아요
배구,오승현,21,Fall,5.0,재밌게 잘가르쳐주시고 츤데레느낌이십니다 귀여워요
배구,오승현,21,Fall,5.0,지금까지 들었던 체육과목 중에 제일 재밌었음. 배구 너무 재밌어서 이제 배구 경기 보러 다님. B줬어도 나한테는 5점 만점짜리 강의였다. 근데 A+도 주심. 무슨 말이 더 필요할까?
배구,오승현,21,Fall,5.0,"학점느님 그자체 
신청하고 나서야 에쎈유 전환 안되는 전공수업인걸 알았는데 한 학기 동안 폭풍삽질한 제게 과분한 학점을 주셨읍니다.."
배구,오승현,21,Fall,5.0,배구 듣는 목요일만 기다리니 학기가 너무 빨리 지나가버렸어요!! 교수님이 재밌으시고 학생들 마음을 잘 아세요. 여기에 배구도 재밌으니 모든 게 완벽한 수업 !!
배구,오승현,21,Spring,5.0,"과제는 하이큐 감상문, 배구 경기 감상문인데 사실상 없다고 보면 되고요…
시험은 중간 리시브 기말 서브인데 학점 주시는 거 그냥 빛이니 재밌게 수업만 들으시면 됩니다.
배구 기본적인 요소들 잘 알려주시고 바로 시합할 수 있게 해주셔서 재밌게 수업 들을 수 있었습니다."
배구,오승현,21,Spring,5.0,5점이 만점이라 아쉽네요. 지금까지 체육 수업 꽤 많이 수강했는데지금까지 들었던 체육 수업중에 단연코 가장 재밌었습니다.
배구,오승현,21,Spring,5.0,"꼭 들으세요 진심 힐링임.. 과제 많지 않고, 시험도 빡세지 않고 수업은 재밌음.."
배구,오승현,21,Spring,5.0,"수업 진짜 재밌어요 꼭 들으세요! 교수님도 좋으십니다.

과제는 중간으로 하이큐 1기 감상문, 기말로 배구경기 감상문이 있고 분량은 대충 1장쯤 쓰면 됩니다.
하이큐 1기가 생각보다 많고 또 재밌으니까 학기중에 바쁜 사람은 방학때 미리 봐놓는 것도 좋아요!"
배구,오승현,20,Spring,5.0,배구하면서 힐링했습니다. 처음엔 공 받기도 힘들었는데 한두번 익숙해지다보면 적응하더라구요. 물론 스파이크는 어려워서 수업 끝날때까지 못 때렸지만...ㅎ
배구,오승현,21,Spring,5.0,수학을 안 가르치시고 배구를 가르치신다는 사실에 놀랐습니다
배구,오승현,20,Fall,5.0,평점 5만점이 없어서 5점으로 줍니다.. 또 듣고 싶습니다..
배구,오승현,20,Fall,5.0,"교수님도 너무 좋으시고 배구도 재미있어요!!
운동 좋아하시는 분들 꼭 들으세용"
배구,오승현,20,Fall,5.0,"과제로 하이큐 감상문을 작성하는 수업이 있다?! 바로 여기입니다. 코로나 때문에 비대면과 대면을 오가긴 했지만 정말 너무 즐거운 수업이었습니다. 교수님도 어떻게든 학생들이랑 대면수업 하기 위해 노력하시고 계속해서 더 많은 것들을 알려주고자 하는 모습이 느껴졌습니다. 중간은 언더핸드 토스로 지정된 위치로 보내기, 기말은 서브 시험이 있었습니다. 저는 정말 딱 평균값 정도의 점수에 불과했는데 에쁠을 주셨습니다. 교수님께서도 시험 못봤다고 너무 성적에 연연하지 말라고, 그렇게 야박한 사람 아니라고 계속 강조하시고 격려해주셨습니다. 이시국만 아니었으면 정말 오조오억배는 더 재미있을 강의라고 생각합니다. 진짜 꼭 들으세요 ㅠㅠ"
배구,오승현,19,Fall,5.0,"교수님 성적 정말 잘 주십니다 제가 A+ 받을 정도면
시험은 두 번 봅니다 제자리 리시브 20번 이상이랑 네트 반대쪽에서 던지는 공을 일정 선 안으로 넘기기 / 서브 시험이랑 세터한테 리시브하기 이렇게 두 번 봤는데 엄청 못봐서 솔직히 좀 걱정했었어요
과제는 하이큐 1기 보고 소감문쓰기랑 직접 배구 경기 관람하고 사진 첨부해서 소감문 쓰기있습니다
개인적으로 시간되시면 수업 듣는 사람들이랑 같이 대회 나가시는거 추천드려요 다같이 친해지면 수업이 훨씬 재밌어집니다
교수님 일부러 첫날 좀 빡세게 하시고 차음에 멍이 좀 들텐데 나중엔 멍 안들어요 학생마다 좀 잘한다 싶으면 더 강하게 키우시는 느낌은 좀 있습니다 ㅋㅋ
한 학기동안 너무 재밌게 들었습니다 ㅎㅎ"
배구,서재철,19,Spring,1.0,"체육교양치고 학점 매우 깐깐
수업도 체계적이지 못함
운동신경 없는편이면 절대 듣는 일 없길바랍니다"
배구,서재철,20,Spring,1.0,여성분뿐만 아니라 남성분들의 경우도 배구 운동 신경 없으면 듣지 않는 거 추천이요...다른 운동들 오래 해와서 출석 꼬박꼬박하고 배구 플레이도 잘하고 토스랑 콤비도 개수다 채웠는데 A-였어요... 그냥 원래부터 배구 잘하는 학생이 A+ 받아가는 수업이에요. 1학점 체육에서 A- 받는 건 또 처음이네요..고등학교 떄부터 배구 해왔다!하시는 분만 A~F 추천해요
배구,서재철,20,Fall,5.0,기본기를 3 4차시 걸쳐 가르쳐주시고 나머지는 사실상 응용 동작들 + 절반 이상이 시합 시간으로 쓰십니다. 이번 학기 유일한 대면 수업이었고 그만큼 많이 즐기고 땀흘리다 갑니다. 다만 배구를 안해보신 분들보다는 고교든 대학이든 한번이라도 시합 할 정도의 실력을 지니신 분들이 수강하시길 추천합니다. 체교과 분들도 많고 배구부 분들은 넘사... 라 흑흗.. 다만 노력하고 실력이 향상되는 모습을 보이면 잘 주십니다. 특히 기말 시험(실습)이 중요합니다
배구,서재철,20,Spring,5.0,"2020 여름계절 수강.
배구를 이전에 배웠던 사람이어서 재밌고 편하게 들을 수 있었음. 
그런데 철저하고 체계적인 수업? 음... 그건 아닌듯 ㅜ 교수님께서 그렇게 섬세하게 가르쳐주시지 않아서 처음 배우는 사람한테는 조금 힘들 수 있는 듯. 그래도 운동신경 있으면 곧잘 따라오시는 것 같던데, 운동신경 없는 여자 분들에게는 비추."
배구,서재철,20,Spring,4.0,"체육 수업 치고는 깐깐 그러나 철저하고 체계적인 교육 재밌는 수업 아쉬운것은 늦은공지가흠
자세한런스랖참고"
배구,서재철,20,Spring,4.0,"20-여름학기 수강자입니다.
최종시험은 언더-토스 연속 10회와 경기(팀 점수 X)로 평가합니다. (S/U는 경기가 점수에 반영되지 않습니다.)
이미 배구를 알고 있어 언더-토스가 자유로운 상태라면 수업 수준이 딱 맞아 재밌게 많이 배워갈 수 있습니다. 좋은 점은 교수님께서 모든 학생의 이름을 외워주신다는 점과, 계절치고는 수준급 경기가 가능하다는 점입니다. 아, 그리고 과제가 없다는 점도 좋습니다."
배구,서재철,20,Spring,3.0,"이시국이라 그랬는진 몰라도 수업자체는 널널합니다.
S/U같은 경우엔 토스,범퍼 콤비네이션으로 일정 횟수 이상 하면 통과입니다."
